id,amount,amount_label,vendor,vendor_score,vendor_label,invoice_number,invoice_number_label,bill_date,bill_date_label
52852834,581.7,581.7,,,Customer 7,2018-2,2018-2 Customer 7,22.08.2018,2018-08-22 00:00:00
51549425,,152.55,camscanner,0.636422336101532,Pickering Auto Lab,,,08/03/2018,2018-08-03 00:00:00
50906354,193.78,193.78,orientaltrading,0.6957515478134155,Oriental Trading,691318300,,07/26/18,2018-07-26 00:00:00
51799181,7.0,7.0,bwc.ohio.gov,0.5778563618659973,bwc,,,08/06/2018,2018-08-06 00:00:00
51836250,16.33,12.02,cheritzplus,0.8504047393798828,Cheritzplus,2410-3575-2814-4714,2410-3575-2814-4714,,2017-08-11 00:00:00
52381165,-1689.5,1689.5,trademarks,0.9217705726623536,TradeMarks,261569,261569,"wed, aug 22, 2018",2018-08-22 00:00:00
50318537,49.59,49.59,chouchou foods,0.9914482235908508,Chouchou foods,0454,0454,"march 28, 2018",2018-03-28 00:00:00
52533493,108.36,108.36,priori specialty food,0.7604869604110718,Priori Specialty Food,52832,52832,26 aug 2018,2018-08-26 00:00:00
51192904,500.0,500.0,performance lifestyle,0.9651566743850708,Julia McRae,7770,,08/03/2018,2018-08-03 00:00:00
51154264,265.56,265.56,hygrade laser profiling,0.9824027419090272,Hygrade Laser Profiling,91970,91970,08/22/2018,2018-08-22 00:00:00
51206888,233.98,233.98,bob kirst transport,0.9968085885047911,Bob Kirst Transport,28164,28164,"fri, aug 17, 2018",2018-08-17 00:00:00
53028542,50.0,50.0,constant contact,0.7649929523468018,Rethinking Construction,197392998,197392998,21 july 2018,2018-07-20 00:00:00
51836476,400.0,400.0,gardencityplastics,0.9705395102500916,Garden City Plastics,3Q07069,,23 august 2018,2018-08-23 00:00:00
51431489,176.0,176.0,stuart russell totman,0.6801788806915283,Stuart Russell Totman,INV-1193,INV-1193,08/24/2018,2018-08-01 00:00:00
51545607,,487.5,australia post,0.9676796793937684,Australia Post,1006632492,1006632492,,2018-08-10 00:00:00
52845939,369.0,369.0,queuesolutions,0.9997353553771972,Queue solutions,1808267,1808267,02/08/2018,2018-08-02 00:00:00
51785390,185.98,185.98,hilti,0.9790465235710144,Hilti Inc.,4612108949,4612108949,"july 1,2018",2018-07-01 00:00:00
51592117,665.68,665.68,aaa electronic services,0.9193990230560304,AAA Electronic Services Inc,S28180,,24-aug-2018,2018-08-24 00:00:00
51603226,617.94,617.94,gensco,0.998892605304718,"Gensco, Inc.",848282420,848282420,"thursday, august 16, 2018",2018-08-16 00:00:00
50668490,2757.67,2757.67,eastpoint plumb,0.6974052786827087,Master,,33002818-00,8/16/2018,2018-08-16 00:00:00
51971495,27.46,27.46,bunnings,0.9441606998443604,Bunnings Trade,6359/00173759,6359/00173759,"april 20, 2018",2018-04-20 00:00:00
52975397,42.79,42.79,genstock,0.9165815114974976,Genstock,INV-GB-116727801-2017-568,INV-GB-116727801-2017-568,"tuesday, august 14, 2018",2018-08-24 00:00:00
52429527,2840.49,2840.49,mpx bioceutical corporation,0.666741132736206,National Equicom,600424007,600424007,"wed, aug 29, 2018",2018-08-21 00:00:00
52742619,67.8,67.8,koodo,0.8869332075119019,Koodo mobile,,,08/10/2018,2018-08-10 00:00:00
51659846,20.0,20.0,giovannissalonspa & s,0.7050297856330872,Giovannissalonspa&Supply,,,jul 19 2018,2018-07-19 00:00:00
52606634,2638.0,2638.0,rc construction,0.9052430987358092,RC Construction,,,17 jul 2018,2018-07-17 00:00:00
51754338,10.0,10.0,digital pacific,0.959382176399231,Digital Pacific,873397,873397a,"december 18, 2016",2016-12-18 00:00:00
52763693,653.55,0.0,md aesthetics,0.8390846252441406,Daily Sales,,,08/25/2018,2018-08-25 00:00:00
51324338,210.34,210.34,cox communications,0.5946377515792847,Cox Communications,,,"jul 04, 2018",2018-07-04 00:00:00
52623353,550.0,550.0,armadillo tire,0.7828754186630249,Armadillo,,,30-09-2017,2018-08-24 00:00:00
50719063,46.49,46.49,alberni,0.5578940510749817,Alberni Power & Marine,97445A,97445A,"apr. 23, 2018",2018-04-23 00:00:00
51577104,59.0,59.0,the girl up front,0.9086273312568665,The Girl Up Front,2222,2222,"tue, jul 31, 2018",2018-08-02 00:00:00
50948080,13.75,13.75,proviso,0.9611842036247252,Proviso Pty Ltd,291320187,291320187,8/24/2018,2018-08-24 00:00:00
51821063,100.0,100.0,amelia brown,0.992820918560028,Amelia Brown,061320,061320,27/07/18,2018-07-27 00:00:00
52749330,3947.51,3947.51,turning point innovations,0.9724249839782716,Turning Point Innovations,,,12/08/2018,2018-08-12 00:00:00
52231498,197.06,197.06,nova,0.7932715415954591,Janssen Bio Advance,INV0000033138,INV0000033138,15 march 2018,2018-03-15 00:00:00
50809956,570.68,570.66,wired automotive,0.8966139554977417,Wired Automotive Electrics,INV-0074,74,07/27/2018,2018-08-13 00:00:00
51849766,27.59,27.59,uberx,0.9919584393501282,Uber,,,06/15/18,2018-06-15 00:00:00
50244990,36.5,36.5,act data services,0.9868443608283995,Act Data Services,19359,19359,aug 14 2018,2018-08-14 00:00:00
51000889,4096.8,4096.8,mike may,0.6427481174468994,Mike May,,,"march 6, 2018",2018-03-06 00:00:00
50224346,,5.0,suncoastfresh,0.9938306212425232,Suncoast Fresh,801731,801731,08/07/2018,2018-07-08 00:00:00
50858649,22.05,22.05,microsoft,0.9985980987548828,Tayber Yastremski,E020068ICT,E020068ICT,07/06/2018,2018-07-06 00:00:00
52569362,350.0,350.0,pivotal software,0.6792706251144409,Pivotal Tracker,,,11 jun 2018,2018-06-11 00:00:00
52203440,157.56,157.56,sector nine distribution,0.94187194108963,Sector Nine Distribution,10701,,08/22/2018,2018-08-22 00:00:00
52245773,20137.04,20137.04,us foods,0.98940110206604,"US Foods, Inc.",,STATEMENT,"aug 21, 2018",2018-08-21 00:00:00
50655865,15.9,15.9,ls screening,0.9770975708961488,LS Screening LLC,69058,69058,16/08/2018,2018-08-16 00:00:00
52034997,3664.0,3664.0,thebedrock,0.7928876876831055,Bedrock,15984,15984,,2018-08-22 00:00:00
51615062,1795.97,1795.97,plusone company,0.9729081988334656,PlusOne,7397,7397,"jul 13, 2018",2018-07-13 00:00:00
51984949,166.64,166.64,leclair decor,0.9336386919021606,Freightcom,,FC0302136,"april 25, 2018",2018-04-25 00:00:00
51994743,150.0,150.0,anna rosa castro,0.9124077558517456,Anna Rosa Castro,,09/14/2018_AC,"august 19, 2018",2018-08-19 00:00:00
50625415,4020.5,4020.5,barmac,0.9695212841033936,Barmac,126566,126566,"may 31, 2018",2018-05-31 00:00:00
51868241,15908.47,15908.47,serbiz,0.9978051781654358,SERBIZ Inc.,2018-08-12,2018-08-12,01/08/18,2018-08-01 00:00:00
50657046,1603.33,1603.33,belay,0.7374447584152222,Belay,,,08/09/18,2018-08-09 00:00:00
51912882,3663.46,18063.46,rittman mead america,0.9110172390937804,Rittman Mead,,RMA000824,"august 8, 2018",2018-08-08 00:00:00
51998517,83.74,83.74,apple,0.9518389701843262,APPLE,,,2018 / 08 / 20,2018-08-20 00:00:00
52283572,,86.95,,,FMV,,,"july 6, 2018",2018-07-06 00:00:00
51172428,90.0,90.0,newsquest media group,0.9246376752853394,Newsquest Media Group,,25700887,"mon, aug 27, 2018",2018-08-27 00:00:00
51158145,991.9,991.9,telstra,0.9845257401466372,Telstra,T311,,08/17/2018,2018-08-17 00:00:00
51589283,400.25,400.25,menkes rental suites management,0.7259445190429688,Menkes Rental Suites Management Inc.,,,05/18/18,2018-06-15 00:00:00
52602649,,15324.42,bmo,0.606157124042511,BMO,,,08/13/18,2018-08-13 00:00:00
50576848,82.2,82.2,petro-canada,0.9902224540710448,Petro Canada,,,"thu, aug 9, 2018",2018-08-09 00:00:00
52623680,,858.5,terrace electric,0.9602295160293579,Supporting Strategies,,,01 aug 2018,2018-08-01 00:00:00
51854648,31344.0,31344.0,kainero media group,0.991973876953125,Kainero Media Group Limited,06387,06387,21 august 2018,2018-08-21 00:00:00
52721663,126.0,126.0,carpenter brothers,0.7436205148696899,Carpenter Brothers Inc.,569224,569224,"august 11, 2018",2018-08-11 00:00:00
51666363,133.05,133.05,originenergy,0.9986435770988464,Origin Energy,163 001 227 596,163 001 227 596,08/16/2018,2018-08-16 00:00:00
50815239,96.28,96.28,leavainbakery@gmail,0.9051628112792968,Leavain Bakery,00333122,00333122,21/05/2018,2018-05-21 00:00:00
50239175,378.0,1137.7,,,VincesMarket,2613,2613,11 30 2017,2017-11-30 00:00:00
52534019,515.97,515.97,king taco restaurants,0.9998700022697448,"King Taco Restaurants, Inc.",000362242,000362242,"mon, may 8, 2017",2017-05-08 00:00:00
50790440,795.0,795.0,creative ideas catering sf,0.9926443696022034,Creative Ideas Catering SF,1806,1806,"august 24, 2018",2018-08-24 00:00:00
50531738,,140.7,,,Aircraft Spruce Canada,72796,865151,6/5/2018,2018-06-05 00:00:00
52859605,1430.0,1430.0,smart structures au,0.9268366098403932,Smart Structures,INV-697,LL-INV-697,8/14/18,2018-08-14 00:00:00
50798765,,107.5,imaging,0.5460500121116638,Lp Pineapple Inc.,,,"august 13, 2018",2018-08-13 00:00:00
51150875,99.0,99.0,masters media,0.9441667199134828,Masters Media,6JT03450G4541234S,41234S,8/9/2018,2018-08-09 00:00:00
52601358,149.99,127.49,amazon,0.9612026810646056,Amazon,111-9844314-6113824,111-9844314-6113824,08/06/2018,2018-08-06 00:00:00
52533998,216.65,216.65,king taco restaurants,0.9997550249099731,"King Taco Restaurants, Inc.",000361848,000361848,"tuesday, august 7, 2018",2018-08-07 00:00:00
50943615,49.72,49.72,teledynamics,0.9781305193901062,TeleDynamics,0005646066,0005646066,04/22/2017,2017-04-22 00:00:00
53019570,39.8,39.8,uber,0.9937930703163148,Uber,,,"august 6, 2018",2018-08-06 00:00:00
50995151,,41.9,,,New York Bagel Cafe,,,7/04/18,2018-07-04 00:00:00
50935562,27.53,27.53,amazon,0.9978329539299012,Amazon.ca,701-3148813-2225032,701-3148813-2225032,20 october 2017,2017-10-20 00:00:00
51585882,686.63,686.63,fedex,0.9988580942153932,FedEx,1-720-14454,1-720-14454,"august 12, 2018",2018-08-12 00:00:00
52109578,11542.51,8737.09,nick bain,0.80116868019104,Nick Bain,,201808-5,2018/07/21,2018-07-21 00:00:00
52557552,619.59,619.59,qantas,0.9954438209533693,Qantas,NBF6KC,NBF6KC,17/08/2018,2018-08-17 00:00:00
51603730,58.99,58.99,the wright company electrical and maintenance services,0.9320157170295716,The Wright Company Electrical,30845,30845,2018-08-02,2018-08-02 00:00:00
52624885,1952.0,1952.0,total equipment rental,0.9482232928276062,Total Equipment Rental,1130165001 ,1130165001,01-08-2018,2018-01-08 00:00:00
50763503,315.0,315.0,smc accounting service,0.9447159171104432,Smc Accouting Service,2018-105,2018-105,07/08/2018,2018-07-08 00:00:00
52897311,7635.76,7635.76,synnex,0.9187923669815063,Synnex Corporation,96831009,96831009,"27 june, 2018",2018-06-27 00:00:00
50590028,5369.2,5369.2,greenfield organix,0.6996962428092957,Greenfield Organix dba Loudpack,,PO 669,"august 13, 2018",2018-08-13 00:00:00
50768722,10.91,10.91,ferguson enterprises,0.9891627430915833,Ferguson Enterprises Inc.,,,8/2/2018,2018-08-02 00:00:00
50756360,5856.84,5856.84,hydraulics network,0.9804912209510804,Hydraulics Network,0947,,08/20/2018,2018-08-20 00:00:00
50801913,,594.0,,,MWC Practice Management,,18145,8/2/2018,2018-08-02 00:00:00
53022242,195.21,195.21,mobil,0.9472247362136841,Mobil,,,07/03/2018,2018-08-15 00:00:00
53093854,220.0,220.0,sunshine coast 4wd wreckers,0.8860695362091064,Sunshine Coast,23481,23481,"sat, jul 28, 2018",2018-07-28 00:00:00
51460372,250.0,250.0,brighton dental,0.7619134783744812,Plooto,,,aug02/18,2018-08-02 00:00:00
52451076,32.32,32.32,tech data,0.96764075756073,Tech Data Ltd,8141475702,8141475702,,2018-05-01 00:00:00
50664420,444.96,444.96,pigs ears beers,0.748917281627655,Pigs Ears Beers,SO15055,SO15055,08/23/2018,2018-08-23 00:00:00
51927944,143.43,143.43,spark.co.nz,0.973868191242218,Spark,,Aug 18,7/30/2018,2018-07-30 00:00:00
51451925,108.9,108.9,limon health & beauty spa,0.9329848289489746,Limon Shop,221,,"august 23, 2018",2018-08-23 00:00:00
52541441,1380.5,1380.5,bowens,0.8747511506080627,Bowens,14720965,14720965,12/10/14,2014-10-12 00:00:00
50994954,3000.0,3000.0,damir daughter,0.6228545308113098,Damir Skeric,,,"august 01,2018",2018-08-01 00:00:00
51392095,54.67,54.67,yahoo,0.9642528295516968,Pets Stop,69814,69814,8/15/2018,2018-08-15 00:00:00
52572936,543.09,543.09,romteck grid,0.9773295521736144,romteck grid,00160808,00160808,24/04/2018,2018-04-24 00:00:00
52808195,666.0,666.0,matt braden photo,0.96979558467865,Matt Braden Photo,626,626,06/11/18,2018-06-11 00:00:00
51297981,324.0,324.0,a-team pump & control service,0.9645869135856628,A-Team Pump & Control Services LLC,18-141,18-141,8/4/2018,2018-08-04 00:00:00
52248535,550.0,550.0,sophie banner,0.9950497150421144,"American Burger Morehead, Llc",453,453,08/15/2018,2018-08-15 00:00:00
52319901,136.13,136.13,nab gingko intelligence,0.9074143767356871,Gingko It,7409,7409,8/13/2018,2018-08-13 00:00:00
50848308,767.25,767.25,abuzz couriers,0.8610461950302124,Abuzz Couriers Pty Ltd,INV-0171,INV-0171,08 august 2018,2018-08-08 00:00:00
51515579,242.95,242.95,ontario,0.7478887438774109,Climate Works 1799541 Ontario,15028,15028,08-08-2018,2018-08-08 00:00:00
51399920,5.0,5.0,google,0.994351089000702,Google,3481859206,3481859206,8/9/2018,2018-08-09 00:00:00
52966000,,5000.0,winterllp,0.9720503687858582,Winter LLP,2262,,"april 5, 2018",2018-04-05 00:00:00
51591762,2903.25,2903.25,precisioninteriors,0.7014830112457275,Precision Interiors,1028,1028,,2018-08-26 00:00:00
51294662,1916.63,1916.63,waxcenter,0.9203725457191468,Waxcenter.com,SIN285399,SIN285399,22.08.2018,2018-08-22 00:00:00
50279785,2254.71,2254.71,merchant services,0.7851415872573853,Merchant Service,,,,2018-08-02 00:00:00
51530755,2425.12,2425.12,joaq,0.7525179982185364,"Goodman Distribution, Inc.",147456,181303,08/07/2018,2018-08-07 00:00:00
52724076,56.67,56.67,praxair,0.9938948750495912,Praxair,84681332,84681332,10 aug 2018,2018-08-10 00:00:00
52985274,,1752.59,,,Bayswood Timber,,162941,7/08/2018,2018-08-07 00:00:00
52735588,5859.82,5859.82,kristen rivoli interior design,0.9768468141555786,"Kristen Rivoli Interior Design, LLC",11990,11990/GRA,23.08.2018,2018-08-23 00:00:00
52949908,14.65,14.65,uber,0.9947693347930908,Uber,,,"jul 31, 2018",2018-07-31 00:00:00
51745107,1587.75,1587.75,bms mitre 10,0.9793114662170408,BMS Mitre 10,9-1666073,9-1666073,06 april 2018,2018-04-06 00:00:00
51750369,13196.64,13196.64,,,PAYROLL,,081018 PAYDAY,"16, 2018",2018-08-14 00:00:00
53005183,184.0,184.0,laundryaustralia,0.8758912086486816,Laundry Australia,,,07/28/2018,2018-07-28 00:00:00
50252811,250.0,250.0,pooja chaudhary,0.9789397716522216,Upwork_STAT,T185705291,T185705291,31/07/2018,2018-07-31 00:00:00
52378746,120.0,120.0,code climate,0.8902661800384521,Code Climate,IN_DS2OU0ACJXRA4H,in_DS2Ou0ACJxra4H,"august 17, 2018",2018-08-17 00:00:00
53007967,-17.39,-17.39,swbroadband,0.9027095437049866,Swbroadband,61388,61388,jul 26/18,2018-07-26 00:00:00
51229049,130.0,130.0,harvest,0.991071343421936,Harvest,H-6A8FDD3F19,H-6A8FDD3F19,25-07-2018,2018-07-25 00:00:00
51561469,6.65,6.65,uber,0.9955517649650574,Uber,,,"thu, aug 2, 2018",2018-08-02 00:00:00
52014460,79.0,79.0,nevada business magazine,0.8584550023078918,Nevada Business Magazine,,,08/16/18,2018-08-16 00:00:00
51196575,1393.5,1393.5,gary morehead dba morehead,0.8009418845176697,Gary Morehead DBA,534,534,"jul 02, 2018",2018-07-13 00:00:00
52999095,,38449.91,,,Westamerica Bank,,,8/1/2018,2018-08-01 00:00:00
51314847,2057.0,2057.0,j-maxx plumbing services,0.76590496301651,J-Maxx Plumbing Services,INV-0255,INV-0255,8/21/2018,2018-08-21 00:00:00
51356660,1006.29,1006.29,homeaway,0.7824629545211792,HomeAway,16030739-75,,"may 31, 2018",2018-05-31 00:00:00
51545492,-493.9,493.9,milnsbridge it voice & data,0.9597166776657104,Milnsbridge,27600,27600,"august 10, 2018",2018-08-10 00:00:00
50217891,265.38,265.38,alternativebeauty,0.9421026110649108,Alternativebeauty,0000270209,0000270209,08/09/2018,2018-08-09 00:00:00
51261881,4799.6,4799.6,bmo,0.6876832842826843,BMO,,,07/11/2018,2018-07-11 00:00:00
51279182,43.88,43.88,,,henry schein,,,8/27/2018,2018-08-27 00:00:00
51169745,93.75,93.75,tech team,0.9610831141471864,Tech Team,8067,8067,12/30/17,2017-12-30 00:00:00
50223205,214.5,214.5,tle electrical,0.9606900215148926,Tle Electrical,500187-245,500187-245,08/15/2018,2018-08-15 00:00:00
52456329,254.0,254.0,,,ASIC,,,"fri, aug 17, 2018",2018-08-17 00:00:00
52577990,140.0,140.0,maribel pineda,0.9077141880989076,JMac Services,,,11/30/16,2016-11-30 00:00:00
50866065,,32.19,moteurs electriques motair,0.7200029492378235,MOTAIR,,,6 aug 2018,2018-08-06 00:00:00
52171383,270.53,270.53,key sun laboratories,0.9336387515068054,Key Sun Laboratories Pty Ltd,,,"apr 27, 18",2018-04-27 00:00:00
50257828,136.01,136.01,telus,0.948386013507843,TELUS,,,,2018-08-23 00:00:00
50462562,6000.0,6000.0,innamorato services,0.897818386554718,Innamorato Services LLC,DRIVEWAY,,"21 august, 2018",2018-08-21 00:00:00
52496578,7.36,7.36,williams lumber and home,0.916543185710907,Williams Lumber and Home,609166/1,609166/1,10/08/2018,2018-08-10 00:00:00
52541844,244.92,244.92,bell,0.9565032720565796,Bell,,,2018-08-02,2018-08-02 00:00:00
52835967,25.49,25.49,indeed,0.8293102383613586,Indeed,16753271,16753271,08/02/2018,2018-08-02 00:00:00
50550885,182.19,182.19,c & j e le c tric - w a v e rly,0.9830885529518129,C & J E lectric - Waverly,,17454,jul 18,2018-07-12 00:00:00
52519254,3.68,3.68,uber,0.9959253668785096,uber,,,07/31/2018,2018-07-31 00:00:00
50601647,,1792.4,beaumont tiles orange,0.9008734822273254,beaumont tiles orange,34280,,,2018-08-23 00:00:00
51781359,9750.0,16369.0,lbmc,0.7292712926864624,LBMC,10492462,08/10/2018_7352,10/07/2018,2018-07-10 00:00:00
51645741,1216.89,1216.89,laguna,0.9061489701271056,"Fci Lender Services, Inc.",,,"august 11, 2018",2018-08-11 00:00:00
52648301,2541.3,2541.3,united maple logistics,0.9981685876846312,United Maple Logistics,565533,565533,01/08/18,2018-08-01 00:00:00
50212492,231.0,231.0,bilanz,0.9717836380004884,Bilanz,INV-1770,INV-1770,08/17/2018,2018-08-17 00:00:00
50641922,918.5,918.5,timesnewsgroup,0.6824854612350464,Timesnewsgroup.com,00093487,,"june 21, 2017",2017-06-21 00:00:00
51796793,4867.2,4867.2,ameritex pipe & products,0.9870670437812804,Ameritex Pipe & Products,C0002719,C0002719,"aug 11, 2018",2018-08-11 00:00:00
51874219,76.24,76.24,wtc parts canada,0.9835570454597472,Wtc Parts Canada,508457472,508457472,07/31/2018,2018-07-31 00:00:00
50560284,1118.02,1118.02,nuflours,0.9989914298057556,NuFlours,9391,9391,31 jul. 2018,2018-07-31 00:00:00
51195463,133.0,133.0,zoom video communications,0.9185923933982848,Zoom Video Communications Inc.,,,"august 14, 2018",2018-08-14 00:00:00
50680357,15000.0,15000.0,fractal river,0.9799855351448059,Fractal River,2018SH07,2018SH07,"august 20, 2018",2018-08-20 00:00:00
51279123,,272.76,national general insurance,0.8106931447982788,National General,,,08/05/18,2018-08-05 00:00:00
50941040,771.56,771.56,cfa i laminate,0.7374537587165833,CFA Laminate Pty Ltd,,,,2017-06-30 00:00:00
50225785,319.88,319.88,officeworks.coni,0.6869237422943115,Officeworks,,,08/17/18,2018-08-17 00:00:00
50920605,386.32,386.32,,,Body Plus,0000594122,0000594122,"jul 31, 2018",2018-07-31 00:00:00
52539435,,58.01,,,Office Depot,,185789413001,"december 31, 2017",2017-12-31 00:00:00
50904130,10750.0,10750.0,cast,0.9794169068336488,Cast Inc,CL3655,CL3655,8/09/18,2018-08-09 00:00:00
51421736,8.65,8.65,apple,0.9903365969657898,Apple,215221429226,215221429226,"august 1, 2018",2018-08-01 00:00:00
53013995,2252.17,19341.42,siarc,0.9608420133590698,Siarc Inc Oil & Fuel,,,8/07/2018,2018-08-07 00:00:00
50185548,114.64,114.64,bell,0.9618226885795592,Bell,,,03/08/2018,2018-08-06 00:00:00
51951850,167.6,167.6,heritage food service group,0.9653999209403992,Heritage Food Service Group Inc.,0005153325-IN,0005153325-IN,03 august 2018,2018-08-03 00:00:00
51480217,96.63,96.63,swiiss/harveys,0.8322857618331909,Swiss Chalet Harveys,,,22 august 2018,2018-08-22 00:00:00
51354042,50.0,2015.09,harvey norman,0.9821887612342834,Harvey Norman,2445004,2445004,02/07/2018,2018-03-07 00:00:00
50242094,45.0,45.0,craigslist,0.9723834991455078,Craigslist,6656639074,,08/08/18,2018-08-08 00:00:00
51410533,208.43,208.43,morgan james,0.9789881110191344,Morgan James,4312516,4312516,6/08/2018,2018-08-06 00:00:00
52207973,354.0,354.0,openultra felixstowe,0.9743590354919434,Openultra,INV2679,INV2679,13/07/2018,2018-07-13 00:00:00
51986176,125.0,125.0,jackson,0.5027883052825928,Interac,,,15/08/2018,2018-08-15 00:00:00
53045271,25000.0,25000.0,the vimy foundation,0.9977399110794068,The Vimy Foundation,5291,5291,08/15/2018,2018-08-15 00:00:00
52327704,147.92,147.92,aaccountancy insurance,0.9739996790885924,Accountancy Insurance Pty Ltd,10102568,10102568,2018-07-16,2018-07-16 00:00:00
52235267,70.56,70.56,oddity kombucha,0.986405611038208,Oddity Kombucha,2018-285,2018-285,"august 12, 2018",2018-08-12 00:00:00
51264716,24.0,24.0,j2 global ireland,0.9793458580970764,J2 Global Ireland Limited,37631927,37631927,8/15/2018,2018-08-15 00:00:00
50315594,6154.52,6154.52,king taco restaurants,0.9997785687446594,"King Taco Restaurants, Inc.",000360086,000360086,14/8/2018,2018-08-14 00:00:00
50170392,130.0,130.0,office furniture warehouse,0.98957359790802,Office Furniture Warehouse,125158,125158,july 2018,2018-07-01 00:00:00
50638509,4868.54,4868.54,benczik team realty,0.6033475995063782,120 Main St,,,,2018-08-13 00:00:00
51295512,32.82,32.82,homedepot,0.6734589338302612,Home Depot,,57996,01/07/2018,2018-07-31 00:00:00
51529958,51607.69,51607.69,bmo,0.6624007821083069,BMO Bank of Montreal,,,"august 3, 2018",2018-08-03 00:00:00
51243822,1039.5,1039.5,russell & sons,0.9718865752220154,Russell & Sons,608284,608284,"wed, aug 22, 2018",2018-08-22 00:00:00
52216761,90.0,90.0,,,TD Canada Trust,,,8/14/18,2018-08-14 00:00:00
50935721,42.41,42.41,uber,0.9942004084587096,Uber,,,feb-14-2018,2018-02-14 00:00:00
50169214,695.0,695.0,barracudamsp,0.7103728652000427,Intronis Technologies,018-629342-629173,018-629342-629173,1/06/2018,2018-06-01 00:00:00
51984189,111.23,111.23,285 manchester,0.8628092408180237,ATD-Credit,,S112461989,8/20/2018,2018-08-20 00:00:00
50304005,607.04,607.04,efax,0.9223768711090088,Teleflex,,,08/07/2018,2018-08-07 00:00:00
50830977,19.6,19.6,att,0.9810346961021424,AT&T,,,08.15-18,2018-08-15 00:00:00
52130938,1492.0,1492.0,foam south,0.989478886127472,Taylor Basement 2018,5836,5836,"friday, august 10, 2018",2018-08-10 00:00:00
51909205,135.6,135.6,yow popcorn co,0.9571570754051208,Yow Popcorn,1310,1310,01 aug 2018,2018-08-01 00:00:00
51565855,9605.0,9605.0,oak & rumble,0.977034032344818,OAK & Rumble,18-035,18-035,11/7/2017,2017-11-07 00:00:00
51198189,5.14,5.14,a pro plumbing supply,0.9944789409637452,A Pro Plumbing Supply,64230,64230,10 jul 2018,2018-07-10 00:00:00
52466413,20.0,20.0,corporations,0.8908376693725586,BMO Bank,6580862-R02,6580862-r02,8/10/2018,2018-08-10 00:00:00
51507839,62.98,62.98,paul's ace hardware,0.9987616539001464,Paul's Ace Hardware,883749/6,883749/6,18.08.18,2018-08-18 00:00:00
52014913,101.95,101.95,professional paint center,0.9952185750007628,Professional Paint Center,W0226710,W0226710,"august 13, 2018",2018-08-13 00:00:00
53058013,16.32,1079.55,,,Oak Beverages Incorporated,958027,958027,08/21/18,2018-08-21 00:00:00
50704528,1056.41,1056.41,american airlines,0.9854735136032104,American Airlines,,,"july 17, 2018",2018-07-18 00:00:00
50827160,142.21,142.21,pack my product sales,0.8608041405677795,Pack My Product Sales,300039260,300039260,21-08-2018,2018-08-21 00:00:00
52640246,,36.6,uniform express,0.9963695406913756,Uniform Express,348667,348667,07/13/2018,2018-07-13 00:00:00
50553673,,500.0,randi,0.5665310621261597,Jen Froning,2018,2018 Summer Immersion,"april 16, 2017",2017-04-16 00:00:00
50590661,123.8,123.8,brownes foods,0.8532140851020813,Brownes,14392586,14392586,28 august 2018,2018-08-28 00:00:00
50137124,90.0,90.0,bm consulting,0.94963276386261,BM Consulting,BMC3496,BMC3496,2016-06-15,2016-06-15 00:00:00
50638184,395.5,395.5,surebooks business services,0.9695563316345216,SureBooks Business Services,1164,1164,27.08.2018,2018-08-27 00:00:00
51979749,1073.5,1073.5,pnklaw,0.9010940194129944,Piasetzki Nenniger Kvas LLP,53631,53631,06/15/2017,2017-06-15 00:00:00
51601685,24512.25,18817.12,von tobel corporation,0.8133768439292908,Von Tobel,181,181,31 jul 18,2018-07-31 00:00:00
50255298,3000.0,3000.0,2059401ontarioinc,0.7237438559532166,Payments Received,,2059401ONTARIOINC,"may 04, 2018",2018-04-12 00:00:00
52383976,2.77,2.77,u.s. oil,0.9961597919464112,US Oil,201801298843,201801298843,08/18/2018,2018-08-18 00:00:00
51788057,142.0,142.0,dennis p. block & associates,0.9924128651618958,Dennis P. Block & Associates,169850,169850,07/08/2018,2018-08-07 00:00:00
52840070,-20.0,20.0,hubdoc,0.9997425079345704,Hubdoc,111892,111892,"monday, august 20, 2018",2018-08-24 00:00:00
50236976,4852.5,4852.5,synnex,0.9177145957946776,Synnex,96172203,96172203,08/14/2018,2018-08-14 00:00:00
52572117,207.581,207.58,telstra,0.9757156372070312,Telstra,1365980211,1365980211,08/13/2018,2018-08-13 00:00:00
50671801,90.0,90.0,linode,0.9362489581108092,Linode,7679922,7679922,07/26/18,2018-07-26 00:00:00
51660614,432.23,432.23,idaho central,0.5560051202774048,Square,,,8/7/2018,2018-08-07 00:00:00
52707932,196.65,196.65,wtc parts canada,0.9855887293815612,Wtc Parts Canada,508458013,508458013,12.08.18,2018-08-12 00:00:00
51227145,15.4,15.4,alltel,0.9956160187721252,alltel,66207150,66207150,01/08/18,2018-08-01 00:00:00
52990405,489.33,489.33,bowens,0.9527549743652344,Bowens,14721419,14721419 Di Stasio,01/25/18,2018-01-25 00:00:00
52475917,851.63,851.63,whole aveda oldsmar,0.9526685476303101,Oldsmar Monthly Reports,,,08-27-2018,2018-08-27 00:00:00
50167472,322.35,322.35,heber city carquest,0.6285268068313599,Car Quest Heber City,,15341-11846,02/08/18,2018-08-02 00:00:00
51421534,,5986.5,"w o f f i c e s l e y d i g , v o i t & m a y e r",0.7045352458953857,"Leydig, Voit & Mayer, LTD.",1879107,1879107,16/07/18,2018-07-16 00:00:00
52765283,5930.5,5930.5,cbre,0.586780309677124,CBRE,,Sept 2018 rent,07/02/2018,2018-07-02 00:00:00
50286950,674.12,499.99,faxko,0.8399418592453003,LED Electric Inc.,,,2018-07-23,2018-07-23 00:00:00
52663772,275.0,275.0,waxcenter,0.9107685685157776,Waxcenter.com,SIN290079,SIN290079,"august 2, 2018",2018-08-02 00:00:00
51242444,148.5,148.5,acis,0.8175620436668396,ACIS,526058,526058,08-07-2018,2018-08-07 00:00:00
50670180,220.35,220.35,t&k business services,0.9739176630973816,T&k Business Services,233,233,08/01/2018,2018-08-01 00:00:00
51992463,24.0,24.0,ingram micro,0.9484341144561768,Ingram Micro Global Services,2018SIUK0013984,2018SIUK0013984,"july 5, 2017",2017-07-05 00:00:00
52564896,636.36,636.36,saya skincare,0.9663493037223816,HF - Saya Skincare Pty Ltd,INV-2497,,2018/08/01,2018-08-01 00:00:00
51315420,700.6,700.6,nerdsonsite,0.7175567746162415,Nerds on Site,646589,646589,august 17,2018-08-02 00:00:00
51802237,913.5,913.5,randy nickerson,0.948302149772644,Randy Nickerson,21,21,07-aug-2018,2018-08-07 00:00:00
53005254,1030.99,1030.99,national products fulfilment,0.6652638912200928,National Products Fulfilment,INV-2012-38601,INV-2012-38601,7/28/2018,2018-07-28 00:00:00
50869749,-112.5,-112.5,fulfillment,0.9949269890785216,Fulfillment,51644,51644,jul-31-2018,2018-07-31 00:00:00
50151695,121.2,121.2,rocky mountain wealth architects,0.9427598714828492,Rocky Mountain Wealth Architects,INV-0102,INV-0102,"fri, aug 17, 2018",2018-08-17 00:00:00
50614577,847.0,847.0,uniquefabrics.co.nz,0.8194055557250977,Unique Fabrics New Zealand Pty. Ltd.,433692,433692,24/07/2018,2018-07-24 00:00:00
51179684,370.4,108.95,all about the beans,0.9964712262153624,All About The Beans,2860,2860,"fri, aug 10, 2018",2018-08-10 00:00:00
52101480,-1334.0,-1334.0,lancaster archery supply,0.9804016947746276,Lancaster Archery Supply,900915015,900915015,08/21/2018,2018-08-21 00:00:00
52022334,3050.0,3050.0,sound moves logistics,0.9405299425125122,Sound Moves,SML-601216-001,SML-601216-001,"aug 8, 2018",2018-08-08 00:00:00
50588573,309.24,669.57,freedom mobile,0.7210883498191833,CDCR Report,,,"august 18, 2018",2018-08-18 00:00:00
50529575,71.0,71.0,4-fitwel,0.9837402701377868,Fit Wel,DW- 1621,DW- 1621,25/08/2018,2018-08-25 00:00:00
51168688,68.38,68.38,amazon web services,0.8217564225196838,amazon,146145155,146145155,20 jul 2018,2018-07-20 00:00:00
51329215,,1360.0,steve,0.5918192267417908,Name Steve Lynsdale-de,,,"jul 29, 2018",2018-07-29 00:00:00
51672626,91.69,91.69,the,0.5694369673728943,The Home Depot,,,8/13/18,2018-08-13 00:00:00
51657221,27.0,27.0,brookes books,0.995830535888672,Brookes Books,INV-3975,INV-3975,7/31/2018,2018-07-31 00:00:00
51583347,412.96,412.96,everett pattison health,0.7673813104629517,Everett Pattison,,"August 10, 2018","august 2, 2018",2018-08-02 00:00:00
52405604,3104.08,3104.08,intuition sports,0.9763377904891968,Intuition Sports Inc.,,,08/07/2018,2018-08-07 00:00:00
51770169,68.9,68.9,harris farm markets,0.9866151213645936,Harris Farm Markets,SINV03341564,SINV03341564,08/23/2018,2018-08-23 00:00:00
51990700,9426.27,9426.27,sierra,0.8396745324134827,Nucor Grating Fisher & Ludlow,618503,618503,25.06.2018,2018-06-25 00:00:00
51912540,,1000.0,jacksepticeye,0.5337917804718018,Payroll,,,06/30/2018,2018-06-30 00:00:00
50562689,87.0,87.0,fathom,0.9292499423027042,Fathom,65988,65988,07/11/2018,2018-07-11 00:00:00
51856345,527.28,527.28,supporting strategies,0.9958260059356692,Supporting Strategies,1884,1884,aug 14,2018-08-27 00:00:00
50151936,-10.49,-10.49,ferguson enterprises,0.9987363815307616,Ferguson Enterprises Inc.,CM785226,CM785226,07/30/18,2018-07-30 00:00:00
52184740,-486.75,486.75,,,Zuca,220956CM,,"thu, aug 16, 2018",2018-08-16 00:00:00
52827107,1610.25,1610.25,stephen walters professional corporation,0.9409641027450562,Stephen Walters Professional Corporation,9302,9302,09/08/2018,2018-08-09 00:00:00
51280225,777.98,777.98,air canada's,0.9960765838623048,Air Canada,LGS5PR,LGS5PR,"jul 31, 2018",2018-07-31 00:00:00
50789301,743.76,743.76,,,Mile IQ,,July 2018 Mileage,"wed, aug 8, 2018",2018-08-08 00:00:00
52416350,39.55,39.55,ho yin siu,0.9069981575012208,Ho Yin Siu,201808LAF002,201808LAF002,02/08/2018,2018-08-02 00:00:00
51166242,,1.0,ink,0.7419692873954773,Hp Instant,,,19 aug 2018,2018-08-19 00:00:00
52707115,59.0,59.0,,,Clear Estimates,21768,21768,7/31/2018,2018-07-31 00:00:00
52199882,635.06,635.06,precision orthotic laboratories,0.9991649389266968,Precision Orthotic Laboratories,12841,12841,07/23/2018,2018-07-23 00:00:00
50924347,,387.81,australia post,0.929421067237854,Australia Post,1007738247,1007738247,"aug 13, 2018",2018-08-13 00:00:00
51235829,879.0,879.0,timstyresandauto,0.8611361384391785,Tim's Tyers,00039865,00039865,07/06/2018,2018-06-19 00:00:00
50787572,203.5,246.83,,,doterra,239419156,239419156,7/30/2018,2018-07-30 00:00:00
52855746,12.75,12.75,lyft ride,0.8180949687957764,lyft ride,1171820723778082878,,31-jul-2018,2018-07-31 00:00:00
51837032,85.0,85.0,office copy,0.7387378811836243,Keystone Pest Control,,0211830,8/13/18,2018-08-13 00:00:00
50833370,74.01,74.01,cozzini bros,0.9750921726226808,Cozzini Bros,,,"august 24, 2018",2018-08-24 00:00:00
52209483,79.09,79.09,adobe systems,0.7380141615867615,Adobe Systems Incorporated,934352900,,28/08/2018,2018-08-28 00:00:00
51759437,509.95,509.95,sysco,0.9912296533584596,Sysco,7819531,7819531,,2018-08-02 00:00:00
51220422,101.91,101.91,standard process of n. ca,0.9882813096046448,Standard Process Of N. Ca,1896552-IN,1896552-IN,01/08/2018,2018-08-01 00:00:00
52044161,13.43,13.43,facebook,0.8795066475868225,Facebook,Y4HZ7HWMM2,,08/08/2018,2018-08-08 00:00:00
51191998,3390.0,3390.0,wildhearted studios,0.9893919229507446,Wildhearted Studios Inc.,126,126,"wed, aug 1, 2018",2018-08-01 00:00:00
53030329,96.0,96.0,the cellular connection,0.9992136955261228,The Cellular Connection,279424-I,279424-I,22,2018-08-22 00:00:00
50196319,350.92,350.92,baysideplasterboard,0.9789371490478516,Bayside Plastering Boral,242329,242329,"jul 12, 2018",2018-07-12 00:00:00
51106846,2667.92,2667.92,anthony munro,0.99174827337265,Anthony Munro,00000627,00000627,08/01/2018,2018-08-01 00:00:00
50609722,3919.34,3919.34,gescan,0.9510276913642884,Gescan,,,08/04/2018,2018-08-04 00:00:00
50235508,10.1,10.1,coles,0.9598787426948548,Coles,3962,3962,"april 25, 2018",2018-04-25 00:00:00
52325021,859.86,859.86,4refuel,0.9856444597244264,4refuel,266514,,"tue, aug 7, 2018",2018-08-07 00:00:00
51359185,203.39,203.39,shop.lego,0.6633015871047974,Legoshop.com,,,08/07/2018,2018-08-07 00:00:00
50443603,,0.0,muskoka brewery,0.9927360415458679,Muskoka Brewery,SI126239,SI126239,8/6/2018,2018-08-06 00:00:00
51752071,109.82,109.82,wurth,0.9662094116210938,Wurth,4306386907,4306386907,6/25/2018,2018-05-23 00:00:00
52390706,40.56,40.56,donotreply=upwork,0.9568309783935548,Upwork,194613689,194613689,"thu, aug 9, 2018",2018-08-09 00:00:00
51066526,20179.35,20179.35,facebook,0.995303750038147,Facebook,23190415,23190415,"july 31, 2018",2018-07-31 00:00:00
50800055,4.0,4.0,colorado springs food rescue,0.9835576415061952,Colorado Springs Food Rescue,1031,1031,8/24/2018,2018-08-24 00:00:00
52907003,67.8,67.8,best buy,0.9869287014007568,Best Buy,,,23/02/2018,2018-02-23 00:00:00
51453577,1214.73,1214.73,australian plastic profiles,0.9895161390304564,Australian Plastic Profiles,737647,737647,02 aug 2018,2018-08-02 00:00:00
50191416,406.3,406.3,nrma,0.7436716556549072,greenslips.com,4469200023,,20.08.2018,2018-08-20 00:00:00
52329232,916.3,916.3,chieftains accountants,0.9347379207611084,Chieftains Accountants,2019001176,2019-001176,,2018-08-17 00:00:00
52733634,11403.39,11403.39,symantec,0.8076826333999634,Cushman & Wakefield,ON015-2/102,ON015-2/102,"wednesday, august 15, 2018",2018-08-15 00:00:00
50245955,2034.0,2034.0,pinpoint bookkeeping,0.9872292280197144,Pinpoint Bookkeeping,INV-2791,INV-2791,"feb 27, 2018",2018-02-27 00:00:00
51465572,10.0,10.0,support.microsoft,0.9192044138908386,Microsoft,12510982800,12510982800,07/01/2018,2018-07-01 00:00:00
51316346,401.27,401.27,deschenes,0.7590895295143127,Deschenes,8229968,8229968,,2018-08-15 00:00:00
51107330,828.0,828.0,tsheets,0.8919191360473633,TSheets,,,"july 31, 2018",2018-07-31 00:00:00
52195876,2394.3,2394.3,kloeckner metals,0.9071056842803956,Kloeckner Metals,9122471,9122471,"december 31, 2017",2017-12-31 00:00:00
52990324,388.87,388.87,alloys,0.9974550604820251,Alloys,1714388,1714388,30 july 2018,2018-06-19 00:00:00
50607478,5.0,5.0,digitalocean,0.9848251342773438,Digital Ocean,,,14 aug 2018,2018-06-01 00:00:00
51751141,267.85,267.85,crowe horwath,0.8441689610481262,Crowe horwath,0222587,,08/15/2018,2018-08-16 00:00:00
50754184,1242.38,1242.38,sitebenefits,0.9977474212646484,SiteBenefits Inc,23398,23398,08/24/2018,2018-08-24 00:00:00
51011168,80.5,80.5,flexitime,0.9943689703941344,Flexitime,DIGITALACCOUNTING201808,Digitalaccounting201808,25/01/18,2018-01-25 00:00:00
52419819,4068.0,4068.0,steve sharpe,0.9670612812042236,Steve Sharpe,,,"wed, aug 15, 2018",2018-08-16 00:00:00
50905538,324.22,324.22,the office boss,0.9691582322120668,The Office Boss,,Statement - July2018,8.1.2018,2018-08-01 00:00:00
51178107,1477.42,1477.42,triland property,0.923638641834259,Triland Property,1293,1293,08/28/2018,2018-08-28 00:00:00
53087733,357.86,357.86,konica minolta business solutions,0.8767058849334717,Konica Minolta Business Solutions,85008387,85008387,15 2018,2018-08-15 00:00:00
51841848,263.5,27.58,amazon,0.9958829283714294,Amazon,112-5377412-9300214,112-5377412-9300214,31 july 2018,2018-07-30 00:00:00
50523390,526.5,526.5,beacon light,0.9890214800834656,Beacon Light & Supply Co.,5270200,5270200,"thu, aug 9, 2018",2018-08-09 00:00:00
51050669,428823.0,428823.0,majestic mobiles,0.8420872092247009,majestic mobiles,226511,226511,aug 11 2018,2018-08-11 00:00:00
52082122,867.73,867.73,chempak pharmasystems,0.9630017280578612,chempak pharmasystems,,,08/27/2018,2018-08-27 00:00:00
51608027,378.179,61.66,rcuaysruyrstdsqyaxtd,0.6476698517799377,Amazon,56789,,08/15/18,2018-08-15 00:00:00
51797896,5488.69,5488.69,gordon food service,0.9617806673049928,Gordon Food Service,,,15 june 2018,2018-06-15 00:00:00
51866753,151.44,151.44,sherwin-williams,0.9943094849586488,Sherwin-Williams Co.-Govt,,7593-9 080718,"july 30th, 2018",2018-07-30 00:00:00
50262604,122.91,122.91,st lucie county utilities,0.7772895693778992,St. Lucie County Florida,,,"tuesday, august 14, 2018",2018-08-14 00:00:00
51754786,469.0,469.0,appliancesonline,0.9518104791641236,Appliances Online,SI02824976,SI02824976,2018-08-22,2017-06-23 00:00:00
52019271,2606.72,2606.72,fiore nursery & landscape supply,0.9366938471794128,Fiore,I149494,I149494,13 august 2018,2018-08-13 00:00:00
51631303,,9127.59,imperialtobacco,0.99579256772995,Imperial Tobacco Invoice,2005026251,,8/20/2018,2018-08-20 00:00:00
50927311,106.7,106.7,riva corporation,0.9919648170471193,Riva,INV-59535,INV-59535,7/27/2018,2018-07-27 00:00:00
52104108,6659.0,66.59,aramark-uniform,0.9943475127220154,Aramark,000051414624,000051414624,dec-06-2017,2017-12-06 00:00:00
50785489,8.33,8.33,bergen logistics,0.9924650192260742,Bergen Logistics,10292916,10292916,08/08/2018,2018-08-08 00:00:00
51300764,28.25,36.94,rewind,0.9865782856941224,Rewind,11E10BC-0006,11E10BC-0006,"wednesday, august 1, 2018",2018-08-01 00:00:00
50243478,9829.4,18806.93,alpha connect,0.9925879836082458,Alpha Connect,7607,7607,8/21/2018,2018-08-21 00:00:00
50917010,16.62,16.62,edmonton nut & bolt,0.9493453502655028,Edmonton Nut & Bolt,3397752,3397752,06/14/2018,2018-07-06 00:00:00
52263479,39.9,39.9,infotrack,0.933752715587616,Info Track,200W407908,200w407908,"feb 20, 2018",2018-02-20 00:00:00
50924942,300.87,300.87,,,Goodman,232944,232944,july 31,2018-07-31 00:00:00
51193645,52.88,52.88,regus,0.9525421857833862,Regus meeting room,949-23225,949-23225,30-jun-18,2018-06-30 00:00:00
52075799,139.43,139.43,huntheat,0.8950336575508118,Hunt Heating,217423,217423,7 aug 2018,2018-08-07 00:00:00
50295173,3718.75,3718.75,,,Usa Mobile Drug Testing,3267181,3267181,7-31-18,2018-07-31 00:00:00
51019739,383.6,383.6,deliveroo,0.9854614734649658,Deliveroo Australia,INV-AU-5511,INV-AU-5511,03/12/18,2018-03-12 00:00:00
51777362,5186.83,5378.5,george bouchaya,0.8564497232437134,George Bouchaya,114,114,9 august 2018,2018-08-09 00:00:00
52300800,5.16,5.16,hava java coffee house,0.9932246804237366,Hava Java Coffee House,,,,2018-07-07 00:00:00
52157092,11.85,11.85,fiiz drinks mapleton,0.9413191676139832,FiiZ Drinks Mapleton,024979,,8/22/2018,2018-08-22 00:00:00
51242484,354.53,354.53,gymsales software,0.8417878150939941,Gymsales Software,INV-8227,INV-8227,06/15/18,2018-06-15 00:00:00
50220607,,18.0,big u nn bour,0.6628161668777466,Big W,,EFT,06/02/2018,2018-06-02 00:00:00
52119782,8848.04,8848.04,microart,0.9831764698028564,"Microart Services, Inc.",SI78078,SI78078,8/23/2018,2018-08-23 00:00:00
50579765,36.2,36.2,voipline telecom,0.977209746837616,Volpline,324413,324413,3/08/2018,2018-08-03 00:00:00
52140583,706.25,706.25,christian's cleaning,0.9649111032485962,Christian's Cleaning,129,129,"august 11, 2018",2018-08-11 00:00:00
52286975,,142.87,,,amazon.com,,,01 august 2018,2018-08-01 00:00:00
50476065,480.0,480.0,april jarina,0.7849912047386169,April Jarina,,7312018,8/24/2018,2018-08-24 00:00:00
51380677,27904.76,27904.76,royal bank of canada,0.7165335416793823,Royal Bank Of Canada,,,20.06.2018,2018-06-20 00:00:00
52093798,14.33,14.33,shiptime,0.9669283032417296,Shiptime.com,4188411,4188411,,2018-08-20 00:00:00
52726381,11664.54,11664.54,winsport winsport canada,0.7438784241676331,Winsport,,,23 aug 2018,2018-08-23 00:00:00
52153659,,2449.9,capitalone,0.9769424200057985,Capital One,,,,2018-05-25 00:00:00
51931994,24.95,24.95,total tools,0.9677199721336364,Total Tools,386813,386813,jan-30-2018,2018-01-30 00:00:00
50145843,84.0,84.0,sharesight,0.961322009563446,Sharesight,311412,311412,2018/06/05,2018-06-05 00:00:00
52007280,59.49,59.49,trulite,0.9894400835037231,Trulite,I22257866,I22257866,8/20/2018,2018-08-20 00:00:00
51158039,427.0,427.0,apple,0.9843978881835938,Apple Pty Ltd,6746207609,6746207609,20 august 2018,2018-08-20 00:00:00
52645078,223.03,223.03,hilti,0.9675704836845398,Hilti,1685479881,1685479881,6 aug 2018,2018-08-06 00:00:00
50822204,11674.85,11674.85,jm landscape,0.6440872550010681,JM Landscape,INV-0449,INV-0449,8/16/18,2018-08-16 00:00:00
52639784,115.0,115.0,the home depot,0.9813606142997742,The Home Depot,,,"july 31, 2018",2018-07-31 00:00:00
51147687,517.66,517.66,rimage,0.8957049250602722,rimage,90184263,90184263,7/13/18,2018-07-13 00:00:00
53004317,941.14,941.14,m o'brien painting,0.9599985480308532,M O'Brien Painting Pty Ltd.,J20373,J20373,"mon, aug 27, 2018",2018-08-27 00:00:00
52881343,29966.27,29966.27,jbwere,0.7346425652503967,JBWERE,,,2018-08-22,2018-08-22 00:00:00
51800166,1092.57,1092.57,albion fisheries,0.9807134866714478,Albion Fisheries,,,"march 30, 2018",2018-03-30 00:00:00
52547137,,50.86,amazon,0.9929715991020204,Amazon.com,,,15/08/2018,2018-08-15 00:00:00
50339559,9249.7,9249.7,flight centre,0.947429656982422,Flight Centre,BF0I2018DINVC0033,,8/26/2018,2018-08-26 00:00:00
51165972,882824.25,882824.25,macquarie,0.6533960700035095,360 Private,,,6/13/2018,2018-06-13 00:00:00
53057942,95.73,95.73,pacificplumbing,0.6573334336280823,Pacific Plumbing,06262373,06262373,"july 31, 2018",2018-07-31 00:00:00
52532477,2321.46,2321.46,development company of america,0.9214194416999816,"Development Company of America, Inc",,September Rent,13.08.2018,2018-08-13 00:00:00
50648940,44.11,44.11,trade uk,0.6455238461494446,Screwfix,0895739658,0895739658,"jul 21, 2018",2018-07-21 00:00:00
52420536,75.0,75.0,oregon entrepreneurs network,0.8759220838546753,Oregon enterpreneurs network,CH_1D1GEGEX0TESDGVOXJPPLAHS,,"wed, aug 22, 2018",2018-08-22 00:00:00
52207004,6.3,6.3,shopify,0.611760139465332,Shopify,,,07/31/2018,2018-07-31 00:00:00
52345627,62.74,62.74,shiptime,0.9548642635345459,ShipTime,114724,114724,08/21/18,2018-08-21 00:00:00
53089622,3546.28,3546.28,comfort energy,0.7164812684059143,"Comfort Energy, Inc.",151250,151250,06/26/18,2018-06-26 00:00:00
52357241,377.0,377.0,asic,0.9522684812545776,ASIC,,,"friday, august 03, 2018",2018-08-03 00:00:00
50883658,42834.88,42834.88,kodeshop alicante 2004 s.l,0.9180004596710204,Kodeshop Alicante 2004 S.L.,SI/2018/0143KSA,0143KSA,7 aug 2018,2018-08-07 00:00:00
51488160,283.15,283.16,mckee foods,0.9402843713760376,McKee Foods,148824254,148824254,"tue, jul 17 2018",2018-07-17 00:00:00
51986864,5193.81,5193.81,capo sgro,0.9373009204864502,Capo Sgro LLP,59206,59206 DMJ,"august 3, 2018",2018-08-16 00:00:00
52121799,429.56,429.56,xfinity,0.8481760621070862,Xfinity,,,08-08-2018,2018-08-08 00:00:00
51397874,21.25,21.25,greenp,0.9800613522529602,GreenP,14605744,,8/16/2018,2018-05-31 00:00:00
52975747,220.0,220.0,lemon tree landscpaes,0.7569147944450378,Lemon Tree Landscpaes,10161,10161,02-aug-2018,2018-08-02 00:00:00
51543733,220.0,220.0,unavailshop,0.9796282052993774,unavailshop via Square,05197G,,31-jul-2018,2018-07-31 00:00:00
50604553,898.27,898.27,icl,0.914362907409668,Icl,SI23035,,09/08/2018,2018-08-09 00:00:00
51907483,5698.35,7294.35,accurate drafting,0.9726024866104126,Accurate Drafting,2018-046,2018-046,,2014-06-12 00:00:00
51265513,49.88,49.88,aliexpress,0.93860924243927,Aliexpress,93677915592262,,8/15/18,2018-08-15 00:00:00
53036914,7076.4,7076.4,thyssenkrupp elevator,0.9137197136878968,thyssenkrupp Elevator,,,08/21/2018,2018-08-21 00:00:00
51650653,150.0,150.0,dear systems,0.9951415657997132,Dear Systems Limited,INV-41578,INV-41578,"april 30, 2018",2018-04-30 00:00:00
51303509,734.5,734.5,the cloud accountant,0.996158480644226,The Cloud Accountant Inc.,3099,3099,"jul 31, 2018",2018-07-31 00:00:00
50955481,36.0,36.0,vox,0.5258275866508484,Workspace Management Ltd,1329915,,2018-08-10,2018-08-10 00:00:00
51398602,,1038.92,liteline corporation,0.8373969793319702,Liteline Corp.,1NV205655,INV205655/ 0585,8/2/2018,2018-08-02 00:00:00
53025879,3172.51,3172.51,papaya solutions,0.7851346731185913,Papaya Solutions N.V.,180826,180826,"aug 14, 2018",2018-08-14 00:00:00
51640903,1098.38,554.08,hollyburn country club,0.9880194067955016,Hollyburn Country Club,39820,July 2018,07/18/2018,2018-07-18 00:00:00
52194458,1120.0,1120.0,herron,0.6598736047744751,Herron Todd White,JB1004477,JB1004477,7/26/2018,2018-07-26 00:00:00
51388285,58.6,58.6,adams pest control,0.969921350479126,Adam's Pest Control,2687977,2687977,08/10/2018,2018-08-10 00:00:00
52707311,,35.25,mohhs,0.4926348626613617,Loblaws,,,01 aug 2018,2018-08-01 00:00:00
52723195,46.66,46.66,torbramelectric,0.7506451606750488,City Electric Supply,VIC/78453,VIC/78453,08/19/2018,2018-08-19 00:00:00
52118771,1742.32,1742.32,bshell canada products,0.8898755311965942,Shell Canada Products,42334696,42334696,"august 6, 2018",2018-08-06 00:00:00
52084300,373.79,373.79,,,Emcoltd,79442102-00,79442102-00,"august 4, 2018",2018-08-04 00:00:00
53037269,25.19,25.19,kijiji canada,0.7807636857032776,Kijiji Canada,,CA20023197448,"wed, aug 8, 2018",2018-08-08 00:00:00
51867852,2025.0,2025.0,gbg energy,0.9959484934806824,GBG Energy,HERS-1509,HERS-1509,2018-05-15,2018-05-15 00:00:00
50779868,273.24,273.24,metrics chartered,0.8451871275901794,Metrics Chatered Professional,A2FB7C0-0020,A2FB7C0-0020,08/01/18,2018-08-01 00:00:00
52427912,30.0,30.0,xero,0.9977400898933412,Xero,INV-1582446,INV-1582446,6/ 20/ 18,2018-06-20 00:00:00
50678157,10.8,10.8,autoentry,0.9661333560943604,AutoEntry,INV-68058,INV-68058,8/ 1/2018,2018-08-01 00:00:00
52033027,,3.51,digikey,0.9260330200195312,DIGI KEY,63508565,63508565,20.08.2018,2018-08-20 00:00:00
52522026,439.3,439.3,yuens,0.962459921836853,Yuens,1038634,1038634,08/01/2018,2018-08-01 00:00:00
50985735,317.2,317.2,innisfial,0.8384013175964355,The Town of Innisfail,1019340,1019340,"friday, august 17, 2018",2018-08-17 00:00:00
51862430,576.0,576.0,craftmade,0.9303019642829896,Craftmade,90603527-00,90603527-00,06 aug 2018,2018-08-06 00:00:00
50802412,284.99,284.99,amazon,0.994777500629425,Amazon,702-9216114-1619449,,26/08/2018,2018-08-26 00:00:00
50299056,,4104.18,us foods,0.9991477727890016,US Foods Inc,1115489,1115489,24/08/2018,2018-08-24 00:00:00
51814739,98.32,98.32,cupertino florist,0.9884076714515686,Cupertino Florist,281002805,281002805,"sunday, july 29, 2018",2018-07-29 00:00:00
50917309,1937.7,1937.7,fastsigns,0.9462136030197144,Fastsigns,E-SF-79855,E-SF-79855,05/28/2018,2018-05-28 00:00:00
50280923,903.94,903.94,new roots herbal,0.9875677824020386,New Roots Herbal,294615,294615,1. august 2018,2018-08-01 00:00:00
51399529,47.84,47.84,regus,0.9946012496948242,Regus,1614-15517,1614-15517,8/26/18,2018-08-26 00:00:00
50336809,218.9,218.9,deca australia,0.6315554976463318,Cjd Equipment Pty. Ltd.,006218198,6218198,"thursday, july 26, 2018",2018-07-26 00:00:00
52434205,425.5,425.5,kelly services,0.992096483707428,Kelly Services,209241,209241,2018-07-31 2018-07-31,2018-08-02 00:00:00
51677611,1.99,1.99,amazon,0.9984200596809388,amazon.com,D01-6115528-5283463,D01-6115528-5283463,"august 27, 2018",2018-08-27 00:00:00
52728029,3.68,3.68,tota! parts express,0.8234305381774902,Total Parts Express ltd.,,800-564539,"tue, aug 7, 2018",2018-08-07 00:00:00
51933848,229076.09,229076.09,california bank,0.9848854541778564,California Bank,,,20/07/2018,2018-07-20 00:00:00
51973126,214.29,214.29,direct fasteners & industrial supplies,0.9937443137168884,Direct Fasteners,54986,54986,"jan 31, 2018",2018-01-31 00:00:00
51908255,,6.76,rite,0.6078617572784424,Rite Aid,,180803,1 7 2018,2018-08-17 00:00:00
52385261,113.86,113.86,cobblestone hotel & suites,0.7544412612915039,Cobblestone Hotel & Suites,,,"14, 2018",2018-08-14 00:00:00
52502419,295.5,295.5,,,NV Energy 7966,2043796,Unit 100B,"may 19, 2018",2018-05-19 00:00:00
50767819,,16.44,topmast chemieal,0.7131207585334778,Topmost,675769,675769,17-jul-2018,2018-07-17 00:00:00
50753178,316.36,316.36,jocelyn chan,0.7297816276550293,Jocelyn Chan,,July Expense 2018,"june 6, 2018",2018-06-06 00:00:00
51369858,2000.0,2000.0,donya gambardella,0.9054203033447266,Donya Gambardella,103SIG,103SIG,08/07/2018,2018-08-07 00:00:00
52605327,308.7,308.7,fitness foods,0.9594318866729736,Fitness Foods,,1212,6/16/2018,2018-06-16 00:00:00
52047901,10000.0,10000.0,rafferty air,0.7449929714202881,Ben Rafferty Air & Electrical,12201,12201,2018/08/08,2018-08-08 00:00:00
51814525,1695.0,747.99,amazon,0.9962112903594972,Amazon,113-9980769-6409017,,4/11/2018,2018-07-01 00:00:00
52092907,403.1,403.1,aeronet,0.9072890877723694,Aeronet,INV-11719,INV-11719,13-aug-2018,2018-08-13 00:00:00
50225427,3931.35,3931.35,dhouse,0.7053604722023009,CMI Music & Audio,380202,380202,31 jul 2018,2018-07-31 00:00:00
50844900,4320.0,4320.0,salesforce,0.9991081953048706,salesforce,13128863,13128863,03 dec 2018,2018-07-30 00:00:00
52188497,220.95,220.95,montgomery pacific corporation,0.9996599555015564,Montgomery Pacific Corporation,2018-2160,2018-2160,07/27/2018,2018-07-27 00:00:00
52932496,154.25,154.25,goodman,0.9128317832946776,Goodman,232944,R030329,31/07/2018,2018-07-31 00:00:00
50739253,5.0,5.0,google,0.9951418042182922,Google,3484184095,3484184095,"august 22, 2018",2018-08-22 00:00:00
51012051,278.09,278.09,myat&t,0.943892538547516,At&t,,,08/01/2018,2018-08-01 00:00:00
52969721,1.31,1.31,buccaneer marina & resort,0.992539644241333,Buccaneer Marina & Resort Ltd.,301911,301911,2018-08-22,2017-12-01 00:00:00
50543760,26.95,26.95,broad st mobil,0.955214500427246,Broad St Mobil,645716,,08/03/2018,2018-08-06 00:00:00
50770091,-68.29,68.29,toddy®,0.7295052409172058,Toddy,2055952,2055952,"jul. 06, 2018",2018-07-06 00:00:00
50453321,62.8,62.8,groupon,0.9786375164985656,Groupon,1000-097166-357939,1000-097166-357939,07/30/2018,2018-07-30 00:00:00
51624223,3491.7,3491.7,redcage,0.6991073489189148,Redcage Solutions,SAJ/2018/3562,SAJ/2018/3562,01/07/2018,2018-07-01 00:00:00
50462838,192.0,192.0,beyond123,0.992633819580078,Beyond 123,68645,68645,"tue, aug 21, 2018",2018-08-21 00:00:00
51040978,550.0,550.0,andreano & son excavations,0.9573280811309814,Andreano & Son Excavations,00002357,00002357,"sat, jun 16, 2018",2018-06-16 00:00:00
51420496,12.97,12.97,home depot,0.6599766612052917,Home Depot,,,8/1/2018,2018-08-01 00:00:00
50373317,10.24,10.24,rasier pacific,0.8782071471214294,UBER,CGTYXCAP-03-2018-0002051,CGTYXCAP-03-2018-,"aug 10, 2018",2018-08-10 00:00:00
52141871,95.86,95.86,platt,0.9425409436225892,Platt.com,,,08/18/2018,2018-08-18 00:00:00
51853440,2253.15,2253.15,bilanz,0.9540424942970276,Bilanz,INV-1796,INV-1796,08/14/18,2018-08-14 00:00:00
50890183,176.24,176.24,entergy-louisiana,0.9836831092834472,Entergy,35005353796,35005353796,1/08/2018,2018-08-01 00:00:00
51106828,40651.05,40651.05,dynamic bradview roofing,0.9810642600059508,Dynamic Bradview Roofing,INV-52536,,11-aug-2018,2018-08-11 00:00:00
52002430,17.34,17.34,unique wholesale,0.9824228882789612,Unique Wholesale,1626606,1626606,15/08/2018,2018-08-15 00:00:00
52374253,27.46,27.46,bni,0.8275390267372131,BNI,,,07/31/2018,2018-07-31 00:00:00
51852985,113.0,113.0,the cellular connection,0.9996036887168884,The Cellular Connection,IN000000000459705,IN000000000459705,,2018-07-31 00:00:00
50969813,305.1,305.1,alberto cubillas,0.8796494603157043,Alberto Cubillas,1055,1055,14 aug 2018,2018-08-14 00:00:00
51713335,66.98,66.98,ameripride,0.9004483222961426,Ameripride,1502185915,1502185915,"aug. 03, 2018",2018-08-03 00:00:00
53108381,3.48,3.48,mycommerce,0.8227184414863586,Digital River Company,570776303,570776303,7/31/2018,2018-08-01 00:00:00
51724214,1709.88,1709.88,anna michella domenici,0.8079295754432678,Anna Michella Sehwani Domenici,MD11,MD11,,2018-08-22 00:00:00
51182684,117.0,117.0,haba technologies,0.9845372438430786,"HABA Technologies, Inc.",3182,3182,06/02/2018,2018-02-06 00:00:00
53096424,1410.05,1410.05,the home depot,0.9505324363708496,The Home Depot,6616-902498,90288,"tuesday, august 21, 2018",2018-08-21 00:00:00
52360470,772.41,772.41,discount drug stores,0.9813702702522278,Discount Drug Stores,00100648,00100648,07/31/18,2018-07-31 00:00:00
52606277,21.99,21.99,plumbfix,0.9544004201889038,Plumbfix,A4561805799,A4561805799,08/22/2018,2018-08-22 00:00:00
50606336,,165.0,,,Positive Accounting Solutions,,2639,"july 28, 2018",2018-07-28 00:00:00
51324205,993.68,993.68,avail administrative services,0.8563569188117981,Avail Administrative Services,1065,1065,06/22/2018,2018-06-22 00:00:00
50945223,151.39,151.39,partscheck,0.9874893426895142,Partscheck,16901807,16901807,7/30/2018,2018-07-30 00:00:00
50919196,214.53,214.53,s h e r r i f f e l e c t r i c a l,0.9888020157814026,Sherriff Electrical,309070362,309070362,07/28/2018,2018-07-28 00:00:00
50893920,167.4,167.4,mount hope wholesale,0.9630114436149596,Mount Hope,609203,609203,2018/07/20,2018-07-20 00:00:00
50921569,30.0,40.46,insightly,0.9552730917930604,Insightly Inc,IN_DB0CBO1BH300FC,,12 jun 2018,2018-06-12 00:00:00
52600033,1073.5,1073.5,clocktower brewing,0.996185839176178,Clocktower Brewing,CNWBE-155-1422,CNWBE-155-1422,"aug 03, 2018",2018-08-03 00:00:00
52563027,2695.0,2695.0,adam brennan,0.8602371811866759,Adam Brennan,610,610,01 august 2018,2018-08-01 00:00:00
50676965,19.74,19.74,parcel monkey,0.6975088715553284,Parcel Monkey,5362779,5362779,08/15/18,2018-08-15 00:00:00
50946612,59.9,59.9,dodo,0.8248921632766724,dodo accounts,,03-08-2018,08/14/18,2018-08-14 00:00:00
50878919,224.83,224.83,amazon,0.9958300590515136,Amazon,702-4252673-7289833,702-4252673-7289833,10/20/17,2017-10-20 00:00:00
52486318,396.96,396.96,agropur cooperative natrel division,0.7608476877212524,Agropur Cooperative Natrel Division,W5059563,W5059563,06-aug-18,2018-08-06 00:00:00
52760395,215.0,215.0,steiner biotechnology steiner biotechnology,0.9513770341873168,Steiner Biotechnology,S2123,S2123,30 jun 2018,2018-06-30 00:00:00
51370976,65.0,65.0,chargeover,0.8981817960739136,ChargeOver,M9GT9,M9GT9,,2018-08-13 00:00:00
52264337,222.5,222.5,midway building services,0.8882808089256287,Midway Building Services,23123,23123,08/03/2018,2018-08-03 00:00:00
51857577,161.26,161.26,bes.co.uk,0.7689909934997559,B E S,,2323942,24 jun 2018,2018-06-24 00:00:00
51442633,1992.2,1992.2,apexmasonry,0.9079189300537108,Apex Masonry,103027,103027,07/31/2018,2018-07-31 00:00:00
53056358,88.81,88.81,gulfeagle supply,0.9940724372863772,GULFEAGLE Supply,S8189050.001,S8189050.001,17/07/2018,2018-07-18 00:00:00
50380213,152.55,152.55,,,Pitchers Hospitality Supplies,,,8/1/2018,2018-08-01 00:00:00
52410581,108.33,108.33,zoro,0.9555962681770324,Zoro,5460234,5460234,30 july 2018,2018-07-30 00:00:00
51510157,,63.0,,,Goodwill Industries of North Centre,,,08/07/18,2018-08-07 00:00:00
52475248,940.5,940.5,tox free australia,0.9613785147666932,Toxfree,5583515,5583515,"aug 17, 2018",2018-08-17 00:00:00
51844279,1077.96,1077.96,quest,0.8564659357070923,Quest,182669186,182669186,"monday, july 30, 2018",2018-07-30 00:00:00
50455972,42.15,42.15,wv/w.juzousa,0.7470722198486328,Juzo,01358988,01358988,27/08/2018,2018-07-31 00:00:00
52979929,544.5,544.5,pressed earth juices,0.8270719051361084,Pressed Earth Juices,INV-332018259247,INV-332018259247,"july 28, 2018",2018-07-28 00:00:00
52195710,368.34,368.34,kloeckner metals,0.9081568121910096,Kloeckner Metals,9124701,9124701,08/20/2018,2018-08-20 00:00:00
50482776,109.99,109.99,coca-cola bottling company,0.9013538360595704,Coca Cola,2168206524,2168206524,2 aug 2018,2018-08-02 00:00:00
51478392,2.0,2.0,mytax.illinois.gov/_/retrieve/0/c-/mbegnvczmgfucmy7cv7bvq__?file__=webhtml,0.5821197032928467,Illinois Department of Revenue,,,08/09/18,2018-08-09 00:00:00
51769651,1800.0,1800.0,equal exchange,0.8965376615524292,Equal Exchange Boylston,PSI230726,PSI230726,08/01/2018,2018-08-01 00:00:00
52383984,607.99,607.99,jetbrains americas,0.8691233396530151,JetBrains Americas Inc,INVJBA796496,INVJBA796496,"august 1, 2018",2018-08-01 00:00:00
52759428,51.46,51.46,uberx,0.9947208166122437,Uber,,,"22 aug, 2018",2018-08-22 00:00:00
52738423,,1880.74,american express,0.9352545738220216,Amex the Plum card 41009,,,07/11/2018,2018-07-11 00:00:00
52385393,443.0,443.0,grab,0.9201564788818359,Grab,IOS-57394702-4-008,,"tue, aug 7, 2018",2018-08-07 00:00:00
51961120,27.35,27.35,epochstats,0.9651246070861816,EpochStats (Virtual Real Porn),,,"may 22, 2018",2018-05-22 00:00:00
51256487,687.5,687.5,jeanna leclair,0.8889713287353516,Jenna Leclair Design & Illustration,18-002,18-002,"may 24, 2018",2018-05-24 00:00:00
51513534,16435.0,16435.0,us-analytics solutions group,0.9288591146469116,US-Analytics,26208,26208,7/30/2018,2018-07-30 00:00:00
51853327,126.56,126.56,intuit quickbooks,0.8058863282203674,Intuit QuickBooks,230012093952,230012093952,"august 20, 2018",2018-08-20 00:00:00
50848289,357.5,357.5,abuzz couriers,0.871521532535553,Abuzz,INV-0170,INV-0170,8/07/18,2018-08-07 00:00:00
50921084,170.5,170.5,cheapgarbageservice,0.8985301852226257,Cheap Garbage Service,,,,2018-07-27 00:00:00
51862794,73.51,73.51,tech data canada,0.9825152158737184,Tech Data Canada,,,"aug 07, 2018",2018-08-07 00:00:00
51357716,40.11,40.11,blackbutt hardware,0.9946305751800536,Blackbutt Hardware,1075543,1075543,"mon, feb 27, 2017",2017-02-27 00:00:00
52022700,87.26,87.26,supply centre,0.7028464078903198,Supply Centre and Bookstore,4571,,"july 30, 2018",2018-07-30 00:00:00
52161425,2800.0,39.67,aximum fun,0.857548713684082,Capral aluminium,,96403802,august-04-2018,2018-08-04 00:00:00
52576436,2692.43,2692.43,vision source,0.8968430757522583,Vision Source Marketing,,,10 aug 2018,2018-08-10 00:00:00
50775440,2.21,2.21,parking,0.9826914072036744,Parking,383389579,383389579,8/10/2018,2018-08-10 00:00:00
51547875,1185.03,1185.03,credit one bank,0.8622782230377197,Credit One Bank Credit Card,,,23 jul 2018,2018-07-23 00:00:00
52068876,,714.5,government ol south australia,0.6368081569671631,DPTI,,0023834567,"aug 06, 2017",2017-08-06 00:00:00
51419987,207.9,207.9,yoggu,0.7594286799430847,YOGGU,3,3,"sat, jul 28, 2018",2018-07-28 00:00:00
50572085,202.71,202.71,the orchid lei company,0.9847460389137268,The Orchid Lei Company,MOANA18-144,MOANA18-144,8/17/2018,2018-08-17 00:00:00
50438338,69.3,69.3,golden state lumber,0.9743123054504396,Goldenstate Lumber,2854816,2854816,08/07/18,2018-08-07 00:00:00
51739925,14.99,14.99,adobe,0.7479476332664491,Adoble Creative Cloud,ADB013632284,ADB013632284,08/24/18,2018-08-24 00:00:00
51200517,734.6,734.6,bg products,0.9355928301811218,BG Products,221129245,,8/07/18,2018-08-07 00:00:00
52196185,6534.46,6534.46,crystalcreeklogistics,0.9733948707580566,Crystal Creek Logistics LLC,COR18-8B,COR18-8b,7/08/2018,2018-08-07 00:00:00
50935484,877.98,877.98,powertorque,0.7126064896583557,Power Torque Finance,,,08/09/2018,2018-08-09 00:00:00
51881231,89.1,89.1,cpawebengage,0.7579882740974426,Cpaacademy.org,5704,5704,21-aug-2018,2018-08-21 00:00:00
51340169,48.0,48.0,simplemdm,0.9490718841552734,Simplemdm,CH_1CSDKL2Y125WDFJ8FFHVTLEY,ch_1CsDkl2Y125wdFj8FfHVtley,"july 13, 2018",2018-07-13 00:00:00
50590634,963.22,963.22,allegion,0.7271362543106079,Brio,,,"august 24, 2018",2018-08-24 00:00:00
51579325,,3394.49,vexilor:transaction,0.7000660896301271,Daily Sales,,,"mon, aug 13, 2018",2018-08-13 00:00:00
51580967,394.37,394.37,breakawayexperiences,0.5638502240180969,Breakaway,4891,4891,07/31/2018,2018-07-31 00:00:00
53020373,712.1,712.1,gordon food service,0.9760303497314452,Gordon Food Service,2883532,2883532,20/08/18,2018-08-20 00:00:00
52293392,200.0,200.0,us-analytics solutions group,0.9321740865707396,US-Analytics,26380,26380,04/08/2018,2018-08-04 00:00:00
52784769,59.99,59.99,dashlane,0.9374229907989502,Dashlane,,,,2018-08-01 00:00:00
50169766,2.67,2.67,uber,0.936010241508484,Uber,,,"fri, jul 27, 2018",2018-07-27 00:00:00
51047138,47.38,47.38,mcmaster-carr,0.986469030380249,McMaster-Carr,69549562,69549562,08/02/18,2018-08-02 00:00:00
52678656,249.0,249.0,wp engine,0.992401659488678,WP ENGINE,INV01370844,INV01370844,"june 2, 2018",2018-06-02 00:00:00
52003213,1469.72,1469.72,red mechanical,0.7790752649307251,Red Mechanical,018-12477,018-12477,8/9/2018,2018-08-09 00:00:00
50833810,189.73,189.73,,,David Christensen Consulting,,reimb July,7/8,2018-07-03 00:00:00
51821586,43.25,43.25,dunn-edwards corporation,0.6678072810173035,The Finest Paints,,,"july 5, 2018",2018-07-20 00:00:00
52859354,138.6,138.6,outer aisle gourmet,0.9914653301239014,Outer Aisle Gourmet,2027119,2027119,07/31/2018,2018-07-31 00:00:00
52675694,7.99,7.99,amazon,0.9969395995140076,Amazon,113-6687240-7947445,113-6687240-7947445,01/08/18,2018-08-01 00:00:00
52155152,2894.04,2894.04,xero australia,0.6812959313392639,Xero Australia Pty Ltd.,INV-6684952,INV-6684952,08/15/18,2018-08-15 00:00:00
50433896,1594.63,1594.63,signature systems group,0.9985545873641968,Signature Systems Group,PSI034613,PSI034613,"aug 1, 2018",2018-08-01 00:00:00
50593825,245.04,245.04,eurofoodsqld,0.8690463900566101,Euro Food Qld,,MM17502,06/08/18,2018-08-06 00:00:00
50219406,121.59,121.59,bell mobility,0.7710471749305725,Bell,525148549,,8/4/2018,2018-08-04 00:00:00
50327703,24.06,24.06,amazon,0.9985187649726868,Amazon,114-5474169-7299447,114-5474169-7299447,12/7/2016,2016-12-07 00:00:00
52365705,1659.0,1659.0,ryan mcallister,0.9451149702072144,Ryan McAllister,17,17,2018-08-01,2018-08-01 00:00:00
52391470,1237.5,1237.5,csaa,0.7655484080314636,Csaa Insurance,,CAAS206896442,08/18/18,2018-08-18 00:00:00
51838239,87.45,87.45,s h e r r i f f e l e c t r i c a l,0.9895665049552916,Sherriff Electrical,,309071181,23/08/2018,2018-08-24 00:00:00
51737898,347.81,347.81,vittle-healthy meal plan,0.8297107815742493,Auto-Receipt,40871188484,,31/07/2018,2018-07-31 00:00:00
50888642,821.93,821.93,citicards,0.9312549233436584,Citi,,,aug 13/2018,2018-08-13 00:00:00
53072277,109.72,109.72,fortisbc,0.9882024526596068,Fortis BC,,,14/07/18,2018-07-14 00:00:00
50861037,206.25,206.25,standard real estate services,0.8337146043777466,VI Standard Real Estate Services,,,23/07/2018,2018-07-23 00:00:00
50903509,352.14,352.14,aramark uniform services,0.8513498306274414,Aramark,,May-July 2018,"wednesday, august 1, 2018",2018-08-01 00:00:00
53092400,87.95,87.95,godaddy,0.9909347891807556,Godaddy,1359607115,1359607115,08/15/2018,2018-08-15 00:00:00
51545445,229.67,229.67,myob,0.8351789712905884,Myob,1-46255520979,1-46255520979,03/08/2018,2018-08-03 00:00:00
51492403,-178.87,-178.87,george howell coffee,0.8972803950309753,George Howell Coffee,73965,73965,2/08/2018,2018-08-02 00:00:00
52441171,108.41,99.0,apple,0.8994789123535156,apple store,W586622705,W586622705,"tuesday, august 7, 2018",2018-08-07 00:00:00
50698026,367.39,367.39,f. l. harter & sons,0.9984108805656432,"F. L., Harter & Sons, Inc.",8856,HarterJeffJuly18,28/07/18,2018-07-28 00:00:00
51070916,213.03,213.03,giant enterprises,0.986166536808014,"Giant Enterprises, Inc.",323735,323735,10/03/16,2016-10-03 00:00:00
53011515,253.0,253.0,d.f. skelley & co,0.8534749150276184,D.F Skelley & Co,00038359,00038359,08/11/2018,2018-08-11 00:00:00
51768601,24.0,24.0,silver,0.5801336169242859,Deanway Properties,2145,2145,14/08/2018,2018-08-14 00:00:00
51571364,123.36,123.36,gme,0.8336995244026184,GME,2191831,2191831,"august 10, 2018",2018-08-01 00:00:00
51200875,181.52,181.52,samsclub,0.9253848791122437,Sam's Club,1738799037,,"tue, aug 21, 2018",2018-08-21 00:00:00
52752259,8460.0,8460.0,2nd,0.5010235309600829,FRANKLIN ARMORY,18-9587,18-9587,2018-08-22,2018-08-22 00:00:00
53049339,27705.34,27705.34,climatemp systems,0.9705331325531006,Climatemp Systems,58245,58245,8/6/2018,2018-08-06 00:00:00
51257335,997.13,997.13,agropur cooperative natrel division,0.7851582169532776,Agropur Cooperative Natrel Division,W1518980,W1518980,"august 27, 2018",2018-08-27 00:00:00
52769421,114.31,114.31,alexander timber & hardware,0.7942138314247131,Mt Alexander Timber and Hardware,110313951,110313951,21.08.2018,2018-08-21 00:00:00
51785914,189.0,189.0,cluso investigation,0.9970892071723938,Cluso Investigation,67975,67975,1 aug 2018,2018-08-01 00:00:00
51176131,2015.99,2015.99,marine home center,0.9855806827545166,Marine Home Center,,13323 7.18,31 jul 2018,2018-07-31 00:00:00
52436685,16960.81,16960.81,flashpoint fuels,0.9893342852592468,Flashpoint Fuels Ltd.,471830017,471830017,"jun 15,2018",2018-06-15 00:00:00
50628827,767.3,767.3,mundubbera tyre service,0.9651728272438048,Mundubbera Tyre Service,,,09/08/2018,2018-08-09 00:00:00
52132862,113.0,113.0,rewind,0.9893798828125,Rewind,A833AE8-0006,A833AE8-0006,31 may 2018,2018-05-31 00:00:00
51477706,6825.0,6825.0,decorative concrete,0.6592680215835571,Curb Canada,,,9 apr 2018,2018-04-09 00:00:00
51951002,5929.91,5929.91,district of columbia,0.7188611030578613,District of Columbia,,,08/09/18,2018-08-09 00:00:00
52506401,17.41,17.41,uber,0.9947104454040528,Uber,,,7 may 2018,2018-05-07 00:00:00
52918232,500.0,500.0,powassan bikers,0.96623295545578,Powassan Bikers Fest,004451,,04/07/2018,2018-07-04 00:00:00
52397649,,302.49,"alarm lock systems,inc",0.6316347122192383,"Alarm Lock Systems, Inc.",491805,491805,08/10/2018,2018-08-03 00:00:00
52090805,,346.67,,,discount propane,,,15/08/2018,2018-08-15 00:00:00
51333536,720935.0,720935.0,tomorrowland co,0.9204753041267396,"Tomorrowland Co., Ltd.",NO.18FW00034,NO.18FW00034,04/16/2018,2018-04-16 00:00:00
52417320,76.56,674.28,lcbo,0.91226726770401,LCBO,,,08/17/18,2018-08-17 00:00:00
52810579,150.0,150.0,maryland tech solutions,0.9939693212509156,Maryland Tech Solutions,3546,3546,28 july 18,2018-07-28 00:00:00
50911357,,12030.55,datacentres.rogers,0.6590483784675598,Rogers Data Center (68278),2032515,2032515,27 jul 18,2018-07-27 00:00:00
50948573,80.5,80.5,shimano,0.994504988193512,Shimano,07755570 RI,07755570 RI,"apr 30, 2015",2015-04-30 00:00:00
50366984,133.87,133.87,uline,0.9988614916801452,Uline.com,99804789,99804789,08/09/18,2018-08-09 00:00:00
52416931,2100.0,2100.0,,,lenbeth weeping tile,337730,337730,8/23/18,2018-08-23 00:00:00
51558472,28.37,28.37,uber,0.9928025603294371,Taxi and Uber,,,,2018-07-30 00:00:00
51291263,1027.6,1027.6,firma,0.8523931503295898,Firma,,,07/31/2018,2018-07-31 00:00:00
50535878,214.9,35.99,ebay,0.9734880924224854,eBay,,,08/07/2018,2018-08-07 00:00:00
51655014,593.12,593.12,lawrenceville,0.9989540576934814,Lawrenceville,5313715-00,5313715-00,"august 17, 2018",2018-08-17 00:00:00
51770802,53.99,53.99,the home depot,0.8397493362426758,The Home Depot,,,"august 31, 2018",2018-08-31 00:00:00
52891315,99.0,99.0,officeworks,0.9975883364677428,Officeworks,38286854,38286854,01 aug 2018,2018-08-01 00:00:00
50757899,19.06,19.06,freedomvoice,0.9984173774719238,Freedom Voice,309522,,"fri, aug 17, 2018",2018-08-17 00:00:00
52444880,1500.0,1500.0,ascendeur,0.7751510143280029,Ascendeur,20,20,"tue, aug 21, 2018",2018-08-21 00:00:00
51985528,36.0,36.0,dmp,0.9837312698364258,DMP,1154732,1154732,"sun, jul 8, 2018",2018-07-08 00:00:00
52084227,30.4,30.4,voyages indigenous,0.8123538494110107,Outback Pioneer Hotel,686184,686184,,2018-07-17 00:00:00
50559428,255.8,255.8,the home depot,0.9668793082237244,The Home Depot,,43184,08/23/2018,2018-08-23 00:00:00
51164888,1035.43,1035.43,mz3,0.877541720867157,MZ3 Pty Ltd,3859,3859,23/08/18,2018-08-23 00:00:00
51811569,3268.92,3268.92,theubank,0.9210608601570128,TheUBank,,,"aug 6, 2018",2018-08-06 00:00:00
50877342,426.79,426.79,anipet animal supplies,0.9826570749282836,Anipet Animal Supplies Inc.,,SI+1070092,20/08/2018,2018-07-16 00:00:00
52466316,0.45,0.45,paybyphone,0.9559441804885864,PayByPhone,380972805,,07/09/2018,2018-07-12 00:00:00
53106141,50.84,50.84,the roof center,0.8378003239631653,The Roof Center,Z013396,Z013396,31/07/2018,2018-07-31 00:00:00
51454784,4472.0,4472.0,boyles fitness equipment,0.9571862816810608,Boyles Fitness Equipment,39081238,39081238,07/10/2018,2018-07-10 00:00:00
50997068,404.1,404.1,american airlines,0.968148708343506,American Airlines,CONFIRMATION-YJBWFG,,"tue, aug 14, 2018",2018-08-14 00:00:00
52820287,1613.45,1613.45,thesalonpeople,0.6689058542251587,TSP-FS-Retail,2113740,2113740,04-30-16,2016-04-30 00:00:00
50644765,449.25,449.25,bluestar canada,0.9673799872398376,Blue Star Canada,10493314,10493314,jun-06-2018,2018-06-06 00:00:00
51647651,19.35,19.35,uberx,0.9957616925239564,Uber,,,31 jul 2018,2018-07-31 00:00:00
51818750,221.65,221.65,salon service group,0.9340232014656068,Salon Service Group,600609817,600609817,20/08/2018,2018-08-20 00:00:00
52735780,36.75,36.75,rmp athletic locker,0.9157100319862366,Rmp Athletic Locker Ltd,CMRMP004225,CMRMP004225,6-17,2018-07-30 00:00:00
51426047,15.26,15.26,electromart,0.9912742972373962,ELECTROMART LIGHTING & ELECTRICAL SUPPLY,G355352,G355352,"thu, aug 16, 2018",2018-08-16 00:00:00
51274598,1207.5,1207.5,sevco enterprises,0.9976084232330322,Sevco Enterprises,CAFT004-8.3.18,CAFT004-8.3.18,8/21/2018,2018-08-21 00:00:00
51098520,26.0,26.0,uber,0.9972996711730956,Uber,,,04/08/2018,2018-08-04 00:00:00
52048941,1.0,1.0,paybyphone,0.9319207072257996,PaybyPhone,386733404,386733404,04aug18,2018-08-04 00:00:00
51771970,24.0,24.0,amazon,0.9958061575889589,Amazon,112-4852385-8225849,,08 august 2018,2018-08-08 00:00:00
51449134,2399.85,2399.85,"tiffany j stewart, cpa",0.7144735455513,"Tiffany J Stewart, CPA",2421,2421,10 aug 2018,2018-08-10 00:00:00
53063015,242.0,242.0,technical art solutions,0.9973469376564026,Technical Art Solutions,00009405,00009405,"wednesday, august 08, 2018",2018-08-08 00:00:00
51583928,116490.0,11649.0,university of denver,0.7244579195976257,University of Denver,,12225,08/10/2018,2018-08-10 00:00:00
50714794,289.18,289.18,real estate signs,0.6153585314750671,"Real estate signs and services, llc",33839,33839,8/15/2018,2018-08-15 00:00:00
51602758,161.82,161.82,playmobil canada,0.8583806157112122,Lechuza,38192060,38192060,aug 07,2018-08-07 00:00:00
51992504,104.0,104.0,cellhelmet,0.7066639065742493,Wireless Nation,SO72213,SO72213,"august 9, 2018",2018-08-09 00:00:00
52102857,750.0,750.0,capital concepts usa,0.9986515045166016,Capital Concepts Usa,80814,80814 CV,"monday, july 9, 2018",2018-07-09 00:00:00
52167338,338.96,338.96,,,"CED Consolidated Electrical Distributors, Inc.",1125-560142,1125-560142,8/3/2018,2018-08-01 00:00:00
52563045,61.75,145.0,originenergy,0.9974971413612366,Origin,167 001 191 437,167 001 191,7/31/2018,2018-07-31 00:00:00
50146830,24000.0,24000.0,,,Juma Al Majid Est,1969,1969,01/08/18,2018-08-01 00:00:00
50858593,85.9,85.9,cabotss,0.8958846926689148,Cabot,326988,326988,25-07-2018,2018-07-25 00:00:00
50925837,133.84,133.84,hall security,0.9229637384414672,Wayne Hall Family Trust,3436,3436,08/03/18,2018-08-03 00:00:00
50844125,0.83,0.83,dicker data,0.9982798099517822,Dicker Data Limited,3166300,3166300,08/12/18,2018-08-12 00:00:00
52386038,5516.67,52.46,elavon,0.7389652132987976,Elavon,21342033,,"august 2, 2018",2018-08-02 00:00:00
51180026,468.97,468.97,lifewalker mobility,0.788474440574646,Mark McCutchen,66249,,12/31/2017,2017-12-31 00:00:00
52811446,256.64,50.0,,,Katherine Barreto,,,,2018-07-18 00:00:00
52565901,55.0,55.0,google australia,0.7711384296417236,google,3483377783,3483377783,jun 29/18,2018-06-29 00:00:00
51453948,11.5,11.5,e-plot,0.8167519569396973,E-Plot,T110626,T110626,"april 12, 2018",2018-04-12 00:00:00
51171451,145.0,145.0,balco business solutions,0.8779320716857909,BalCo Business Solutions,3073,3073,08/20/18,2018-08-20 00:00:00
50247411,1224.79,1224.79,jackson rowe,0.6615416407585144,Jackson Rowe,12097_BO02,12097_BO02,4 jul 2018,2018-07-04 00:00:00
53112368,,82.25,,,Sysco,56678911,247011578,10 aug 2018,2018-08-10 00:00:00
50418185,2672.52,2623.03,entrematic,0.9991375207901,Entrematic,5130403 RI,5130403 RI,8/27/2018,2018-08-27 00:00:00
50607566,2250.0,2250.0,steiny capital,0.82991623878479,steiny capital,,,"august 14, 2018",2018-08-14 00:00:00
52148357,44.8,44.8,unique wholesale,0.9852750301361084,Unique Wholesale,1629106,1629106,11 april 2018,2018-04-11 00:00:00
52192922,25.2,25.2,oxagon,0.9621378779411316,Oxagon,18/OX010070 003703,18/OX010070,"thu, jul 12, 2018",2018-07-12 00:00:00
51852675,194.5,194.5,j wright electrical,0.9641067385673524,J Wright Electrical,INV-1263,INV-1263,,2018-07-29 00:00:00
51898015,290.75,290.75,dandh,0.6811249256134033,D&H,3000056965,,01 aug 2018,2018-08-01 00:00:00
51547090,7778.87,7778.87,steve berry,0.7249720692634583,Audio Video Interiors,2273,2273,"aug 10, 2018",2018-08-10 00:00:00
51036339,221.22,221.22,brownes foods,0.8438082933425903,Brownes Foods Operations Pty Ltd,14344253,14344253,03 aug 2018,2018-08-03 00:00:00
50963839,238.22,238.22,the home depot,0.9692372679710388,The Home Depot,,,08/01/2018,2018-08-01 00:00:00
51279142,353.01,353.01,schurman family company,0.8799747824668884,Schurman Family Company,,,8/1/2018,2018-08-01 00:00:00
52553143,,157.7,,,White House Deli,,,,2018-07-31 00:00:00
50966463,30.0,30.0,google,0.9946575164794922,Google,3482919574,3482919574,"thu, aug 23, 2018",2018-08-23 00:00:00
52884369,935.0,935.0,tt accountancy,0.9796060919761658,TT Accountancy Pty Ltd,INV-2931,INV-2931,27/07/18,2018-07-27 00:00:00
50194397,1032.0,1032.0,allison page rn,0.9834434986114502,Allison Page,6,6,6 aug 2018,2018-08-06 00:00:00
50991753,994.09,994.09,mbmp,0.944247543811798,MBMP,11629,11629,28/07/2018,2018-07-28 00:00:00
51850534,2360.0,2360.0,tyrepower,0.7681246399879456,Tyrepower Chinchilla,125381,125381,2018/08/24,2018-08-24 00:00:00
52999926,216.21,216.21,alintaenergy,0.9666261076927184,Alinta Energy,,19010632,08/14/2018,2018-08-14 00:00:00
50192643,367.25,367.25,ledgers,0.9277703166007996,Ledgers,1032,1032,8/6/2018,2018-08-06 00:00:00
52359469,2200.0,2200.0,ascent cfo solutions,0.978397011756897,Ascent CFO,2711,2711,01/08/18,2018-08-01 00:00:00
51046722,1350.0,1350.0,themarketingindex,0.9585232734680176,The Marketing Index,9,9,,2018-08-21 00:00:00
52449544,20.84,20.84,amazon,0.9961974024772644,Amazon,112-9954888-1865042,,07/31/2018,2018-07-31 00:00:00
50977741,125.0,125.0,the langsdale law firm pc,0.940239191055298,The Langsdale Law Firm PC,,,08/08/2018,2018-08-08 00:00:00
50995001,,700.0,mentretainer_13866-24th,0.5915915966033936,Oakwood Management Ltd,,PCECAFp9hUw,8/23/2018,2018-08-23 00:00:00
51801483,450.0,450.0,willows,0.7310678958892822,Nicole virtue,,,07/31/2018,2018-07-31 00:00:00
50916804,55.0,55.0,beverage of youth,0.9438625574111938,Beverage of Youth Inc.,0049,0049,14-jun-2018,2018-06-14 00:00:00
51542928,1871.63,1871.63,edmonton economic development,0.9070292711257936,Edmonton Economic Development Corp.,RC000002733,RC000002733,"friday, july 27, 2018",2018-07-27 00:00:00
52019178,-379.71,-379.71,boca raton,0.9452980160713196,Worldwide Express,,,08/10/2018,2018-08-10 00:00:00
52037981,216.18,216.18,arb corporation,0.9996780157089232,ARB Corporation,8837553,8837553,28/08/2018,2018-08-28 00:00:00
52784418,-378.84,378.84,zerocater,0.9956150054931641,ZeroCater,159498,159498,07/31/18,2018-07-31 00:00:00
51053168,375.84,375.84,p&l management services,0.9861818552017212,P&L Management Services,1004,1004,15/08/18,2018-08-15 00:00:00
52656325,334.91,334.91,patronmanager,0.96187561750412,"PatronManager, LLC",,,15-august-2018,2018-08-15 00:00:00
52372765,1825.0,1825.0,jcy consultancy,0.9428364038467408,JSC Consultancy,SI00002,LC7513G:SI00002,07/28/18,2018-07-28 00:00:00
51149563,36.58,36.58,boc,0.9929593205451964,BOC,4020227289,4020227289,07/02/18,2018-07-02 00:00:00
51630272,1722.5,1722.5,kramerica business solutions,0.9639489054679872,Kramerica Business Solutions LLC,2059,2059,25 jul 2018,2018-07-01 00:00:00
50236904,271.2,271.2,freedom,0.993948459625244,Freedom,192761,192761,"august 13, 2018",2018-08-13 00:00:00
52165434,2.49,2.49,google play,0.8311871886253357,Google Play,SOP.1341-8979-3754-83657..19,,2018-08-04,2018-08-04 00:00:00
51361675,20.0,20.0,officepantry.co.uk,0.9617161750793456,Office Pantry,180806304,180806304,,2018-07-28 00:00:00
52800990,429.45,429.45,sundal international,0.9953122138977052,Sundal International,2121,2121,"aug 22, 2018",2018-08-22 00:00:00
52516080,1621.29,528.79,hunter communications,0.8464615941047668,Hunter,,869 July,"march 16, 2018",2018-03-16 00:00:00
51917411,975.0,975.0,whiskey bear,0.8938449025154114,"Whiskey Bear, Inc.",18-011,18-011,jul 29/2018,2018-07-29 00:00:00
52384368,610.0,610.0,knowing tracy,0.9976831674575806,Knowing Tracy,JJ081919,JJ081919,"august 23, 2018",2018-08-23 00:00:00
51151446,3806.46,3806.46,tutt bryant hire,0.9872269630432128,Tutt Bryant Hire,5001609,5001609,2018-04-03,2018-04-03 00:00:00
52378046,1297.25,1297.25,mackay & whitsunday locksmiths,0.9482332468032836,Mackay & Whitsunday Locksmiths Pty Ltd,1133853,1133853,"tuesday, august 28, 2018",2018-08-28 00:00:00
52467672,310.2,310.2,hobart food equipment,0.8166170716285706,Hobart Food Equipment,1162701,135860,1 aug 2018,2018-08-01 00:00:00
50247548,1075.0,1075.0,provident consulting,0.6364674568176271,Provident Consulting LLC,1755,1755,8/16/18,2018-08-16 00:00:00
52962585,,5725.21,solutions,0.5754926800727844,National Bank of Canada,,,"fri, jul 20, 2018",2018-07-20 00:00:00
51758763,212.8,212.8,atkins,0.9797835946083068,Atkins,611490,611490,"jul 26, 2018",2018-07-26 00:00:00
51472903,2000.0,500.0,,,City Pub AZ,836,836,"july 26, 2018",2018-07-26 00:00:00
51442329,79.6,79.6,port view,0.9973411560058594,Port View - Gas,INV-1883,INV-1883,08/10/2018,2018-08-10 00:00:00
50981290,491.5,491.5,shoofly vegan bakery,0.9934375882148744,Shoofly Vegan Bakery,1460,1460,"thu, aug 16, 2018",2018-08-16 00:00:00
52841881,799.0,799.0,amazon,0.9959938526153564,Amazon,113-4380462-4553848,113-4380462-4553848,18 aug 2018,2018-08-23 00:00:00
51143524,678.04,678.04,jmetcash food & grocery,0.9278228878974916,Metcash Food & Grocery Pty Ltd.,87348,87348,17-06-2018,2018-06-17 00:00:00
51301528,,8.32,credit one,0.8909528851509094,Credit One Bank,,,"august 26, 2018",2018-08-26 00:00:00
51717715,625.0,625.0,nitram financial solutions,0.9860473871231079,Nitram Financial Solutions,1878,1878,"aug. 15, 2018",2018-08-15 00:00:00
52101555,164.38,164.38,new balance athletics,0.9959595799446106,New Balance Athletics,R965624,R965624,8/1/2018,2018-07-09 00:00:00
52550815,11.01,11.01,amazon,0.9166231751441956,Amazon,11452882166695462,114-5288216-6695462,07/31/2018,2018-07-31 00:00:00
51863595,198.0,198.0,senseelectrical,0.9961118102073668,Sense Electrical,2711,2711 - 99 Brigalow Street Lyneham,,2018-04-28 00:00:00
51209964,27325.0,27325.0,naturalhealthsherpa,0.5669413208961487,Natural Health Sherpa,1111,1111,"jul 30, 2018",2018-07-31 00:00:00
51016143,,14088.83,td,0.588288426399231,TD First Class Travel,,,27/07/18,2018-07-27 00:00:00
53015251,1875.0,1875.0,mielke product design,0.8380021452903748,Mielkedesign.com,1009-18,1009-18,09/10/2018,2018-08-19 00:00:00
52466810,,3555.58,city national bank,0.9923666715621948,City National Bank,,,08/24/2018,2018-08-24 00:00:00
51592726,89.61,89.61,miller paint,0.9961205124855042,Miller Paint,INVOICES/30971132.PDF,30971132,30/07/18,2018-07-31 00:00:00
50211539,-91.94,91.94,,,EMCO Corporation,79440815-00,79440815-00,,2018-07-13 00:00:00
51258300,663.22,663.22,res-av,0.9719486236572266,Res-av,42837,42837,08/10/2018,2018-08-10 00:00:00
53055095,2562.19,2562.19,king taco restaurants,0.999805748462677,"King Taco Restaurants, Inc.",000362814,000362814,7/30/18,2018-07-30 00:00:00
52331284,,605.0,emirates,0.7462878227233887,Emirates,11762684/EXNQMJ,11762684/EXNQMJ,"jul 28, 2018",2018-07-28 00:00:00
50136948,15.82,15.82,floret,0.7303049564361572,Floret (Hello Toast Rest.),,,31 jul 2018,2018-07-31 00:00:00
52394222,93.23,93.23,janet mcintyre-blair,0.9878305196762084,Janet McIntyre-Blair,87,87,"thursday, august 2, 2018",2018-08-02 00:00:00
52564904,203.4,203.4,hrvstst,0.874482274055481,HF - Hrvst St,IN0866,IN0866,2018-06-08,2018-06-08 00:00:00
50578669,182.74,182.74,jensens market supplies,0.9975410103797911,Jensens Market Supplies,0205260-D01,0205260-D01,30-07-2018,2018-07-30 00:00:00
53033289,15.04,15.04,biosafesupplies,0.9986646771430968,BioSafe Supplies,72018779,72018779,2018-08-01,2018-08-01 00:00:00
52586665,180.0,180.0,go proposal,0.9755716919898988,GoProposal,INV-5399,INV-5399,8/26/2018,2018-08-26 00:00:00
52379961,135.0,135.0,cajun boudin & food,0.6617583632469177,LeBlanc's,210037,210037,2018-08-20,2018-08-20 00:00:00
50978765,77.33,77.33,nikita hismatov,0.8885990977287292,Nikita Hismatov,T141858496,T141858496,14/08/2018,2018-08-14 00:00:00
50984124,-108.41,108.41,scentair technologies,0.969829261302948,Scentair Technologies,INV723836]~~@[DOC_KEY:INV723836,INV723836,26/07/2018,2018-07-26 00:00:00
51272966,452.0,452.0,kevlar landscape & construction,0.9639049172401428,Kevlar Landscape & Construction,2577,2577,"tuesday, july 31, 2018",2018-07-31 00:00:00
52368495,100.0,100.0,kounta,0.8951651453971863,Kounta Accounts,K00269185,K00269185,8 august 2018,2018-08-08 00:00:00
51729667,10.95,10.95,sunheart holistic,0.97914057970047,"Sunheart Holistic, LLC",000008,000008,"thu, aug 16, 2018",2018-08-16 00:00:00
52643374,16.0,16.0,planning center,0.9529494047164916,Planning Center,,,22-aug-18,2018-08-22 00:00:00
51834449,1483.3,1483.3,p & t hospitality,0.998397171497345,P & T Hospitality Pty Ltd,316764,316764,,2017-08-15 00:00:00
51992621,66.3,66.3,hajoca,0.8969526290893555,Hajoca,S010286512.001,S010286512.001,"wed, aug 1, 2018",2018-08-01 00:00:00
51220208,465.52,465.52,apxium,0.926853358745575,Apxium,INV-0563,INV-0563,30/7/2018,2018-07-30 00:00:00
52839959,11.84,11.84,uber,0.9894174337387084,UBER,,,14-aug-18,2018-08-14 00:00:00
52499486,345.0,1345.17,dowler-karn,0.9787871837615968,Dowler Karn,469416,469416,2018 / 08 / 06,2018-08-06 00:00:00
52220652,56.76,56.76,city of san luis,0.9160192608833312,City of San Luis Obispo,,,05 jul 2018,2018-07-05 00:00:00
50249319,535.5,535.5,vanguard cleaning systems of bc,0.9770463705062866,Vanguard Cleaning Systems of BC,22684,22684,"august 24, 2018",2018-08-24 00:00:00
50783190,167.2,167.2,delta air lines,0.9373127222061156,Delta Airlines,,,12.7.18,0218-07-12 00:00:00
51863842,157.55,157.55,gammix,0.957286775112152,AXL Affiliates Ltd,DAFALGAN150-304,DAFALGAN150-304,05-25-2018,2018-05-25 00:00:00
52273199,15.79,15.79,the home depot,0.9806596040725708,The Home Depot,,,5/17/2018,2018-05-17 00:00:00
51244675,1375.0,1375.0,outcomes,0.6835542917251587,Outcomes International,6038,eWay,23/08/2018,2018-08-23 00:00:00
50763873,19.36,19.36,juno,0.9015161991119384,JUNO,,,8/03/2018,2018-08-03 00:00:00
52050807,294.85,294.85,triple g corporation,0.9711003303527832,Triple G Corporation Inc.,4692,4692,7/30/2018,2018-07-30 00:00:00
52923372,347.0,347.0,katrina ruth,0.8620402216911316,Katrina Ruth Pty Ltd,37802,37802,07/29/18,2018-07-29 00:00:00
52213795,393641.5,13835.75,sabre sheet metal,0.9388400912284852,Sabre Sheet Metal Ltd,18/4016,18/4016,20-aug-2018,2018-08-20 00:00:00
50569857,449.99,449.99,fsc,0.7824420332908629,Fisher Scientific,0441064,0441064,"tue, jul 31, 2018",2018-07-31 00:00:00
50856769,127.97,127.97,paypal,0.9960112571716307,Paypal,,,"july 20, 2017",2017-07-20 00:00:00
51985307,1856.76,1856.76,blue falls manufacturing,0.9898329377174376,Blue Falls Manufacturing Ltd,PSI-70036,PSI-70036,"august 14, 2018",2018-08-14 00:00:00
50725573,53.13,53.13,google,0.989426612854004,Google,3482794629,3482794629,"july 18, 2018",2018-07-18 00:00:00
52747878,722.59,722.59,grandwestauto,0.90740305185318,Grandwest Enterprises Inc.,42269440,42269440,"august 23, 2018",2018-08-23 00:00:00
51798733,2167.64,2167.64,antech diagnostics,0.8970173597335815,Antech Diagnostics,3-201806-0,3-201806-0,2/10,2017-08-28 00:00:00
51934932,25.8,25.8,selectcom,0.9934406280517578,Selectcom,0004498374,0004498374,7/31/2018,2018-07-31 00:00:00
51314858,29.0,29.0,paddle,0.9559955596923828,Paddle,4060010,4060010,"aug. 20, 2018",2018-08-20 00:00:00
50765729,,31.98,,,Amazon.ca,,701-5852625-5743405,08/14/2018,2018-08-14 00:00:00
50583168,37915.5,37915.5,direct marketing ideas,0.613979160785675,Sg Marketing,436,436,31-jul-2018,2018-07-31 00:00:00
52564531,204.74,204.74,,,Rights at Home Canada,,2665,08/10/2018,2018-08-10 00:00:00
51171371,152.53,152.53,fedex,0.99932062625885,fedex,6-254-65362,6-254-65362,3 aug 2018,2018-08-03 00:00:00
52539989,183.0,183.0,queuesolutions,0.9996526837348938,Queue solutions,1808099,1808099,"january 05, 2018",2018-01-05 00:00:00
51185017,353.91,353.91,american/universal supply,0.9964787364006042,American Universal Supply Inc,S6077513.001,S6077513.001,17 august 2018,2018-08-17 00:00:00
52143963,7000.0,7000.0,william colbert,0.8331220149993896,Freshbooks,,0000023,08/02/2018,2018-08-02 00:00:00
51873618,585.56,585.56,johnson county wastewater,0.9810978174209596,Johnson County Wastewater,,,"august 13, 2018",2018-08-13 00:00:00
51565584,,25.8,tpp wholesale,0.9919093251228333,TPP Wholesale,11874856,11874856,,2018-08-13 00:00:00
51551945,6.71,6.71,uberx,0.9947458505630492,Uber,,,june 26/18,2018-06-29 00:00:00
52693413,59.95,65.2,skymesh,0.9903093576431274,Skymesh Pty Ltd,3446311,3446311,27 august 2018,2018-08-27 00:00:00
51603822,54.0,54.0,qbox,0.9581228494644164,Qbox,,,07/16/2018,2018-07-16 00:00:00
51423155,306.04,306.04,air canada's,0.9980039596557616,Air Canada,MBAAUI,,"aug 18, 2018",2018-08-18 00:00:00
51361751,76.89,76.89,parts for trucks,0.9755913019180298,Parts for Trucks,42207869-01,42207869-01,jun 26 2018,2018-06-30 00:00:00
51249096,42.0,42.0,solid state computing,0.6286484003067017,Solid State Computing Ltd,5286,5286,,2018-08-14 00:00:00
50849384,292.87,292.87,intuit,0.8393927812576294,Intuit QuickBooks Team,230013419613,230013419613,08/22/18,2018-08-22 00:00:00
53021472,1393.19,1393.19,cintas canada,0.824072003364563,Cintas,29N144168,29N144168,"wed, aug 15, 2018",2018-08-15 00:00:00
50151053,74.71,74.71,avg,0.9412388801574708,AVG,50366158300,50366158300,8/10/18,2018-08-10 00:00:00
51149227,153.25,153.25,dinnings food & dairy dist,0.9519736170768738,Dinnings Food & Dairy,00626030,00626030,,2018-05-26 00:00:00
52592021,90.07,90.07,boston limo ride,0.968244731426239,Boston Limo Ride Inc,10315,92688 - Hart,8/2/2018,2018-08-02 00:00:00
52439836,46.19,46.19,caltex,0.5785312652587891,Caltex,,,08/03/2018,2018-08-03 00:00:00
51883146,45.2,45.2,inkyourride,0.9587823748588562,Eminent Custom Graphics,10500,10500,"tuesday, july 31, 2018",2018-07-31 00:00:00
51477472,12.42,12.42,apple,0.9797517657279968,Apple,,,20 2018-08,2018-08-22 00:00:00
52366164,11.89,11.89,jeays hardware,0.9984152913093568,JEAYS HARDWARE,110531313,110531313,08/20/2018,2018-08-20 00:00:00
52526170,95.96,95.96,southwest airlines,0.942952573299408,Southwest Airlines,,,05/24/18,2018-05-24 00:00:00
52566111,,8700.95,martin brower australia,0.9960595965385436,Martin Brower Australia,3368522,3368522,1 may 2018,2018-05-01 00:00:00
50736732,,541.68,,,"Shamrock Group, Inc",,2260097,"tue, aug 21 2018",2018-08-21 00:00:00
51213019,12.5,12.5,short stop distribution,0.992634654045105,Short Stop Distribution,1124253,1124253,26jun2018,2018-06-26 00:00:00
50266745,1460.0,1280.31,instacart,0.9894121885299684,Instacart,,180730,22/08/2018,2018-08-22 00:00:00
50129026,857.34,857.34,infusionsoft,0.9556090831756592,Infusionsoft,2560347,2560347,"october 16, 2017",2017-10-16 00:00:00
52673001,9.901430770201804e+26,75.17,caltex,0.6065139174461365,Caltex,,43077,14/08/18,2018-08-14 00:00:00
52694974,17.11,17.96,ola australia,0.8999947309494019,Ola,,,"fri, aug 17, 2018",2018-08-17 00:00:00
52247725,968.39,968.39,viavid broadcasting,0.81610506772995,Via Vid,2018HOTR-05-Q1,2018HOTR-05-Q1,08/14/18,2018-08-14 00:00:00
52368439,147.0,147.0,smithrite,0.979786217212677,Smithrite Disposal,66094-190359-941691,66094-190359-941691,,2018-08-08 00:00:00
52063279,10797.95,10797.95,tony's pizzaria,0.8490075469017029,American Express,,,07-aug-18,2018-08-07 00:00:00
50964304,144.0,144.0,reliance-lift.co.uk,0.7900346517562866,Reliance Lift Service,2285,2285,"wednesday, august 01, 2018",2018-08-01 00:00:00
51843707,276.99,276.99,arb corporation,0.9996246695518494,ARB Corporation,8835384,8835384,"tue, apr 10, 2018",2018-04-10 00:00:00
50933151,147.7,147.7,hbw foodservice,0.9877574443817142,HBW Foodservice,148924,148924,08/14/18,2018-08-14 00:00:00
50878654,494.0,494.0,legalzoom,0.9535443186759948,LegalZoom,53431614,53431614,"august 20, 2018",2018-08-20 00:00:00
50787162,363.7,363.7,freightera,0.5120171308517456,Freightera,,11120,aug 23/18,2018-08-23 00:00:00
51471011,,935.32,google,0.9000694155693054,Google Ireland,621932915133-18,621932915133-18 Mao,06/11/2012,2012-06-11 00:00:00
50875760,59.75,59.75,kijiji canada,0.911666214466095,Kijiji Canada,CA20023890668,CA20023890668,"may 10, 2018",2018-05-10 00:00:00
52079088,1119.12,1119.12,ricky richards,0.9921559691429138,Ricky Richards,288250,288250,6/30/2018,2018-06-30 00:00:00
51350185,392.92,392.92,service foods,0.9783716201782228,Service Foods,IN2049752,IN2049752,"wed, jan 31, 2018",2018-01-31 00:00:00
52143598,223.6,223.6,hotmail,0.9899978637695312,SB Finishing,16993,16993,2018/08/02,2018-08-02 00:00:00
50860471,3120.21,3120.21,airy medical eye center,0.7820198535919191,Mt Airy Medical Eye Center,,,01 /22/18,2018-01-22 00:00:00
50225776,26.85,26.85,bunnings,0.9761971831321716,Bunnings Warehouse,,,9 aug 2018,2018-08-09 00:00:00
52212128,4.79,4.79,staples,0.9731468558311462,Staples,3386916905,3386916905,05/29/2018,2018-05-29 00:00:00
52726071,,20665.73,federated co-operatives,0.8526437282562256,Federated Co-Operatives Ltd,,2272976,27 aug 2018,2018-08-27 00:00:00
50748889,394.2,394.2,merial,0.9960559010505676,Merial Inc.,8048984,8048984,2018-08-22,2016-09-18 00:00:00
50694363,1402.3,1402.3,mimecast north america,0.8754705786705017,Mimecast North America Inc.,C/INVUS10752803,C/INVUS10752803,2018-07-01,2018-07-31 00:00:00
51523083,2023.95,2023.95,mangates tech solutions,0.9239741563796996,Office Supplies,0120-6332-8034-1309,PMP Course (CP),6 aug 2018,2018-08-06 00:00:00
51163979,2390.0,2390.0,metro carpentry services,0.9416046738624572,Sydney Metro Carpentry,INV-0204,INV-0204,30 jul 18,2018-07-30 00:00:00
51155027,1145.66,1145.66,lionco,0.8483740091323853,Lion LD & D Australia Pty LTd,556964035,556964035,10/08/2018,2018-08-10 00:00:00
50128719,145.0,145.0,etsy,0.9282755851745604,Etsy,1334106498,1334106498,08/22/18,2018-08-10 00:00:00
50680104,81.14,81.14,coca-cola,0.8912575244903564,Coca-Cola,36743904,36743904,"jul 23, 2018",2018-07-23 00:00:00
51741456,,1553.0,rachel,0.5296008586883545,Sales,,,07/31/18,2018-07-31 00:00:00
51771236,135.72,135.72,atvcity.co.uk,0.950174868106842,ATV City,94154,94154,"tuesday, august 21, 2018",2018-08-21 00:00:00
52123997,546.0,546.0,greentree imaging,0.9829999208450316,GreenTree Imaging,18764,18764,08/17/2018,2018-08-17 00:00:00
50232243,320.25,320.25,coastal tax and accounting services,0.993073582649231,Coastal Tax and Accounting Services,1459,1459,31 july 2018,2018-07-31 00:00:00
52216292,7.65,7.65,iubenda,0.918915867805481,iubenda,2018/59991,2018/59991,07/31/2018,2018-07-31 00:00:00
50535490,2333.98,2000.0,rachel tillman cool river marketing,0.7740829586982727,Rachel Tillman,,07202018,08/15/18,2018-08-15 00:00:00
52847003,,538.94,"red giant,llc",0.916825830936432,Red Giant,,5004805,21/08/2018,2018-08-21 00:00:00
52566337,23.46,23.46,homegrown juice company,0.9795511364936828,Homegrown Juice Company,HA19877,HA19877,08/23/2018,2018-08-23 00:00:00
51530344,33.63,33.63,shopify,0.986404538154602,Shopify,50910476,50910476,08/07/18,2018-08-07 00:00:00
50390747,262.5,262.5,benson seymour,0.9958921074867249,Benson Seymour,18895,18895,06/08/18,2018-06-08 00:00:00
52187380,,0.0,uline,0.9989228248596193,Uline,100372048,100372048,8/08/2018,2018-08-08 00:00:00
50762373,45.15,45.15,apple,0.8811476826667786,Apple Polo Park,R3694765458,,,2018-08-09 00:00:00
52018437,3655.55,3655.55,advanced office solutions,0.9219194054603576,Advanced Office Solutions,,2018.08.07,5 jul 2018,2018-07-05 00:00:00
50791045,26.25,26.25,metrics chartered,0.805746853351593,Metrics Chartered Professional Accounting,INV-2515,INV-2515,,2018-07-26 00:00:00
52831528,263.57,263.57,alsco,0.9976384043693542,Alsco Canada,LCAL512919,LCAL512919,08/01/18,2018-08-01 00:00:00
51240727,348.84,348.84,intuit,0.8827981352806091,Intuit Quickbooks,225011399954,225011399954,30-jun-2018,2018-06-30 00:00:00
51804169,122.12,122.12,shoes for crews,0.9989035725593568,Shoes for Crews,4579211,4579211,07/11/2018,2018-07-11 00:00:00
50440158,1335.32,1335.32,cleanpro,0.8794635534286499,CleanPro,17702,17702,"aug 13, 2018",2018-08-13 00:00:00
51590117,1442.5,2002.5,haylie meyer photography,0.9402540326118468,Haylie Meyer Photography,1036,1036,"monday, april 2, 2018",2018-04-02 00:00:00
51367931,94.0,94.0,mintz,0.7338076829910278,Mintz Levin,8854874,8854874,01/24/2018,2018-01-24 00:00:00
52439823,,41.06,coles,0.6904770135879517,coles express,,,07/17/2018,2018-07-17 00:00:00
51128095,152.44,152.44,american express,0.8244809508323669,FedEx,,,09/06/2018,2018-06-09 00:00:00
51606874,43.36,43.36,precision graphics,0.8805107474327087,MegaSolutions,139941,139941,02/08/2018,2018-08-02 00:00:00
51616776,80.67,80.67,,,Pete's Auto body,IV28843,IV28843,08/22/18,2018-08-22 00:00:00
51207356,22.5,22.5,evolve tele-services,0.9844766855239868,Evolve Tele-services,27535,27535,"jul 23, 2018",2018-07-23 00:00:00
51440952,699.05,699.05,bingo waste services,0.9903222322463988,Bingo Waste Services,BF903936,BF903936,"thu, aug 2, 2018",2018-08-02 00:00:00
52906358,689.98,689.98,outpostpackaging,0.6958455443382263,Outpost Packaging,326523,326523,"aug 14, 2018",2018-08-14 00:00:00
50777883,4303.2,4303.2,sotel systems,0.9687293767929076,SoTel Systems LLC,130412805,130412805,01/08/2018,2018-08-01 00:00:00
51444582,,75.0,pest,0.7070010900497437,Facility Pest Control,19729,,"aug 17, 2018",2018-08-17 00:00:00
51009303,492.5,492.5,local tortilla,0.981266438961029,Local Tortilla,4121,4121,7/31/2018,2018-07-31 00:00:00
51599611,67.99,67.99,lescodistributing,0.9127767086029052,Lesco Distributing,OC290466,OC290466,"august 12, 2018",2018-08-12 00:00:00
51550919,284.0,284.0,the landscaping yard & hardware,0.9995037913322448,The Landscaping Yard & Hardware,451001,451001,"august 13, 2018",2018-08-13 00:00:00
52686272,1176.74,1176.74,national products fulfilment,0.6553370356559753,National Products Fulfilment,INV-2012-38299,INV-2012-38299,"july 31, 2018",2018-07-31 00:00:00
50434991,15865.3,15389.34,arbortech,0.9820943474769592,Arbortech,00058211,00058211,"fri, aug 3, 2018",2018-08-03 00:00:00
51418955,449.74,449.74,rtp mechanical,0.9850198030471802,Rtp Mechanical Limited,3093,3093,"august 1, 2018",2018-08-01 00:00:00
52858925,,323.4,,,Sherriff Electrical Pty Ltd,,313017744,31-07-18,2018-07-31 00:00:00
52776389,5.0,5.0,club macstories,0.9514087438583374,Club Macstories,DD81164C,DD81164C,8/14/2018,2018-08-14 00:00:00
51503717,28.09,28.09,amazon,0.9989743232727052,Amazon,114-5154028-2465810,114-5154028-2465810,"august 4, 2018",2018-08-04 00:00:00
51331398,,220.0,camscanner,0.6278602480888367,Commonwealth Bank,,,07/31/2018,2018-07-31 00:00:00
50675384,40000.0,40000.0,womens choice,0.678272008895874,Women Certified Inc.,,,02/07/2018,2018-02-07 00:00:00
50798725,280.12,280.12,direct earth electrical,0.8834618330001831,Direct Earth Electrical,10919,10919,8/2/2018,2018-08-02 00:00:00
51795011,1253.86,1253.86,gensco,0.9979217648506165,"Gensco, Inc.",848288664,848288664,,2018-08-10 00:00:00
51282735,1224.93,1224.93,myat&t,0.9533447027206421,AT&T,,,07/28/2018,2018-07-28 00:00:00
51129191,131.83,131.83,trip rentals,0.582404375076294,Road Trip Rental Inc,,,07/27/2018,2018-07-31 00:00:00
52195904,1209.6,1209.6,kloeckner metals,0.8969263434410095,Kloeckner Metals,9122454,9122454,"jul 3, 2018",2018-07-03 00:00:00
51163604,1118.25,1118.25,charlene hart dance,0.9081835150718688,Charlene Hart,,June 2018,07/12/2018,2018-07-12 00:00:00
51007992,659.8,659.8,thesignpad,0.9589257240295408,The Sign Pad,,,08/21/2018,2018-08-21 00:00:00
50221325,6.1,6.1,browns rural,0.9976229071617126,Brown's Rural,10318967,10318967,21-08-2018,2018-08-21 00:00:00
52039727,356.27,356.27,ecr4kids,0.9944641590118408,ECR4Kids,737136,737136,"august 31, 2018",2018-09-01 00:00:00
53066250,3.99,3.99,email.apple,0.9620236158370972,Apple,,,"aug 1, 2018",2018-08-01 00:00:00
51906779,28.0,28.0,hangtag,0.9163153767585754,Hang Tag,,2711729,"fri, aug 10, 2018",2018-08-08 00:00:00
52684258,123.32,123.32,kimballmidwest,0.7966426014900208,Kimball Midwest,6465349,6465349,02/08/18,2018-08-02 00:00:00
51827456,37.86,37.86,reece australia,0.8334814310073853,Reece Australia,92742691,92742691,"wed, aug 8, 2018",2018-08-08 00:00:00
50952595,283.15,283.15,bio-rad laboratories,0.9774049520492554,Bio-rad Laboratories,902937140,STATEMENT 08/03/18,8/17/2018,2018-08-17 00:00:00
50544979,217.29,217.29,beau's all natural brewing company,0.8379600644111633,beau's all natural brewing,,,2018-08-22,2018-08-22 00:00:00
52318776,75.0,75.0,dropbox,0.9628309607505798,Dropbox,GYNS2T2JZH11,,03-08-2018,2018-08-03 00:00:00
50838072,626.8,626.8,soumah,0.9668571352958679,Soumah of Yarra Valley,00005100,00005100,"mon, jul 30, 2018",2018-07-30 00:00:00
52603002,19.2,19.2,godaddy,0.9880779385566713,Godaddy,1356637596,1356637596,08/01/2018,2018-08-01 00:00:00
50852653,18.72,18.72,inty,0.7052128314971924,inty cascade,INV00039569,INV00039569,"july 9, 2018",2018-07-09 00:00:00
50248796,191.67,191.67,amazon,0.9940559864044192,Amazon,702-5267353-2868264,2868264,21 aug 18,2018-08-21 00:00:00
52153415,1021.06,1021.06,coast builders sechelt,0.9947271943092346,Coast Builders Sechelt,113593/1,113593/1,"wed, aug 1, 2018",2018-08-01 00:00:00
51348702,178.2,178.2,q-imaging,0.9604141712188721,QImaging Australia,A549692,A549692,08/15/2018,2018-08-15 00:00:00
51527406,87.21,87.21,blacklane,0.952800750732422,Blacklane,318567084,,"sat, aug 11, 2018",2018-08-11 00:00:00
52359397,178.25,178.25,blackmores,0.993196964263916,BlackMores,2391971,2391971 RI,21.08.2018,2018-08-21 00:00:00
50209978,5373.38,5373.38,grey street legal,0.9898438453674316,Grey Street Legal Limited,INV-23461,INV-23461,"thursday, august 16, 2018",2018-08-16 00:00:00
51258380,581.49,581.49,the home depot,0.904804527759552,The Home Depot,,,8/14/2018,2018-08-14 00:00:00
50997405,75.0,75.0,the league chiropractic clinic,0.9524959921836852,The League Chiropractic Clinic,,,"june 25, 2018",2018-06-25 00:00:00
52691848,254.35,254.35,rqueensland,0.5900146961212158,QUEENSLAND GOVERNMENT,,48846C,07/30/2018,2018-07-30 00:00:00
50505279,2.14,2.14,the home depot,0.9089226126670836,The Home Depot,,,august 15,2018-08-15 00:00:00
52604993,557.36,557.36,mouser electronics,0.9976845979690552,Mouser Electronics,49317068,49317068,"aug 24, 2018",2018-08-24 00:00:00
51228571,33.96,33.96,namecheap,0.9941774010658264,Namecheap,37093969,,"april 13, 2018",2018-04-13 00:00:00
50899107,2554.22,2554.22,bdc,0.8304228186607361,bdc,201818011063,201818011063,"august 10, 2018",2018-08-10 00:00:00
50606551,2520.0,2520.0,kh burnaby cpas,0.8572524785995483,KH Burnaby,17-887,17-887,7/13/18,2018-07-13 00:00:00
52700135,773.52,575.0,paypal,0.5830382108688354,PayPal,3XX543721K466302H,,01 aug 2018,2018-08-01 00:00:00
52283606,,8.2,,,Parking,,,22 aug 2018,2018-08-22 00:00:00
51283095,168.37,168.37,mac energy,0.9451961517333984,Independent Mechanical Supply Inc.,1244175,1244175,6/08/2018,2018-08-06 00:00:00
50197434,14.99,14.99,edgefluence,0.9323635101318359,Edgefluence,3KM29285M1548510W,,08/08/18,2018-08-08 00:00:00
50232367,600.0,600.0,bank,0.6230518817901611,PayPal,4V2197424G671360N,,8/24/2018,2018-08-24 00:00:00
50918780,,12.73,payadvantage,0.92485111951828,Payadvantage,PAD6F99-0051,PAD6F99-0051,"wed, aug 1, 2018",2018-08-01 00:00:00
50679463,299.0,299.0,amazon,0.9969894886016846,Amazon.com,114-0056029-5147411,114-0056029-5147411,7/3/2018,2018-07-03 00:00:00
52213300,42.52,42.52,dominos,0.9178422093391418,Dominos.com,1025742,1025742,"wednesday, august 8, 2018",2018-08-08 00:00:00
51066069,120.0,120.0,tenafly therapy group,0.9833452105522156,Tenafly Therapy,2920,2920,9/01/18,2018-01-09 00:00:00
52949019,299.2,299.2,romarksecurity,0.7536554932594299,Romark Security,INV-7923,INV-7923,31 july 2018,2018-07-31 00:00:00
52150374,652.03,652.03,badecreativesolutions,0.876916766166687,badecreativesolutions,172018,172018,22 august 2018,2018-08-22 00:00:00
50340955,1431.8,1431.8,australian plastic profiles,0.9897072911262512,Australian Plastic Profiles,735603,735603,2018-08-15,2018-08-15 00:00:00
52954368,820.9,820.9,winberry,0.6122875213623047,Kristin Winberry,S20926,S20926,8/7/2018,2018-08-07 00:00:00
52178123,174.0,174.0,australian native landscapes,0.9248555898666382,Australian Native Landscapes,01-2-00027667,01-2-00027667,"fri, mar 16, 2018",2018-03-16 00:00:00
52596533,7261.33,7261.33,wells fargo,0.8653548955917358,Wells Fargo,,,07/31/2018,2018-07-31 00:00:00
50315567,308.41,308.41,king taco restaurants,0.9997714757919312,"King Taco Restaurants, Inc.",000359994,000359994,08/08/2018,2018-08-08 00:00:00
52212869,22.52,22.52,andaner,0.8442346453666687,Anda,,6656669,20 may 2017,2017-05-20 00:00:00
51747823,396.0,396.0,nudgee crematorium,0.6690206527709961,Nudgee Cemetery & Crematorium,S02351,S02351,06/13/18,2018-06-13 00:00:00
51852924,113.0,113.0,the cellular connection,0.9996615052223206,The Cellular Connection,IN000000000459627,IN000000000459627,"wed, aug 1, 2018",2018-08-01 00:00:00
50965614,1984.62,1984.62,criteo canada,0.7905609607696533,Criteo,33CA1807234,33CA1807234,31/07/2018,2018-07-31 00:00:00
52915539,,68.49,,,Office Depot OfficeMax,,,,2018-07-11 00:00:00
52381620,31.2,31.2,a2x,0.7243556976318359,A2X,5347769033687040,5347769033687040,13 august 2018,2018-08-13 00:00:00
50242352,,218.2,city of la marque,0.8385804295539856,City of La Marque,,,08/09/2018,2018-08-09 00:00:00
52734684,53.46,53.46,hesselbein tire co,0.9920029044151306,Hesselbein TIre CO,93862,IA02116818,22-08-18,2018-08-22 00:00:00
50920662,2626.71,2626.71,caru pet food company,0.9986719489097596,Caru Pet Food Company,18188,18188,7/31/2018,2018-07-31 00:00:00
50313560,878.9,878.9,originenergy,0.9945589900016784,Origin,,,8/1/2018,2018-08-01 00:00:00
52195373,3116.99,3116.99,kloeckner metals,0.9240338802337646,Kloeckner Metals,9128707,9128707,18/08/2018,2018-08-18 00:00:00
52257093,1019.15,1019.15,the home depot,0.9770596623420716,The Home Depot,,,07/31/2018,2018-07-31 00:00:00
52592362,44.19,44.19,the home depot,0.976783275604248,The Home Depot,H4110-66809,,08/18/2018,2018-08-18 00:00:00
50253757,2632.66,2632.66,,,Global Rental Co Inc,3269733,3269733,"july 27, 2018",2018-07-27 00:00:00
50215611,1325.5,1325.5,car console supplies,0.9229154586791992,Car Console Supplies,IN-28628,IN-28628,08/16/2018,2018-08-16 00:00:00
51220001,170.0,170.0,modelsmith group,0.9153227806091307,Modelsmith Group LLC,2060,2060,04/02/2018,2018-04-02 00:00:00
52518173,73.14,73.14,garden st. portables,0.9918888807296752,Garden St Portables,A-44594,A-44594,08/01/2018,2018-08-01 00:00:00
51786214,95.0,95.0,drupalize.me,0.9240186810493468,Drupalize Me,50003,50003,,2018-08-09 00:00:00
52646940,29.99,29.99,ami carson,0.6888028979301453,Ami Carson,,,3/08/2018,2018-08-03 00:00:00
52246225,4232.92,4232.92,sanmar canada,0.7267802357673645,Sanmar Canada,,,08/07/2018,2018-08-07 00:00:00
52027267,240.0,240.0,aurum labs,0.9635207056999208,Aurum Labs,5782,5782,31/7/2018,2018-07-31 00:00:00
52513171,-28.25,-28.25,roar solutions,0.981902241706848,Roar Solutions,0052771,0052771,06 aug 18,2018-08-06 00:00:00
50259181,191.0,191.0,office depot,0.8009135127067566,Office Depot_STAT,,,07/31/2018,2018-07-31 00:00:00
52478698,755.22,755.22,apa ,0.7347124218940735,APA Credit,7124722-00,7124722-00,7/30/2018,2018-07-30 00:00:00
51990851,9040.0,9040.0,grit capital advisory,0.9288296699523926,Grit Capital Advisory,093,093,06/29/18,2018-06-29 00:00:00
52746554,66.99,66.99,sysco,0.9884676933288574,Sysco,9450190,9450190,01/08/2018,2018-08-01 00:00:00
52175989,2043.03,2043.03,best buy,0.9938321113586426,Best Buy Canada,,,8/18/18,2018-08-18 00:00:00
52369636,95.55,95.55,officeworks,0.9965097308158876,Officeworks,,,,2018-08-03 00:00:00
50328936,8.5,8.5,amazon,0.9985945820808412,Amazon,111-1293553-6401818,111-1293553-6401818,"march 31, 2017",2017-03-31 00:00:00
52979965,750.0,750.0,mr & mrs smith,0.6468036770820618,Mr & Mrs Smith Americas,NASA18204,NASA18204,07/08/2018,2018-08-07 00:00:00
52433658,2938.23,2938.23,waxcenter,0.9304527044296264,Waxcenter.com,SIN289043,SIN289043,6/30/2018,2018-08-01 00:00:00
52832117,-105.0,105.0,ccf drivers,0.7205231189727783,Cherry Capital Foods,C20205,,"july 09, 2018",2018-07-09 00:00:00
52118437,1010.9,1010.9,charlie sciara produce co,0.8536963462829591,Charlie Sciara Produce Co,,,08/01/2018,2018-08-01 00:00:00
51170200,25.0,25.0,social curator,0.9861299395561218,Social Curator,94AA58E-0002,,"tue, aug 7, 2018",2018-08-07 00:00:00
51197773,33.32,33.32,swh,0.6323895454406738,South West Hardware,01-1640,01-1640,aug 2018,2018-08-01 00:00:00
52206516,329.85,329.85,ingram micro,0.8626078367233276,Ingram Micro Payments,2018SICA0012018,2018SICA0012018,08/23/2018,2018-08-23 00:00:00
52435013,1575.0,1575.0,discount bartending,0.99057799577713,Discount Bartending,,180903 B Huff/Kroah,07/30/2018,2018-07-30 00:00:00
50632187,125.55,125.55,gotomypc,0.8239200115203857,Gotomypc.com,1365406380-210,,3 august 2018,2018-08-03 00:00:00
53010622,102.99,102.99,eurowings,0.9052125215530396,Eurowings,DYDZMJ,,,2018-08-01 00:00:00
50978744,328.0,328.0,nikita hismatov,0.8945353627204895,Nikita Hismatov,T136383736,T136383736,,2018-08-06 00:00:00
51212726,79.78,79.78,us foods,0.998995304107666,Us Foods,1215242,1215242,07/31/18,2018-07-31 00:00:00
52500878,37675.35,37675.35,payroll,0.8909252285957336,Payroll,,pp # 34 - 2018,31/07/2018,2018-07-31 00:00:00
50327724,38.03,38.03,amazon,0.9984126091003418,Amazon,114-7570992-7369837,114-7570992-7369837,08/08/18,2018-08-08 00:00:00
52706170,325.75,325.75,flash furniture,0.9984720945358276,Flash Furniture,INV-6110788,Inv-6110788,14-aug-2018,2018-08-14 00:00:00
51525305,270.71,270.71,sobeys,0.9478908181190492,Macdonalds Consolidated,28985074,28985074,"thu, jun 28, 2018",2018-06-28 00:00:00
52654874,20.0,20.0,progreen window cleaning,0.9994175434112548,"ProGreen Window Cleaning, Inc.",62875,62875,7/26/2018,2018-07-26 00:00:00
51364848,10.0,10.0,myfax,0.9932888746261596,Myfax,38056398,38056398,08/03/18,2018-08-03 00:00:00
51181764,29.18,29.18,flagship courier solutions,0.7300896048545837,FlagShip,363421,363421,08/27/2018,2018-08-27 00:00:00
51005235,24.83,24.83,arc document solutions,0.9941756725311279,ARC Document Solutions,64NYI9000691,64NYI9000691,30th july 2018,2018-07-30 00:00:00
51622243,102.67,102.67,crossroads roofing supply,0.996971607208252,Crossroads Roofing Supply,INV0230234,INV0230234,"june 30, 2018",2018-06-30 00:00:00
51827458,32.98,32.98,reece australia,0.8273459672927856,Reece Australia,280857605,280857605,"sunday, august 12, 2018",2018-08-12 00:00:00
51974151,231.72,231.72,synnex canada,0.9972779750823976,Synnex Canada,45485622,45485622,20-jul-2018,2018-08-14 00:00:00
50165528,12.76,18.6,canadian,0.6644939184188843,Canadian Springs,9926124090,9926124090,"june 28, 2018",2018-06-28 00:00:00
52084482,3000.0,3000.0,rosedent management,0.7970689535140991,Rosedent Management Ltd,,,,2018-01-31 00:00:00
51252564,1209.52,10513.5,jump+ toronto,0.8606370687484741,Jump+ Toronto,TOR-I-62586,TOR-I-62586,"aug 15, 2018",2018-08-15 00:00:00
51753824,33.5,33.5,the burrito truck,0.9866825342178344,The Burrito Truck,,,"may 21, 2018",2018-05-21 00:00:00
52066198,285.0,285.0,wholesale car parts,0.7570788860321045,ACM Parts,279594,279594,"may 29, 2018",2018-05-31 00:00:00
50878514,101.14,101.14,dhl,0.6488194465637207,DHL,,,08/04/2018,2018-08-04 00:00:00
51587735,4405.56,4405.56,turnermoore,0.6979756951332092,Turnermoore,18-74,18-74,8/15/2018,2018-08-15 00:00:00
51211843,14.99,14.99,adobe creative cloud,0.928920567035675,Adobe Creative Cloud,C5011367885,C5011367885,2018-08-09,2018-08-09 00:00:00
50820674,1673.88,1673.88,starleaton,0.9185298681259156,Starleaton Holdings Pty Ltd,IN0333515,IN0333515,01/08/2018,2018-08-01 00:00:00
50721117,984.83,984.83,simply tea and chocolate,0.978287398815155,Simply Tea and Chocolate,1806002,1806002,"aug 2, 2018",2018-08-02 00:00:00
51621467,4276.13,4276.13,1008669 b,0.8254125118255615,Ez-vape,1004,1004,"aug. 05, 2018",2018-08-05 00:00:00
51427781,280.9,280.9,saloncentric,0.9960899949073792,SalonCentric,874213774,874213774,01 aug 2018,2018-08-01 00:00:00
52489462,69.95,69.95,easeus data,0.7177743911743164,Cleverbridge,BKD-73623323929,BKD-73623323929,31/07/2018,2018-07-31 00:00:00
52605884,23.0,448.0,alaia physiotherapy,0.6207418441772461,MSP,,,"thu, aug 16, 2018",2018-08-16 00:00:00
52182418,466.97,466.97,toocann international,0.8780470490455627,Toocann International,NSW2093,TC-16510,30/07/2018,2018-07-30 00:00:00
50543402,95.24,95.24,universal electrical supply,0.9967505931854248,Universal Electrical Supply,J0270404,J0270404,10 april 2018,2018-04-10 00:00:00
51584200,13.75,13.75,craftmade,0.9434475302696228,Craftmade,90601524-00,90601524-00,30/01/2018,2018-08-13 00:00:00
51799364,347.48,347.48,araujo construction,0.9868993163108826,Araujo Construction,1017,1017,1 jul 2018,2018-07-01 00:00:00
52135438,2061.25,2061.25,fiore nursery & landscape supply,0.9090099930763244,Fiore,I149520,I149520,08/13/2018,2018-08-13 00:00:00
50210795,19347.41,19347.41,kev's powder coating & sandblasting,0.9745402932167052,Kev's Powder Coating & Sandblasting,,,03/08/2018,2018-08-03 00:00:00
50814996,-322.45,240.0,katherine,0.5452852249145508,Paypal,,,"jul 05, 2018",2018-07-09 00:00:00
51623977,9048.28,9048.28,amazon web services,0.840420126914978,Amazon web services,145001296,145001296,25/07/2018,2018-07-25 00:00:00
50343939,775.0,775.0,capsule cleaning services,0.974973738193512,Capsule Cleaning Services,293,293,8/04/30,2018-04-30 00:00:00
52351135,60.35,60.35,pfd food services,0.9857485294342041,PFD Food Services Pty Ltd,KL541925,KL541925,08/11/2018,2018-08-11 00:00:00
52553299,83.98,83.98,oscan electrical supplies,0.9863534569740297,Oscan Electrical Supplies Ltd.,0331802,0331802,8/16/2018,2018-08-16 00:00:00
52572732,798.34,798.34,revlon australia,0.9885714054107666,Revlon Australia Pty Ltd,1840087781,1840087781,"june 29, 2018",2018-07-10 00:00:00
52432862,52.5,52.5,slow dough bread co,0.9958763122558594,Slow Dough Bread Co,385367,385367,"thu, aug 16, 2018",2018-08-16 00:00:00
50172095,122.38,122.38,got 2 eat meals,0.9136266112327576,Got 2 Eat Meals,5093,5093,"sun, aug 19, 2018",2018-08-19 00:00:00
52464499,49.77,49.77,australia post,0.9463024139404296,Auspost,1007737231,1007737231,"tuesday, april 3, 2018",2018-04-03 00:00:00
51242304,4390.54,4390.54,brickworks,0.8659197688102722,Brickworks,15013218,15013218,6/14/2017,2017-06-14 00:00:00
52204980,4698.4,4698.4,the cellular connection,0.9991683959960938,The Cellular Connection,278052-I,278052-I,2018-08-01 2018-08-14,2018-08-02 00:00:00
51796360,212.95,212.95,g5 outdoors,0.9733978509902954,G5 Outdoors,294191,294191,7/31/2018,2018-07-31 00:00:00
50318514,382.0,382.0,kaman fluid power,0.912831723690033,Kaman Fluid Power,A38471-002,A38471-002,07/20/2018,2018-07-20 00:00:00
51723463,7.26,7.26,uber,0.9962169528007508,Uber,,,08/04/2018,2018-08-04 00:00:00
50854406,1530.5,1530.5,invoiced.scansource's,0.9965372085571288,Scansource,13859582,13859582,31/07/2018,2018-07-31 00:00:00
50677820,9.99,9.99,apple,0.9911882281303406,Apple,119220491068,,23 jul 2018,2018-07-23 00:00:00
51869166,55.13,55.13,in tax warrant,0.7843101024627686,In Tax Warrant,,,07/31/18,2018-07-31 00:00:00
52216552,4560.1,4560.1,,,FedEx,,,"jun 17, 2018",2018-06-17 00:00:00
52425657,,2347.62,autobody express,0.777271032333374,Autobody Express,30280,30280,10/09/2017,2017-10-09 00:00:00
51063112,4483.49,4483.49,forwarders,0.5891351103782654,UPS,Y6774,IY6774,08/21/2018,2018-08-21 00:00:00
52531745,167.39,167.39,of,0.5177657604217529,Nextran,,91424,"tue, aug 7, 2018",2018-08-07 00:00:00
52990833,23.52,14.89,amazon,0.9947898983955384,Amazon,111-9132381-6533821,111-9132381-6533821,08/06/18,2018-08-06 00:00:00
51678410,38.0,38.0,taxjar,0.9105364680290222,The TaxJar,,,8/4/2018,2018-08-04 00:00:00
52736827,1240.46,1240.46,farmersinsurance,0.6919841766357422,Farmers Insurance,,,"august 2, 2018",2018-08-02 00:00:00
51357904,2.49,2.49,google play,0.8403176665306091,google play,SOP.1394-5082-6460-13742..17,,"jul 31, 2018",2018-07-31 00:00:00
51914342,,14.19,camscanner,0.636422336101532,walgreens,,,31/05/2018,2018-05-31 00:00:00
51267611,61.64,61.64,intuit,0.5038802623748779,Equipe Quickbooks,230013337989,230013337989,08/17/18,2018-08-17 00:00:00
51920157,382.52,382.52,flat world supply chain,0.9810038805007936,Flat World Supply Chain,R1671765,r1671765,08/27/18,2018-08-27 00:00:00
51017015,293.75,241.43,staples,0.9854861497879028,Staples,,7202136609,07/31/18,2018-07-31 00:00:00
52128582,368.15,368.15,sparrow bakery acquisition,0.9923412799835204,Sparrow Bakery Acquisition,12157,12157,08/15/2018,2018-08-15 00:00:00
52058557,198.0,198.3,aufs,0.7310927510261536,Asian - United Food Service,119502,119502,07/08/2018,2018-08-07 00:00:00
52448866,297.0,297.0,iconis group,0.9638893008232116,Iconis Group,1363-3333,1363-3333,07/06/2018,2018-07-06 00:00:00
50865439,9250.0,9250.0,university,0.6111624240875244,University of Bristol,80033459,80033459,27 jul 2018,2018-07-27 00:00:00
52416202,30.79,30.79,bioexcell®,0.535568118095398,Worldwide Life Sciences Division,129155,129155,30 jul 18,2018-07-30 00:00:00
51530496,12733.88,12733.88,rapid concrete,0.974775731563568,Rapid Concrete,,,8/16/2018,2018-08-16 00:00:00
52729629,67782.0,67782.0,cambridge mercantile,0.7565124630928041,Cambridge,,,28 july 2018,2018-07-28 00:00:00
51619818,2.63,2.63,google,0.9817931056022644,Google,0965-2158-0770-2523-032018,0965-2158-0770-2523-032018,"tuesday, august 28, 2018",2018-08-28 00:00:00
52134285,2806.32,2806.32,ultimate laser,0.9465411305427552,Ultimate Laser,244060,244060,"march 22, 2017",2017-03-22 00:00:00
53107971,2608.63,2608.63,agropur,0.9074812531471252,AgroPur - pay,301268,301268,,2018-06-29 00:00:00
51758018,275.0,275.0,,,Seiva,I006284,I006284,,2018-12-01 00:00:00
51876521,113.1,113.1,sanel auto parts,0.9999289512634276,Sanel Auto Parts,04JQ5534,04JQ5534,07/31/18,2018-07-31 00:00:00
51975170,99.5,99.5,robert coon,0.9314044713974,Bendigo Bank,ORD1808143,1508108Coon,"august 22, 2018",2018-08-22 00:00:00
50889143,51.97,51.97,siaples canada,0.7190453410148621,Staples,,,07/31/2018,2018-07-31 00:00:00
51983219,142.5,142.5,hotmail,0.9906283020973206,SB Finishing,16988,16988,8/12/2018,2018-08-12 00:00:00
50901738,1404220.72,1230659.44,wellsfargo,0.9867116212844848,Wells Fargo,,,"august 1, 2018",2018-08-01 00:00:00
52095702,-24.74,24.74,lewis knowles,0.8091484308242798,Bonline,NO.205250,No.205250,2018-06-30,2018-06-30 00:00:00
52464252,,236.79,,,City Of Medicine Hat Utilities,,,07/31/2018,2018-07-31 00:00:00
52345742,393.99,393.99,supportingstrategies,0.9942837953567504,Supportingstrategies.com,2318,2318,8/02/18,2018-08-02 00:00:00
51543960,,350.0,quickbooks,0.5133656263351439,Quickbooks,89545,,31 july 2018,2018-07-31 00:00:00
51404621,1556.1,1556.1,excel sundecks,0.9930801391601562,Excel Sundecks Ltd,6074,6074,2018/08/07,2018-08-07 00:00:00
51548880,314.69,314.69,,,The Juice Truck,21538,21538,05/08/2018,2018-08-05 00:00:00
52179845,148.5,148.5,reece australia,0.8468843102455139,Reece Australia,840901790,840901790,06/30/2018,2018-06-30 00:00:00
53060779,,65.68,gys,0.6160225868225098,amazon,6789,,30/7/2018,2018-07-30 00:00:00
50527008,158.05,134.09,reliable permit solutions,0.6659261584281921,Reliable Permit Solutions,234937,234937,08/08/2018,2018-08-08 00:00:00
50131368,3053.8,3053.8,,,Mortgage Documents,262396,,13 august 2018,2018-08-14 00:00:00
50238354,5.94,5.94,correspondence & returns,0.9691128730773926,Correspondence & Returns,0009172316,0009172316,22/8/2018,2018-08-22 00:00:00
52216689,36.88,36.88,amazon,0.9720215201377868,Amazon,702-2590338-0867403,702-2590338-0867403,31 jul 2018,2018-07-31 00:00:00
50862554,1104.61,1104.61,frills,0.5455402135848999,snapd Royalties,9530,9530,11/08/18,2018-08-11 00:00:00
52680388,,375.0,mouser electronics,0.8985915780067444,Mouser Electronics,49334600,49334600,"mon, aug 27, 2018",2018-08-27 00:00:00
52295019,26.95,26.95,indiecan entertainment,0.9178721904754642,Indiecan Entertainment Inc,,,"mon, aug 6, 2018",2018-08-06 00:00:00
50637065,546.0,546.0,gilosoft consulting,0.9955037832260132,Gilosoft Consulting Inc.,1575,1575,"thu, aug 2, 2018",2018-08-02 00:00:00
51916440,243.24,243.24,pilgrim foods,0.7337736487388611,Sonya westcarr-moore,,,08/10/18,2018-08-10 00:00:00
52010422,5062.5,5062.5,kate powers,0.894439160823822,Kate Powers,,8,08/03/18,2018-08-03 00:00:00
52876837,62.4,62.4,barwon timber & hardware,0.98878812789917,Barwon Timber & Hardware Pty Ltd.,255215,255215,03/08/2018,2018-08-03 00:00:00
50241630,53.02,53.02,,,Vern Lewis Welding Supply Inc,, PS 100805,7/31/2018,2018-07-31 00:00:00
50925492,2707.01,2707.01,sevelle building services,0.6412110924720764,Sevelle Building Services Pty Ltd,15205,15205,08/06/18,2018-08-06 00:00:00
50143617,76.02,76.02,doug fox parking,0.9183995127677916,Doug Fox Parking,,,,2018-08-20 00:00:00
51942466,944.9,944.9,the positive accounting & tax solutions,0.9921674728393556,The Positive Accounting & Tax Solutions,ZUYDAM 2018,ZUYDAM 2018,"fri, aug 10, 2018",2018-08-10 00:00:00
52121160,1078.87,1078.87,jag printing,0.9406595826148988,Jag Printing,,,08/01/2018,2018-08-01 00:00:00
50572663,8273.75,8273.75,river source,0.9745876789093018,"River Source, LLC",M-12518,M-12518,2018/07/30,2018-07-30 00:00:00
52005446,86.21,86.21,sherwin williams,0.9982860088348388,Sherwin Williams,8801-9,8801-9,5/22/2018,2018-05-22 00:00:00
51865636,310.75,310.75,colour,0.6165953874588013,Cheo Tiny Hearts,83233,83233,"wednesday, may 23, 2018",2018-05-23 00:00:00
50685317,180.24,180.24,hettich australia,0.7467626929283142,Hettich,91728309,91728309,10/17/16,2016-10-17 00:00:00
52275160,1484.49,1484.49,enterprises,0.5713714361190796,PrairieCoast,,W18111,07/31/2018,2018-07-31 00:00:00
51475404,406.7,406.7,discoverorg,0.9961894750595092,DiscoverOrg,53080,53080,08/25/2018,2018-08-25 00:00:00
52241889,788.21,788.21,revision,0.5635864734649658,Badger Mining Corporation,1701851,1701851,08/07/18,2018-08-07 00:00:00
51881238,40045.06,40045.06,peninsula lumber & millwork,0.9946167469024658,Peninsula Lumber & Millwork Inc.,,,07/24/2018,2018-07-24 00:00:00
50238499,460.0,460.0,business association of nl & lb,0.962864100933075,Business Association of NL,0000005734,0000005734,"saturday, august 11, 2018",2018-08-11 00:00:00
53039487,4524.0,4524.0,ameritex pipe & products,0.9866981506347656,Ameritex Pipe & Products,S24190,S24190,31/07/2018,2018-07-25 00:00:00
50923096,277.6,305.36,novum networks,0.9805874228477478,Novum Networks,9000024,9000024,07/23/2018,2018-07-23 00:00:00
50572327,183.58,183.58,mwi animal health,0.9815942049026488,MWI Animal Health,11934180,11934180,8/16/2018,2018-08-16 00:00:00
52617514,,124.26,husky,0.9977357983589172,Husky,,,08/24/18,2018-08-24 00:00:00
51565559,,25.8,tpp wholesale,0.9919093251228333,TPP Wholesale,11874856,11874856,2018-08-02,2018-08-02 00:00:00
51447857,,1550.46,oec logistics,0.7372599244117737,Department Of Homeland Security,,,8/13/2018,2018-08-13 00:00:00
51175330,145.0,145.0,booker,0.9817087650299072,Booker,199254937,199254937,"mon, aug 13, 2018",2018-08-13 00:00:00
52581641,125.32,125.32,txu energy,0.9716118574142456,TXU Energy,055202115168,055202115168,"august 21, 2018",2018-08-21 00:00:00
50622518,5.99,18.35,amazon,0.5825991630554199,Amazon.com,,113-1719926-1469020,08/02/2018,2018-08-02 00:00:00
52021628,12.0,12.0,queuesolutions,0.9997448325157166,Queue solutions,1807834,1807834,8/17/2018,2018-08-17 00:00:00
51165562,822.42,822.42,facebook,0.8772948980331421,Facebook,1643803279066633-3031193,,"aug 10, 2018",2018-08-06 00:00:00
51444506,382.48,382.48,los angeles,0.7548549175262451,Los Angeles Department Of Water And Power,,,"july 16, 2018",2018-07-16 00:00:00
50321266,44.17,44.17,canadianlinen,0.9791417717933656,Canadian Linen & Uniform Service,6100765524,6100765524,28 may 2018,2018-05-28 00:00:00
51586758,3190.0,3190.0,data software research co,0.9872333407402042,Data Software Research Co Ltd,116-073118D,116-073118D,18-06-2018,2018-06-18 00:00:00
50217508,717.33,717.33,bdc,0.8642842173576355,Bdc,201820400562,201820400562,30 jun 18,2018-06-30 00:00:00
52523267,38.23,38.23,pizza pie,0.8586497902870178,Pizza Pie,348759,348759,06/02/2018,2018-02-06 00:00:00
51768099,210.3,210.3,qantas,0.9668259024620056,Qantas,VYNW8M,VYNW8M,22-aug-18,2018-08-22 00:00:00
51212451,226.08,226.08,better-it,0.9589487910270692,Better-It,INV-11058,INV-11058,"thu, aug 2, 2018",2018-03-14 00:00:00
51918958,322.73,322.73,ghent construction,0.9952642917633056,Ghent Construction,11006,11006,9 aug 2018,2018-08-09 00:00:00
51949942,,906.41,,,Monza Imports,,2389117,07/31/2018,2018-07-31 00:00:00
52262435,4523.11,4523.11,archdiocese of kc in ks,0.8931423425674438,Archdiocese Of Kc In,20180815RET030,20180815RET030,08/03/2018,2018-08-03 00:00:00
52758148,35.0,35.0,amanda kobilanski,0.99245947599411,Amanda Kobilanski,VA0015,VA0015,31/07/2018,2018-07-31 00:00:00
51736056,49.59,49.59,,,Spire,,180809-1111,"august 02, 2018",2018-08-02 00:00:00
52588221,9900.0,9900.0,dencona,0.986928403377533,Dencona,INV-0168,INV-0168,17/08/2018,2018-08-17 00:00:00
51780015,1317.4,1317.46,first air/4f8,0.9970900416374208,First Air,2452105589422,2452105589422,08/01/18,2018-08-01 00:00:00
52209840,11159.01,11159.01,boston,0.6227519512176514,BP Russia Wharf,647264,,08/22/2018,2018-08-22 00:00:00
51512120,125.9,125.9,spscommerce,0.9851611852645874,sps commerce,PSI-113158861,PSI-113158861,8/15/18,2018-08-15 00:00:00
52524947,27.75,27.75,ferguson enterprises,0.990151047706604,Ferguson Enterprises Inc.,6483014,6483014,"friday, august 3, 2018",2018-08-03 00:00:00
50224324,51909.0,51909.0,fmg procurement services,0.8896155357360841,Procurement Services,,,07/05/2018,2018-07-05 00:00:00
50239244,51.77,51.77,backblaze,0.9581477046012878,BackBlaze,,,"august 20, 2018",2018-08-20 00:00:00
52813024,231.67,231.67,mac energy,0.7503679990768433,Mac Energy,1246736,1246736,08/17/2018,2018-08-17 00:00:00
50269801,183.82,183.82,sherwin-williams,0.9913540482521056,Sherwin-Williams-Resi,,5271-7 072818,"aug 7, 2018",2018-08-07 00:00:00
53021973,,13393.22,prismhr,0.5309783816337585,RESTONIC MATTRESS CORPORATION,201816-INIT,201816-INIT,"wednesday, august 22, 2018",2018-08-22 00:00:00
51164681,6281.34,6281.34,diverse electrical,0.6878618001937866,AWM Electrical,,,7/19/2018,2018-07-19 00:00:00
51474726,,89.0,centerpointenergy,0.9879308342933656,Center Point Energy,,,01/08/2018,2018-08-01 00:00:00
50256156,66.46,66.46,20ubereats,0.9451416730880736,Uber,,,07/21/2018,2018-07-21 00:00:00
51478379,165.19,165.19,vision credit union,0.6997177600860596,Vision Credit Union,,,07/30/18,2018-07-30 00:00:00
50293321,880.0,880.0,mckenzie-mohr,0.8803691864013672,Customated,1544,,,2018-08-12 00:00:00
51943032,-26.25,-26.25,hubdoc,0.9997344613075256,Hubdoc,107409,107409,22/08/2018,2018-08-22 00:00:00
52753841,,6.79,stopashop,0.6466186046600342,Stop&Shop,,,28/07/2018,2018-07-28 00:00:00
51639093,7842.63,7842.63,wells fargo,0.9084617495536804,Wells Fargo,6660990745,,"aug 2, 2018",2018-08-02 00:00:00
52778485,114.36,114.36,toner warehouse,0.9996172189712524,Toner Warehouse,IN2134177,IN2134177,31 jul 2018,2018-07-31 00:00:00
51171273,3606.28,3606.28,wrightcore,0.9473689198493958,Wrightcore,INV5437,INV5437,08/01/18,2018-08-01 00:00:00
51721696,,264244.87,sigma company,0.8449186682701111,Sigma Healthcare,,,8/29/2018,2018-07-30 00:00:00
53034812,643.32,643.32,mountvillecanada,0.6355963945388794,Mountville Mills Canada,SI00062759,SI00062759,9/16/2018,2018-08-17 00:00:00
51001249,395.5,395.5,stratus events,0.9930819869041444,Stratus Events Inc,1010,1010,"august 15, 2018",2018-08-15 00:00:00
50712843,300.0,300.0,jonah goldstein,0.9847556352615356,Goldstein Visuals,070318,070318,08/01/2018,2018-08-01 00:00:00
50160127,,10313.11,gordon food service,0.9919254183769226,Gordon Food Service,2798100,2798100,17 jul 2018,2018-07-17 00:00:00
51695492,326.83,326.83,airbnb,0.9648389220237732,Airbnb,HMKB9JXSCW,2018-07-12,12 aug 2018,2018-08-13 00:00:00
51314786,,47.8,camscanner,0.636422336101532,Karthik Ramakrishna,,7/20/18,2018-08-24,2018-08-24 00:00:00
52995148,51.04,51.04,t & c supplies,0.9887027144432068,T & C Supplies,13043910,13043910,2018 / 08 / 15,2018-08-15 00:00:00
51718341,120.0,120.0,rachael bamford,0.8271987438201904,Rachael Bamford,,,"august 1, 2018",2018-08-01 00:00:00
50213871,49.49,49.49,paypal,0.9961960911750792,Paypal,,,"thursday, august 16, 2018",2018-08-16 00:00:00
52357813,1400.0,1400.0,tyson darren smith,0.953414261341095,Tyson Smith,INV0090,INV0090,08/07/2018,2018-08-07 00:00:00
51885404,160.0,160.0,804 restore,0.9850356578826904,804 restore llc,2481,2481,,2018-08-03 00:00:00
52437773,3450.44,3450.44,macevedo,0.5747666954994202,Preferred Freezer Services,1-621671,621671,,2018-06-04 00:00:00
50701653,3652.69,3652.69,produits chimiques,0.8844251036643982,Produits Chimiques Aria,,,31/07/2018,2018-07-31 00:00:00
52220795,2000.0,2000.0,mj directions,0.9964392781257628,Mj Directions Llc,5971,5971,05/22/2018,2018-05-22 00:00:00
50765787,200.0,200.0,supporting strategies partners,0.9704879522323608,"Supporting Strategies Partners,Llc",8371,8371,02-aug-18,2018-08-02 00:00:00
51528071,25.0,25.0,beeray'vine,0.7027916312217712,Craigslist,128529729,,july 30th 2018,2018-07-30 00:00:00
51782801,186.48,186.48,freeagent central,0.9264482855796814,FreeAgent,,FA-025,2018/08/23,2018-08-23 00:00:00
50733220,654.4,654.4,costcobusinesscentre,0.7675671577453613,Costco Business Centre,276642443,276642443,"august 22, 2018",2018-08-22 00:00:00
51678602,685.58,685.58,mrcooper,0.6333056092262268,Mr. Cooper,,,6/08/2018,2018-08-06 00:00:00
50160028,3320.25,3320.25,healthcare synergy,0.9403709769248962,HealthCare Synergy,314263,314263,08/15/18,2018-08-15 00:00:00
51701553,12.08,12.08,v cafe,0.9460400938987732,V Cafe,,,,2018-08-20 00:00:00
52718720,369.0,501.96,vending machine,0.5493755936622621,Vending.com (All Brands Marketing),,,"may 23, 2018",2018-05-23 00:00:00
52627894,,11438.0,thisopenspace,0.9329462647438048,Thisopenspace,10564,10564,,2018-08-08 00:00:00
51200915,897.75,897.75,propel orthodontics,0.9903429746627808,Propel Orthodontics,14417,14417,,2018-07-20 00:00:00
51211110,4585.0,4605.0,syed,0.5753557682037354,Syed Mahsam Abbas,,,31/07/2018,2018-07-31 00:00:00
51267369,624.03,624.03,hpbuilders,0.9449062347412108,HP Builders,171125,171125,07/31/2018,2018-07-31 00:00:00
50574149,109.89,109.89,john r turk,0.9892967343330384,John R Turk,13283984,13283984,15/08/2018,2018-08-15 00:00:00
50218463,20000.0,20000.0,j & r sims plumbing & gas,0.9760606288909912,J&R Sims Plumbing & Gas,INVX-1333,INVX-1333,01-06-2018,2018-06-01 00:00:00
52524117,321.55,321.55,walmart,0.9903882145881652,Walmart,2626252584,2626252584,30 jun 18,2018-07-28 00:00:00
51421643,814.5,814.5,james calderon,0.9952897429466248,James Calderon,,5,"jul 31, 2018",2018-07-31 00:00:00
52226414,101.8,101.8,bestplumbing,0.9892528653144836,Bestplumbing.ca,732279,732279,08-17-2018,2018-08-17 00:00:00
50971866,44.63,44.63,rsr group,0.9986853003501892,RSR Group,965-4005695442,965-4005695442,11/10/2015,2015-11-10 00:00:00
51861346,,0.0,precision door service,0.8523312211036682,Precision Door Service,36552,,08/11/2018,2018-08-11 00:00:00
51162371,287.0,287.0,all coast tyre solutions,0.9510371685028076,Allcoast Tyre,257974,257974,06/08/18,2018-08-06 00:00:00
52597776,89.97,89.97,amazon,0.9983353614807128,Amazon,113-9261068-9117817,Hillcrest ,08/07/18,2018-08-07 00:00:00
51513561,376.68,376.68,tallman truck centre,0.9698804020881652,Tallman Truck Centre,,,,2018-07-11 00:00:00
51440202,1413.52,1413.52,ecowoolinsulation,0.848239541053772,Ecowool Insulation,00070495,00070495,24 aug 2018,2018-08-24 00:00:00
52691840,1971.1,1971.1,oinspectable,0.6098834276199341,QUEENSLAND GOVERNMENT,,596WAK,"august 1, 2018",2018-08-01 00:00:00
50230030,1013.0,1013.0,the cellular connection,0.9996840357780457,The Cellular Connection,IN000000000458583,IN000000000458583,27-jul-18,2018-07-27 00:00:00
52127053,7608.87,7608.87,td canada trust,0.8082234859466553,TD Canada Trust,,,22/08/2018,2018-08-22 00:00:00
50715587,973.23,973.23,virgil greenhouses,0.9971604943275452,Virgil Greenhouses,,,19 jul 18,2018-07-19 00:00:00
52831856,30.0,30.0,michael lefkowitz,0.6927645206451416,Overtime Sports Inc,,,07/30/2018,2018-07-30 00:00:00
52186881,3234.0,3234.0,ba frost,0.780444860458374,BA Frost,1087,1087,08/12/2018,2018-08-12 00:00:00
52688304,2468.18,2468.18,bingo waste services,0.9829762578010559,Bingo Waste Services Pty Ltd,BR912123,BR912123,13 aug 18,2018-08-13 00:00:00
52527138,10.0,10.0,bee pro,0.7538594007492065,Bee Pro,112390471,,"friday, august 24, 2018",2018-08-24 00:00:00
50294363,800.0,800.0,jl jace lumley,0.7915019989013672,Jace Lumley,5072,NBA-FEM-5072,17 august 2018,2018-08-17 00:00:00
51827267,30.0,30.0,google,0.9937613606452942,google llc,3482853925,3482853925,19 jul 2018,2018-07-19 00:00:00
51179155,74.18,74.18,the music people,0.9946451783180236,The Music People,1210162,1210162,02/08/2018,2018-08-02 00:00:00
51264578,5085.0,5085.0,golden heating and cool,0.9909149408340454,Golden Heating & Cooling,2404,2404,07/13/2018,2018-07-13 00:00:00
51194006,100.0,100.0,sunrise food mart,0.9333996176719666,Chevron,,,20/08/2018,2018-08-20 00:00:00
51002657,98.7,98.7,synnex corporation,0.8767582178115845,Synnex,INVOICE#698040,698040,2018-08-03,2018-07-30 00:00:00
52314074,2484.33,2484.33,apple,0.8960117101669312,Apple La Cantera,,,08/13/2018,2018-08-13 00:00:00
50616132,22.6,22.6,td accounting services,0.9860427379608154,TD Accounting Services,,,31-07-18,2018-07-31 00:00:00
52263354,,0.0,u.s. bank,0.9105157852172852,Us Bank,,,08/28/2018,2018-08-28 00:00:00
50589597,517.5,517.5,sector nine distribution,0.941988170146942,Sector Nine Distribution,10583,,"aug 19, 2018",2018-08-19 00:00:00
51981404,,30.0,paper tube & core,0.9310980439186096,Paper tube & Core,10024,10024,,2016-06-06 00:00:00
50812980,105.29,105.29,toner warehouse,0.9996269941329956,Toner Warehouse,IN2129173,IN2129173,,2018-08-05 00:00:00
51367517,51.28,51.28,,,Pyramid Plumbing Supply,3016486,3016486,"fri, aug 24, 2018",2018-08-24 00:00:00
52432227,399.0,399.0,vimeo,0.8415951728820801,Vimeo,,,"august 16, 2018",2018-08-16 00:00:00
52705049,767.07,1026.81,shopify,0.9935305714607242,SHOPIFY,53998781,53998781,02/08/2018,2018-08-02 00:00:00
52217311,60.76,60.76,gensco,0.9949986338615416,"Gensco, Inc.",848307761,848307761,"august 3 , 2018",2018-08-03 00:00:00
51363810,1882.43,1882.43,intuit,0.7420666217803955,Intuit,,,"july, 2018",2018-07-01 00:00:00
51163962,2313.3,2313.3,serenity bedding,0.7699788808822632,Serenity Bedding,INV-17959,INV-17959,,2018-07-29 00:00:00
51941844,47.0,47.0,clickfunnels,0.991383135318756,Evolution Cloud,1916-6384,,08/06/18,2018-08-06 00:00:00
50150933,60.59,60.59,callrail,0.949118971824646,Callrail,,,17aug2018,2018-08-17 00:00:00
51630971,540.37,540.37,life culinary,0.6603745818138123,The Corporate Room,,2330,"january 16, 2016",2016-01-16 00:00:00
50865391,216.63,216.63,bunce rental,0.7576668858528137,Bunce Rental,231548-4,231548-4,12/28/2017,2018-08-01 00:00:00
51813894,1611.71,1611.71,mckesson,0.7742984294891357,McKesson_CORR,,,31-jul-2018,2018-07-31 00:00:00
51252305,,18.0,lyft ride,0.7646583914756775,Lyft,1161357549995694862,,"mon, aug 27, 2018",2018-08-27 00:00:00
51321409,112.25,112.25,groundwork coffee,0.902721107006073,Groundwork,364904,364904,"august 7, 2018",2018-08-07 00:00:00
51129276,81.49,81.49,tara triggs,0.6901838183403015,Tara Triggs,,,08/07/18,2018-08-07 00:00:00
50731012,321989.92,321989.92,sotheby's international realty canada,0.9412350058555604,Sotheby's International Realty Canada,,,"july 31, 2018",2018-08-01 00:00:00
51093475,5100.0,5100.0,digital packager,0.9289854764938354,Digital packager corp.,1084,1084,8/3/2018,2018-08-03 00:00:00
50916906,,10264.45,fidelity,0.8309998512268066,"Riverstone Advisors, Llc",,,,2018-07-09 00:00:00
52099838,6568.0,4018.0,checkx solutions,0.8274327516555786,Weir Global Inc.,1807-IMM,NW1807IMM,2018/07/14,2018-07-14 00:00:00
51611202,18979.4,18979.4,,,comotion,,,,2018-07-26 00:00:00
53021035,180.0,180.0,hen of the woods,0.996810019016266,Hen Of The Woods,4959,4959,27/07/18,2018-07-27 00:00:00
51186116,110.13,110.13,the home depot,0.9124670624732972,The Home Depot,,,10/20/10,2010-10-20 00:00:00
52240414,1351.81,1351.81,river source,0.975557506084442,"River Source, LLC",M-12395A,M-12395A,"tue, aug 14, 2018",2018-08-14 00:00:00
51754067,126.28,126.28,comcast business,0.780999481678009,Comcast Business,,,"thu, aug 2, 2018",2018-08-02 00:00:00
52753016,750.0,750.0,win your brand,0.9379145503044128,Winyourbrand.com,540,540,"monday, august 13, 2018",2018-08-13 00:00:00
51135394,68.0,68.0,my.smartvault,0.9302245378494264,Smartvault,,,,2017-01-31 00:00:00
53049705,6.1,6.1,hydro one,0.9539349675178528,Hydro One,J3287088,,"thu, jul 19, 2018",2018-07-20 00:00:00
50664225,-40.95,40.95,standard enzyme,0.9028345942497252,Standard Enzyme Company of North America,182168,182168,07/30/2018,2018-07-30 00:00:00
50584663,8874.25,8874.25,jack marlow,0.785605788230896,Jack Marlow,23889,23889,08/10/18,2018-08-10 00:00:00
52733971,25.0,25.0,indiana dental association,0.9680656194686892,Indiana Dental Association,120518,120518,07/24/2018,2018-07-24 00:00:00
53000024,2233.0,2233.0,mmr lending services,0.8967460393905641,MMR LENDING SERVICES,079,079,,2018-07-26 00:00:00
51820509,-2.98,-2.98,johnstone supply,0.9982500076293944,Johnstone Supply,329-S1734055.001,329-S1734055.001,,2018-07-31 00:00:00
51218755,39.29,39.29,distam,0.9287766814231871,Distam,FC00332734,FC00332734,"tue, aug 14, 2018",2018-08-14 00:00:00
52316378,15.96,15.96,microsoft,0.9979079365730286,Microsoft,E01006488K,E01006488K,09/01/2018,2018-09-01 00:00:00
51669154,27.06,27.06,wistia,0.9945017695426941,Wistia,948544,,,2018-08-07 00:00:00
51223760,18.9,18.9,duo security,0.7886525988578796,Duo Security Inc,MSP814355,MSP814355,06/21/18,2018-06-21 00:00:00
50684141,165.0,165.0,canada malting co,0.9908334016799928,Canada Malting Co. Ltd,CREDT0001338,CREDT0001338,"august 23, 2018",2018-08-23 00:00:00
51867520,15.0,19.91,fotolia,0.9728306531906128,Fotolia,210538837-203870173,,,2018-05-13 00:00:00
51535129,2.92,2.92,city of detroit,0.99496990442276,City of Detroit,1846,1846,19/08/2018,2018-08-19 00:00:00
50208750,94.73,94.73,maritimeelectric,0.9829761385917664,Maritime Electric,3677,,"july 17, 2018",2018-07-17 00:00:00
50475069,153.99,153.99,facebook ads,0.8701135516166687,Facebook Ads,YSHUHGEQG2,YSHUHGEQG2,"april 12, 2018",2018-04-12 00:00:00
51522514,186.75,186.75,,,City of St. Paul,,,01/08/2018,2018-08-01 00:00:00
52323181,550.0,550.0,zaks bin hire,0.973385453224182,Zaks Bin Hire,IV00000005242,IV00000005242,2018-05-14,2018-05-14 00:00:00
52208691,6.4,6.4,american tire,0.6017709374427795,ATD,S112562183,S112562183,"sat, jul 28, 2018",2018-07-28 00:00:00
51602337,213.7,213.7,johnson's rock products,0.9938344359397888,Johnson's Rock Products,8103,8103,15 aug 2018,2018-08-15 00:00:00
51456881,750.0,750.0,mike timmins,0.994352638721466,Mike Timmins,326,326,,2018-08-02 00:00:00
51491608,28.88,28.88,arvic search services,0.9212185144424438,Arvic search services inc.,337595,337595,31 jul 2018,2018-07-31 00:00:00
51771174,,721.22,vermont economic development authority,0.9422156810760498,Vermont Economic,,,"september 18, 2016",2016-09-18 00:00:00
51900162,504.24,504.24,bcldb,0.5180745124816895,Liquor Distribution Branch,200017497,,7/1/2018,2018-08-01 00:00:00
51380369,250.0,250.0,vonigo software,0.93879896402359,Vonigo,20001,20001,27-aug-2018,2018-08-27 00:00:00
52369608,100.67,100.67,telstra_notifications,0.9208792448043824,Telstra Notifications,1110094594,1110094594,8/5/2018,2018-08-05 00:00:00
51505262,12.0,12.0,apps4rent,0.9887853264808656,Apps4rent,302188,302188,2018-08-25,2018-08-19 00:00:00
52195963,205.0,205.0,kloeckner metals,0.8939128518104553,Kloeckner Metals,9122025,9122025,"august, 2018",2018-08-13 00:00:00
50337117,,65.0,amazon,0.9592549204826356,Durafastlabel.com,114-9776363-4589056,114-9776363-4589056,31/07/2018,2018-07-31 00:00:00
51343610,11000.0,11000.0,prime accounting & business advisory,0.932037889957428,Prime Accounting & Business Advisory,5447,5447,"july 31, 2018",2018-07-31 00:00:00
52180442,49998.65,49998.65,anz,0.5885809063911438,ANZ Securities,,12896350,"friday, august 10, 2018",2018-08-09 00:00:00
52910173,495.0,495.0,healthcaresynergy,0.9993729591369628,HealthCare Synergy,315136,315136,"aug 4, 2018",2018-08-04 00:00:00
52100457,,1261.08,campbell bader,0.9748142957687378,Campbell Bader LLP,215251-1,235446,"apr 30, 2017",2017-04-30 00:00:00
50245963,146.79,146.79,dropforge leather care,0.7377811670303345,DropForge Leather Care,1028,1028,14-aug-2018,2018-08-14 00:00:00
52791852,2721.39,2721.39,pharmachoice canada,0.9826563596725464,PharmaChoice,1151,1151,"wed, aug 15, 2018",2018-08-15 00:00:00
51434798,50.98,50.98,amazon,0.9984555840492249,Amazon,114-5914555-9477048,114-5914555-9477048,2018-08-15,2018-08-15 00:00:00
52286694,,68.84,,,Amazon,,,08/03/2018,2018-08-03 00:00:00
52196125,331.0,331.0,north yorkshire county council,0.6924920082092285,North Yprkhire County Council,,Email,08/20/18,2018-08-20 00:00:00
50835074,123.09,123.09,wolters,0.8530306816101074,Wolters,I-0341733,I-0341733,16 aug 2018,2018-08-16 00:00:00
52445258,12.0,12.0,servicescouts,0.8748906254768372,Shopper Payment Statement,183945,117023,09/08/2018,2018-08-09 00:00:00
50732171,200.0,200.0,the langsdale law firm pc,0.9387758374214172,The Langsdale Law,,,08/01/18,2018-08-01 00:00:00
52305209,414.75,414.75,da silva vineyards and winery,0.9490215182304382,Da Silva Vineyards and Winery,65841,65841,17-aug-2018,2018-08-17 00:00:00
52844265,1905.75,1905.75,,,Customer 2,2018-6,2018-6 Customer 2x,05/23/2018,2018-05-23 00:00:00
53099533,5192.05,5192.05,agropur,0.9892798662185668,Agropur 1898,42062007,42062007,19 aug 18,2018-08-19 00:00:00
52107089,614.91,614.91,canadaposl,0.7404724359512329,Canada Post,D174438169,D174438169,"wed, aug 08, 2018",2018-08-08 00:00:00
51338547,1450.0,1450.0,bank of the sierra,0.8275619745254517,Bank of the Sierra,20574,,07/26/2018,2018-07-26 00:00:00
50559364,75.0,75.0,josh hostetter,0.6455131769180298,Haba,577984,577984,4 jul 2018,2018-07-04 00:00:00
52736721,10440.0,10440.0,campbell concrete & materials,0.9757861495018004,Lehigh Hanson,1009387,1009387,30 jul 2018,2018-07-30 00:00:00
51212253,11595.65,11595.65,arrowhead general insurance agency,0.7779136896133423,Arrowhead Insurance,,,14 august 2018,2018-08-14 00:00:00
52814648,197.75,197.75,jbmk electrical contracting,0.9758175611495972,JBMK Electrical Contracting,1214,1214,,2018-07-31 00:00:00
52075516,1172.99,1172.99,fit-bioceuticals,0.753678560256958,BioCeuticals,,,"august 01, 2018",2018-08-01 00:00:00
50167040,55.46,55.46,the home depot,0.968109667301178,The Home Depot,14841,14841,08/09/18,2018-08-09 00:00:00
50919674,54.72,54.72,jetty's,0.5249502658843994,Jetty's Landscape Supplies,INVOICE-33298,invoice-33298,8/08/2018,2018-08-08 00:00:00
52007389,596.06,596.06,box,0.8722582459449768,Box.com,B00587941,,"august 31, 2017",2017-08-31 00:00:00
50813164,110.0,110.0,h e,0.7073988914489746,Hello Jade Creative,0129,0129,10 august 2018,2018-08-10 00:00:00
50983834,80781.67,80781.67,"mgoldfarb, levy",0.7638599276542664,Goldfarb Levy Eran,,,,2018-08-26 00:00:00
50985429,20.57,20.57,microsoft,0.996809422969818,Microsoft,E020069IB1,E020069IB1,07/31/18,2018-07-31 00:00:00
53070904,484.0,484.0,dlga,0.8706963062286377,DLGA Pty Ltd,8374,8374,07/19/18,2018-07-19 00:00:00
52082304,1336.66,1336.66,sysco,0.9982115626335144,Sysco,252171421,252171421,"11 apr, 2018",2018-04-11 00:00:00
52738636,58.26,58.26,,,Onroute,,,16/08/2018,2018-08-16 00:00:00
52844676,1.0,1.0,canva,0.9546405076980592,Canva,02043-3248404,02043-3248404,01/08/2018,2018-08-01 00:00:00
50677007,250.0,250.0,made coffee,0.9511212706565856,Made Coffee,2244,2244,"september 20, 2016",2016-09-20 00:00:00
52355108,87.8,87.8,ezionline.ezidebit,0.85603928565979,Ezidebit,,,7/3/2018,2018-07-03 00:00:00
52701967,282.5,282.5,freedom,0.9968371391296388,Freedom,195492,195492,"mon jul 30, 2018",2018-07-30 00:00:00
51989854,598.0,1598.0,location jean lgar lte,0.887628436088562,Location Jean Legare,,,"august 8, 2018",2018-08-01 00:00:00
50860662,6432.53,6432.53,system resources,0.9954808950424194,System Resources,2016-034,2016-034,23/08/2018,2018-08-23 00:00:00
50683099,270.08,270.08,dari farms ice cream,0.9088530540466307,Dari Farms Ice Cream Distributors,4608758,4608758,08/24/2018,2018-08-24 00:00:00
51819510,145.45,145.45,mark a. mamros,0.7520313262939453,Mark A Mamros,,,3-16-17,2017-03-16 00:00:00
50698230,99.75,99.75,midwest systems & services,0.9778140187263488,"Midwest Systems & Services, Inc.",W27964,W27964,aug-02-18,2018-08-02 00:00:00
51560348,991.0,991.0,officeheads,0.982342004776001,Officeheads,20156355,20156355,8/14/2018,2018-08-14 00:00:00
50319459,1566.45,1566.45,parmalat australia,0.8747283220291138,Parmalat Australia,,,09-08-2018,2018-08-09 00:00:00
52299368,,0.0,expert environmental pest & wildlife,0.8188504576683044,Expert Environmental,6523,18-5267,08/23/2016,2016-08-23 00:00:00
51219918,108.9,108.9,lawlive,0.9322253465652466,LawLive,134319000002,134319000002,"aug. 1, 2018",2018-08-01 00:00:00
51459382,21.63,21.63,webstaurantstore,0.9809949398040771,Webstaurant Store,20851041,20851041,27/06/2018,2018-06-27 00:00:00
51293187,160.0,160.0,maintenx,0.9773231744766236,MaintenX,349747,349747,09/30/2018,2018-08-01 00:00:00
52748755,184.87,184.87,agropur cooperative natrel division,0.7536913752555847,"Agropur, Division",W4187379,W4187379,"tue, jul 10, 2018",2018-06-21 00:00:00
52164555,202.25,202.25,1 gmac,0.8884930610656738,Gmac Pty ltd,INV-2696,INV-2696,28/06/2018,2018-06-28 00:00:00
52213048,1776.0,1776.0,sherweb,0.9570569396018982,SherWeb,2340670,2340670,15 aug 2018,2018-08-15 00:00:00
51691645,158.99,158.99,dell marketing,0.8660822510719299,Dell,10197717361,10197717361,30-jun-18,2018-07-31 00:00:00
52455345,824.36,270.28,vonex,0.9590953588485718,Vonex,501504-0415,501504-0415,23/05/2018,2018-05-23 00:00:00
52230766,795.0,795.0,ximplifi,0.9945611357688904,Ximplifi,INV-0047,INV-0047,08/08/18,2018-08-08 00:00:00
50994979,,1200.0,,,National Bank,,79475634,04/30/17,2017-04-30 00:00:00
52531803,1340.73,1340.73,,,Scholtens Candy,INV65499,65499,31/07/2018,2018-07-31 00:00:00
51209629,1800.0,1800.0,quickbooks,0.8460537791252136,QuickBooks,5662,5662,31.07.2018,2018-07-31 00:00:00
52815868,361.77,361.77,cloudnetcanada,0.9518007636070251,CloudNet,144921,144921,"tuesday, july 31, 2018",2018-07-31 00:00:00
51937944,279.0,279.0,gold medal bookkeeping,0.9945470690727234,Gold Medal Bookkeeping,1176,1176,04/13/18,2018-04-13 00:00:00
50349998,99.82,99.82,vetro trading company,0.7825199961662292,Vetro Trading Company,,,07/26/2017,2017-07-26 00:00:00
52411638,414.75,414.75,edvan custom metal processing,0.7593428492546082,Edvan Custom Metals,17281,15679,"aug 18, 2018",2018-08-18 00:00:00
51170598,1400.0,1400.0,north florida lawn,0.9965007305145264,North Florida Lawn,3286,3286,27.07.2018,2018-07-27 00:00:00
52099964,632.5,632.5,pharmachoice canada,0.9916544556617736,PharmaChoice,205078,205078,08/03/18,2018-08-03 00:00:00
51824581,1650.0,1650.0,shackindustries,0.9884490966796876,Shack Industries,,,16/07/2018,2018-07-16 00:00:00
50810332,138.6,138.6,angela's virtual assistance,0.9467592835426332,Angela's Virtual Assistance,164,164,3/08/2018,2018-08-03 00:00:00
50560737,3820.44,3820.44,divine cabinetry,0.9758225679397584,Divine Cabinetry Inc.,SO-00001006,SO-00001006,"jul 30, 2018",2018-07-30 00:00:00
50233913,85.0,85.0,paul austin equitation,0.9404725432395936,Paul Austin Equitation,00003380,00003380,6 august 2018,2018-08-06 00:00:00
51160845,15000.0,15000.0,ooredoo maldives pvt,0.769652247428894,Ooredoo Maldives,,OM/2018/C-INV/046,24/08/2018,2018-08-24 00:00:00
51132731,80.05,80.05,adp,0.9990582466125488,ADP,518652324,,6/24/2018,2018-06-24 00:00:00
51899217,13221.35,13221.35,sector nine distribution,0.9655461311340332,Sector Nine Distribution,1165,1165,"fri, aug 17, 2018",2018-08-17 00:00:00
51293537,387.25,387.25,unitedtranzactions,0.5615878105163574,Keystone,12072470,12072470,"may 15, 2018",2018-05-15 00:00:00
52542845,6.75,6.75,atlantic city expressway,0.7648882865905762,Atlantic City Expressway,,,15/08/2018,2018-08-15 00:00:00
50587976,154.4,154.4,amcap,0.5747715830802917,Skipper Transport Parts,2180812,2180812,02/08/2018,2018-08-02 00:00:00
52006515,230.52,230.52,sterling talent solutions,0.9375263452529908,Sterling,7530793,7530793,08/21/2018,2018-08-21 00:00:00
52941844,42.0,42.0,evernote,0.9855126142501832,Evernote,4725352532387307,,,2018-07-15 00:00:00
51275406,,776.91,justin gentry,0.6092339158058167,First United Bank & Trust,,,"aug 15, 2018",2018-08-15 00:00:00
52346431,100.0,100.0,intuit,0.7576885819435121,Intuit Payroll,,,08/13/2018,2018-08-13 00:00:00
51464893,34621.14,34621.14,reinhart foodservice,0.9292283058166504,Reinhart Foodservice,,,07-31-2018,2018-07-31 00:00:00
51937439,261.8,261.8,sbs fence,0.9499046802520752,SBS Fence,61301,53544,8/6/2018,2018-08-06 00:00:00
50765100,41.4,41.4,sanel auto parts,0.9999290704727172,Sanel Auto Parts,04JJ9027,04JJ9027,09 aug 2018,2018-08-09 00:00:00
52001634,50.4,50.4,drew's catering & events,0.6964707970619202,Drew's Catering & Events,E12749,E12749,21 august 2018,2018-08-21 00:00:00
52760516,-186.83,-186.83,,,Three ring management,114619,114619,10-aug-2018,2018-08-10 00:00:00
50604971,,48.65,,,woolworths,,,08/15/18,2018-08-15 00:00:00
51444423,201.27,201.27,the home depot,0.966201901435852,The Home Depot,44896,,07/31/18,2018-07-31 00:00:00
52242385,101.37,101.37,ken's roofing supplies,0.9981185793876648,Ken's Roofing Supplies Ltd.,0000210031,0000210031,8/23/2018,2018-08-23 00:00:00
50729307,4000.0,4000.0,cibc,0.7031410932540894,Receiver General - PAYROLL,,2018.06.13,"thursday, august 9, 2018",2018-08-09 00:00:00
51573030,370.42,410.66,nicholas & company,0.6069113612174988,Nicholas & Company,,286129,26/08/2018,2018-08-26 00:00:00
51206960,135.0,135.0,zoho,0.8334566354751587,Zoho,RPT2000543069500,,31/07/18,2018-07-31 00:00:00
51812488,50.0,5667.16,unltodlumbbr,0.7372068166732788,United Lumber Home Hardware,,852317,7/29/2018,2018-07-30 00:00:00
51592059,45.58,45.58,homans associates,0.9986493587493896,Homans Associates,60971900-00,60971900-00,"aug 1, 2018",2018-08-31 00:00:00
51173035,558.66,558.66,ferguson enterprises,0.9910866022109984,Ferguson Enterprises Inc.,6436455,6436455,08/21/2018,2018-08-21 00:00:00
52177359,2845.88,2845.88,inxpress,0.9885390400886536,InXpress,10201578SG02,,"wednesday, august 01, 2018",2018-08-01 00:00:00
50433893,169.5,169.5,c'est bon cooking,0.8326369524002075,Marthanne Robson,,,31 jul 2018,2018-07-31 00:00:00
52094579,,2182.45,city line distributors,0.9886457920074464,City Line Distributors,,946210,08/8/2018,2018-08-08 00:00:00
52686597,,6355.02,abuzz,0.7001451253890991,TOLL PRIORITY,REMITTANCE,TP281,08/28/2018,2018-08-28 00:00:00
51568602,166.81,166.81,cintas,0.942256510257721,Cintas,022574478,022574478,1 july 2018,2018-07-31 00:00:00
50278672,5750.0,5750.0,sector nine distribution,0.7860527038574219,Sector Nine Distribution Ltd.,10057,10057,08/14/2018,2018-08-14 00:00:00
52610960,5646.29,5646.29,vince's central,0.8554612398147583,Vince's Central Support,3450,3450,"sunday, august 5th 2018",2018-08-05 00:00:00
52741519,586.2,758.33,air canada,0.9881005287170408,Air Canada,M872IM,,"sun, aug 5, 2018",2018-08-05 00:00:00
51144187,1317.25,1317.25,paasnational,0.6264780163764954,PAAS National,,,07 aug 18,2018-08-07 00:00:00
50941534,750.0,750.0,rotary australia,0.5652350783348083,Rotary Australia World Community,116782,116782,"fri, aug 3, 2018",2018-08-03 00:00:00
50993508,42.69,42.69,microsoft store,0.8054878711700441,Microsoft,9142856409,,,2018-08-05 00:00:00
51768458,933.05,933.05,sunshinecoast.qld.gov,0.7245953679084778,Sunshine Coast,,165815,8/13/2018,2018-08-13 00:00:00
50250253,1968.75,1968.75,eagle it,0.9926357865333556,Eagle IT,1443,1443,07/03/2018,2018-07-03 00:00:00
50956868,,598.5,,,VincesMarket,2732,2732,07/27/2018,2018-07-27 00:00:00
52369603,330.0,330.0,jim's skip bins,0.9285545349121094,Jim's,DREW HAR00075,Har00075,,2018-08-15 00:00:00
52391150,75.0,75.0,ordertalk,0.9636533260345459,Ordertalk,I257335,I257335,2018-07-27,2018-07-27 00:00:00
50664942,,144.02,verizon,0.7890447378158569,Verizon Wireless,3758919215,3758919215,8/21/2018,2018-08-21 00:00:00
53071728,1694.0,1694.0, r grey suncorp,0.6378492116928101,Roxanne Grey,INV-1316,,30/07/2018,2018-07-30 00:00:00
51644392,318.09,318.09,richview glass wedding supplies,0.9614235162734984,Richview Glass Wedding Supplies,2019,2019,08/01/2018,2018-08-01 00:00:00
51899764,2.59,2.59,google,0.9788258671760559,Google,SOP.1308-1082-9898-60040..18,,07/01/2018,2018-06-30 00:00:00
50801007,417.1,417.1,earnest ice,0.6246711015701294,Recyling Alternative,0000079070,0000079070,08/01/2018,2018-01-08 00:00:00
50726407,,140.0,procom,0.9268919825553894,Procom,2360S,23605,06.08.2018,2018-08-06 00:00:00
51804313,169.5,169.5,gs1 canada,0.9651180505752563,GS1 Canada,,,2018-07-30,2018-07-30 00:00:00
52904971,39.1,39.1,fedex,0.9993534088134766,Fedex,6-253-64734,6-253-64734,"august 7, 2018",2018-08-07 00:00:00
51663255,9250.0,9250.0,the accountant,0.6805933713912964,Rakbank,8352651901901,,"november 27, 2017",2017-11-27 00:00:00
52349649,14.65,14.65,icebreaker merino clothing,0.95860356092453,Icebreaker Merino Clothing,CSI0234846,CSI0234846,08/05/2018,2018-05-08 00:00:00
51805138,1110.0,1110.0,jennifer opheim,0.8340166211128235,Jennifer Opheim,EM04,EM04,"monday, august 20, 2018",2018-08-20 00:00:00
53111143,-784.71,-784.71,crescent crown distributing,0.98374342918396,"Crescent Crown Distributing, LLC",6658960,6658960,08/23/2018,2018-08-23 00:00:00
50352938,130.0,130.0,wholesale appliance supplies,0.995670735836029,WHOLESALE APPLIANCE SUPPLIES,CS821223,CS821223,13/07/2018,2018-07-13 00:00:00
52051241,,2547.9,daily,0.6772891283035278,Daily Sales,,,31-07-2018,2018-08-02 00:00:00
50886208,1556.04,1556.04,tool technology distributors,0.8729296922683716,Tool Technology Distributors,,,8/5/2018,2018-08-05 00:00:00
52468267,2825.92,2825.92,campos coffee,0.9231463670730592,Campos Coffee,186925,186925,2018 / 08 / 11,2018-08-11 00:00:00
50987487,220.56,220.56,,,guelph auto parts,324054,2 - 324054,08 mar 2018,2018-03-08 00:00:00
52722725,26.75,26.75,manley deboer lumber,0.9519799947738647,Manley Deboer,1808-270757,1808-270757,"mon, aug 27, 2018",2018-08-27 00:00:00
51570868,195.0,195.0,sue ellemor interiors,0.945441484451294,Sue Ellemor Interiors,00002300,00002300,"thursday, august 2, 2018",2018-08-02 00:00:00
52710373,302.87,302.87,tompkins canada,0.98993319272995,Tompkins Canada,403962284,403962284,8/9/2018,2018-08-09 00:00:00
50230324,86.31,86.31,migomag,0.9100881218910216,Migomag,SO09085787,SO09085787,,2018-08-17 00:00:00
51197907,434.19,434.19,maven bookkeeping,0.9978109002113342,Maven Bookkeeping Inc,2122,2122,29/08/2018,2018-08-29 00:00:00
52086760,105.9,105.9,danmurphys,0.7354796528816223,Dan Murphy's,90770122,90770122,5/30/2018,2018-05-30 00:00:00
52875067,0.11,0.11,facebook,0.9701555371284484,Facebook,1876886572426228-3524443,,08/23/2018,2018-08-23 00:00:00
50186964,336.5,336.5,selma barwood selma barwood selma barwood,0.9617482423782348,Selma Barwood,,25-07-2018,07/23/18,2018-07-19 00:00:00
51788400,14294.8,14294.8,ameritex pipe & products,0.9862551689147948,Ameritex Pipe & Products,C0003133,C0003133,7/30/2018,2018-07-30 00:00:00
53056469,,3127.65,us foods,0.9990901947021484,usfoods,2032084,2032084,08/14/18,2018-08-14 00:00:00
51059935,111.33,111.33,pitchouguina,0.5733147263526917,Moral Evolution,,,"monday, may 28, 2018",2018-05-28 00:00:00
50204073,,1350.0,,,Lease,,,"fri, aug 17, 2018",2018-08-17 00:00:00
52494371,450.26,450.26,sunroc building materials,0.9159474372863772,Sunroc Building Materials,87116,87116,07/31/18,2018-07-31 00:00:00
52110856,309.0,309.0,pde technology corporation,0.9919661283493042,PDE Technology Corporation,1801815-IN,1801815-IN,01 aug 18,2018-08-15 00:00:00
51363487,20.5,20.5,ebay,0.9695414304733276,Ebay,323374341237,,"mon, aug 20, 2018",2018-08-20 00:00:00
51986182,6.95,6.95,private internet access,0.7396312952041626,London Trust Media,9417585,9417585,28 june 2018,2018-06-28 00:00:00
52762884,59.8,59.8,campagnolo store,0.7854630351066589,Campagnolo,,,,2018-08-08 00:00:00
52663392,253.92,253.92,godaddy,0.9615460634231568,GoDaddy,1355718941,1355718941,,2018-07-31 00:00:00
50331269,139.56,139.56,mackintosh,0.5169746279716492,Evolution,51713,51713,21/08/2018,2018-08-21 00:00:00
51854628,21.57,21.57,chase,0.8335980176925659,Chase,,,08/02/2018,2018-08-02 00:00:00
52871264,4468.88,4468.88,mckesson specialty care dist,0.9800860285758972,McKesson Specialty Care Dist.,315277383,315277383,"august 2, 2018",2018-08-02 00:00:00
52438835,160.09,160.09,atechmotorsports,0.8252893686294556,Atech Motorspots,8619603,8619603,"sat, oct 21, 2017",2017-10-21 00:00:00
51416578,2105.34,2105.34,usehedge,0.9645751714706421,Spaces,4477-435,4477-435,08/24/18,2018-08-24 00:00:00
51960075,509.95,509.95,sysco,0.993639588356018,Sysco,7821025,7821025,"2november, 2017",2017-11-02 00:00:00
52426667,615.79,615.79,tk pizza,0.9270690679550172,Hunt Brothers Pizza,INV2102081,INV2102081,07/30/2018,2018-07-30 00:00:00
50993728,6.44,6.44,fogarty builders of the keys,0.7791464328765869,Strunk Ace Hardware,621068,621068,"july 21, 2018",2018-07-21 00:00:00
52416096,65000.0,65000.0,telluride film festival,0.9518909454345704,TELLURIDE FILM FESTIVAL,062218,062218,7/31/2018,2018-07-31 00:00:00
50932758,50.65,50.65,a m e r n e t,0.9266408681869508,A M E R N E T,27924,27924,"friday, august 10, 2018",2018-08-10 00:00:00
51796047,48.15,48.15,the home depot,0.939056396484375,The Home Depot,,,20-aug-2018,2018-08-20 00:00:00
50329631,144.0,144.0,virgin,0.5875439047813416,Melair,,MEL-VAVL-4771763,15-aug-2018,2018-08-15 00:00:00
51492947,136.69,136.69,eecol electric,0.9971998333930968,Eecol electric,FS 0414806,FS 0414806,22-mar-18,2018-04-19 00:00:00
51303271,89.12,89.12,laserskinvein,0.6343634128570557,moneris,2465-1,,7/31/2018,2018-07-31 00:00:00
50587294,34.16,34.16,bradypeopleid,0.9992135763168336,Brady People  ID,9337748253,9337748253,"aug 15, 2018",2018-08-15 00:00:00
51741215,85.0,85.0,sunshine coast 4wd wreckers,0.9022057056427002,Sunshine Coast 4WD Wreckers,23116,23116,"tue, aug 7, 2018",2018-08-07 00:00:00
52375893,9.76,9.76,uber,0.99725341796875,Uber,,,7/31/2017,2017-07-31 00:00:00
51327970,254.25,254.25,ashton brewing company,0.9734210968017578,Ashton Brewing Company,26519,26519,"fri, aug 17, 2018",2018-08-17 00:00:00
50729935,3.3,3.3,google,0.9017302393913268,Google Ireland Ltd,3482712597,3482712597,2018-08-01 ,2018-08-01 00:00:00
50809909,34.0,35.02,venmo,0.625625491142273,VENMO,,,14-aug-2018,2018-08-14 00:00:00
50873594,1.99,1.99,accutel,0.9816669225692748,Accutel,0088049,0088049,2018,2018-08-16 00:00:00
52201063,-2260.0,-2260.0,creativelandscapedepot,0.9871459603309632,Creative Landscape Depot,112830,112830,08/20/2018,2018-08-20 00:00:00
50570281,,1081.5,,,Macro Properties,20T800004797,20t800004797,17-jul-18,2018-07-17 00:00:00
52284400,732.53,732.53,sunroc building materials,0.8082659840583801,Sunroc,IN-1301496-1,1301496,08/14/2018,2018-08-14 00:00:00
53007705,4500.0,4500.0,"mesia group, p.a",0.8464982509613037,"Mesia Group, P.A.",2968,2968,08-24-2018,2018-08-24 00:00:00
52135221,1573.2,1573.2,three clicks,0.9763135313987732,Three Clicks Pty Ltd,IV00026036,,07 aug 2018,2018-08-07 00:00:00
51611779,540.0,540.0,mycreativemark,0.9666625857353208,"My Creative Mark, Inc.",1201,1201,,2018-08-14 00:00:00
51414556,6062.45,6062.45,mcdougall & grace,0.9824208617210388,McDougall & Grace LLP,180075,180075,19.03.2015,2015-03-19 00:00:00
51944049,,1332.79,meecash,0.7496287226676941,Harbottle on  Premise,,24530,18/07/18,2018-07-18 00:00:00
51000989,992.59,992.59,microsoft,0.9889294505119324,Microsoft,E01006AHDN,E01006AHDN,11/03/17,2017-11-03 00:00:00
52045052,14.9,14.9,vodafone,0.995643436908722,Vodafone Network,2008000241117551,2008000241117551,8/9/2018,2018-08-09 00:00:00
51868737,291.5,291.5,philip warwick,0.7358679771423341,Philips Warwick & Co. Ltd,34354,34354,06/08/18,2018-08-06 00:00:00
51105506,167.2,167.2,red,0.5795609951019287,Red Lion Hotels,,,07/21/2018,2018-07-21 00:00:00
50559851,135.36,135.36,verizon,0.9068167805671692,Verizon Wireless,9810319264,9810319264,31.07.2018,2018-07-31 00:00:00
52265608,3056.0,3056.0,mckesson specialty care dist,0.9820639491081238,McKesson Specialty Care Dist.,315234877,315234877,"thu, aug 2, 2018",2018-08-02 00:00:00
50881952,49.0,49.0,premiercopperproducts,0.9895071387290956,Premier Copper Products,158407,158407,,2018-07-31 00:00:00
50523004,13547.19,13547.19,sunny dale colony,0.7997963428497314,Hams Marketing,3952504,243474,8/6/2018,2018-08-16 00:00:00
51227465,306.07,306.07,enersource,0.7441145777702332,Enersource,514020953655,,jul-18,2018-07-31 00:00:00
50238546,38.99,38.99,intuit,0.8968472480773926,Intuit,230013399005,230013399005,07/08/2018,2018-08-07 00:00:00
51190888,12.0,12.0,servsafe,0.8956471681594849,Sinceer Etienne,5429896,16N5215765,mar 2 2016,2016-03-02 00:00:00
51069654,83.31,83.31,idexx laboratories,0.7858468890190125,IDEXX,3026888001,3026888001,08/03/2018,2018-08-03 00:00:00
51979248,155.74,155.74,bunnings group,0.8260183334350586,Bunnings Trade,7377/00110744,7377/00110744,2016-11-24,2016-11-24 00:00:00
51796130,139.28,139.28,,,Maslack Supply Limited,3726540,3726540,"august 15, 2018",2018-08-15 00:00:00
52124844,28.15,96.87,janet,0.7111907005310059,Olympic Dust Control,,,"friday, aug 17, 2018",2018-08-17 00:00:00
52357517,5.95,5.95,lucidchart,0.7544600963592529,Lucidchart,2583539,2583539,"tuesday, july 31, 2018",2018-07-31 00:00:00
51812559,243.4,243.4,big michael's fruit & vegetables,0.875402569770813,Big Michael's Fruit & Vegetables,00024765,00024765,13 august 2018,2018-08-13 00:00:00
51423110,205.99,205.99,west jet,0.9960779547691344,Westjet,8382137798702,,08/20/18,2018-08-22 00:00:00
51279311,11.0,11.0,the burrito truck,0.98772394657135,The Burrito Truck,,,07/31/18,2018-07-31 00:00:00
51544744,3713.52,4084.87,visy packaging,0.8533803820610046,Visy Packaging,14196243,14196243,21/08/2018,2018-08-21 00:00:00
52435547,19.99,19.99,google play,0.7863622307777405,Google Play,SOP.3371-4292-6005-87456,SOP.3371-4292-6005-87456,7/31/2018,2018-07-31 00:00:00
50277703,202.08,202.08,the home depot,0.9799582362174988,The Home Depot,WA26979015,,"friday, august 17, 2018",2018-08-17 00:00:00
50816148,-111.99,-111.99,xplornet,0.9859387874603271,Xplornet,INV22967554,INV22967554,1/03/2018,2018-03-01 00:00:00
50971845,2500.0,2.68,mirving energy,0.9630425572395324,Irving Energy,,,8/3/2018,2018-08-01 00:00:00
51204706,17.63,23.77,1password,0.5671665668487549,1Password,IN_1CLR0CHBAX7L5HDFRTHJREAD,07JUL18,16/07/2018,2018-07-16 00:00:00
50701580,249.84,249.84,nutraceutical family of brands,0.9760158658027648,Nutraceutical Family of Brands,7920319.04,7920319.04,,2018-07-31 00:00:00
52602085,571.0,571.0,in-progress,0.6715466976165771,Solar Home Organisation,23609,,06/01/2018,2018-06-01 00:00:00
51148283,99.0,99.0,abn bas,0.9163790941238404,ABN BAS,,,05/31/16,2016-05-31 00:00:00
50851658,120.0,120.0,google,0.9942455291748048,Google,3484705930,3484705930,"august 27, 2018",2018-08-27 00:00:00
52492543,84.0,84.0,evernote,0.9869214296340942,Evernote,4525348214626576,4525348214626576,31 jul 2018,2018-07-31 00:00:00
50787521,55.0,55.0,cliniko,0.8893561363220215,Cliniko,,,14/08/2018,2018-08-14 00:00:00
51377952,466.59,466.59,viewpoint construction,0.8285950422286987,ViewPoint,VU260460,VU260460,08/10/18,2018-08-10 00:00:00
51052939,-28.25,-28.25,hubdoc,0.999781608581543,Hubdoc,107261,107261,july 2018,2018-07-01 00:00:00
52920045,50.0,50.0,freshworks,0.9604580998420716,Freshworks,FD674620,FD674620,31 jul 2018,2018-07-31 00:00:00
52617521,-244.0,244.11,farrel,0.6155915260314941,Princess Auto,,,"may 25, 2018",2018-05-25 00:00:00
50572027,181.12,181.12,bon accord products,0.9476869702339172,Bon Accord Products,758281,,"sun, aug 5, 2018",2018-08-05 00:00:00
50137425,377.26,377.26,dhl,0.9672114253044128,DHL,YHMI000796024,YHMI000796024,2018-07-15,2018-07-15 00:00:00
50340832,734.25,734.25,books to taxes,0.9802694320678712,Books to Taxes,ROU-27,ROU-27,8/27/18,2018-08-27 00:00:00
52374374,779.41,779.41,service nsw,0.8704549074172974,Service NSW,,,08/08/2018,2018-08-08 00:00:00
51577164,1223.01,1223.01,seven lamps,0.8451706171035767,Seven Lamps,,,12/08/2018,2018-08-23 00:00:00
51178668,223.0,40511.75,morgan stanley's,0.9371269345283508,Morgan Stanley,,,08/21/2018,2018-08-21 00:00:00
51867524,30.0,30.0,fotolia,0.8970671296119691,Fotolia,210355261-203870173,,"july 31, 2018",2018-07-31 00:00:00
51470730,202.24,202.24,pya importer,0.9890190958976746,PYA Importer Ltd.,095939,268364,13/08/2018,2018-08-13 00:00:00
52223181,904.0,904.0,sohohouseto,0.8353427648544312,SOHO House,INV-1695125,INV-1695125,"aug 1, 2018",2018-08-01 00:00:00
50776430,1608.54,1608.54,dryco building supplies,0.9670951962471008,Dryco Building Supplies,,,1 jun 2018,2018-06-01 00:00:00
53076720,180.9,180.9,mann lake,0.8792726993560791,Mann Lake,600941,,04/23/2018,2018-04-23 00:00:00
50299156,12.15,12.15,canada post,0.9819878935813904,Canada Post,D174937978,D174937978,08/27/2018,2018-08-27 00:00:00
51318544,2482.02,2482.02,mondelez australia's,0.9654938578605652,Mondelez Australia,6190630702,6190630702,aug 08,2018-08-08 00:00:00
51771643,20.0,20.0,village media. village media,0.9891568422317504,village media,A7F9355-0005,A7F9355-0005,"july 14, 2018",2018-07-14 00:00:00
50913666,6250.16,2353.8,united rentals,0.9902449250221252,United Rentals,,15947935-001,2018-07-31,2018-07-31 00:00:00
50629178,,10539.25,vegitation wholesale produce,0.9745793342590332,vegitattion Wholesale Priducts,,,16/aug/2018,2018-08-16 00:00:00
53103809,58.72,58.72,beacon roofing supply,0.6623955965042114,The Roof Center,Z829528,Z829528,14 aug 2018,2018-08-14 00:00:00
51479028,113.89,113.89,ferguson enterprises,0.993521809577942,Ferguson Enterprises Inc.,6449435,,"thu, aug 9, 2018",2018-08-09 00:00:00
52605777,181.47,181.47,adavid.co.uk,0.7065052986145021,Arthur David,4342367,4342367,6/1/2018,2018-06-01 00:00:00
52730534,558.8,558.8,signature flight support,0.989177405834198,Signature Flight Support,0143,0143,8/13/2018,2018-08-13 00:00:00
51153316,12.26,12.26,bms mitre 10,0.9776880145072936,BMS Mitre 10,10-3361404,10-3361404,01 august 2018,2018-08-01 00:00:00
50247239,399.0,399.0,morter health alliance,0.9879332184791564,Morter Health Alliance,297378697,297378697,09/08/2018,2018-08-09 00:00:00
52758103,1962.44,1962.44,clare interior supplies,0.9864985346794128,Clare Interior Supplies,1808-098551,1808-098551,13 aug 2018,2018-08-13 00:00:00
51589402,1545.29,1545.29,nedco-div.of,0.986700177192688,Nedco,,,,2017-11-20 00:00:00
52535606,78.3,78.3,safford builders supply,0.998065710067749,Ace Safford Builders,784965,784965,17/08/2018,2018-08-17 00:00:00
51140358,178.79,178.79,,,reddometta,254,254,08/04/18,2018-08-04 00:00:00
52428733,59719.85,48903.02,,,Note Servicing Center,100342,100342,"monday, august 20, 2018",2018-08-20 00:00:00
51659863,943.5,11063.5,hills,0.5477484464645386,usbank,,,2018/07/13,2018-07-13 00:00:00
52361973,2794.0,2794.0,88 agencies,0.7706050276756287,88 Agencies Pty Ltd.,,,2018-09-20,2018-08-21 00:00:00
50541320,1565.05,1565.05,engineered electric controls,0.9858246445655824,Engineered Electric Controls,109450,109450,"mon, jul 30, 2018",2018-07-30 00:00:00
52159471,2500.0,2500.0,jenny beres coaching,0.9897247552871704,Jenny Beres Coaching,0000081,0000081,21-08-18,2018-08-21 00:00:00
52852680,1909.0,1909.0,wavefront software,0.9949451088905334,Wavefront Software,I18-01528,I18-01528,jul 31,2018-07-31 00:00:00
51121445,585.0,585.0,ten toes brewery,0.9885469675064088,Ten Toes Brewery,10T-INV-1053,,7/31/2018,2018-07-31 00:00:00
50922775,1500.0,1500.0,lawpay,0.8080379366874695,Lawpay.com,,,"august 21, 2018",2018-08-21 00:00:00
51743608,58.0,58.0,,,Ministry Of Design®,8430,8430,jul 18,2018-07-18 00:00:00
52688344,241.79,241.79,amazon,0.9981899261474608,Amazon,114-6415492-1238609,,"july 19, 2018",2018-07-19 00:00:00
51133070,762.75,762.75,manitoulin,0.6580720543861389,Manitoulin Transport,4176239,4176239,8/17/2018,2018-08-17 00:00:00
52016234,1327.96,1327.96,mr feret,0.6602319478988647,Feret Nicolas,893,893,06/18/2018,2018-06-18 00:00:00
50793222,21.0,21.0,express bin hire,0.9843506813049316,Express Bin Hire,IV0016752,IV0016752,13 august 2018,2018-08-13 00:00:00
52790805,440.0,440.0,allsuper,0.9865270853042604,AllSuper Pty Ltd,19051,19051,04/30/2018,2018-04-30 00:00:00
50577533,,257.48,freedom mobile,0.7519428730010986,CDCR Report,,,"august 1, 2018",2018-08-01 00:00:00
52701295,127.63,127.63,directv.ebilling,0.9402702450752258,Directv,,,1 mar 2018,2018-03-01 00:00:00
52616945,176.17,176.17,csg of exeter,0.6971731185913086,Onda Origins,,,8/7/2018,2018-08-07 00:00:00
50862561,,1563.92,snapd,0.8851693272590637,snapd Royalties,,11546,25/05/18,2018-05-25 00:00:00
50837152,576.56,576.56,axels grind,0.9133908748626708,Axels Grind,1010,1010,14/06/2018,2018-07-01 00:00:00
50128861,342.77,342.77,bradypeopleid,0.9991909861564636,Brady People  ID,9337726738,9337726738,8/10/2018,2018-08-10 00:00:00
52736346,2729.6,2729.6,pro-analytics,0.9478158950805664,"Mettler-Toledo Process Analytics, Inc.",732026101,732026101,"aug 18, 2018",2018-08-18 00:00:00
52599377,134.1,134.1,victory hemp,0.5741314888000488,Green Mountain Power (4079),,08062018,"tue, jul 31, 2018",2018-07-31 00:00:00
51663339,156.67,156.67,sherwin williams,0.99937903881073,Sherwin Williams,7386-5,7386-5,08/03/18,2018-08-03 00:00:00
52876219,204.12,204.12,airbnb,0.981416881084442,airbnb,RCDSD3XC9A,,08/27/18,2018-08-27 00:00:00
51265361,386.84,386.84,happy host cleaning,0.9949006438255308,Happy Host Cleaning,6225,6225,aug. 8 / 2018,2018-08-08 00:00:00
50954092,352.0,352.0,purifiedplumbing,0.6216305494308472,Purified Plumbing,1601,1601,,2018-08-23 00:00:00
52548845,400.0,400.0,nano tech electrical,0.998497486114502,Nano Tech Electrical,00005159,00005159,09/01/2018,2018-09-01 00:00:00
51051112,185288.0,185288.0,majestic,0.5557360053062439,Ooredoo Maldives,,SH07/60317,30 jul 2018,2018-07-30 00:00:00
51228538,,14631.29,hicks,0.5005028247833252,DentiCare,,Remittance,8/6/2018,2018-08-06 00:00:00
50651899,47.5,47.5,albany dms,0.9565793871879578,Albany DMS,,38623,08/23/18,2018-08-23 00:00:00
50727078,143.63,143.63,stratford office,0.7797220945358276,Taylor Fluid Systems,00328448,00328448,08/16/2018,2018-08-16 00:00:00
52782848,17536.77,1126.9,dexus property services,0.7885702252388,DEXUS Property Services,349330,349330,08/16/2018,2018-08-16 00:00:00
52783742,2115.42,2115.42,dermalogica,0.9860353469848632,Dermalogica,SI534053,SI534053,"mon, aug 13, 2018",2018-08-13 00:00:00
53051830,418.95,418.95,,,Communication Connection,47877,47877,8/23/2018,2018-08-23 00:00:00
51555998,50.0,50.0,cornerstone christian church,0.6931296586990356,Cornerstone Campus Ministry,,702,27/08/2018,2018-08-27 00:00:00
51537745,2247.0,2247.0,clickbooth,0.9557587504386902,clickbooth,CB107301,CB107301,28th july 2018,2018-07-28 00:00:00
52126023,56.5,56.5,tim hortons,0.9820951223373412,Ad Fund 1898,7250074139,7250074139,13/8/2018,2018-08-13 00:00:00
51787997,877.5,877.5,kramer holcomb,0.8535297513008118,KHS,320,320,"fri, jul 20, 2018",2018-07-20 00:00:00
50833502,21.5,21.5,falls creek laundry,0.9630512595176696,Falls Creek Laundry,00010520,00010520,"august 01, 2018",2018-08-01 00:00:00
50224200,151.08,151.08,olliix,0.9933183789253236,Olliix,S46527162-1,,07/19/2018,2018-07-19 00:00:00
51253527,2608.4,2608.4,capitolcityproduce,0.9970632195472716,Capitol City Produce,,,23 aug 2018,2018-08-23 00:00:00
51506098,173.25,173.25,royal vista,0.6449280381202698,Maple Leaf Self Storage,,,"aug 3, 2018",2018-07-22 00:00:00
50902618,131.6,131.6,davenport tower,0.5845264792442322,The Davenport Tower,95795135,,22 aug 2018,2018-08-22 00:00:00
51477354,4425.0,4425.0,hardin compliance consulting,0.9844626784324646,Hardin Compliance Consulting,09-6551,09-6551,"3rd august, 2018",2018-08-03 00:00:00
51181923,244.65,244.65,240-livermore-npt,0.574364423751831,Livermore-NPT Distribution,D8268756,D8268756,,2018-08-01 00:00:00
51909521,327.6,327.6,herbaland naturals,0.9954193830490112,Herbaland Naturals,12181,12181,07/24/18,2018-07-24 00:00:00
50286925,9186.79,9186.79,suntrust,0.9372308254241944,Suntrust (6988),1000205216988,1000205216988,"august 12, 2018",2018-08-12 00:00:00
52042493,21.05,0.0,preferred meats,0.99876868724823,"Preferred Meats, Inc.",187302 A,187302 A,22 august 2018,2018-08-22 00:00:00
52195763,,4223.4,kloeckner metals,0.9051731824874878,Kloeckner Metals,9123258,9123258,08/01/2018,2018-08-01 00:00:00
52829767,8835.0,8835.0,resources,0.9574409127235411,REsources Inc,155,155,10/31/2014,2014-10-31 00:00:00
52015838,654.14,16654.14,mortagne,0.5340129137039185,Inv. 95 Mortagne Inc,,,"aug 21, 2018",2018-08-21 00:00:00
51512124,251.8,251.8,sps commerce,0.899057149887085,sps commerce,PSI-113122654,PSI-113158861,31/07/18,2018-07-31 00:00:00
50812786,2367.6,2367.6,michelle estes,0.9772472381591796,Michelle Estes,10,10,"thursday, august 9, 2018",2018-08-09 00:00:00
52439087,78990.64,78990.64,,,Foundation Supportworks Inc.,53714,53714,31/7/2018,2018-07-31 00:00:00
52671739,3757.24,3757.24,deposit,0.5623227953910828,Aug Deposit Slip,13076369,,08/17/18,2018-08-17 00:00:00
51877727,1698.41,1698.41,kuikenbrothers,0.944376528263092,Kuiken Brothers,MP-368369,MP-368369,08 jun 2018,2018-06-08 00:00:00
52614998,18936.0,18936.0,michaelryanhomes,0.914264678955078,Larry & Junior Construction,,,,2018-07-31 00:00:00
51848422,66.0,66.0,vancar transport/ golf cart hire,0.8946312665939331,Vancar Transport,INV-0660,INV-0660,"wed, aug 1, 2018",2018-08-01 00:00:00
51808539,966.85,966.85,fiore nursery & landscape supply,0.9508316516876221,Fiore,I149199,I149199,aug 6 2018,2018-08-06 00:00:00
50986545,12.95,12.95,canva,0.9858666658401488,Canva,02032-2739660,02032-2739660,07/26/18,2018-07-26 00:00:00
51710871,27.5,27.5,all things sorted,0.9872665405273438,All Things Sorted,INV-0357,INV-0357,"monday, august 27th, 2018",2018-08-27 00:00:00
50848570,67.01,67.01,ferguson,0.8888963460922241,Ferguson,4157688,4157688,08/17/2018,2018-08-17 00:00:00
52822608,185.32,185.32,webgistix,0.7382237315177917,Webgistix,1247180803,1247180803,"august 13, 2018",2018-08-13 00:00:00
52490398,838.91,838.91,fresh start foods canada,0.9666393399238586,Fresh Start Foods Canada,,,"tue, aug 21, 2018",2018-08-21 00:00:00
50975225,393.33,393.33,,,One Stop Inc,1147324321,3151123,"fri, aug 3, 2018",2018-08-03 00:00:00
52627206,183.5,183.5,magnetsigns northwest sr signs,0.8516879677772522,Magnetsigns Northwest,1290,1290,"july 31, 2018",2018-07-31 00:00:00
52795664,91.91,91.91,florida water products,0.9988246560096741,FWP,5231230,5231230,"august 22, 2018",2018-08-22 00:00:00
52624537,398.47,398.47,the home depot,0.9521029591560364,The Home Depot,6616-895275,,09 aug 2018,2018-08-09 00:00:00
51114030,164.56,164.56,colorado springs utilities,0.9942712783813475,Colorado Springs Utilities,,,20/08/2018,2018-08-20 00:00:00
52675926,158.4,158.4,oborne health supplies,0.8489674925804138,Oborne Health Supplies,SOH0187964,SOH0187964,7/30/18,2018-07-30 00:00:00
51401439,86.69,86.69,acme supplies,0.9056297540664672,Acme Supplies,797159,,7/31/2018,2018-07-31 00:00:00
52386335,140.92,140.92,orkin,0.9390307664871216,Orkin,173062138,173062138,27/08/2018,2018-08-27 00:00:00
52336788,25.51,25.51,sherwin-williams,0.9931809306144714,Sherwin-Williams Co.-Govt,,6572-8 081418,02 july 2018,2018-06-28 00:00:00
52849138,200.0,200.0,bell,0.9548839330673218,Bell,532634391,,"sunday, august 5, 2018",2018-08-01 00:00:00
51024897,,171.36,mow and snow land services,0.7535102367401123,Mow And Snow Land Services Ltd,3340,3340,"aug 14, 2018",2018-08-14 00:00:00
52995856,146.99,146.99,telstra,0.979920506477356,Telstra,1049,1371049823,"july 23, 2018",2018-07-23 00:00:00
51547777,,19316.65,,,Eastern Checking,,,"august 4, 2018",2018-08-04 00:00:00
51470819,1999.98,1999.98,premier markings,0.9877837300300598,Premier Markings,,,"thursday, august 23, 2018",2018-08-23 00:00:00
50566264,250.0,250.0,josh kemp,0.9717563986778259,Joshua Kemp,,180728 SU Miyamoto/Cooper,"august 1, 2018",2018-07-26 00:00:00
52415068,,24425.0,r a n k l i n b u,0.7641224861145021,Franklin Builders,,10048,"august 24, 2018",2018-08-24 00:00:00
51238874,3052.8,3052.8,crokers truck,0.6476542353630066,CROKERS TRUCK CENTRE - STATEMENTS,,STATEMENT,,2018-08-14 00:00:00
51357718,115.0,115.0,workplace wellness & counselling services,0.8878717422485352,Workplace Wellness & Counselling Services,283,283,,2018-07-30 00:00:00
53040441,19.3,19.3,grizzly supplies,0.964435338973999,Grizzly Supplies,SI011322,SI011322,8 aug 2018,2018-08-08 00:00:00
51299621,9219.17,9219.17,sap canada,0.9770137071609496,SAP Canada,6009062323,6009062323,30/07/2018,2018-07-30 00:00:00
50974983,,44.75,mail.google,0.5286193490028381,Office Depot - Office Max,,,7/10/2018,2018-07-10 00:00:00
51252171,406.96,406.96,matheson tri-gas,0.7902768850326538,Matheson,,17956704,"july 29, 2018",2018-07-29 00:00:00
51293107,217.51,217.51,refrigerative supply,0.9952332377433776,Refrigerative Supply,4205755,4205755,08/01/2018,2018-08-01 00:00:00
52830633,175.0,175.0,daniel cullen,0.7390854954719543,Daniel Cullen,,,14/08/2018,2018-08-17 00:00:00
50680452,109.99,109.99,vitalitydepot,0.964657723903656,Vitalitydepot.ca,950803,950803,jun 04 2018,2018-06-04 00:00:00
51452816,673.2,673.2,campaigntrack,0.9896500110626221,Campaign Track,R0458372,R0458372,31/07/2018,2018-07-31 00:00:00
52721960,39.99,39.99,timberline ace hardware,0.9973153471946716,TIMBERLINE ACE HARDWARE,B58137,B58137,,2018-08-27 00:00:00
50588183,299.0,299.0,receipt bk us,0.6633595824241638,Receipt Bank,47419,47419,08/10/2018,2018-08-10 00:00:00
52375497,19.95,19.95,liveplan,0.7988389730453491,Team Liveplan,,,8/10/2018,2018-08-10 00:00:00
52030199,366.29,366.29,fastservsupply,0.9654049277305604,FastServ,1856449,1856449,06/11/2018,2018-06-11 00:00:00
52217962,145.0,300.0,perfect pour services,0.9661200642585754,perfect pour service,15-28342,15-28342,11/23/2016,2016-11-23 00:00:00
51805682,400.0,400.0,high,0.5472539663314819,High Desert CHB,B1800003634,B1800003634,2018 08 25,2018-08-25 00:00:00
51605374,225.0,225.0,jennifer dickinson photography,0.9822763204574584,Jennifer Dickinson Photography,156,156,7/31/2018,2018-07-31 00:00:00
51143979,120.0,420.0,re-fit rhys evans,0.9082837104797364,Re-fit Rhys Evans,NO.018,no.018,"july 25, 2018",2018-07-25 00:00:00
50598332,79.85,79.95,air liquide healthcare,0.9165275692939758,Air Liquide,CON3822952,CON3822952,"fri, jul 27, 2018",2018-07-27 00:00:00
50304553,597.76,597.76,ecr4kids,0.9945601224899292,ECR4Kids,727124,727124,"december 30, 2016",2016-12-30 00:00:00
50223602,1015.41,1015.41,australian plastic profiles,0.989230751991272,Australian Plastic Profiles,735141,735141,07/28/2018,2018-07-28 00:00:00
51372555,3605.44,3605.44,insight,0.9891260862350464,Insight,913991954,913991954,08/21/18,2018-08-21 00:00:00
50990351,409.72,409.72,nancy hummel,0.6777513027191162,Stevens Business Service,85063,85063,2018-08-19,2018-08-19 00:00:00
52095828,483.76,483.76,zoom video communications,0.9782990217208862,Zoom Video Communications Inc.,INV03931265,INV03931265,31/07/2018,2018-07-31 00:00:00
51204318,669.5,669.5,shamrock foods company,0.8424110412597656,Shamrock Foods,18929694,18929694,"august 3, 2018",2018-08-03 00:00:00
51569572,3150.0,3150.0,mnp,0.8965826034545898,MNP LLP,8472688,8472688,"august 14, 2018",2018-08-14 00:00:00
51582926,2061.83,2061.83,robertson electric wholesale 2008,0.9944584965705872,Robertson Electric Wholesale 2008 Ltd.,1621746,1621746,7 jul 2018,2018-07-07 00:00:00
50837304,25.0,25.0,carta,0.9862041473388672,Carta,1995-6156,1995-6156,6 aug 2018,2018-08-06 00:00:00
52223123,474.0,474.0,levi strauss & co,0.9309049248695374,Levi Strauss & Co,9028229163,9028229163,13/07/2018,2018-07-13 00:00:00
52537530,14919.31,14919.31,vince's,0.8199354410171509,Vinces Market,3445,3445,30 jul 2018,2018-07-30 00:00:00
50791625,555.0,138.75,yamaha,0.7271342277526855,Yamaha,6354273,6354273-4,"friday, august 03, 2018",2018-08-03 00:00:00
51228178,21329.2,21329.2,fuji xerox australia,0.8454980850219727,Fuji Xerox,CR882814,CR882814,6/8/2018,2018-08-06 00:00:00
51440270,4049.26,4049.26,d e p o s i t s l i p,0.943275272846222,Deposit Slip,,,2018-07-12,2018-07-12 00:00:00
53066589,37.74,37.74,three.co.uk/priceguide,0.914460301399231,Three.co.uk,ABK70907523,ABK70907523,"july 28, 2018",2018-07-28 00:00:00
52532617,403.69,403.69,the home depot,0.9215850830078124,The Home Depot,,,20 aug 2018,2018-08-20 00:00:00
50255635,11865.0,11865.0,freelance copywriter,0.9577125310897828,Miles Markovic,COLLECTIVEIQ 718-510,CollectiveIQ 718-510,"august 1, 2018",2018-08-01 00:00:00
50279708,76.82,76.82,,,Guelph Auto Parts, 323763,2 - 323763,8/27/18,2018-08-27 00:00:00
52398000,860.98,860.98,mountvillecanada,0.6439396142959595,Mountville Mills Canada,SI00062674,SI00062674,"tue, aug 7, 2018",2018-08-07 00:00:00
51630352,99.99,99.99,originenergy,0.9967846274375916,Origin,121000561808,121000561808,07/24/18,2018-07-24 00:00:00
52654872,45.0,45.0,progreen window cleaning,0.99936705827713,"ProGreen Window Cleaning, Inc.",62852,62852,16 august 2018,2018-08-16 00:00:00
50606432,254.6,254.6,exmouth hardware & building supplies,0.9312236309051514,Exmouth Hardware,962721,July 2018 Account,10/06/17,2017-10-06 00:00:00
51480334,568.86,568.86,refundsmanager,0.993439257144928,Refunds Manager,1956865,1956865,"thursday, may 04, 2017",2017-06-01 00:00:00
52029283,113.26,113.26,,,Ultramar,,,28 august 2018,2018-08-16 00:00:00
51819032,91.24,91.24,upwork,0.8870103359222412,Upwork,194137700,194137700,"sat, aug 18, 2018",2018-08-18 00:00:00
52575006,23.59,23.59,thermalsupply.billtrust,0.9486513733863832,Thermal supply inc.,6637215,6637215,01/08/18,2018-08-01 00:00:00
50202310,169.49,169.49,best buy,0.9957163333892822,Best Buy,,,"sat, aug 11, 2018",2018-08-11 00:00:00
52043494,1019.66,1019.66,tile shoppe,0.99746435880661,TIle Shoppe,7633,7633,02/08/18,2018-08-02 00:00:00
52421794,34213.57,34213.57,royal bank of canada,0.7152237296104431,Royal Bank Of Canada,,,27/03/2018,2018-03-27 00:00:00
51380535,121.47,121.47,versapay,0.9203227758407592,Versapay,,secure.versapay.com/invoices/62586,8.27.18,2018-08-27 00:00:00
52954705,106.23,106.23,m o r l e y w h o l e s a l e f r u i t & v e g e ta b,0.8245465755462646,morley wholesale fruit & vegetables,00009306,00009306,8/2/2018,2018-08-02 00:00:00
52239784,144.93,144.93,amazon,0.9473503232002258,Amazon,113-1996458-7740261,113-1996458-7740261 REF,2018.07.13,2018-07-13 00:00:00
51582741,2500.0,2500.0,,,Cambridge Audio,SUS20000195,SUS20000195,"august 8, 2018",2018-08-08 00:00:00
50744501,64.75,64.75,appriver,0.9971799850463868,"Appriver, Llc",440020,440020,13 jun 2018,2018-06-13 00:00:00
52025986,177.0,177.0,telstra,0.9806771278381348,Telstra,,,08/08/2018,2018-08-08 00:00:00
50979171,72.14,72.14,gulfeagle supply,0.9936027526855468,GULFEAGLE Supply,S8163823.001,S8163823.001,6/30/2018,2018-06-30 00:00:00
52066485,,3.0,camscanner,0.636422336101532,Australia Post,,,01 aug 2018,2018-08-01 00:00:00
51892027,1000.0,1000.0,rhinoboss,0.6436387896537781,Joseph Neyer,,81518,3/07/2018,2018-07-03 00:00:00
51180022,18.65,18.65,amazon,0.9961465001106262,Amazon,114-7783999-9317054,,"sun, jul 29, 2018",2018-07-29 00:00:00
52198342,,10.49,camscanner,0.636422336101532,RONA,,,,2018-08-02 00:00:00
51654616,387.17,387.17,qantas,0.9935827851295472,Qantas,PSJXES,PSJXES,7/16/2018,2018-07-16 00:00:00
50752304,1255.4,1255.4,bear's custom painting,0.9039142727851868,Bear's Custom Painting,660,660,08-15-18,2018-08-15 00:00:00
52111731,99.0,99.0,happy city,0.9962992668151855,Maryam Ahmadi Oloonabadi,INV-004,INV-004,27-aug-2018,2018-08-27 00:00:00
53037672,25.0,25.0,stamps,0.9925791621208192,Stamps,,,"friday, august 3, 2018",2018-08-03 00:00:00
51016238,2.93,2.93,chase,0.8976600766181946,Square Feat_CORR,,,08/23/2018,2018-08-23 00:00:00
50600281,2710.15,2710.15,wotso workspace,0.960290253162384,Wotso WorkSpace,INV-17803,INV-17803,09-07-2018,2018-09-07 00:00:00
51598595,-1488.63,1488.63,,,Medicine shoppe canada corporation,,8000995937,17 jul 2018,2018-07-17 00:00:00
50863493,970.6,970.6,global strategic accountants,0.9916519522666932,Global Strategic Accountants,TI073118,TI073118,"sep. 11, 2017",2017-09-11 00:00:00
51650666,150.0,150.0,dear systems,0.949869692325592,Dear systems,IN-0050836,IN-0050836,"saturday, august 12, 2017",2017-08-12 00:00:00
51261317,,23878.43,us-analytics solutions group,0.9308934211730956,"US-Analytics Solutions Group,",26192,26192,,2019-05-12 00:00:00
52413718,350.05,350.05,jc furniture hardware,0.9384412169456482,JC Furniture Hardware,1837-2866-5017-6854,150075,"aug 6, 2018",2018-08-06 00:00:00
52905309,36.95,36.95,square,0.9488703608512878,Square,,,"may 30, 2017",2017-05-30 00:00:00
51540745,10000.0,10000.0,facebook ads,0.8663404583930969,Facebook,,,,2018-07-31 00:00:00
52240534,102.48,102.48,centre branch,0.5627873539924622,TD,,2413845 Ontario Inc,"july 20, 2018",2018-07-20 00:00:00
51694126,3570.6,3570.6,exponential innovation,0.8980855345726013,Exponential Innovation,INV-00055,INV-00055,6/1/2018,2018-06-01 00:00:00
52820179,258.75,258.75,the home depot,0.9203895926475524,The Home Depot,H4110-66984,H4110-66984,6 aug 2018,2018-08-06 00:00:00
52455926,14.3,14.3,australia post,0.9828287363052368,Australia Post,AP03847440,AP03847440,,2018-08-20 00:00:00
50312388,230.49,230.49,frontier plumbing & heating supply,0.9735547304153442,Frontier Plumbing & Heating Supply,02-032715,02-032715,"july 27, 2018",2018-07-27 00:00:00
51750730,19.85,19.85,intuit,0.8163817524909973,Intuit,230013413600,230013413600,2018,2018-08-09 00:00:00
52379537,61.93,61.93,imperialcoffee,0.9615240097045898,Imperialcoffee.com,227 2691,227 2691,"august 25, 2018",2018-08-25 00:00:00
52863008,161.54,161.54,click2gov,0.7783709764480591,Carson City Utilities,92014343,,02 jul 2018,2018-07-02 00:00:00
50128326,3066.97,3066.97,re/max camosun,0.9035325646400452,Camosun Properties Ltd.,201807,,08/09/18,2018-08-10 00:00:00
50754495,260.0,260.0,visible edge,0.7706774473190308,FIAI/Cross Ins,INVOICE#1253940,1253940,august 27 2018,2018-08-27 00:00:00
52048900,66.8,66.8,petries mitre 10,0.9716237783432008,Petries Mitre 10,3-1999573,3-1999573,2018,2018-07-29 00:00:00
51374704,75.0,75.0,clear sage networks,0.9898179769515992,Clear Sage Networks,1028,1028,"august 22, 2018",2018-08-22 00:00:00
50864137,5.99,5.99,dana puzey,0.8050770759582521,Dana Puzey,,,,2018-08-06 00:00:00
52752123,103.9,103.9,porter,0.9167015552520752,PORTER,,V13BRR,8/8/2018,2018-08-08 00:00:00
52114959,,96.23,valvoline,0.5655799508094788,Seguin express care,,,31-jul-18,2018-07-31 00:00:00
51463469,2125.76,33.39,elite food co,0.8224236369132996,Elite Foods,,87475/01,7/31/18,2018-07-31 00:00:00
51989558,,40.06,amazon,0.9825193285942078,Amazon,114-5285046-5695407,,31/07/2018,2018-07-31 00:00:00
52966023,18000.0,18000.0,asdg structural design group,0.8738970160484314,Structural Design Group,,,3 aug 2018,2018-08-03 00:00:00
51328557,920.08,920.08,petro coating systems,0.962300717830658,Petro Coating Systems,28400,28400,8/5/2018,2018-08-05 00:00:00
52382549,184.53,184.53,,,Identity systems inc,0000162307,0000162307,,2018-07-31 00:00:00
52994613,55.0,55.0,intuit,0.8976843357086182,Intutit Quickbooks,225011263976,225011263976,september 2018,2018-09-01 00:00:00
50968054,203.68,203.68,upper grand refrigeration,0.7952598333358765,Upper Grand 0659,00006574,00006574,7/08/2018,2018-08-07 00:00:00
52411809,22.87,22.87,tradegecko,0.986979603767395,Tradegecko Pte,INV00031089,INV00031089,2 august 2018,2018-08-02 00:00:00
52373364,205.66,205.66,8926409 canada,0.7470571398735046,8926409 Canada Inc,3,3,08/24/2018,2018-08-24 00:00:00
51449358,374.0,374.0,petries mitre 10,0.9830704927444458,Petries Mitre 10,2-1541995,2-1541995,08/20/2018,2018-08-20 00:00:00
51362933,212.54,212.54,noble,0.9916486740112304,Noble Corporation,20117852-00,20117852-00,08/02/2018,2018-08-02 00:00:00
50906871,26.41,26.41,uberx,0.9963476657867432,Uber,,,"mon, jan 9, 2017",2017-01-09 00:00:00
50176123,113.79,113.79,,,EMCO Corporation,79440875-00,79440875-00,01-aug-2018,2018-08-01 00:00:00
51671580,427.57,427.57,gymsales software,0.8337578177452087,Gymsales Software,INV-7709,INV-7709,"aug 3, 2018",2018-07-26 00:00:00
51626302,1585.0,1585.0,denkers property maintenance,0.950351893901825,Denkers Property Maintenance,3161,3161,"thu, jul 5, 2018",2018-07-05 00:00:00
51720818,722.53,722.53,shopify,0.9934645891189576,shopify,53740907,53740907,20.08.2018,2018-08-20 00:00:00
50952183,250.0,250.0,jenna brown,0.9955909252166748,Jenna Brown,126,126,28/07/18,2018-07-28 00:00:00
51470671,1911.27,1911.27,naked and famous denim,0.9802558422088624,Naked & Famous,43851,43851,05/31/18,2018-05-31 00:00:00
51539476,53.31,53.31,refrigerative supply,0.9942718744277954,Refrigerative Supply,4210029,4210029,"august 05, 2018",2018-08-05 00:00:00
51847511,469.59,469.59,platt,0.99522602558136,Platt,T057247,T057247,08/20/2018,2018-08-20 00:00:00
52731973,940.0,940.0,evolve,0.6008570194244385,Tele Pak Inc.,2018-12696,2018-12696,06.08.2018,2018-08-06 00:00:00
52889140,4.51,4.51,apple,0.9771655797958374,Apple,204223384369,204223384369,"aug 23, 2018",2018-08-23 00:00:00
51545508,138.6,138.6,efex,0.8877172470092773,efex,FA00053525,FA00053525,05/31/2018,2018-05-31 00:00:00
50312557,106.13,106.13,the landscaping yard & hardware,0.9994816780090332,The Landscaping Yard & Hardware,450382,450382,"jul 19,2018",2018-07-19 00:00:00
51909237,2421.71,2421.71,waxcenter,0.9105902314186096,Waxcenter.com,SIN286884,SIN286884,"august 2, 2018",2018-08-02 00:00:00
50416292,8.86,8.86,correspondence & returns,0.9555975794792176,Correspondence & Returns,0009181191,0009181191,,2018-08-15 00:00:00
52643607,198.0,198.0,queuesolutions,0.9996040463447572,Queue solutions,1808168,1808168,14/08/2018,2018-08-14 00:00:00
52517291,282.5,282.5,watkin small business services,0.9203670620918274,Watkin Small Business Services,117-24,117-24,07/31/2018,2018-08-01 00:00:00
50631413,,519940.1,massage envy spa,0.7155945897102356,Massage Envy,,,mar 01 2018,2018-08-07 00:00:00
52341886,27.6,27.6,envato market,0.68265700340271,Vystina,IVIP27358885,IVIP27358885,8/2/2018,2018-08-02 00:00:00
52869882,1282.25,1282.25,trimar promotional products,0.63393634557724,By Design Embroidery and Screen Print,20182519,20182519,9/08/2018,2018-08-09 00:00:00
51331292,100.0,100.0,aftership,0.9565827250480652,Aftership,AFTERSHIP-1533675188705000,AFTERSHIP-1533675188705000,2018/08/23,2018-08-23 00:00:00
52122584,251.47,251.47,bic graphic,0.9660077691078186,Bic Graphic,5391068,5391068,,2018-08-08 00:00:00
52775719,50.0,50.0,stamps,0.9846370816230774,Stamps.com,,180823,8/13/2018,2018-08-13 00:00:00
51586107,195.0,195.0,redleaf engravers,0.9913796782493592,Redleaf Engravers,11762,11762,08/07/2018,2018-08-07 00:00:00
50310763,440.0,440.0,exceptional glass,0.9968997836112976,Exceptional Glass,1704,1704,05/29/2018,2018-05-29 00:00:00
50396422,67.99,67.99,paypal,0.99568510055542,Paypal,,,22/7/2018,2018-07-22 00:00:00
51442363,99.0,99.0,vertical axion,0.8289145231246948,Vertical Axion,28484,28484,"august 31, 2017",2017-07-31 00:00:00
53113092,229.2,229.2,crescent creamery,0.937427818775177,"Crescent Creamery, Inc.",0000277333,0000277333,03/10/2016,2016-10-03 00:00:00
50836117,1473.41,1473.41,fengos,0.627662718296051,Fasken,1185201,,8/1/2018,2018-08-01 00:00:00
51757901,192.1,192.1,michael goencz photography,0.9930683374404908,Michael Goencz,1034,1034,09-08-2018,2018-08-14 00:00:00
52345743,277.5,277.5,d&l nyc,0.8017863035202026,Supporting Strategies,,,2018-08-13,2018-08-13 00:00:00
52497990,15.0,15.0,storelocatorwidgets,0.9195377826690674,Store Locator Widgets,111385,111385,07/17/2018,2018-07-17 00:00:00
52675528,750.0,992.61,sococo,0.8223207592964172,Sococo,,,8/8/2018,2018-08-08 00:00:00
51471645,2967.15,2967.15,american burger - smithtown,0.9318888187408448,American Burger - Smithtown,,,8/9/2018,2018-08-10 00:00:00
52181570,,476.39,,,Globe,,1488709,18/07/31,2018-07-18 00:00:00
51232713,211.72,211.72,facebook,0.9643206596374512,Facebook,,,25 nov 2017,2017-11-25 00:00:00
51577138,,335.86,british airways,0.9382323622703552,British Airways (Eng),,O9DNDY,21 august 2018,2018-08-21 00:00:00
50986618,640.0,640.0,sector nine distribution,0.9250450134277344,Sector Nine Distribution,10615,10615,24/08/2018,2018-08-24 00:00:00
50835179,,50.27,fengos,0.8039786219596863,BBK,15917,15917,7/31/2018,2018-07-31 00:00:00
50864327,,4.9,google,0.907738983631134,Google,3481197919,3481197919,8/14/2018,2018-08-14 00:00:00
50423126,104.95,104.95,giftcards,0.97597473859787,GiftCards.com,6646991,6646991,08/21/2018,2018-08-21 00:00:00
51150621,34.58,34.58,leavainbakery@gmail,0.8752002120018005,Bread & Cake Production,00333333,00333333,,2018-07-30 00:00:00
52365214,300.13,300.13,savour and grace,0.995123028755188,Savour and Grace,116374,116374,08/27/2018,2018-08-27 00:00:00
52095417,7507.37,0.0,driverseat,0.9206382632255554,PAYROLL REPORTS,,GL 17AUG2018,08/03/2018,2018-08-03 00:00:00
53067189,1199.85,1199.85,bix produce,0.9924034476280212,Bix Produce,,,,2018-07-20 00:00:00
51583834,1242.86,1242.86,wex,0.6163344979286194,Wex universal,,ACH081018,5/31/2018,2018-05-31 00:00:00
52650716,3617.6,3617.6,,,Michael  Saint-Aubin,,082218,2018/08/15,2018-08-15 00:00:00
53091371,262.9,262.9,handy industries,0.8659116625785828,Handyform,129987,129987,07/15/2018,2018-07-15 00:00:00
51644836,7.7,7.7,fiverr,0.965971291065216,Fiverr,,11Aug18,29/07/2018,2018-07-29 00:00:00
51894594,8560.0,8560.0,texas lone star,0.9273720979690552,Texas Lone Star Auto Auction,,P332640,08/21/2018,2018-08-21 00:00:00
52582042,347.89,347.89,better books bookkeeping,0.990594208240509,Better Books Bookkeeping,8468,8468,27 apr 2018,2018-04-27 00:00:00
51990867,168.8,168.8,dari farms ice cream,0.9067694544792176,Dari Farms Ice Cream Distributors,4620241,4620241,"tuesday, august 7, 2018",2018-08-07 00:00:00
51757238,2908.68,2908.68,franchise tax board,0.7392684817314148,State of California Franchise Tax Board,,,13/08/2018,2018-08-13 00:00:00
53060204,61.53,61.53,upwork,0.8885000348091125,upwork,196178732,,08/08/2018,2018-08-08 00:00:00
51819260,94.9,94.9,,,Rentshop,,,6/30/2018,2018-06-30 00:00:00
51018941,2382.09,2382.09,seai.y,0.5495083928108215,TD Canada Trust,,,,2018-07-25 00:00:00
51245454,18.0,18.0,toolstation,0.8485956788063049,Toolstation,OWW940304969,OWW940304969,02/08/2018,2018-08-02 00:00:00
52659636,17.78,17.78,amazon,0.9552047848701476,Amazon,114-0720117-5943438,114-0720117-5943438,"wed, aug 1, 2018",2018-08-01 00:00:00
50839480,51.15,51.15,coastal office national,0.9049614071846008,Coastal Office National,2041852,2041852,"august 01, 2018",2018-08-01 00:00:00
50570856,980.25,980.25,kev's powder coating & sandblasting,0.8886651992797852,Kev's Powder Coating,00016094,00016094,sep 29/17,2017-09-29 00:00:00
52523154,2825.0,2825.0,2357401 ontario,0.9555365443229676,2357401 Ontario Inc.,,PC-08.15.18,8/6/18,2018-08-06 00:00:00
52627877,,595.0,thisopenspace,0.9316992163658142,thisopenspace,2507,2507,"friday, august 3, 2018",2018-08-03 00:00:00
52430775,90.0,90.0,le'bcanc's cajun boudin & food co,0.895279586315155,LeBlanc's,210064,210064,31/07/2018,2018-07-31 00:00:00
50982997,88.91,88.91,office supply co,0.9934136867523192,Office Supply Co,2015-2,2015-2Supplies,"july 5, 2018",2018-07-05 00:00:00
51822447,1131.9,1131.9,whistler blackcomb,0.9316351413726808,Whistler Blackcomb Mountain Resorts,34120,,"31 july, 2018",2018-07-31 00:00:00
50501767,3867.77,3867.77,iss,0.9961881041526794,Iss,114326,114326,08/19/2018,2018-08-19 00:00:00
50345856,678.46,678.46,bug order,0.9957600831985474,Bug Order,719333,719333,"aug 01, 2018",2018-08-01 00:00:00
51602838,2583.47,2583.47,oeb breakfast co,0.9634220004081726,Oeb Breakfast Co,OEB003-FY2018P13-3,OEB003-FY2018P13-3,13/06/2018,2018-06-13 00:00:00
52739935,26.43,26.43,total workwear,0.9235806465148926,Total Workwear,76303,58880,07/24/18,2018-07-24 00:00:00
52595594,1075.0,1075.0,rory mccracken,0.988127052783966,Rory McCracken,0000534,,21 aug 2018,2018-08-21 00:00:00
52966220,5000.0,1000.0,buche & associates,0.7662415504455566,Buche & Associates,,,"may 11, 2018",2018-05-11 00:00:00
52624910,135.0,135.0,,,Daylight Electric Electrical Contractor,71771,71771,2018-03-28,2018-03-28 00:00:00
50241548,791.0,791.0,custom glass installations,0.9721713662147522,Custom Glass,3001,3001,07/31/2018,2018-07-31 00:00:00
50270688,533359.99,533359.99,top notch cabinets,0.9834234714508056,Top Notch Cabinets,2899,2899,19/08/2018,2018-08-19 00:00:00
51114658,862.01,862.01,facebook,0.9776562452316284,Facebook,1691916784252768-3498470,,17 august 2018,2018-08-17 00:00:00
52979964,750.0,750.0,mr & mrs smith americas,0.8579018712043762,Mr & Mrs Smith Americas,NASA18204,NASA18204,06/30/2018,2018-06-30 00:00:00
50630230,595.6,595.6,atd cleaning services,0.6110358238220215,Atd Cleaning Services,3319,3319,2018-05-25,2018-05-25 00:00:00
51024144,403.67,403.67,reece australia,0.8435265421867371,Reece Australia,286706066,,"jul 27th, 2018",2018-07-27 00:00:00
50672097,16.8,16.8,invoco,0.9365128874778748,Invoco Telecom,151814,151814,15/08/2018,2018-08-15 00:00:00
53084125,25.0,25.0,cobb connectors,0.8907062411308289,Cobb Connectors,8H593166RR075472C,,,2018-08-21 00:00:00
52641948,1938.33,1938.33,fortisbc,0.9918269515037536,Fortis BC,,1462385-08/21,7-aug-18,2018-08-07 00:00:00
51302993,250.0,250.0,charlotte ottawa,0.9152694940567015,Jordan David,015,015,11,2018-06-28 00:00:00
51127403,14.55,14.55,uber,0.9878624081611632,Uber,,,"aug 01, 2018",2018-08-01 00:00:00
51962957,428.18,428.18,huntheat,0.9003597497940063,Hunt Heating,217361,217361,8/6/18,2018-08-06 00:00:00
52772937,1128.75,564.38,quickbooks,0.6512137055397034,Quickbooks Payments,1095,1095,july 2018,2018-08-01 00:00:00
50669060,30.0,30.0,lasco,0.9826952815055848,Lasco Corp,3896,3896,"tue, aug 21 2018",2018-08-21 00:00:00
51788933,656.7,656.7,capital finishing,0.9944858551025392,Capital Finishing,9831,9831,7/31/2018,2018-07-31 00:00:00
52963323,1650.0,1650.0,dinebari c. tony-enwin,0.9740079641342164,Dinebari C. Tony-Enwin,24082018,24082018,,2018-08-05 00:00:00
52839651,12.05,12.05,,,Emco Corporation,34141970-00,34141970-00,08/21/18,2018-08-21 00:00:00
52730590,,101.7,,,Keystone,,OT527737,07/10/18,2018-07-10 00:00:00
50582131,1788.6,1788.6,tasman,0.6547959446907043,Tasman Group,164636,164636 Bottle Shop MK to review,08/05/2018,2018-08-05 00:00:00
52370841,54.85,54.85,carter bros. fruit & veg,0.9617767333984376,Nathan Tait,0090004931,0090004931,"thursday, august 02, 2018",2018-08-02 00:00:00
51323928,49.9,111.05,henry schein,0.8394705653190613,Henry Schein_STAT,00953523-01,00953523-01,,2018-06-08 00:00:00
52707181,38.42,38.42,mccrayoptical,0.9489362239837646,MCCRAY OPTICAL SUPPLY INC,0001106403,0001106403,"monday, august 27, 2018",2018-08-27 00:00:00
50315364,2933.43,2933.43,raine&horne commercial gold coast,0.8827679753303528,Raine&horne Commercial Gold Coast,884/000003793,884/000003793,6/7/2018,2018-06-07 00:00:00
52474304,4517.96,4517.96,h squared racing,0.9805525541305542,H Squared Racing,939,939,"may 18, 2018",2018-05-18 00:00:00
51903939,2800.0,3148.26,peter harris,0.9876331686973572,Peter Harris (GBP),11175,Jul - 18,"aug 01, 2018",2018-08-01 00:00:00
51272379,143.5,143.5,cristina gonzales,0.9675498008728028,Cristina Gonzales,017,017,2018-06-29,2018-06-29 00:00:00
50136938,288.0,288.73,bell,0.6730564832687378,Graybar Canada,3730180-00,3730180-00,07-08-2018,2018-07-08 00:00:00
52712000,375.38,375.38,arrow electronics,0.9994487762451172,Arrow Electronics,WSI0139001-90,WSI0139001-90,31/07/2018,2018-07-31 00:00:00
51421368,778.54,582.75,actewagl,0.9648796319961548,Actew agl,,,"monday, august 20, 2018",2018-08-20 00:00:00
52138680,132.35,132.35,prairie dog brewing,0.8927826285362244,Alberta Gaming & Liquor Commission,E-1004,Prairie Dog E-1004,05/23/17,2017-05-23 00:00:00
51305284,,2969.27,sysco,0.9861453175544742,Sysco,9474345,9474345,02/01/2016,2016-02-01 00:00:00
50765563,1826.72,913.36,waste connections of canada,0.9930111765861512,Waste Connections Of Canada,7140-0000770796,7140-0000770796,18-jul-2018,2018-07-18 00:00:00
51133417,672.99,672.99,the home depot,0.9014748334884644,Home Depot,,,"august 18, 2018",2018-08-18 00:00:00
51234098,,504.0,screen craft industries,0.9263326525688172,Screen Craft (Customer),VP2948,,02 august 2018,2018-08-02 00:00:00
52020034,227.41,227.41,allied properties,0.8777956962585449,Allied,110910,110910,02 may 2018,2018-05-02 00:00:00
52590020,3200.0,3200.0,ariba,0.6599161028862,Bloomberg,,,19 jul 2018,2018-07-19 00:00:00
53033499,5502.3,5502.3,,,fifth third bank,,,"july 13, 2018",2018-07-13 00:00:00
51257323,8.14,8.14,cylinder,0.6756472587585449,Vern Lewis Welding Supply Inc,RI18070687,RI18070687,16/08/2018,2018-08-16 00:00:00
52574545,238.87,238.87,quadbikeswales.co.uk,0.9286856651306152,quad bikes wales,3386010,,"aug 17, 2018",2018-08-17 00:00:00
51251519,6.14,6.14,rexel electrical supplies,0.8984950184822083,Rexel Electrical Supplies,7830231,Inv 7830231,9/08/18,2018-08-09 00:00:00
50889879,165.24,165.24,amazon,0.9987733364105223,Amazon,701-0379051-5527468,701-0379051-5527468,"august 15, 2018",2018-08-15 00:00:00
51800119,39.33,39.33,confirmed paint sprayers unlimited,0.8099237680435181,Paint Sprayers Unlimited,11653,11653,13/08/2018,2018-08-13 00:00:00
51803514,103.04,103.04,fido,0.9937705397605896,fido,1916306660,1916306660,,2018-08-16 00:00:00
51809892,62.5,62.5,concordia publishing house,0.9162502884864808,CONCORDIA PUBLISHING,INV0005091705,,2/17/2017,2017-02-17 00:00:00
53038294,743.02,743.02,yapstone,0.814468264579773,HomeAway,3158569-76,,08/01/2018,2018-08-01 00:00:00
51860617,733.0,733.0,carrier enterprise,0.9927327632904052,Carrier Enterprise,47988878-00,47988878-00,1/08/2018,2018-08-01 00:00:00
52315278,52.48,52.48,email.apple,0.9643352627754213,Apple,214222948187,,06/24/2018,2018-06-24 00:00:00
52197222,71.5,71.5,xero australia,0.9244979023933412,Xero,752053,752053,8/12/2018,2018-08-12 00:00:00
51271274,29.0,29.0,papertrailapp,0.992686927318573,Papertrail,,eknks83g,23/07/2018,2018-07-23 00:00:00
50894572,67.49,67.49,homedepot,0.6150561571121216,Homedepot.ca,89843,,,2018-06-28 00:00:00
50227094,14418.75,14418.75,underground,0.5582278966903687,Underground Cable Systems,GPM000559,,01/07/2018,2018-07-01 00:00:00
51284698,2881.5,2881.5,maryanne noffke design & drafting,0.9246867895126344,MaryAnne Noffke Design & Drafting,1296,1296,"mon, aug 13, 2018",2018-08-13 00:00:00
52406230,,201.76,kkos lawyers,0.958672821521759,KKOS Lawyers,106116,106116,10/08/18,2018-08-10 00:00:00
50965095,3991.89,3991.89,fisher scientific,0.978689670562744,Fisher Scientific,,,,2018-08-13 00:00:00
52488171,146.12,146.12,restaurant depot,0.9939835667610168,Restaurant Depot,,813456,"jul 31, 2018",2018-07-31 00:00:00
50195654,22.53,22.53,lyft ride,0.8177191019058228,Lyft Ride,,29072018,"mon, jul 30, 2018",2018-07-30 00:00:00
51778619,404.0,404.0,discover charlottetown,0.5840479731559753,JoDee Samuelson,,Projections-01,july 3,2018-07-03 00:00:00
52318878,2016.28,66.0,carecredit,0.8431935310363771,Care Credit,,,"thu, aug 23, 2018",2018-08-23 00:00:00
52421401,205.83,205.83,leftfieldcidercompany,0.5171173810958862,Left Field Cider Company,,12388,08/06/2018,2018-08-06 00:00:00
51270982,124.36,124.36,godaddy,0.9906075596809388,"Godaddy.com, Llc",1349630301,1349630301,,2018-08-16 00:00:00
52083066,32.23,32.23,arthur david f w,0.7050358057022095,Arthur David,,,05-aug-2018,2018-08-05 00:00:00
50952257,790.25,790.25,southeastwater,0.9933934807777404,South East Water,18119465,,03/07/2016,2016-03-07 00:00:00
52419052,6250.0,6250.0,crane productions,0.9286211133003236,Crane Productions,2018000S3-057,2018000S3-057,07/25/2018,2018-07-25 00:00:00
50666079,220.6,220.6,seela's paint & wallpaper,0.9685527086257936,Seela's Paint & Wallpaper Co,05042134,05042134,08 august 2018,2018-08-08 00:00:00
51388995,304.87,152.5,bell,0.935047686100006,Bell Canada Internet,,July'18,"saturday, august 4, 2018",2018-08-04 00:00:00
52713743,249.46,249.46,hilti,0.9016467332839966,Hilti,1685372162,1685372162,"tuesday, july 3, 2018",2018-07-03 00:00:00
51929641,339.18,339.18,emailff.att-mail,0.8549084067344666,Venmo,,,08/01/2018,2018-08-01 00:00:00
51770277,259.9,259.9,bellnet,0.984573483467102,Foil Impressions,4355,4355,08/11/18,2018-08-11 00:00:00
51584573,8.0,8.0,wifi.southwest,0.7474379539489746,Southwest Airlines,,,"august 15, 2018",2018-08-15 00:00:00
52507038,236.27,236.27,city of lakeland,0.945401668548584,City of Lakeland,,,08/04/2018,2018-08-04 00:00:00
50877998,364.43,364.43,gemtec consulting engineers canada,0.8539011478424072,Gemtec Consulting Engineers and Scientists,6368602-2,,06/29/18,2018-06-29 00:00:00
52263485,131.93,131.93,kaba,0.8350237607955933,Kaba IIco Corp,2084568,2084568,"tue, aug 7, 2018",2018-08-07 00:00:00
52039291,17058.52,17058.52,e*trade bank,0.9141693115234376,E.trade bank,,,08/10/2018,2018-08-08 00:00:00
52571292,386.69,386.69,bowens,0.9543233513832092,Bowens,14719643,14719643,22-aug-18,2018-08-22 00:00:00
51354923,30.0,30.0,security transfer australia,0.7411280870437622,Delinquent,INV-0331,INV-0331,"august 10, 2018",2018-08-10 00:00:00
50907563,255.94,255.94,wolf x machina,0.7642392516136169,Wolf X Machina,CL0000014,CL0000014,,2018-08-23 00:00:00
51835924,1141.25,1141.25,z studio,0.7701892256736755,Ze-Studio.com,443,443,31/07/18,2018-07-31 00:00:00
52716146,1060.4,1060.4,ram-tool,0.8089754581451416,Ram Tool,94665574,94665574,"mon, aug 6, 2018",2018-08-06 00:00:00
53112443,115.51,115.51,uline,0.9989981651306152,Uline,100651467,100651467,12-08-2018,2018-08-12 00:00:00
52727748,240.0,240.0,queuesolutions,0.9996792674064636,Queue solutions,1808206,1808206,14 jun 2018,2018-06-14 00:00:00
51757372,75.84,75.84,bunnings,0.9850443601608276,Bunnings,6400/01559980,6400/01559980,20/07/18,2018-07-20 00:00:00
52823321,686.81,686.81,agropur cooperative natrel division,0.7805094718933105,Agropur Cooperative Natrel Division,W1519171,W1519171,16/8/2018,2018-08-16 00:00:00
51262085,4489.26,4489.26,boston scientific,0.9916730523109436,Boston Scientific,961830161,961830161,"august 24, 2018",2018-08-24 00:00:00
52101145,158.17,158.17,,,Maritime Auto Supply,373066,1-373066,1/08/2018,2018-01-08 00:00:00
51207871,4.0,4.0,paybyphone,0.927380919456482,PayByPhone,384462838,,23/08/2018,2018-08-23 00:00:00
51114621,906.97,906.97,facebook,0.983822762966156,Facebook,1541550079289433-3395440,,10/08/2018,2018-08-10 00:00:00
51285699,54.8,54.8,walmart,0.969516932964325,Walmart,,,"jul 31, 2018",2018-07-31 00:00:00
52354928,333.88,333.88,bombora supplies,0.73569655418396,Bombora Supplies,507431,507431,07/30/2018,2018-07-30 00:00:00
51157199,877.25,877.25,lindemann workplace partners,0.9869318008422852,Lindemann workplace partners,1070,1070,,2018-08-21 00:00:00
51793968,1.46,1.46,email.apple,0.9609018564224244,Apple,147142192929,,30/11/2017,2017-11-30 00:00:00
51106019,,3.27,formstack,0.5634178519248962,Formstack Mileage,,,2018-07-31,2018-07-31 00:00:00
53033579,,36.73,oziellaw,0.7932815551757812,Oziel Law,1258,1258,"thu, aug 9, 2018",2018-08-09 00:00:00
50603113,397.48,397.48,allied administrators,0.8971018195152283,Allied Administrators,01761-01624,,08/01/2018,2018-08-01 00:00:00
52995621,288.44,288.44,embassysuites,0.7333710789680481,Embassy Suites,,,"august 21, 2018",2018-08-21 00:00:00
52125382,699.3,699.3,dayton boots (shopify,0.7302029132843018,Dayton Boots,19344556134,,07/02/2018,2018-07-02 00:00:00
52349041,18.86,18.86,facebook ads,0.8737754821777344,Facebook,,QDVKWDWDA2,01-aug-2018,2018-08-01 00:00:00
51723130,,0.0,icaew,0.6243276596069336,ICAEW Events,181265,181265,2/08/2018,2018-08-02 00:00:00
51232627,110.0,110.0,wholesale car parts plus,0.7577678561210632,BCAS,152423,152423,"august 25, 2018",2018-08-25 00:00:00
51844467,,23479.55,express authority,0.6632648110389711,Elantis premium Funding,,,8/3/2018,2018-08-03 00:00:00
51125225,195.0,195.0,mindbodyonline,0.9997856020927428,MindBody,INV02868212,INV02868212,"august 1, 2018",2018-08-01 00:00:00
52911359,3060.0,3060.0,tahoe institute for natural science,0.8779529929161072,Tahoe Institute for Natural Science,313,313,,2018-05-13 00:00:00
52377030,184.86,184.86,city electrical factors,0.70903080701828,CEF,BIS/159145,BIS/159145,05/31/18,2018-05-31 00:00:00
50647439,187.96,187.96,paypal,0.9957365393638612,Paypal,,,21-aug-2018,2018-08-21 00:00:00
50775467,16370.32,17177.9,chase,0.6109448671340942,J.P. Morgan,SCR1041676,,"wednesday, august 15, 2018",2018-08-15 00:00:00
51224713,750.0,750.0,engageonline,0.9265899062156676,EngageOnline,RSZHWCAVWLXBTLGW,RSZHWCAVWLXBTLGW,"march 29, 2018",2018-03-26 00:00:00
52348220,5.0,0.05,metcash food & grocery,0.9197073578834534,Metcash,73875,73875,,2014-01-17 00:00:00
52672658,15.94,15.94,chapters,0.9896974563598632,Chapters LLC,03197G,,3/08/2018,2018-08-03 00:00:00
51735651,-34.99,-34.99,receivable-ambiance radio,0.9942425489425659,Ambiance Radio,1842804,1842804,8/2/2018,2018-08-02 00:00:00
52702112,33.92,33.92,sherwin williams,0.9989795684814452,Sherwin-Williams (Invoices),6312-2,6312-2,16/07/18,2018-07-16 00:00:00
52596094,102.24,102.24,worldwide,0.9405600428581238,Startrack,6741501,,1 aug 2018,2018-08-01 00:00:00
52479540,117.95,87.0,media crafters productions,0.8085499405860901,Media Crafters Productions,,,,2018-07-04 00:00:00
50200667,13.7,13.7,pfd food services,0.986223578453064,PFD Food Services Pty Ltd,KL464747,KL464747,07/20/2018,2018-07-20 00:00:00
52772919,785.0,785.0,supportingstrategies,0.9616807103157043,Supporting Strategies,2152,2152,08-16-2018,2018-08-16 00:00:00
50229505,332.84,332.84,deckers,0.8582273125648499,Deckers,9681332,9681332,8/03/2018,2018-08-03 00:00:00
51268876,2785.85,2785.85,all-fab,0.7286115288734436,Olympic Building Centre,235716,235716,"fri, jul 27, 2018",2018-07-27 00:00:00
52378068,1511.84,1511.84,pfizer australia,0.988150715827942,Pfizer Australia Pty Ltd,6807062737PF,6807062737PF,"mon, aug 6, 2018",2018-08-06 00:00:00
52378848,16046.0,16046.0,tdl group,0.9543368220329284,TDL Group 0659,7050295463,7050295463,july 6/18,2018-07-06 00:00:00
52768577,,152.1,johnstone supply,0.9783095717430116,Johnstone Supply,189946,189946,jul-18,2018-07-18 00:00:00
51381960,231.59,231.59,the home depot,0.9689987897872924,Home Depot,,71740216200040820180451,10/27/1,2017-10-27 00:00:00
51920845,64.05,64.05,miller's professional imaging,0.9462034106254578,Miller's Professional Imaging,Z826013,Z826013,08/06/2018,2018-08-06 00:00:00
51840704,250.0,250.0,wilson accounting and tax services,0.966278612613678,WATS CPA,1209,1209,,2018-05-24 00:00:00
50265606,310.0,310.0,rockwell collins,0.9706916809082032,Rockwell Collins,SO629,,07/20/2018,2018-07-20 00:00:00
51678389,0.02,0.02,facebook,0.9609972238540648,Facebook Ads,K6HRZGSRU2,,jul-18,2018-07-31 00:00:00
52419427,170.57,170.57,the home depot,0.9670233130455016,THE HOME DEPOT,,70560000797720,"mar. 09, 2017",2017-03-09 00:00:00
50271115,880.0,880.0,jim dalton,0.9581550359725952,Jim Dalton,,,07/30/2018,2018-07-30 00:00:00
50345861,767.17,767.17,bug order,0.9953353404998779,Bug Order,719567,719567,2018-08-09,2018-08-09 00:00:00
51565198,144.49,144.49,coles supermarkets,0.6465187668800354,COLES,1911,1911,"thursday, august 09, 2018",2018-08-09 00:00:00
50205803,-113.0,-113.0,hubdoc,0.9997904896736144,Hubdoc,106089,106089,,2018-07-03 00:00:00
51786898,511.88,511.88,friendly bookkeeping services,0.9941806793212892,Friendly Bookkeeping Services (8123101 Canada Ltd.),1319,1319,"january 31, 2018",2018-01-31 00:00:00
53023630,2640.0,2640.0,rightbrain networks,0.9962639808654784,RightBrain Networks,12196,12196,05/08/2018,2018-08-05 00:00:00
51127918,134.0,134.75,s.h. dayton,0.8593917489051819,65 Oilfield Services,,P49983,22/11/2017,2017-11-22 00:00:00
52208016,186.45,186.45,2837790 canada,0.7238157391548157,2837790 Canada Inc.,167133,167133,08/14/2018,2018-08-14 00:00:00
52841712,414.0,414.0,checkpoint learning,0.9111850261688232,Checkpoint Learning,,09-CPL-17108127,"august 02, 2018",2018-08-02 00:00:00
51635449,1363.69,1363.69,wild bites enterprises,0.987545609474182,Wild Bites Enterprises Ltd,3827,3827,"august 8, 2018",2018-08-08 00:00:00
52126274,207.75,207.75,seela's paint & wallpaper,0.967555820941925,Seela's Paint & Wallpaper Co,05043184,05043184,08/11/18,2018-08-17 00:00:00
52134333,259.55,259.55,chase,0.9482305645942688,Chase_1621,,,8/10/2018,2018-08-10 00:00:00
52757425,2722.5,2722.5,yellco ag,0.9769266843795776,Yellco Ag Pty Ltd,IV00001507,1507,"august 13, 2018",2018-08-13 00:00:00
51009581,697.37,697.37,cranston market dental,0.6571897268295288,Aug Deposit Slip,,,,2018-08-01 00:00:00
52824931,35.0,35.0,hart engineering,0.7309852242469788,Hart Engineering,,,08/22/2018,2018-08-22 00:00:00
52961821,12.5,12.5,amazon,0.9964265823364258,Amazon,113-4901475-3964225,113-4901475-3964225,26/07/2018,2018-07-26 00:00:00
50870409,,56.5,coui{saing,0.5809283256530762,The Counselling Place,,,8/15/2018,2018-08-15 00:00:00
51481092,524.16,524.16,highwaytwo,0.9968406558036804,Highway Two,10465059,10465059,"wednesday, august 1, 2018",2018-08-01 00:00:00
52591404,77.52,77.52,kenco label & tag co,0.9939640760421752,"Kenco Label & Tag Co., Llc",0358629,0358629,03/08/2018,2018-08-03 00:00:00
51395072,1336.78,1336.78,united natural foods,0.7332721948623657,Unfi,,,08/08/2018,2018-08-08 00:00:00
50324160,161.46,161.46,brownes foods,0.8501613736152649,Brownes,14391768,14391768,31/07/2018,2018-07-31 00:00:00
51678804,175.2,175.2,vin,0.5794717073440552,Veterinary Information Network,,,,2018-08-11 00:00:00
52331286,650.0,60.0,local tortilla,0.9927738904953004,Local Tortilla,20623,20623,8/7/2018,2018-08-07 00:00:00
51660736,12.0,12.0,samsara networks,0.9936120510101318,Samsara Networks,EFB3494-0003,,7/5/2018,2018-07-05 00:00:00
50147803,,2783.9,us foods,0.9991111159324646,U.S Foods,1115404,1115404,"january 25, 2018",2018-01-25 00:00:00
51319169,135.21,135.21,bluecrew,0.9850050210952759,"BlueCrew, Inc.",7792,7792,8/21/2018,2018-08-21 00:00:00
50560050,1746.4,1746.4,mileiq,0.9542303681373596,MileIq,,,"sat, aug 4, 2018",2018-08-04 00:00:00
51345861,20.0,20.0,rocycling,0.5241680145263672,Wingfield,,,08 august 18,2018-08-08 00:00:00
50804198,44.95,44.95,clover support,0.7875176072120667,Clover,,,08/17/2018,2018-08-17 00:00:00
51788124,444.76,408.04,the home depot,0.9560155272483826,The Home Depot,H6616-68564,H6616-68564,07/13/2018,2018-07-13 00:00:00
51888029,6124.97,2833.9,,,Triangle West,,,"thu, aug 9, 2018",2018-08-09 00:00:00
53019357,360.39,360.39,american airlines,0.8817142844200134,American Airlines,,,"tuesday, august 14, 2018",2018-08-14 00:00:00
50246067,340.45,340.45,the home depot,0.8050259351730347,the home depot,,,,2018-08-22 00:00:00
52538192,1.75,1.75,honkmobile,0.9774383306503296,HonkMobile,DBWTRKJP,dbwtrkjp,8/21/2018,2018-08-21 00:00:00
50972705,5830.5,5830.5,vbarbuzzi landscaping,0.974838137626648,Barbuzzi Landscaping,18380803,18380803,08/03/2018,2018-08-03 00:00:00
51340582,643.5,643.5,ideal electrical suppliers,0.9609034061431884,Ideal Electrical Suppliers,13273092,13273092,04/12/17,2017-12-04 00:00:00
51350089,900.0,900.0,j s lawrence,0.98268461227417,J S Lawrence,,,07-31-2018,2018-07-31 00:00:00
52359699,10.0,10.0,goa alberta land titles spatial information system,0.9435783624649048,GOA Alberta Land Titles Spatial Information System,35721795,,2018-05-01,2018-05-01 00:00:00
52959602,31.68,31.68,uber,0.9935426712036132,Uber,,,"wednesday, january 4, 2017",2017-01-04 00:00:00
50897756,587.3,587.3,dhm2m,0.8855175971984863,DHWS,INV966,INV966,01/15/18,2018-01-15 00:00:00
51014430,350.0,350.0,david lee,0.7272039651870728,Its Over Time,,,19 july 2018,2018-07-19 00:00:00
52370755,581.84,110.22,actrol parts,0.9665918946266174,Actrol Maroochydore,268025069,268025069,"august 19, 2018",2018-08-19 00:00:00
50842350,46.95,46.95,theconsole,0.9942200183868408,netregistry,11818327,11818327,08/19/18,2018-08-19 00:00:00
51803863,37.85,37.85,amazon,0.9980557560920716,Amazon Fresh,,,18/05/2018,2018-05-18 00:00:00
50993108,21.34,21.34,microsoft store,0.7940835952758789,Microsoft,,,"thursday, august 16, 2018",2018-08-16 00:00:00
52744235,1258.01,1258.01,gray designs,0.9914512634277344,Gray Designs,1974,1974,"mon, jul 30, 2018",2018-07-30 00:00:00
52934467,190.0,190.0,later,0.9819517135620116,Later,7B94FC8-0001,7B94FC8-0001,8/16/18,2018-08-16 00:00:00
51988004,311.88,311.88,sterling talent solutions,0.9481769800186156,Sterling Talent Solutions,7528879,7528879,08/27/2018,2018-08-13 00:00:00
52993182,179.7,179.7,wiley,0.7345603108406067,Wiley,8797822,8797822,07/23/2018,2018-07-23 00:00:00
51411619,156.26,156.26,amazon,0.9932023882865906,Amazon.com,113-5265855-6013069,,8/15/2018,2018-08-15 00:00:00
52252145,9.36,9.36,saint frank coffee,0.9927016496658324,Saint Frank Coffee,,,08/06/2018,2018-08-06 00:00:00
52215961,42.61,42.61,canadian,0.7017399072647095,Canadian Springs,9926196624,9926196624,08/01/2018,2018-08-01 00:00:00
50761051,54.0,54.0,expensify,0.9532467722892758,Expensify,,,,2018-08-09 00:00:00
50655951,65.45,65.45,milestone chemicals,0.7647920846939087,Milestone Chemicals Australia Pty Ltd,684999,684999,8/03/18,2018-08-03 00:00:00
51372062,10.0,14.18,stamps,0.9804182052612304,Stamps,,,"jul . 28, 2017",2017-07-28 00:00:00
52780987,46.69,46.69,woolworthsrewards,0.5294522643089294,Woolworths Petrol,,,30/07/2018,2018-07-30 00:00:00
53071224,52.5,52.5,freshbooks,0.979383945465088,Fresh books,201136957,201136957,07/31/2018,2018-07-31 00:00:00
50460035,1105.51,1105.51,slegg building materials,0.8718888759613037,Slegg Building Materials,IN1836759,IN1836759,"monday, august 6, 2018",2018-08-06 00:00:00
51338012,24.97,24.97,winzip,0.7901832461357117,Winzip,AKD-73652498266,AKD-73652498266,8/07/18,2018-08-07 00:00:00
51647977,419.95,419.95,adobe creative cloud,0.9437500238418579,Adobe Creative Cloud,,AD008928370,jan 16,2018-08-22 00:00:00
50930001,,5887.71,general,0.6265239715576172,General Stationery Supplies,,,"thu, aug 9, 2018",2018-08-09 00:00:00
51599979,342.0,342.0,nikita ovsyannikov,0.7829546928405762,Nikita Ovsyannikov,102018,10-2018,,2017-12-31 00:00:00
51546233,495.0,495.0,change gps,0.989412009716034,Change GPS,INV-10368,INV-10368,"fri, aug 3, 2018",2018-08-03 00:00:00
50190132,265.65,265.65,corinthian ind,0.9346514940261841,Corinthian Industries,514346,514346,,2018-07-31 00:00:00
50501179,1252.57,1252.57,barco rent a truck,0.9817034602165222,BARCO RENT A TRUCK,76055I1,76055i1,08/17/2018,2018-08-17 00:00:00
50981690,458.47,458.47,joto paper,0.9912845492362976,Joto Paper Ltd,0000078309,0000078309,"august 24, 2018",2018-08-24 00:00:00
51535739,2463.07,2463.07,kootenay weed control,0.9623308777809144,0782508 Bc Ltd.,1221,1221,8/13/2018,2018-08-13 00:00:00
51901643,5632.0,5632.0,west texas drum co,0.996464192867279,West Texas Drum,45946,45946,02/08/18,2018-08-02 00:00:00
52229410,,117.0,,,Thomson Reuters,,8705573,8/16/18,2018-08-20 00:00:00
50780128,46.2,46.2,,,Sew Shop,149799-801,149799-801,7/26/2018,2018-07-26 00:00:00
51257062,480.5,480.5,sav-on bags,0.7207103967666626,Sav-onbags,55050,55050,08/13/18,2018-08-13 00:00:00
52211845,150.44,183.61,chick-fil-a,0.9697039127349854,Chick-fil-A,,,,2018-07-28 00:00:00
52589394,560.0,560.0,leopard lens photography,0.8782903552055359,Leopard Lens,IV00000002011,IV00000002011,"august 13, 2018",2018-08-13 00:00:00
53063671,1068.25,1068.25,fastsigns,0.8957785367965698,Fast Signs,218-53637,218-53637,8/14/18,2018-08-14 00:00:00
52210301,1100.0,1100.0,marsh fischmann & breyfogle,0.9189406633377076,Marsh Fischmann & Breyfogle,,,"august 1, 2018",2018-08-01 00:00:00
52249103,,1054.28,quince flowers,0.7013053297996521,Daily Sales Report,,,07/31/2018,2018-07-31 00:00:00
53022322,128.06,128.06,sherwin-williams,0.9916951656341552,Sherwin-Williams-Resi,,6847-4 082218,08-09-2018,2018-08-09 00:00:00
52694602,20.51,20.51,mailchimp,0.9879930019378662,Mailchimp,MC06789545,MC06789545,"fri, aug 17, 2018",2018-08-17 00:00:00
52497163,46.7,46.7,manley deboer,0.970659077167511,Manley Deboer,1808-270178,1808-270178,"tuesday, august 21st, 2018",2018-08-21 00:00:00
51186531,3491.7,3491.7,ipg shared services,0.8484815359115601,True North Communications,9900180354,9900180354,"aug 11, 2018",2018-08-11 00:00:00
53093761,164.96,164.96,scansource,0.9982345700263976,Scansource,5403993106,5403993106,08/23/2018,2018-08-23 00:00:00
50930933,214.2,214.2,horizon,0.7344449162483215,horizon,,,10-aug-2018,2018-08-10 00:00:00
50854656,939.67,939.67,the hartford,0.985665798187256,The Hartford,,,07 april 2018,2018-04-07 00:00:00
52959524,42.59,42.59,l&h,0.7655015587806702,L&H Group,4327722,Inv 4327722,19/07/2018,2018-07-19 00:00:00
51595472,15.0,15.0,base,0.6647045016288757,Base,609563,609563,27 july 2018,2018-07-27 00:00:00
50988886,3389.93,3389.93,mbmp,0.9008053541183472,MBMP,10760,10760,02-01-18,2018-02-01 00:00:00
50987606,224.79,224.79,lifebooster,0.8826903700828552,Jukebox Print,,2615812,"august 9, 2018",2018-08-09 00:00:00
51325512,2672.5,2672.5,hunter,0.534593403339386,"A C Control,Inc",,,04/01/14,2014-04-01 00:00:00
50738259,25.1,25.1,bluetie,0.8615965247154236,BlueTie,1808-100021,1808-100021,"fri, aug 24, 2018",2018-08-24 00:00:00
53039747,,24484.13,hyperkin,0.8997693061828613,Hyperkin,SO039045,,23-07-2018,2018-07-23 00:00:00
52280752,2625.0,2625.0,gamomo creative lab,0.9881778359413148,Gamomo Creative Lab Inc.,,007,7/30/2018,2018-07-30 00:00:00
50797009,8001.12,8001.12,emc ideas,0.9887181520462036,"EMC Ideas, Inc.",1029,1029,27/07/18,2018-07-27 00:00:00
53056337,28.15,28.15,carr hardware north adams,0.9193355441093444,Carr's Hardware,605895,605895,04/10/2018,2018-04-10 00:00:00
52281752,315.38,315.38,sequel naturals ulc,0.928393304347992,Vega,SO-SNC-00313105,SO-SNC-00313105,2018-08-03,2018-08-03 00:00:00
51261752,1897.3,1897.3,worldwide express,0.9987767338752748,WORLDWIDE EXPRESS,1807135982,1807135982,07/06/2018,2018-07-06 00:00:00
50788530,2992.5,2992.5,artic truck parts,0.7996845245361328,Artic Truck Parts & Services,4436967,4436967,01-08-18,2018-01-08 00:00:00
53048536,277.3,277.3,etsy,0.9460121393203736,Etsy,1344623470,,"aug 07, 2018",2018-08-07 00:00:00
50262114,170.0,170.0,bank of america,0.6440942287445068,Bank of America,000034,,,2018-08-01 00:00:00
52399631,1479.42,1479.42,sp provisions,0.9904086589813232,SP Provisions,705603,705603,03/08/18,2018-08-03 00:00:00
51952651,,1456.23,first-source,0.9256816506385804,First Source,536655,536655,"march 11, 2018",2018-03-11 00:00:00
52144413,468.95,468.95,sheri cantle,0.997305393218994,Sheri Cantle,745,745,"fri, aug 3, 2018",2018-08-03 00:00:00
52363347,1735.84,1735.84,australian plastic profiles,0.9890812635421752,Australian Plastic Profiles,742672,742672,01/08/2018,2018-08-01 00:00:00
52216530,68.31,68.31,amazon,0.9918296933174132,Amazon,702-5658583-2285812,702-5658583-2285812,,2018-07-31 00:00:00
50266966,401.25,267.5,stikeman elliott,0.8916063904762268,Stikeman Elliot,5629362,5629362,27/08/2018,2018-08-27 00:00:00
50899230,226.35,226.35,google,0.9940308928489684,Google.com,3479848851,3479848851,14 august 2018,2018-08-14 00:00:00
51784690,1198.92,1198.92,the raw office,0.8830472230911255,The Raw Office,,,25 august 2018,2018-08-20 00:00:00
52753290,18.57,18.57,lyft ride,0.8108134865760803,Lyft Ride,1171361152632721750,,3-aug-2018,2018-08-03 00:00:00
50970430,132.28,132.28,arrow electronics,0.9900429844856262,Arrow Electronics,635891,8225973,08/01/2018,2018-08-15 00:00:00
50274895,,16.19,oolintohn ace hard,0.7953001856803894,Downtown Ace Hardware,,,08/04/18,2018-08-04 00:00:00
50989936,1.022656871057246e+20,35.73,air liquide,0.9859634637832642,Air Liquide Canada,68710572,68710572,10/08/2018,2018-08-10 00:00:00
50751840,1356.0,1356.0,structural engineers & managers,0.9238072037696838,Structural Engineers & Managers,23484,23484,08-01-2018,2018-08-01 00:00:00
53014588,930.08,930.08,nancy hummel,0.6569608449935913,"Stevens Business Service, Inc.",85659,85659,10-jul-2018,2018-07-10 00:00:00
52808647,9.45,9.45,whitecap,0.6600316166877747,White Cap Construction Supply,10009270993,10009270993,14/06/2018,2018-06-14 00:00:00
51602936,-19.99,19.99,apex clearing corporation,0.8886348605155945,Stockpile,,,04/04/2014,2014-04-04 00:00:00
51354074,-244.83,244.83,,,EMCO Corporation,82058864-00,82058864-00,"mon, jul 16, 2018",2018-07-16 00:00:00
52802886,261.81,261.81,blockbindings,0.9074427485466005,Entoilages & Biais Block Itee,245627,245627,,2017-11-15 00:00:00
52673799,975.33,975.33,bidfood,0.8442835807800293,Bidfood,I43231604.PAM,I43231604.PAM,18/07/2018,2018-07-18 00:00:00
52262608,8.9,8.9,uber,0.995061993598938,Uber,,081718,"wednesday, august 8, 2018",2018-08-08 00:00:00
52152725,,2000.0,deposit,0.5811182260513306,First County Bank,,,aug 17,2018-08-17 00:00:00
52337135,300.0,300.0,tyson steele associates,0.9762350916862488,Tyson Steele Associates,1294-28789,1294-28789,10/31/2017,2017-10-31 00:00:00
51914407,13.4,13.4,uber,0.996556282043457,Uber,,,11/08/2018,2018-08-11 00:00:00
52682342,1282.18,1410.4,yoe,0.8014464378356934,8831 Yoe Pty Ltd,67706,67706,01 jun 2018,2018-06-01 00:00:00
51246767,3.93,3.93,ideal electrical suppliers,0.8813148140907288,Ideal Electrical Suppliers,20156438,20156438,23-july-2018,2018-07-23 00:00:00
50193976,,725000.0,pinnacle bank,0.9427556991577148,Pinnacle,,,august 24,2018-08-24 00:00:00
52815512,188.02,188.02,sixt,0.6569865942001343,Sixt Rent a Car,,,"july 29, 2018",2018-07-29 00:00:00
51164524,203.23,203.23,foxtel,0.9712013602256776,Foxtel Business,299765764,,31 jul. 2018,2018-07-31 00:00:00
51480784,46.07,46.07,the home depot,0.9798946380615234,The Home Depot,H6329-79009,,8 aug 18,2018-08-08 00:00:00
52117433,1823.0,1823.0,westland,0.7098566293716431,Westland Insurance,12593282,12593282,august-02-18,2018-08-02 00:00:00
53082584,205.95,1948.15,bwillis temby insurance brokers,0.8652879595756531,Willis Temby,134716,134716,"fri, aug 17, 2018",2018-08-17 00:00:00
52377747,970.84,970.84,wholesale vapor,0.91546630859375,Electronic Cigaret NY(Wholesale Vapor ),90239528,90239538,15.08.18,2018-08-15 00:00:00
52451342,300.06,300.06,agl energy,0.7515624165534973,Agl,,,07/07/2018,2018-07-08 00:00:00
52061302,987.9,987.9,ophelia + west events,0.9037880897521972,Ophelia + West Events,1031,1031,8/04/18,2018-08-04 00:00:00
51416014,1118.7,1118.7,bbbs.ltd,0.957888662815094,Beyond Bookkeeping,429,429,07/01/2018,2018-07-01 00:00:00
52179657,1009.95,1009.95,support.stripe,0.8143608570098877,Stripe,,,08/04/2018,2018-08-04 00:00:00
50432566,6.42,6.42,facebook,0.9200798273086548,Facebook,,,07/29/2018,2018-07-29 00:00:00
51261902,218.72,7067.76,mbna,0.9697903990745544,Mbna,,,24/08/18,2018-08-24 00:00:00
52361266,114.0,114.0,intuit,0.7937795519828796,Intuit,,,02/03/2010,2010-02-03 00:00:00
52747496,236.2,236.2,delta air lines,0.9404352903366088,Delta Air Lines,HVJP5W,HVJP5W,"tue, mar 6, 2018",2018-03-06 00:00:00
51308976,448.96,448.96,elliottelectric,0.8884586095809937,Elliottelectric,66-55665-02,66-55665-02,7/31/2018,2018-07-31 00:00:00
52327624,,60.65,evoice,0.9313046932220459,eVoice,615374,615374,22/08/2018,2018-08-16 00:00:00
53017014,56.04,56.04,,,Pyramid Plumbing Supply,3019849,3019849,2018 07 30,2018-07-30 00:00:00
51290529,14.8,14.8,mckesson drug co,0.8282876014709473,McKesson - 897847 RX,7882801658,7882801658,"mon, aug 27, 2018",2018-08-27 00:00:00
50824312,,10534.09,erm power,0.6446224451065063,ERM Business Energy,2372972,2372972,08/16/2018,2018-08-16 00:00:00
50544723,55.39,55.39,ipbc,0.5860434174537659,Kimme Lafayette,,,"mon, aug 13, 2018",2018-08-13 00:00:00
51418177,181.93,181.93,bio-rad laboratories,0.8740166425704956,Bio-rad Laboratories,902957939,902957939,11/4/16,2016-11-04 00:00:00
52991616,89.49,89.49,shaw,0.8695500493049622,Shaw Cable,,,"31-,jul-2018",2018-07-31 00:00:00
51670682,39.97,39.97,cashcowpro,0.9925525784492492,Cashcowpro.com,88F5CB0-0006,88F5CB0-0006,8/14/18,2018-08-14 00:00:00
52530799,310.61,310.61,the home depot,0.9181674718856812,The Home Depot,,,"july 31, 2018",2018-07-31 00:00:00
51257198,3955.0,3955.0,battlefield equipment ontario,0.9153391718864441,Battlefield Equipment,30251734,30251734,19jul18,2018-07-19 00:00:00
51810088,2675.0,2675.0,integrity title company,0.9835494756698608,Integrity Title Company,,,16 jun 2018,2018-06-16 00:00:00
51337568,300.0,300.0,classical tint,0.7299783825874329,Classical Tint,0314,0314,"july 15, 2018",2018-07-15 00:00:00
50970514,103.04,103.04,hampton inn,0.8213703632354736,Hampton,,Mark King,"july 30, 2018",2018-07-30 00:00:00
51866405,8413.42,8413.42,berry global,0.9134611487388612,Berry Global Inc. & Subsidiaries,,340441,31 jul 2018,2018-07-31 00:00:00
50624500,35.2,35.2,harvest,0.9894288182258606,Harvest,H-2D28EF6B5D,H-2D28EF6B5D,07 aug 2018,2018-08-07 00:00:00
52865011,186.12,1861.24,kennedy auto solutions,0.8447566628456116,Repairpal,,,8/24/2018,2018-08-24 00:00:00
51803219,57.56,57.56,alsco,0.990899384021759,Alsco,,1016052,"august 2, 2018",2018-08-02 00:00:00
52288467,58.96,58.96,sonic,0.9796080589294434,"Sonic.net, Inc.",,,8/9/2018,2018-08-09 00:00:00
51219913,1160.74,1160.74,bremick,0.7806907892227173,Bremick pty Ltd,,,"august 6, 2018",2018-08-06 00:00:00
50215638,480.0,480.0,brenda vos,0.87517911195755,Brenda Vos,78,78,1 may 2018,2018-05-01 00:00:00
53103084,882.99,882.99,agropur,0.9184597730636596,AGROPUR,291697,291697,24/07/18,2018-07-24 00:00:00
51993308,7863.56,7863.56,performance foodservice,0.8486205339431763,Performance Foodservice,,,2018-08-11,2018-08-11 00:00:00
51669044,79.35,79.35,touchbistro,0.9972297549247742,Touch Bistro,INV00058626,INV00058626,8/13/18,2018-08-13 00:00:00
52154406,3780.0,3780.0,collin young cpa,0.8930774331092834,Collin Young CPA,2018238,2018238,"tue, jul 31, 2018",2018-07-31 00:00:00
51019127,297.86,297.86,homesense,0.9891711473464966,HomeSense,,,04.08.18,2018-08-04 00:00:00
51998243,2062.71,599.0,berkshire gas,0.843440592288971,Berkshire Gas,,07262018,"august 8, 2018",2018-08-08 00:00:00
52156977,1100.0,1100.0,virtually with you,0.9854212999343872,Virtually With You,000036,000036,2018-04-01,2018-04-01 00:00:00
51990942,399.72,399.72,tru salt,0.6255730390548706,Home2 Suites By Hilton Dallas,,,31/07/2018,2018-01-08 00:00:00
50715828,551.66,551.66,spicers paper,0.9952665567398072,Spicers Paper,1957375,1957375,23/08/2018,2018-08-23 00:00:00
52423011,14333.5,14333.5,adams keegan--ga,0.9238084554672241,adams Keegan--ga,445508,445508,12-08-2018,2018-08-12 00:00:00
51976374,1309.0,1309.0,a-force transport,0.9875503778457642,A-Force Transport,,,08/03/18,2018-08-03 00:00:00
52872234,1332.52,1332.52,ecr4kids,0.9943491220474244,ECR4Kids,743729,743729,"august 3, 2018",2018-08-03 00:00:00
51581924,209.53,205.34,mckesson,0.9642584919929504,McKesson,7886103742,7886103742,29/07/2018,2018-07-29 00:00:00
51469091,61.2,61.2,pollen + grace,0.9915040135383606,Pollen + Grace Limited,INV-7280,INV-7280,08/15/2018,2018-08-15 00:00:00
52838562,52.0,52.0,kitcast,0.9847334027290344,Kitcast,258F4C5-0003,258F4C5-0003,06/28/18,2018-06-28 00:00:00
50361609,148.0,148.0,the cellular connection,0.9996549487113952,The Cellular Connection,IN000000000458787,IN000000000458787,08/01/18,2018-08-01 00:00:00
51488301,20.0,20.0,mypaymentsplus,0.8420263528823853,MyPaymentsPlus,1252548535,,"tuesday, august 14, 2018",2018-08-14 00:00:00
50769982,175.46,175.46,paypal,0.6907473206520081,Paypal,C4752229826618.1,c4752229826618.1,08/24/18,2018-08-24 00:00:00
51023424,329.45,329.45,meter,0.6685011982917786,Rite Technology,AR265633,AR265633,8/21/2018,2018-08-21 00:00:00
52533636,1419.65,1419.65,anipet animal supplies,0.981949746608734,Anipet Animal Supplies,,SI1073101,21 aug 2018,2018-08-21 00:00:00
52064383,244.76,244.76,empower,0.8995814919471741,Empowerict,CW-13147,,22-aug-18,2018-08-22 00:00:00
51165622,56.4,56.4,booking,0.9919901490211488,Booking.com,1528768480,1528768480,08/09/2018,2018-08-09 00:00:00
51470207,12.3,12.3,google,0.9080029129981996,Google Ireland,3484129499,3484129499 The Rag Trader,25 jul 2018,2018-07-25 00:00:00
53062531,16.79,16.79,adobe systems,0.6778648495674133,Adobe Systems Incorporated,ADB038763311,,12/08/2018,2018-08-23 00:00:00
51402227,15.82,15.82,paracel laboratories,0.9964202642440796,Paracel Laboratories Ltd.,1831501,1831501,07/31/2018,2018-08-21 00:00:00
53011099,-3000.0,3000.0,getty images(us,0.9275811314582824,"Getty Images (US), Inc",13281627,13281627,08/10/18,2018-08-10 00:00:00
50925564,-45.08,45.08,culliganwater,0.9310421347618104,Culligan,1700934,02914877,"june 15, 2018",2018-06-15 00:00:00
53038888,48.0,48.0,automotive parts distributors,0.9994266033172609,Automotive Parts Distributors,778038/1,778038/1,2018-07-10,2018-07-10 00:00:00
52577275,30.0,30.0,secure-optus,0.9838552474975586,Optus,,,07/31/2018,2018-07-31 00:00:00
53111849,,1059.87,hilti,0.8268768191337585,Hilti (Canada) Corporation,,,30jul2018,2018-07-30 00:00:00
52841543,34.25,34.25,the home depot,0.9780550003051758,The Home Depot,H4110-66976,H4110-66976,08/10/2018,2018-08-10 00:00:00
51264963,240.45,321.43,reliable permit solutions,0.6628559827804565,Reliable Permit Solutions,235587,235587,"july 31, 2018",2018-07-31 00:00:00
51165335,151.0,151.0,itpros,0.9493003487586976,IT Pros,00012444,00012444,26 - jul - 2018,2018-07-26 00:00:00
52640224,221.0,221.0,lisette normann,0.7777057886123657,Baldwin EMC,,539216-001 8202018,7/08/2018,2018-08-07 00:00:00
51611302,2842.28,2842.28,mile high workshop,0.9902209043502808,Mile High WorkShop,2626,2626,1/30/2018,2018-01-30 00:00:00
50265082,34841.54,34841.54,wms commissions,0.9072972536087036,Watts Marketing Services,,2018.07.27,18aug18,2018-08-18 00:00:00
50845399,48.0,48.0,google,0.8989796042442322,GOOGLE IRELAND LIMITED,3482285677,3482285677,2/08/2018,2018-08-02 00:00:00
51351776,107.72,107.72,remedy drinks uk,0.9769040942192078,Remedy Drinks UK Ltd,SINV0414,SINV0414,"aug 12, 2018",2018-08-12 00:00:00
51160450,408.5,408.5,stoddart,0.9605938196182252,Stoddart,1606282,1606282,8/9/2018,2018-08-09 00:00:00
50264676,298.94,298.94,,,Toronto District School Board,,1645202,6 july 2018,2018-07-06 00:00:00
50885965,,163.85,,,Enmax,,,"sunday, september 9, 2018",2018-09-09 00:00:00
52351161,726.7,726.7,higgins performance automotive,0.9574210643768308,HIGGINS PERFORMANCE AUTOMOTIVE PTY LTD,INV-003252,INV-003252,"may 29, 2018",2018-08-02 00:00:00
51165598,223.61,223.61,nolan group western australia,0.7844396829605103,Nolan Group Western Australia,PSI226029,PSI226029,27-08-18,2018-08-27 00:00:00
51501979,710.0,710.0,kagan trim center,0.706062912940979,Kagan Trim Center,399119-00,399119-00,"december 9, 2017",2017-12-09 00:00:00
52472978,3106.97,350.0,transferwise,0.9138081669807434,Fechner Legal,,43330532,08-13-2018,2018-08-13 00:00:00
52771545,961.22,961.22,terracostosa,0.65379798412323,Tavendale and Partners,014326-5,,"aug 8, 2018",2018-08-08 00:00:00
51538617,1.0,1.0,envato,0.9310572743415833,Envato,IVHF14219924,IVHF14219924,8/22/2018,2018-08-22 00:00:00
50873101,182.32,182.32,the home depot,0.5566351413726807,The Home Depot,,,8 aug 2018,2018-08-08 00:00:00
52159544,180.8,180.8,1489494 ontario,0.9489013552665708,1489494 Ontario,21469,21469,"tue, jul 17, 2018",2018-07-17 00:00:00
51913957,348.0,348.0,design lab mn. design lab mn,0.9659380316734314,Design Lab Mn,1396-0848,,21/05/2018,2018-05-21 00:00:00
52530833,330.36,330.36,the home depot,0.9122357964515686,The Home Depot,,,08/23/2018,2018-08-23 00:00:00
50972670,42.38,42.38,lisa channell bookkeeping services,0.9701614379882812,Lisa Channell Bookkeeping Services,2018-856,2018-856,,2018-08-01 00:00:00
51189301,3611.83,3611.83,asupporting strategies,0.9940288066864014,Supporting Strategies,1572,1572,08/23/18,2018-08-23 00:00:00
50846737,266.64,266.64,mikes fancy cheese co,0.9729121327400208,Mikes Fancy Cheese Co,,,08/17/18,2018-08-17 00:00:00
52655489,1418.28,1418.28,atd-us,0.7141101360321045,American Tire Distributors,,S112790548,21/06/2018,2018-06-21 00:00:00
52975493,390.0,390.0,amazon,0.9381877779960632,Amazon,AEU-INV-GB-2017-182622324,AEU-INV-GB-2017-182622324,7/10/2018,2018-07-10 00:00:00
51280750,3300.0,3300.0,plooto team,0.6597122550010681,Plooto,,INV3046,31/07/2018,2018-07-31 00:00:00
51344786,71.48,71.48,mwi animal health,0.9229177236557008,MWI Animal Health ,11928120,11928120,8/24/2018,2018-08-24 00:00:00
52889139,84.3,8.0,shopify,0.9679033160209656,shopify,,,"aug 16, 2018",2018-08-16 00:00:00
52122991,9.78,9.78,the home depot,0.9781193733215332,The Home Depot,,,"july 20, 2018",2018-07-20 00:00:00
52438145,610.9,610.9,jr laser cutting,0.9741567969322203,Jr Laser Cutting,,18-2591,2 aug 2018,2018-08-02 00:00:00
50925200,825.0,825.0,accolution,0.9406779408454896,Accolution,18089517,18089517,,2018-08-23 00:00:00
51088051,28.44,28.44,uberx,0.9967727661132812,Uber,,,03/08/2018,2018-08-03 00:00:00
50885925,,198.05,,,Enmax,,,08/08/2018,2018-08-09 00:00:00
51551202,50.09,50.09,voltex,0.8928966522216797,Voltex,INV-358827,INV-358827,"july 5, 2018",2018-07-05 00:00:00
52841584,30.32,30.32,the home depot,0.9782280325889589,The Home Depot,H4110-66982,H4110-66982,"mon, jul 30, 2018",2018-07-30 00:00:00
52462752,5.0,5.0,paybyphone,0.8826684951782227,PayByPhone,376453287,376453287,"fri, aug 3, 2018",2018-08-03 00:00:00
50595731,2475.83,2475.83,eclipse enterprises,0.8935105204582214,Eclipse Enterprises,00039064,00039064,2018-08-01,2018-08-01 00:00:00
52415545,11.6,11.6,google,0.992798388004303,Google,3419383988,3419383988,30-07-18,2018-07-30 00:00:00
52636053,,20410.13,the home depot,0.6357014775276184,The Home Depot,,,"tuesday, may 22, 2018",2018-08-05 00:00:00
52619523,35.42,35.42,safford builders supply,0.9985715746879578,Ace Safford Builders,785084,785084,"tue, aug 14, 2018",2018-08-14 00:00:00
50978654,531.48,531.48,pro-line shipping,0.9690108299255372,Pro-line Shipping,PLS-AR013872,AR013871,"jun 18, 2018",2018-07-01 00:00:00
52513409,47.68,47.68,the home depot,0.8971871137619019,The Home Depot,,,2018 08 27,2018-08-27 00:00:00
51836782,170.0,170.0,molin motorcycle & marine,0.9921446442604064,Molin Motorcycle & Marine,90755,90755,4/11/18,2018-06-15 00:00:00
51697453,1278.78,1278.78,yext,0.9664371013641356,Yext,INV01318060,INV01318060,2018-08-15,2018-08-15 00:00:00
51930733,1500.0,1500.0,dana rebe0ca designs,0.6639444231987,Levy Creations,308129,308129,"monday, august 13, 2018",2018-08-13 00:00:00
52484421,348.3,348.3,manley deboer,0.9675282835960388,Manley Deboer,1808-270090,1808-270090,"august 7, 2018",2018-08-07 00:00:00
50743886,399.0,399.0,rentpath,0.9125053882598876,Rentpath.com,INV01368902,INV01368902,3/08/2018,2018-08-03 00:00:00
50639085,728.0,728.0,smithton bookkeeping,0.9830638766288756,Smithton Bookkeeping,INV-1445,INV-1445,8/17/2018,2018-08-17 00:00:00
51979630,156.33,156.33,bunnings group,0.8763909339904785,Bunnings Trade,7145/00187040,7145/00187040,08/24/2018,2018-08-24 00:00:00
51259046,,29.13,,,Farmers Insurance Federal Credit Union,,,"jul 31, 2018",2018-07-31 00:00:00
52840999,1438.74,1438.74,soniya s. pillay,0.926170825958252,Soniya Pillay,5302120,,08/09/18,2018-08-09 00:00:00
52617446,,1565.86,as&s activewear,0.9930447936058044,S&S Activewear,11423668,11423668,aug 09 2018,2018-08-09 00:00:00
51564917,1650.0,1650.0,wall to wall plastering&interiors,0.775511622428894,Wall to Wall,118,118,14/08/18,2018-08-14 00:00:00
53004669,95.93,95.93,h.r. king & son,0.9809226393699646,H.R. King & Son Pty Ltd,21035558,21035558,02/15/2018,2018-02-15 00:00:00
52781151,296.09,137.73,great ocean foods bank,0.8375498652458191,Great Ocean Foods,,419320,,2018-08-22 00:00:00
50982976,77.43,77.43,office supply co,0.9934401512145996,Office Supply Co,2015-7,2015-7 Supplies,,2018-08-23 00:00:00
52094645,2690.4,2690.4,ideal technology,0.9835488796234132,Ideal Technology Ltd,57141,57141,"saturday, august 11, 2018",2018-08-11 00:00:00
52345205,129.69,129.69,intuit,0.9055384993553162,Intuit,230013540886,230013540886,08/18/2018,2018-08-18 00:00:00
52780941,31.6,31.6,golden eagle,0.6953554749488831,Golden Eagle Deve,1-3960,1-3960,08/07/2018,2018-08-07 00:00:00
50954672,30309.64,30309.64,bankofamerica,0.9875427484512328,Bank of America,,,08/21/2018,2018-08-21 00:00:00
52691872,20791.49,20791.49,workcover queensland,0.7509291172027588,WORKCOVER QLD,,PREMUIM 2017 ,08/16/18,2018-08-16 00:00:00
52063684,121.0,121.0,life resolutions australia,0.9802733659744264,Life Resolutions,INV-6017,INV-6017,08/11/18,2018-08-11 00:00:00
52199875,479.0,479.0,kestrelmeters,0.9994790554046632,Kestrelmeters,C5042128879709.1,c5042128879709.1,"tue, aug 14, 2018",2018-08-14 00:00:00
51478087,,12.68,planet telecom,0.9405417442321776,Planet Telecom,873046,873046,13/08/2018,2018-08-13 00:00:00
52704898,6.8,6.8,,,Ring Go,CAMDENC-2018-08-20-01721,CAMDENC-2018-08-20-01721,8/15/2018,2018-08-15 00:00:00
52750067,69.99,69.99,amazon,0.9969728589057922,Amazon.com,113-8083751-4281063,113-8083751-4281063,"aug 22, 2018",2018-08-22 00:00:00
52486090,147.0,147.0,spark minds,0.8319714069366455,Spark Minds,11331,11331,07/23/2018,2018-07-23 00:00:00
50611276,22.74,22.74,uberx,0.9957152605056764,Uber,,,8/13/2018,2018-08-13 00:00:00
51159710,1064.3,1064.3,toby's estate coffee,0.9806219935417176,Toby's Estate Coffee,323095,323095,26/08/2018,2018-08-26 00:00:00
51003142,560.0,560.0,the devine group,0.9927972555160522,"The Devine Group, Inc.",N1010303,n1010303,06/07/2018,2018-06-07 00:00:00
52200332,461.69,461.69,columbia gas of kentucky,0.9253284931182858,COLUMBIA GAS OF KENTUCKY,,9890-082918,27/08/2018,2018-08-27 00:00:00
51589220,603.5,603.5,ncc,0.9742075800895692,NCC Media,4896150,4896150,07/29/2018,2018-07-29 00:00:00
51810698,535.6,117.42,alphabroder canada,0.8736845254898071,AlphaBroder Canada,27194557,27194557,13-nov-2017,2017-12-07 00:00:00
51908745,,482.74,sun life,0.723067581653595,Sun Life Assurance Company of Canada,,Jul Bill 2018,,2018-07-31 00:00:00
52844268,855.75,855.75,,,Customer 2,2018-4,2018-4 Customer 2,"august 23, 2018",2018-08-23 00:00:00
52376002,210.17,210.17,microsoft,0.9768807888031006,Microsoft,E07006GZOO,E07006GZOO,"august 3, 2018",2018-08-03 00:00:00
51608190,522.46,522.46,inglis print & promo,0.9847987294197084,Inglis Print & Promo,102974,102974,31/07/2018,2018-07-31 00:00:00
50228510,-390.0,-390.0,brookvale tyre & auto,0.9950639605522156,Brookvale Tyre & Auto Pty,CN3177-1,CN3177-1,"tue, jul 31, 2018",2018-07-31 00:00:00
52749877,164.28,164.28,anipet animal supplies,0.9823545813560486,Anipet,SI+1073810,SI1073810,29 jul 2018,2018-07-29 00:00:00
51175164,97.92,97.92,tippers,0.94760400056839,tippers,3287393,3287393,23/08/2018,2018-08-23 00:00:00
52418397,383.25,383.25,first class engraving,0.9824848175048828,First Class Engraving,2174,2174,07/31/2018,2018-07-31 00:00:00
50798122,192.47,192.47,worker success,0.7531384229660034,Avra Davidoff,,Jul 2018,,2018-07-20 00:00:00
50136814,,20.41,harris county,0.6505910158157349,HCTRA,,,08/01/2018,2018-08-01 00:00:00
51548811,253.29,253.29,shiny,0.9889519810676576,Shiny Pty Ltd,1843674,1843674,7/30/2018,2018-07-30 00:00:00
52624958,26368.49,26368.49,feh income properties,0.863653838634491,Feh Income Properties,1267,1267,"jul 31, 2018",2018-07-31 00:00:00
50962339,58.85,58.85,cumberland septic service,0.98252272605896,Cumberland Septic,71621,71621,23-06-2014,2014-06-23 00:00:00
52534005,48.04,48.04,king taco restaurants,0.9997296333312988,"King Taco Restaurants, Inc.",000362060,000362060,"august 28, 2018",2018-08-28 00:00:00
52596240,4250.0,4250.0,bu m p e rcar,0.9784880280494692,Bumpercar inc.,1924,1924,08/09/2018,2018-08-09 00:00:00
50708282,396.34,396.34,google,0.9880480766296388,Google,3483318060,3483318060,"august 22, 2018",2018-08-22 00:00:00
52530461,16.73,16.73,carquest,0.6641897559165955,Car Quest Heber City,,15341-13362,25/07/2018,2018-08-01 00:00:00
50449987,10482.06,10482.06,bmo,0.5510725378990173,CRA,,11123912,"july 28, 2018",2018-07-28 00:00:00
50255896,2600.0,2600.0,sunnybrook,0.9109427332878112,Sunnybrook.ca,2000241203,,,2018-08-06 00:00:00
52888962,156.89,156.89,mckesson medical-surgical,0.9913261532783508,McKesson Medical Surgical,34372535,34372535,08/06/18,2018-08-06 00:00:00
50359743,147.11,147.11,rexel,0.9975944757461548,Rexel,S122105786.001,S122105786.001,08/10/2018,2018-08-10 00:00:00
50812244,1604.53,1604.53,arb corporation,0.9996983408927916,ARB Corporation,8819868,8819868,13 august 2018,2018-08-13 00:00:00
50894322,570.33,570.33,ferguson htg & cooling,0.9248496890068054,Ferguson Htg & Cooling,2586013,2586013,15 aug 18,2018-08-15 00:00:00
52438212,505.05,505.05,payoneer,0.6553072929382324,Payoneer,,89058074,,2018-07-04 00:00:00
51849129,148.89,148.89,intuit quickbooks,0.8116298913955688,Intuit QuickBooks,230013078485,230013078485,07/19/2018,2018-07-19 00:00:00
51428860,4194.53,4194.53,odyssey trust company,0.8243502378463745,Odyssey Trust Company,1034,1034,"sat, jul 21, 2018",2018-07-21 00:00:00
51501212,,96.9,csavoury chef foods,0.9702408909797668,Savoury Chef,999604,999604,8/25/2018,2018-07-26 00:00:00
51348894,635.65,635.65,outdoors domain,0.986283004283905,Outdoors Domain,28161,28161,"apr 28, 2017",2017-04-28 00:00:00
50314105,362.3,362.3,coastalsunbelt,0.8919724225997925,Coastalsunbelt.,1796132,1796132,"december 12, 2016",2016-12-12 00:00:00
52789548,407.02,407.02,qantas,0.9878811240196228,Qantas,V44KFR,V44KFR,07/30/2018,2018-07-30 00:00:00
52857552,117.0,117.0,the patent drawings company,0.8134250640869141,TPDC,5482,5482,19/7/2018,2018-07-19 00:00:00
51404988,79.61,79.61,savoy equipment,0.9807455539703368,Savoy Equipment,98213,98213,11/12/15,2018-07-16 00:00:00
53102028,526.5,526.5,hilti,0.8359241485595703,Hilti,1685433743,1685433743,07/23/18,2018-07-23 00:00:00
52264741,75.0,75.0,sharefile,0.758306086063385,Sharefile,F4C0C,F4C0C,03/08/2018,2018-08-03 00:00:00
51560435,1672.04,1672.04,b&h,0.7278149127960205,B&H,,,jul 30-2018,2018-07-30 00:00:00
51212190,,39.0,cloud pricing,0.5972341299057007,The Cloud Pricing Team,IN_1CQ6XRHKEUHHASLIAH9MC0M4,in_1Cq6XRHKeuHHAslIAh9Mc0M4,"august 2, 2018",2018-08-02 00:00:00
52488507,14118.17,14118.17,nedco,0.7479182481765747,Nedco,,,"mon, aug 6, 2018",2018-08-06 00:00:00
52691218,13720.96,13720.96,harmans estate,0.8953286409378052,HARMANS ESTATE,INV-2200,INV-2200,08/14/2018,2018-08-14 00:00:00
50577011,230.0,230.0,inversetechnologyinc,0.9472475647926332,Kailun Wang,,,15 aug 2018,2018-08-15 00:00:00
52925430,,2288.81,unitedfcu,0.8191603422164917,United,,870181232,01/08/2018,2018-01-08 00:00:00
51046798,250.0,250.0,vitalrads vitalrads,0.921295166015625,VitalRads,VR9417,VR9417,06/29/2018,2018-06-29 00:00:00
52470733,229.35,229.35,ebosgroup,0.7716302275657654,Ebos Group Australia,4469514,4469514,"august 15, 2018",2018-08-15 00:00:00
51887721,500.0,67.79,videoconferencegear,0.7540434002876282,Staples Canada,PO118782,,06/08/2018,2018-08-06 00:00:00
52407126,66.28,66.28,shoes for crews,0.9990500211715698,Shoes for Crews,4587092,4587092,"aug 7, 2012",2012-08-07 00:00:00
52609621,6.4,6.4,apsley home hardware building centr,0.8255043625831604,Apsley Home Hardware Building Centr,216534,216534,"thu, aug 23, 2018",2018-08-23 00:00:00
50238335,120.0,120.0,paypal,0.5197938084602356,PayPal,,Lisa Brasher,7/27/2018,2018-07-27 00:00:00
53042008,1552.89,1552.89,waxcenter,0.9337514638900756,Waxcenter.com,SIN292212,SIN292212,aug 21,2018-08-21 00:00:00
53059786,208.0,208.0,odysys,0.979855477809906,Odysys,308CEB2-0005,308CEB2-0005,2 august 2018,2018-08-02 00:00:00
51163945,632.3,632.3,techbox,0.7769879698753357,Encore,INV-1028,INV-1028,8/23/2018,2018-08-23 00:00:00
52170993,25.0,25.0,admin.typeform,0.9863156080245972,Typeform,0666581,0666581,26/08/2018,2018-08-26 00:00:00
52752307,1348.49,1348.49,great bowery,0.6833755373954773,Bernstein and Andriulli,BAR13974-E,BAR13974-E,01/25/2016,2015-10-27 00:00:00
50593292,378.27,378.27,pharmacare laboratories,0.9796269536018372,Pharmacare Laboratories Pty Ltd,2066076,2066076,08/05/2018,2018-08-05 00:00:00
52932830,514.8,514.8,gdc building,0.740848958492279,GD Constructions,784,784,24 june 2018,2018-06-24 00:00:00
52136431,1356.0,1356.0,whirlpool,0.992244839668274,Whirlpool,8057613668,8057613668,"aug 13, 2018",2018-08-13 00:00:00
51295556,959.56,959.56,m&tbank,0.7670090794563293,M&T Bank,0090691395,,6/11/2018,2018-08-01 00:00:00
50452798,16507.03,16507.03,meridian,0.6075710654258728,HM Revenue & Customs,SC/2428631/182289,Q2 2018 VAT,13 october 2017,2017-10-13 00:00:00
52359089,858.75,858.75,,,Affinity Accountants,122063,122063,"thursday, august 09, 2018",2018-08-03 00:00:00
51789001,15.95,15.95,sysco,0.9905412793159484,Sysco,,9470612,8 07 18,2018-08-07 00:00:00
52483101,592.5,592.5,carrier enterprise,0.997429132461548,Carrier Enterprise,47967788-00,47967788-00,08/09/2018,2018-08-09 00:00:00
51367811,220.0,220.0,alejandra's cleaning,0.8998346328735352,Taylor Basement 2018,INVOICE#073118-02,A073118-02,"aug 4, 2018",2018-08-04 00:00:00
51908512,15.0,15.0,fotolia,0.9756054878234864,Fotolia,210601590-203870173,,06/20/18,2018-06-20 00:00:00
50781109,24.0,24.0,crugo,0.8798225522041321,Crugo,96207,96207,"july 30, 2018",2018-07-30 00:00:00
50217635,10.84,10.84,coles,0.7902718782424927,Coles,4541,,28/07/2018,2018-07-28 00:00:00
51562286,20.0,20.0,flower drum edible flowers,0.8992989063262941,Flower Drum Edible Flowers,FLD0200,FLD0200,09/08/2018,2018-08-09 00:00:00
50950279,30.63,30.63,amazon,0.9971302151679992,Amazon.com,112-4662084-9382667,,8/10/2018,2018-08-10 00:00:00
53029515,3234.91,3234.91,transferwise,0.8488298058509827,Transferwise Team,,,"august 27, 2018",2018-08-27 00:00:00
51016054,88.92,772.92,danicaimports,0.9887316823005676,Danica,1T28268756,1308054431,08/04/2018,2018-08-04 00:00:00
52595149,66.69,66.69,brooksrunning.billtrust,0.9319187998771667,Brooksrunning.com,220811030,220811030,04-30-18,2018-04-30 00:00:00
50383022,,11.79,r&m,0.7023856043815613,BUNNINGS WAREHOUSE,,,06/30/18,2018-06-30 00:00:00
50959130,82.59,82.59,southernhospitality.co.nz,0.993192195892334,southern hospitality ltd,INV0612326,INV0612326,07/26/2018,2018-07-26 00:00:00
51305629,28.0,28.0,lindsay lowery,0.9749318957328796,lindsay lowery,,0004,7/31/2018,2018-07-31 00:00:00
51270665,24.98,24.98,gusto,0.8731485605239868,Gusto,,,"july 19, 2018",2018-07-19 00:00:00
52345598,126.03,126.03,americanexpress,0.8932620882987976,Am Exp RMC INC -02001,,,"jul 28, 2018",2018-07-28 00:00:00
51344184,5043.47,5043.47,capitalone,0.9713722467422484,Capitalone,,,7/26/2018,2018-07-26 00:00:00
52832456,-325.36,325.36,,,Milton Auto Parts,325074,2-325074,16 august 2018,2018-08-16 00:00:00
51145696,200.0,200.0,times square cinema,0.9743258953094482,Time Square Cinema,1807,1807,08/07/2018,2018-08-07 00:00:00
52518617,153.18,153.18,quality logo,0.7218714356422424,Quality Logo Products,,,"wed, aug 8, 2018",2018-08-08 00:00:00
50686139,440.04,440.04,floryn,0.9337616562843324,Floryn,1021770,1021770,07/30/2018,2018-07-09 00:00:00
53112412,,382.89,cruzco,0.6478468179702759,Republic National Distributing Company LLC,,3896880R,8/21/18,2018-08-21 00:00:00
52792081,,25.0,mileiq,0.952146589756012,MileIQ,,,8/21/2018,2018-08-21 00:00:00
52672534,67.79,67.79,clifford hallam healthcare,0.8769365549087524,Clifford Hallam Healthcare,31150269 RI,31150269 RI,12/08/2018,2018-08-12 00:00:00
52490154,127.78,127.78,staples,0.9707468748092652,Staples,8051091052,3387427115,16 july 2018,2018-07-16 00:00:00
52779477,227.93,227.93,sanmar,0.9959232211112976,Sanmar,73837924,73837924,09/08/2018,2018-08-09 00:00:00
50885258,131.13,131.13,amazon,0.9985070824623108,Amazon,111-1396935-4252249,111-1396935-4252249,08/08/18,2018-08-08 00:00:00
53047617,59.0,59.0,bluehost,0.918274998664856,Sara Forbes,42751517,42751517,08/17/2018,2018-08-17 00:00:00
50314400,483.19,483.19,tyree oil,0.8920983076095581,"Tyree Oil, Inc.",0668442-IN,0668442-IN,,2018-08-15 00:00:00
52819378,288.44,288.44,embassysuites,0.7522631883621216,Embassy suites,,,31/07/2018,2018-07-31 00:00:00
52691809,45.88,45.88,jj's on golden,0.6083951592445374,Homestyle Bake,1231702,1231702,8/16/2018,2018-08-16 00:00:00
50200960,963.75,963.75,dianne baker,0.921201467514038,Dianne Baker,,July2818,,2017-10-20 00:00:00
51375538,6531.49,6531.49,u.s. oil,0.9954440593719482,US Oil,201801279674,201801279674,7 aug 2018,2018-08-07 00:00:00
52617085,,0.0,plasticprinters,0.9869654178619384,plasticprinters.com,93411,93411,8.8.2018,2018-08-08 00:00:00
52046323,35.44,35.44,central valley glass & screen,0.999332845211029,"Central Valley Glass & Screen, Inc.",422661,422661,7/25/2018,2018-07-25 00:00:00
51400634,173.77,173.77,facebook ads,0.8479942679405212,Facebook Ads Team,,UE8L3G2ND2,8 jun 2018,2018-06-08 00:00:00
51570736,1925.0,1925.0,sandpaperplus,0.8969196677207947,Sandpaper Plus,59364,59364,07/20/18,2018-07-20 00:00:00
51848640,430.94,430.94,sunbelt rentals,0.9945858716964722,Sunbelt Rentals,81329993-0001,81329993-0001,1/16/18,2018-01-16 00:00:00
52440141,20248.95,20248.95,joeander,0.9033395051956176,HM Franchise Group,,WE 12/08/2018,8/14/2018,2018-08-14 00:00:00
51257872,517.49,517.49,supporting strategies,0.9943856596946716,Supporting Strategies,13297,13297,"2017-aug 28, 2017",2017-08-28 00:00:00
50879452,16.53,16.53,payment source,0.9542830586433412,By Par Payment Source,N03622509,N03622509,"friday, august 17, 2018",2018-08-17 00:00:00
50562626,220.0,220.0,lindsay grieves,0.9724171161651612,Lindsay Grieves,,3,15/08/2018,2018-08-15 00:00:00
51259571,1072.5,1072.5,sales verification company,0.9035053849220276,Sales Verification Company,INVOICE-7004,invoice-7004,08/23/2018,2018-08-23 00:00:00
52053687,36.49,36.49,ihooice,0.6126099824905396,priceless Discount Variety,,,"monday, june 25, 2018",2018-06-25 00:00:00
50299778,242.59,242.59,rogers,0.9132359027862548,Rogers,692618474,,13-aug-2018,2018-08-13 00:00:00
52748753,228.85,228.85,agropur cooperative natrel division,0.7700992226600647,Agropur,W4187424,W4187424,"july 29, 2018",2018-07-29 00:00:00
52415381,74.2,74.2,homans associates,0.9974772334098816,Homans Associates,60979929-00,60979929-00,24/08/2018,2018-08-24 00:00:00
52132923,35.24,35.24,barsky-fleming marketing,0.9947776198387146,Barsky-Fleming Marketing Inc,IN20696,IN20696,jul-21-2018,2018-07-21 00:00:00
52321026,311.11,311.11,p&r electrical wholesalers,0.990306794643402,P&R Electrical Wholesalers,30540666,30540666,"mar 25, 2018",2018-03-25 00:00:00
51729977,25.0,25.0,yahoo gemini,0.7380144000053406,Yahoo Online Services,,,"aug. 9, 2018",2018-08-09 00:00:00
52798530,820.4,820.4,big d albuquerque,0.9179033637046814,Big D Albuquerque,S9580649.001,S9580649.001,22/08/2018,2018-08-22 00:00:00
50330443,4.07,4.07,zendesk,0.9672359824180604,Zendesk,,,08/24/18,2018-08-24 00:00:00
51897181,33335.0,33335.0,stonedesign,0.9107704758644104,Stone Design,1795,1795,"mon, jul 30, 2018",2018-07-30 00:00:00
52566344,91.1,91.1,amazon,0.9990354180336,AMAZON,702-2001814-4164238,702-2001814-4164238,"june 02, 2018",2018-06-02 00:00:00
52976347,,2380.21,,,American Steel Carports,EEC0F32B-A412-4E7C-BD5C-BC5633B7DA0D,,"july 31, 2018",2018-07-31 00:00:00
51582726,122.9,122.9,,,Desjardins,,,08/17/18,2018-08-17 00:00:00
50567689,1.53,1.45,krispy kreme,0.9994535446166992,Krispy Kreme,6257819,6257819,,2018-08-03 00:00:00
52705566,2759.0,2759.0,almo,0.6241075396537781,ALMO,EUF8490,EUF8490,08/08/2018,2018-08-08 00:00:00
50906008,500.0,500.0,actioncoach business coaching,0.8951135277748108,ActionCOACH,173,173,,2018-07-18 00:00:00
52239031,23006.05,23006.05,thomas foods international fresh produce,0.991629958152771,Thomas Foods International Fresh Produce ,P02836,P02836 DKT 3808/3784 AARON BK 6 NORTH,,2018-08-01 00:00:00
52469292,2500.0,2500.0,arthritis foundation,0.5531863570213318,Arthritis Foundation,,,08/16/2018,2018-08-16 00:00:00
50968195,147.84,147.84,doubletree,0.8686704635620117,Hilton,,,08/09/2018,2018-08-09 00:00:00
52916571,952.97,952.97,alterna,0.5933821201324463,Alterna Savings,,4058210012501894,07/31/18,2018-07-31 00:00:00
50374579,165.0,165.0,raather neat carpentry,0.9915298223495485,Raather Neat Carpentry,290,290,13/08/18,2018-08-13 00:00:00
52445164,224.0,224.0,kinetic physio,0.6773942112922668,kinetic physio,,,03/10/2017,2017-03-10 00:00:00
51981240,19.99,19.99,tinder on google play,0.7839622497558594,Google Play,GPA.3382-8306-7277-30551,GPA.3382-8306-7277-30551,"wednesday, august 22, 2018",2018-08-22 00:00:00
51808150,184.48,184.48,myfonts,0.9685621857643129,MyFonts,M9580949,M9580949,13-08-18,2018-08-13 00:00:00
52604025,7497.33,5623.0,trucolors contracting,0.998016893863678,"Trucolors Contracting, Inc.",9021,9021,"22august, 2017",2017-08-22 00:00:00
50929995,83490.0,83490.0,diabeng,0.7357893586158752,Diab Engineering,3340,3340,08/03/18,2018-08-03 00:00:00
51820082,,3125.4,tdcanadatrust,0.7890228629112244,TD Canada Trust,,,7/20/2018,2018-07-20 00:00:00
52709904,29.15,29.15,sherwin williams,0.998305082321167,Sherwin Williams,7709-6,7709-6 Mister Car,"august 2, 2018",2018-08-02 00:00:00
50779579,,15.0,,,Banque Populaire,17060000000000008305,17060000000000008305,06/30/18,2018-07-31 00:00:00
52676246,12837.0,12837.0,davtec group,0.9173378348350524,Davtec Group,2220,2220,"august 22, 2018",2018-08-22 00:00:00
51789317,115.0,115.0,the design & media lab,0.9959936141967772,The Design & Media Lab,3416,3416,"july 27, 2018",2018-07-27 00:00:00
52379872,156.4,156.4,hp,0.8808960914611816,HP,H324390977,,"april 06, 2018",2018-04-06 00:00:00
51329504,9.99,9.99,apple,0.9598366022109984,APPLE,167220355690,167220355690,08/14/2018,2018-08-14 00:00:00
52586173,10176.73,10176.73,kitchen concepts orange,0.9445613622665404,KITCHEN CONCEPTS ORANGE,INV 621,Inv 621,"sunday, august 19, 2018",2018-08-19 00:00:00
50579918,1794.75,1794.75,canada malting co,0.8221377730369568,Country Malting Co.,,021739,2/8/18,2018-08-02 00:00:00
51598264,3488.62,3488.62,,,Snowy Owl Medical Clinic Inc,,08-03-2018,05/03/2018,2018-03-05 00:00:00
52526568,41.62,41.62,adobe systems software,0.7525647878646851,Adobe Systems Software,IEE2017004999088,IEE2017004999088,8/7/2018,2018-08-07 00:00:00
50797720,,193.95,,,OnWireless,,7213-8244,august 16,2018-08-16 00:00:00
51732441,2.0,2.0,paybyphone,0.9373791813850404,PayByPhone,385873545,385873545,17-jul-2018,2018-07-17 00:00:00
53035678,24.0,24.0,pedego,0.9743943810462952,Pedego Inc,SO10875,SO10875,"thursday, august 2, 2018",2018-08-02 00:00:00
50323557,170.0,170.0,unlimited,0.5152598619461061,Color Unlimited Painting,825,825,5/1/2018,2018-05-01 00:00:00
51128426,50.0,50.0,facebook,0.9454302191734314,Facebook Ads,MLLZJGSXD2,MLLZJGSXD2,"wednesday, august 15, 2018",2018-08-15 00:00:00
52063306,1045.47,1045.47,optimum,0.5377224683761597,Robayne,IV219186,IV219186,7/08/2018,2018-08-07 00:00:00
52558952,359.08,359.08,frontier plumbing & heating supply,0.9731194972991944,Frontier Plumbing,02-036505,02-036505,31/07/2018,2018-07-31 00:00:00
51215831,123.14,123.14,bluroot,0.9164061546325684,Bluroot,INV-000812,INV-000812,08/27/2018,2018-08-27 00:00:00
51003729,220.45,220.45,staples canada,0.9070600271224976,Staples,,,06/05/2018,2018-06-05 00:00:00
51489371,487.89,487.89,guillevin international,0.9961312413215636,Guillevin International,2010-566318,2010-566318,"mon, aug 13, 2018",2018-08-13 00:00:00
52752754,,0.0,konica,0.5605694651603699,ImagePath,123764,123764,06/08/2018,2018-08-06 00:00:00
51903231,12.13,12.13,fedex,0.9993416666984558,FedEx,6-271-71811,6-271-71811,7/24/2018,2018-07-24 00:00:00
50766687,5.0,5.0,google,0.9919047951698304,Google,3483795001,3483795001,07/aug/2018,2018-08-07 00:00:00
51584205,452.0,452.0,bookkeeping bureau,0.9926669597625732,Bookkeeping Bureau,2019210,2019210,2018-08-07,2018-08-07 00:00:00
51632715,75.78,75.78,4c insights,0.9942588806152344,4C The Future of Media,INV-34554,INV-34554,"may 2, 2018",2018-05-02 00:00:00
51238201,2521.79,3210.68,mlt atkins,0.9821223020553588,MLT Aikins LLP,905157,,14/8/2018,2018-08-14 00:00:00
51978058,13.54,13.54,microsoft,0.9972094297409058,Microsoft,E03006DTIF,E03006DTIF,27 aug 2018,2018-08-27 00:00:00
50237373,356.37,356.37,btr equipment services,0.973973274230957,"BTR Equipment Services, LLC",12737,12737,07/24/2018,2018-07-24 00:00:00
52447405,1591.0,1591.0,rsr group,0.7533901929855347,RSR Group,,,08/21/2018,2018-08-21 00:00:00
51594730,166.06,166.06,parking,0.6373502612113953,Parking,,FQ110,8/03/2018,2018-08-03 00:00:00
52777687,246.4,246.4,ikea,0.9552849531173706,Ikea,300087644,300087644,"wednesday, august 8, 2018",2018-08-08 00:00:00
52618759,-215.32,-215.32,goodman distribution,0.8413575291633606,Goodman Distribution Inc.,182784,Q993691,"aug 05, 2018",2018-08-05 00:00:00
51190239,-302.9,-302.9,durabuilt windows & doors,0.8464439511299133,Durabuilt Windows & Doors,203757CR,203757CR,07/27/18,2018-07-27 00:00:00
52252025,,5.48,,,Staples,,,"monday, august 13, 2018",2018-07-20 00:00:00
53036034,-56.61,-56.61,shoes for crews,0.9980286359786988,Shoes for Crews,1104144,1104144,2018-07-28 2018-08-12,2018-07-29 00:00:00
51894275,50.22,50.22,the home depot,0.9091145396232604,The Home Depot,,,08/14/2018,2018-08-14 00:00:00
50616818,2289.14,2289.14,consolidated panels & veneers,0.8882573246955872,Consolidated Panels & Veneers,20524,20524,,2018-07-30 00:00:00
50238756,13.0,13.0,lyft ride,0.8323686718940735,Lyft Ride,,,"august 4, 2018",2018-08-04 00:00:00
51010718,,5.0,premier rochester,0.5818687081336975,Premier Banks,,Transfer Receipt,2018/07/24,2018-07-24 00:00:00
50689258,,99.44,,,VincesMarket,2720,,08/07/2018,2018-08-07 00:00:00
51281269,,58.72,camscanner,0.6278602480888367,Whole Foods Market,,,8/15/18,2018-08-15 00:00:00
51018450,3585.9,3585.9,dial 800,0.8935422897338867,DIAL 800,226708,226708,03-aug-2018,2018-08-03 00:00:00
53024139,994.28,994.28,garage kings nova scotia,0.8982925415039062,Garage Kings,1024,1024,09/01/2018,2018-09-01 00:00:00
52577418,27.52,27.52,preferred meats,0.998380959033966,"Preferred Meats, Inc.",187506 A,187506 A,07/28/2018,2018-07-28 00:00:00
51315057,84.87,84.87,ferguson enterprises,0.9940307736396792,Ferguson Enterprises Inc,6702166,,27 aug 2018,2018-08-27 00:00:00
52567407,558.15,558.15,ecr4kids,0.994475245475769,ECR4Kids,741039,741039,24/08/2018,2018-08-24 00:00:00
50309061,129.68,129.68,sareena computer supplies,0.9756936430931092,Sareena Computer Supplies PrintMax,40000,40000,"july 24, 2017",2017-07-24 00:00:00
51346873,1467.86,1467.86,mr,0.5976383090019226,Racing Victoria,811019,,,2018-08-23 00:00:00
51183361,4.75,4.75,cincy ezpark,0.8311944603919983,Cinzy EZPark,114149984,,8/1/2018,2018-08-01 00:00:00
52182916,45.19,45.19,sanmar canada,0.982376217842102,Sanmar Canada,5468069,5468069,,2018-07-26 00:00:00
53083841,2100.0,2100.0,dawn hokaj,0.7230891585350037,Dawn Hokaj,014,014,8/23/18,2018-08-23 00:00:00
52772251,15997.86,15997.86,sector nine distribution,0.9368614554405212,Sector Nine Distribution,10743,10743,08/15/2018,2018-08-16 00:00:00
52436076,95.76,95.76,dallas flat glass distributors,0.990606963634491,Dallas Flat Glass Distributors,823783,823783,10-aug-2018,2018-08-10 00:00:00
52504870,3646.37,3646.37,,,British Columbia,,,25 jul 18,2018-07-25 00:00:00
52492174,13.8,13.8,booking,0.9874034523963928,Booking.com,1528919018,1528919018,"saturday, july 7, 2018",2018-07-07 00:00:00
51966755,467.24,467.24,telstra,0.9881478548049928,Telstra,P 226 418 881-1,P 226 418 881-1,8/13/2018,2018-08-13 00:00:00
50193888,89.32,89.32,microsoft,0.9975955486297609,Microsoft,E06006C9K4,E06006C9K4,6 aug 2018,2018-08-06 00:00:00
51257460,14.0,14.0,supporting strategies,0.993958055973053,Supporting Strategies,13284,13284,8/13/18,2018-08-13 00:00:00
50928507,,87.45,tox free australia,0.8882088661193848,ToxFree,4216097,4216097,15 aug 2018,2018-08-15 00:00:00
52547377,2500.0,2500.0,mile high enterprises,0.9919885993003844,MILE HIGH ENTERPRISES,1005,1005,8/14/2018,2018-08-14 00:00:00
51161176,372.19,372.19,jetstar airways,0.8102899789810181,Jetstar Airways,GNKDYR,,31/07/2018,2018-07-31 00:00:00
53049745,36111.11,36111.11,fusion academy,0.9837091565132141,BSG Team Ventures,11842,11842,08/01/2018,2018-08-01 00:00:00
50854844,95.94,95.94,fpl,0.8745987415313721,FPL,,,7/31/2018,2018-07-31 00:00:00
52193399,496.36,496.36,aviall,0.9464623332023621,Synergy Aviation,9307839235,9307839235,"mon, aug 20, 2018",2018-08-20 00:00:00
52515638,39.72,39.72,new jersey legal,0.9967817664146424,New Jersey Legal,134491,134491,"friday, august 10, 2018",2018-08-10 00:00:00
50661895,1317.18,1317.18,coates hire,0.9724578857421876,Coateshire,17441007,17441007,,2018-05-25 00:00:00
51583202,,17.95,xceed,0.8225177526473999,Xceed,150830,150830,8/21/2018,2018-08-21 00:00:00
52780009,711.11,711.11,agl energy,0.882644772529602,AGL Energy,,Jun-Aug 2018,08/27/18,2018-08-27 00:00:00
51217008,47.96,47.96,the home depot,0.8339844942092896,The Home Depot,36366,,08/03/2018,2018-08-03 00:00:00
51762073,69.3,69.3,arb corporation,0.9996265769004822,ARB Corporation,8833954,8833954,"tue, aug 14 2018",2018-08-14 00:00:00
51572626,672.25,672.25,nicholas & company,0.5843390226364136,Nicholas & Company,304076,304076,"august 15, 2018",2018-08-15 00:00:00
50899720,0.5,0.5,paybyphone,0.9255241155624392,PayByPhone Parking,383620275,,july 30,2018-07-30 00:00:00
52327706,25.5,25.5,app.webcity,0.7019931077957153,Webcity Australia,,,7/10/2018,2018-07-10 00:00:00
50940417,243.94,243.94,airbnb,0.9740028381347656,AIrbnb,,,2018/08/14,2018-08-14 00:00:00
51240958,220.36,220.36,sale - approved,0.9919103980064392,Sale - Approved,,,,2018-08-03 00:00:00
51268477,12.88,12.88,amazon,0.9985337853431702,Amazon.com,112-8494530-1028265,112-8494530-1028265,7/31/18,2018-07-31 00:00:00
52837423,15.53,15.53,options,0.575546145439148,Royal Bank,1604,,31-07-2018,2018-07-31 00:00:00
52121774,300.0,800.0,tristan kong,0.8210538029670715,Tristan Kong,037,037,4/11/2017,2017-04-11 00:00:00
51313372,79.0,79.0,pure bookkeeping australia,0.8218286037445068,Pure Bookkeeping Australia,,280062132,28 july 2018,2018-07-28 00:00:00
51448516,3885.0,3885.0,anb,0.5794658660888672,Access Canberra,2234108889,,08/22/18,2018-08-22 00:00:00
52367523,531.3,531.3,rgm maintenance,0.8029080629348755,RGM Maintenance Pty Ltd.,1041650,1041650,"august 14, 2018",2018-08-14 00:00:00
50361198,45.03,45.03,jeays hardware,0.9985477328300476,Jeays Hardware,110527202,110527202,"february 27, 2018",2018-02-27 00:00:00
50232909,12025.0,12025.0,iaai,0.6652156710624695,IAA Buyer Services,,,"mon, aug 20, 2018",2018-08-20 00:00:00
52419627,10.1,0.1,green p,0.9711637496948242,Green P,116499893,,"aug 08, 2017",2017-08-08 00:00:00
51051765,116.09,116.09,ringcentral,0.9858308434486388,Ring Central,9579259004,9579259004,"august 1, 2018",2018-08-01 00:00:00
50285711,35.22,35.22,rona,0.9919834136962892,RONA,514-17190681,514-17190681,"30 june, 2018",2018-06-30 00:00:00
51429791,16295.05,16295.05,chewy,0.8980987668037415,Chewy,RS494971,RS494971,jul 31,2018-07-31 00:00:00
52783622,6659.0,66.59,aramark-uniform,0.9946991205215454,Aramark,000051444626,000051444626,"tuesday, august 7, 2018",2018-08-07 00:00:00
53021485,,4642.56,nus bank,0.8714357018470764,US Bank,,,"april 7, 2018",2018-04-07 00:00:00
52439828,15.0,120.0,runnings,0.9122374057769777,Bunnings Warehouse,,,08/7/2018,2018-08-07 00:00:00
51161515,2298.64,2298.64,dhl,0.9572769999504088,DHL,MEL666450,MEL666450,"thu, aug 9, 2018",2018-08-09 00:00:00
51791544,591.36,591.36,terago,0.9143450260162354,Terago,722599,722599,30 april 2018,2018-04-30 00:00:00
52355033,1000.0,1000.0,support.stripe,0.8110659718513489,Stripe,,,02/07/2018,2018-07-02 00:00:00
51223407,4600.0,6443.28,rwam insurance,0.6378881335258484,RWAM Insurance,,,14 august 2018,2018-08-14 00:00:00
52425695,2761.09,2761.09,broadway bank,0.9562587141990662,Broadway Bank,,,"august 23, 2018",2018-08-23 00:00:00
51798660,332.6,332.6,royal canin,0.990090310573578,Royal Canin,,SI-I 1898893,31 jul 2018,2018-07-31 00:00:00
50862860,330.26,330.26,slack,0.9580065011978148,Slack,410993897702,410993897702,25-aug-18,2018-08-25 00:00:00
51664606,-55.14,55.14,stc,0.6847872138023376,STC,,payment for mobile bill no. 0545549214 for Raymond,23 aug 2018,2018-08-23 00:00:00
52646815,-20.0,-20.0,hubdoc,0.9947621822357178,Hubdoc,,110342,"april 3 , 2017",2017-04-03 00:00:00
50158109,9.94,9.94,uber,0.9915110468864441,Uber,,,8/8/2018,2018-07-31 00:00:00
50129815,22.14,22.14,amazon,0.948704719543457,Amazon,113-5095138-1029857,113-5095138-1029857,08/20/2018,2018-08-20 00:00:00
52443371,17299.18,17299.18,breakout river,0.9309462904930116,Breakout River,,,jul 27/2018,2018-07-27 00:00:00
52421301,147.29,140.3,american express,0.8672337532043457,American Express,,,2018-08-01 - 2018-08-16,2018-08-02 00:00:00
52148656,4415.36,4415.36,maple grove finishing,0.9188947081565856,Maple Grove Finishing,101704,101704,08/17/18,2018-08-17 00:00:00
50907968,536.75,536.75,ontario presents,0.8697448968887329,Ontario Presents,,,13 august 2018,2018-08-13 00:00:00
50128092,14250.51,14250.51,lendlease services,0.971942663192749,Lendlease Services,360128,,08/21/18,2018-08-21 00:00:00
52420761,1260.0,1260.0,victoria cole,0.8857054114341736,Victoria Cole,,17AUG18,"mon, jul 30, 2018",2018-07-30 00:00:00
50759185,175.0,175.0,campaign precision,0.9959713816642758,Campaign Precision LLc,10629,10629,"august 26, 2018",2018-08-26 00:00:00
50531468,1222.94,1222.94,kindersley transport,0.9836629033088684,Kindersley Transport Ltd.,,015213859,2018/08/06,2018-08-06 00:00:00
50349617,3.14,3.14,account.microsoft,0.9375795722007751,Microsoft,568016509063477378,568016509063477378,,2018-08-18 00:00:00
51031643,52.38,52.38,bpme,0.5861563682556152,Bpme,96995,96995,"august 8, 2018",2018-08-08 00:00:00
50370437,11.99,11.99,www1.ipage,0.9645234942436218,Ipage,,,07/30/2018,2018-07-30 00:00:00
52780975,54.8,54.8,caltex,0.5684115290641785,Chrisomallis Trading Pty Ltd,,,27-aug-18,2018-08-27 00:00:00
50300718,150.64,150.64,,,A Bread Affair,181306,181306,"sun, jul 8, 2018",2018-07-08 00:00:00
53046485,15.18,15.18,central valley glass & screen,0.999315857887268,"Central Valley Glass & Screen, Inc.",427067,427067,"august 15, 2018",2018-08-15 00:00:00
51149633,114.05,114.05,alsco,0.9970825314521792,Alsco,CCTN3025611,CCTN3025611,"sep 21, 2017",2017-09-21 00:00:00
51001235,22.65,22.65,canada post,0.9932854175567628,Canada Post,D172880198,,31/07/18,2018-07-31 00:00:00
51458404,16.94,16.94,suez,0.8642409443855286,Suez,31196354,31196354,13-08-18,2018-08-13 00:00:00
51639693,450.0,450.0,seigfreid bingham,0.8720384836196899,Seigfreid Bingham,1112921,1112921,"wed, aug 1, 2018",2018-08-01 00:00:00
50990184,903.63,903.63,wasatchmeats,0.990307867527008,Wasatch Meats,1098618,1098618,2018-08-08,2018-08-08 00:00:00
50461164,2943.15,2943.15,green leaf hardwood floors,0.7400679588317871,Green Leaf Hardwood Floors,,1229,14/08/201,2018-08-14 00:00:00
51781526,36.91,36.91,intuit-email,0.7186012864112854,Quickbooks,69500708,,2017-05-01,2017-05-01 00:00:00
52294835,1290.0,1290.0,alayna nicol,0.9725172519683838,Alayna nicol,002,002,07/24/2018,2018-07-24 00:00:00
50795226,193.9,193.9,s&s activewear,0.9863447546958924,S&S Activewear,15132492,15132492,16/08/2018,2018-08-16 00:00:00
51258798,178.14,178.14,mcmaster-carr,0.9899283051490784,McMaster-Carr,69289130,69289130,"friday, august 24, 2018",2018-08-24 00:00:00
52998601,650.0,650.0,m&i spares,0.9989601373672484,M & I Spares,28575,28575,8/08/2018,2018-08-09 00:00:00
51249139,63.6,63.6,voipfone,0.6724824905395508,iNet Telecoms Ltd.,1012056916,1012056916,15-07-2018,2018-07-15 00:00:00
50197326,149.47,149.47,paypal,0.9962765574455258,Paypal,,,"fri, aug 17, 2018",2018-08-17 00:00:00
50716373,40.03,40.03,uber,0.9211370348930359,UBER,,,05/17/2018,2018-05-17 00:00:00
51237507,10.95,10.95,panino santa ynez,0.7632116079330444,Panino Syz,,,"august 9, 2018",2018-08-09 00:00:00
52972436,27.0,27.0,stripe,0.9216358065605164,Stripe,,,08/10/18,2018-08-10 00:00:00
51581677,167.75,167.75,stoneridge,0.6144613027572632,Stonebridge Software,2375,2375,21-aug-18,2018-08-21 00:00:00
51498741,82.95,82.95,dogcity,0.8308845758438109,dog city,,,22/04/18,2018-04-22 00:00:00
51301114,1480.52,1480.52,ace&jig,0.9049800634384156,Ace&Jig,I34969,I34969,1 sep 2017,2017-09-01 00:00:00
51901561,5.45,5.45,ashland hardware,0.9957783222198486,Ashland Hardware,987331,987331,8/6/2018,2018-08-06 00:00:00
52716021,1395.23,1395.23,fletchers' mill,0.9503623843193054,Fletchers Mill,25330,25330,"wed, aug 1, 2018",2018-08-01 00:00:00
50267758,,32.76,real,0.6083545088768005,Citizens Bank,7817,180730,08/02/2018,2018-08-02 00:00:00
51302150,3080.0,3080.0,sector nine distribution,0.9855754971504213,Sector Nine Distribution,1173,1173,"wednesday, august 8, 2018",2018-08-08 00:00:00
51939817,-89.0,-89.0,premium springs water company,0.9880993366241456,Premium Springs Water Company Inc.,42789,42789,21 aug 2018,2018-08-21 00:00:00
52169880,20.0,20.0,goa alberta land titles spatial information system,0.9306889176368712,Goa Alberta Land Titles Spatial Information,35712547,35712547,1/17/2018,2018-01-17 00:00:00
50906938,30.99,30.99,linkedin linkedin,0.8258169889450073,Linkedin,WWW.LINKEDIN.COM/PAYMENTS/RECEIPT/4155709253?PRINTRECEIPT=TRUE,4155709253,03/08/2018,2018-08-03 00:00:00
51172847,418.6,418.6,bradypeopleid,0.9984265565872192,Brady People  ID,9337781981,9337781981,06 aug 2018,2018-08-06 00:00:00
50168822,16.47,16.47,the home depot,0.9577481150627136,Home Depot,,,,2014-08-21 00:00:00
52240140,1020.24,1020.24,dimar cutting tools,0.9707361459732056,Dimar Cutting,242873,242873,04/07/2018,2018-07-04 00:00:00
52721701,54.37,54.37,instacart,0.9494109749794006,Instacart,,,2018-07-16,2018-07-16 00:00:00
50313142,3782.27,3782.27,cnr pandora,0.7995582818984985,Cnr Pandora Road & West,,,8/2/2018,2018-08-02 00:00:00
52933037,22.58,25.77,consumer cellular,0.9194103479385376,Consumer Cellular Cell Phone,,103554448,9-07-2018,2018-07-09 00:00:00
51361714,28.58,28.58,keystone,0.9821838140487672,Keystone,TR360516,TR360516,02/12/18,2018-02-12 00:00:00
52901676,196.0,196.0,virtual assistant on call,0.995627462863922,Virtual Assistant On Call,H0541,H0541,08/21/2018,2018-08-21 00:00:00
50707378,5.27,5.27,hardwood floor,0.7134310603141785,Pro Builders Supply Ltd,,,"aug 19, 2018",2018-08-19 00:00:00
51233079,73.92,73.92,synnex,0.9948988556861876,Synnex,693064,693064,"jun 30, 2018",2018-06-30 00:00:00
51289800,818.94,818.94,mckesson mckesson corporation,0.7914587259292603,McKesson - 897847 RX,7883846140,7883846140,07-31-18,2018-07-31 00:00:00
52824072,60.0,60.0,economy exterminators,0.996087908744812,Economy Exterminators,2771060,2771060,"august 23, 2018",2018-08-23 00:00:00
51760783,9000.0,9000.0,kristen stanleick,0.9878191351890564,Kristen Stanleick,1007,1007,8/13/2018,2018-08-13 00:00:00
50714785,298.7,298.7,avant taxworks,0.985036313533783,Avant TaxWorks LLC,1274,1274,7/31/2018,2018-07-31 00:00:00
50743938,59.31,59.31,freightcom,0.9814216494560242,Freightcom,FC0294089,FC0294089,aug-20-2018,2018-08-20 00:00:00
52039965,,553.33,eryoenergy,0.9151587486267092,edpro energy group inc.,386062,386062,aug 22 2018,2018-08-22 00:00:00
52364012,14212.55,14212.55,jk & e white,0.9687270522117616,JK & E White,INV-0009,INV-0009,"july 31, 2018",2018-07-31 00:00:00
51176920,14000.0,14000.0,mass pro carpentry,0.9636986255645752,Mass Pro Carpentry,E180727168,E180727168,07/19/18,2018-07-19 00:00:00
50182148,405.39,405.39,horizon,0.9715507626533508,Horizon Distributors,617745,617745,8/21/2018,2018-08-21 00:00:00
51236841,158.74,158.74,bathurst fruits,0.976146638393402,Bathurst Fruits Pty Ltd,,,13aug18,2018-08-13 00:00:00
51992506,111.0,111.0,lesia design and digital,0.9779548645019532,Lesia Design and Digital,3123432310,3123432310,19-08-2018,2018-08-19 00:00:00
53023754,247.15,247.15,airgas,0.9920921325683594,Airgas,9079546858,9079546858,"august 7, 2018",2018-08-07 00:00:00
52414146,552.52,552.52,greenco2systems,0.9577068090438844,greenco2systems,146141,146141,"thu, aug 2, 2018",2018-08-02 00:00:00
50583503,6966.82,6966.82,coca-cola amatil,0.9246017932891846,Coca-Cola Buzzbar,218037012,B-218037012,7-aug-2018,2018-08-07 00:00:00
52576821,242.0,242.0,essential safety solutions,0.9945448637008668,Essential Safety Solutions,INV-17202,INV-17202,23 jul 2018,2018-07-23 00:00:00
50838422,135.95,135.95,bockersandpony,0.9213694334030152,Bockers and Pony,100056480,100056480,08/04/2018,2018-08-04 00:00:00
50718469,5830.16,5830.16,brew  coffee  co,0.6166273951530457,Station Cold Brew Coffee Co.,,,08 aug 2018,2018-08-08 00:00:00
52183569,84.0,84.0,d.a. levinson & associates,0.8371332883834839,D.a. Levinson & Associates,243,243,,2017-10-27 00:00:00
51228409,37.99,37.99,ratetel,0.919338881969452,Rate Tel,INV2410,INV2410,28 august 2017,2017-08-29 00:00:00
52830640,923.19,923.19,hilti,0.8918221592903137,Hilti,1685482909,1685482909,30/5/2018,2018-05-30 00:00:00
50914670,59.82,159.82,,,The Sultants tent,,,"july 20, 2018",2018-07-20 00:00:00
51336132,1875.5,1875.5,courtney watts,0.8518444299697876,CWBS,INV-0230,INV-0230,01/05/2018,2018-01-05 00:00:00
51163411,1134.0,1134.0,b bailey,0.8946465849876404,b bailey,35,35,08/15/2018,2018-08-15 00:00:00
51059846,1233.36,1233.36,hachette book group,0.8774673938751221,Hachette book group,,,"may 17, 2018",2018-05-17 00:00:00
50249408,500.0,500.0,jeanie lee,0.9027615785598756,Jeanie Lee,8314,8314,"wednesday, august 22, 2018",2018-08-22 00:00:00
50916556,1658.05,1658.05,dick's lumber,0.9992775321006776,Dick's Lumber,4794774-00,4794774-00,04/12/2016,2016-12-04 00:00:00
51767148,344.83,344.83,touch networks,0.9969522356987,TOUCH NETWORKS PTY LTD,11148620180813,11148620180813,07/18/18,2018-07-18 00:00:00
51824213,55.08,55.08,foster electric co,0.9754717350006104,"Foster Electric Co., Inc.",1903784047,1903784047,,2018-08-01 00:00:00
51960957,259.28,259.28,canadian physiotherapy association,0.8631502985954285,Canadian Physiotherapy Association,,M398225271,21/08/2018,2018-08-21 00:00:00
51827487,,122.39,mrd telecommunications,0.9019267559051514,MRD Telecommunications Pty Ltd,1037064693,1037064693,7/27/2018,2018-07-27 00:00:00
51221088,100.0,134.42,market.envato,0.8443403244018555,Envato Pty Ltd.,,,07/31/2018,2018-07-31 00:00:00
51434435,1.42,1.42,paybyphone,0.9820343255996704,PayByPhone,385110262,385110262,,2018-07-01 00:00:00
50176667,271.2,271.2,intrepid law,0.7668638229370117,Intrepid Law,,429,08/09/18,2018-08-09 00:00:00
50448502,105.0,105.0,sunshine office solutions,0.9875305891036988,Sunshine Office Solutions,INV-SOS3581,INV-SOS3581,,2018-07-31 00:00:00
53034702,18.39,18.39,katie,0.5970341563224792,Amazon,,,,2018-07-17 00:00:00
52203060,362.57,362.57,hotwire,0.9050253629684448,Hotwire,6327992259,,26/07/2018,2018-07-26 00:00:00
52215677,72.0,72.0,shasathonuk.org,0.922380268573761,Shas-A-Thon,26335,26335,17 august 2018,2018-08-17 00:00:00
53047963,,1899.0,the home depot,0.978964626789093,The Home Depot,,,02 aug 2018,2018-08-02 00:00:00
52975876,39.99,39.99,amazon,0.9355352520942688,Amazon,AEU-INV-GB-2017-130637986,AEU-INV-GB-2017-130637986,"wed, aug 22, 2018",2018-08-22 00:00:00
51715677,93.9,93.9,bestwaydisposal,0.9894940853118896,Bestway Disposal,1-182046,,8/7/2018,2018-08-07 00:00:00
50761634,3546.0,3546.0,the finchley group,0.927163541316986,The Finchley Group,,,"friday, august 24, 2018",2018-08-24 00:00:00
51467026,,56335.0,kamada pvt,0.7927839159965515,ibrahim liyagath,,771/2018,5/22/2018,2018-05-21 00:00:00
52001733,27.5,27.5,universal background screening,0.9577773213386536,Universal   Background Screening,201806011739,201806011739,07/23/2018,2018-07-23 00:00:00
50924944,,68.83,johnston.biz,0.8383001089096069,Johnston,1639110-00,1639110-00,31 jul. 2018,2018-07-31 00:00:00
51757435,168.72,168.72,haymes paint,0.92665296792984,Haymes Paint,2278965,2278965,01/08/2018,2018-08-01 00:00:00
50649890,420.0,420.0,multi-heat services,0.9706665873527528,Multiheat Services,00003986,00003986,07/13/18,2018-07-13 00:00:00
51733851,26.0,26.0,cozzini bros,0.965928077697754,Cozzini Bros Inc,C5379626,C5379626,05-feb-2018,2018-02-05 00:00:00
52886122,96.0,98.88,the better packaging co,0.9733744859695436,The Better Packaging Co.,542,,"aug 3, 2018",2018-08-03 00:00:00
52974726,1174.67,801.21,lion liquor retail,0.9546168446540833,Lion Liquor Retail,9429046308672,stmt to 27.08.18,03/16/18,2018-03-16 00:00:00
52394559,19.75,19.75,saint frank coffee,0.9929348826408386,Oldani Art Studio,,,"tue, aug 21, 2018",2018-08-21 00:00:00
51021877,2872.6,2872.6,metcash food & grocery,0.938202440738678,Metcash Food & Grocery,,G0825852,8/7/2018,2018-08-07 00:00:00
50563437,,7.98,easy scanner,0.7781467437744141,Goodness Me,,,,2018-06-13 00:00:00
53003204,57.71,57.71,officeworks,0.993385136127472,Officework No Reply,158312083,158312083,7/31/2018,2018-07-31 00:00:00
53010981,35.07,35.07,best buy,0.9942633509635924,Best Buy,,,08/05/2018,2018-08-05 00:00:00
50892007,15.98,15.98,1-877-442-pure,0.6432970762252808,Canadian springs,,8005494196,,2018-07-02 00:00:00
51153752,1267.7,1267.7,chartered accountants australia and,0.8326798081398009,Chartered Accountants Australia and new Zealand,PMTAU524773,,07/24/2018,2018-07-24 00:00:00
52184006,6.99,6.99,dochub,0.9446301460266112,DocHub,CH_1CZYUMDKXYP5FCLP7LICMXH0,,8/6/2018,2018-08-06 00:00:00
52206898,417.5,417.5,abc supply co,0.9596429467201232,Abc Supply Co,72984974,72984974,"thursday, august 9, 2018",2018-08-04 00:00:00
51306229,952.47,952.47,platron.ru,0.6500081419944763,Platron,42849,,26/12/2017,2018-01-03 00:00:00
51163504,5542.79,5542.79,booming games,0.9385270476341248,Booming Games.com,INV-0823,INV-0823,08/03/2018,2018-08-03 00:00:00
51009300,-500.0,500.0,kel b productions,0.9702869653701782,Kei B Productions LLC,0282,0282,03-05-2018,2018-03-05 00:00:00
52311581,15.0,15.0,hellosign,0.9649913311004642,HelloSign,,Apr Bill 2018,"wed, aug 8, 2018",2018-08-08 00:00:00
50200313,82.12,82.12,country home exteriors,0.8293755054473877,Kemptville Building Centre,NO.2649211,2649211,"aug 21, 2018",2018-08-21 00:00:00
50150028,,5.97,costco whalessale,0.8076239824295044,Costco Wholesale,,,30-jul-2018,2018-07-30 00:00:00
51859867,829.99,829.99,wizmo solutions,0.9772828221321106,Wizmo Solutions Inc.,INV-1211,INV-1211,8/17/18,2018-08-17 00:00:00
51169653,5912.0,5912.0,h anderson electrical contractor,0.950801968574524,H Anderson Electrical,1443,1443,"thu, jul 26, 2018",2018-07-26 00:00:00
51002474,534.84,534.84,auptix,0.98777574300766,"Auptix, Inc.",143006,143006,"tue, jul 31, 2018",2018-07-31 00:00:00
52503960,24677.76,24677.76,americanexpress,0.9400016069412231,Am Exp Personal -52005,,,02.28.2018,2018-02-28 00:00:00
50476010,,0.0,rbc,0.6314813494682312,Rbc Royal Bank,,,,2018-08-02 00:00:00
52920885,36.7,36.7,odotrack,0.9123446941375732,Odotrack,,,3-jun-2018,2018-06-07 00:00:00
51262311,177.64,177.64,aquatech,0.6412277221679688,Cover Pools,42075CM,42075CM,7/31/2018,2018-07-31 00:00:00
50696726,1150.0,1150.0,reliance property management,0.9533011317253112,Reliance Property Management,C336-1DB6,C336-1DB6,7/27/18,2018-07-27 00:00:00
52440200,146.59,146.59,canada computers,0.9922926425933838,Canada Computers,ARBL00067556,ARBL00067556,03/02/2016,2016-03-02 00:00:00
53025584,10572.5,10572.5,james cunningham,0.957579493522644,James Cunningham,3,3,08/08/2018,2018-08-08 00:00:00
51363474,15.0,15.0,secure-optus,0.9745703935623168,Optus,,,,2018-07-16 00:00:00
51062597,4426.79,4426.79,ups,0.5349903106689453,UPS,111461,II1461,"august 1, 2018",2018-08-01 00:00:00
50262599,4.2,4.2,keesling  construction,0.9783948659896852,Keesling Construction Inc.,11630,,05/08/18,2018-08-05 00:00:00
51447323,773.0,773.0,the cellular connection,0.999650537967682,The Cellular Connection,IN000000000459446,IN000000000459446,08/02/2018,2018-08-02 00:00:00
51545511,138.6,138.6,efex,0.8153877854347229,efex,FA00060311,FA00060311,"august 10, 2018",2018-08-10 00:00:00
51757752,370.0,370.0,turo,0.6020039916038513,Toyota Prius,,,01 aug 18,2018-08-01 00:00:00
50706310,775.0,775.0,the cv ledger,0.8696174621582031,"The CV Ledger, Inc.",INV-0208,INV-0208,"tuesday, july 31, 2018",2018-07-31 00:00:00
52725797,2900.0,2900.0,wework,0.9843708872795104,Wework,3848344603,3848344603,10/08/2018,2018-08-10 00:00:00
52950064,3078.0,3078.0,gjr computers,0.8619153499603271,GJR Computers,00029465,00029465,31 july 2018,2018-07-31 00:00:00
51662050,41.0,41.0,petersofkensington,0.9220417737960817,Peter's of Kensington,H352208,H352208,"july 18, 2018",2018-07-18 00:00:00
52504409,30.0,30.0,peter james chin,0.9717354774475098,Upwork,T195113449,T195113449,11/14/2017,2017-11-14 00:00:00
53035470,,4029.0,pine project,0.6868752241134644,FCA Insurance Brokers,,371352,"jul 31, 2018",2018-07-31 00:00:00
51015912,314.0,314.0,dmv,0.7277153134346008,CA DMV,,,07/30/2018,2018-07-30 00:00:00
52493419,370.0,370.0,turn 4 toilets,0.991298258304596,Turn 4 Toilets LLC,18-1045,18-1045,08/01/18,2018-08-08 00:00:00
50302203,724.65,724.65,,,Bse Print Solutions,207096A,207096A,31/07/2018,2018-07-31 00:00:00
51149311,5019.75,5019.75,hydro one,0.9891642332077026,Hydro one,,,"mon, jul 30, 2018",2018-07-30 00:00:00
50955573,102.19,102.19,the wild,0.9711638689041138,From The Wild,INV-0979,INV-0979,19 jul 2018,2018-07-19 00:00:00
50581050,420.0,420.0,american airlines,0.9706131219863892,American Airlines,CONFIRMATION-HNVUDF,,"tuesday, july 24, 2018",2018-07-24 00:00:00
50363279,2291.66,2291.66,the lake macquarie economic development,0.8526445627212524,Dantia,INV-0055,INV-0055,08/13/2018,2018-08-13 00:00:00
50936550,610.15,610.15,d'addario australia,0.8344430923461914,D'Addario,5160,5160,04/11/2018,2018-04-11 00:00:00
53003143,251.5,251.5,kev baldwin confectionery,0.8007240891456604,Kev Baldwin,169603,,"mar 24, 2018",2018-03-24 00:00:00
51378135,,280.0,steve wayne lazar,0.8989378213882446,Cosignment,,000021,22 jul 2018,2018-07-22 00:00:00
53041567,1795.0,1795.0,quickbooks,0.6031585335731506,QuickBooks Payments,10669,10669,31/05/2010,2018-05-31 00:00:00
50856784,69.0,69.0,beer garden furniture,0.995676577091217,"Beer Garden Furniture, LLC",1959,1959,1/31/2017,2017-01-31 00:00:00
52303541,133.36,133.36,intuit quickbooks,0.8085893988609314,Intuit,230013571852,230013571852,07/26/2018,2018-07-28 00:00:00
52237651,157.5,157.5,andrewsmeat,0.9101722240447998,Andrews Meat Industries,INV1542691,INV1542691,"mon, aug 20, 2018",2018-08-20 00:00:00
52286940,,27.68,,,Amazon,,,,2018-08-15 00:00:00
50831956,73.92,73.92,the jadeway,0.9774089455604552,The Jadeway,822-P01,822-P01,2018/08/03,2018-08-03 00:00:00
52366845,21.96,21.96,ava party hire,0.997901737689972,AVA Party Hire,15161,15161,"july 29, 2018",2018-07-29 00:00:00
52392824,2458.43,2458.43,biscoind,0.950597643852234,Bisco Industries,EC8883-01,EC8883-01,"tue, aug 7, 2018",2018-08-07 00:00:00
51141942,75.0,75.0,ruizexhaust,0.9144538044929504,Ruiz Exhaust Cleaning Service,2848,2848,"sunday, august 26, 2018",2018-08-26 00:00:00
52645190,,25.0,konell,0.5035613775253296,Facebook,,,"august 3, 2018",2018-08-03 00:00:00
52765402,1379.69,1379.69,lake cathie medical centre,0.9944461584091188,Lake Cathie Medical Centre,768,Inv 768,8/17/2018,2018-08-17 00:00:00
53063636,49.0,49.0,united mitre 10 home & trade,0.9869152307510376,United Mitre 10 Home & Trade,10771162,10771162,"mar 22, 2018",2018-03-22 00:00:00
51396730,3164.27,3164.27,carefirst bluecross,0.8103922009468079,CareFirst BlueCross BlueShield,181900051185,181900051185,7/31/2018,2018-07-31 00:00:00
50678781,23.49,23.49,ideal supply,0.9973468184471128,Ideal Supply Inc.,5088715,5088715,20 jul. 2018,2018-07-20 00:00:00
51088928,352.8,352.8,sure print vancouver island,0.9021996259689332,Sure Print Vancouver Island Inc.,18-061274,18-061274,"jul 05, 2018",2018-07-05 00:00:00
50749766,2977.0,2977.0,ean services,0.8836913108825684,Ean Services LLC,18090136,18090136,"july 26, 2018",2018-07-26 00:00:00
51150811,184.5,184.5,rumble coffee roasters,0.989548921585083,Rumble Coffee Roasters,OMI2391,OMI2390,08/24/18,2018-08-24 00:00:00
51114693,203.56,203.56,facebook,0.9737669229507446,Facebook,1671465262964587-3469036,,,2018-07-26 00:00:00
50982672,65.0,65.0,google,0.994725227355957,Google,3484771823,3484771823,8/3/2018,2018-07-30 00:00:00
52698554,53.45,53.45,carter bros. fruit & veg,0.9586532711982728,Belinda Moyes,0090005043,0090005043,16-08-2018,2018-08-16 00:00:00
52657413,-5.1,5.1,vitality works,0.9731284379959106,Vitality Works,2018-63934-00,,2018-06-27,2018-06-27 00:00:00
51480899,241.14,241.14,the home depot,0.922496259212494,The Home Depot,,,"august 07, 2018",2018-08-07 00:00:00
52801107,1800.0,1800.0,restonic,0.7843602895736694,"Advertising Concepts of America, Inc.",3018398,3018398,2018 / 08 / 13,2018-08-13 00:00:00
51771109,1583.79,1583.79,joseph sanzo,0.8797008395195007,Joseph Sanzo,49,49,"aug 14, 2018",2018-08-14 00:00:00
52812910,4061.88,4061.88,drew anthony smith,0.988387405872345,Drew Anthony Smith,1226,1226,30/07/18,2018-07-30 00:00:00
51231057,358.88,358.88,,,Brand RPM,175383,175383,8/4/2018,2018-08-04 00:00:00
52240462,1750.0,1750.0,venmo,0.6956143379211426,Venmo,,1273554947,"fri, aug 10, 2018",2018-08-10 00:00:00
51244481,,3703.31,tdcanadatrust,0.7544936537742615,TD canada Trust,,,7/31/2018,2018-07-31 00:00:00
52017030,534.81,723.48,upwork,0.6274169087409973,Upwork,,194177638,"mar 14, 2018",2018-03-14 00:00:00
51366941,700.41,700.41,microsoft online,0.9380674362182616,"Microsoft Online, Inc.",9413225967,9413225967,08/21/18,2018-08-23 00:00:00
51608608,573.71,573.71,transmittal log sears,0.6124517917633057,Sears,0000238026,,06-08-18,2018-08-06 00:00:00
52163817,17555.0,17555.0,jingzhu garment group co,0.8969901204109192,Jingzhu Garmet Group,DRA2100-0000,DRA2100-0000,21/08/18,2018-08-21 00:00:00
51763394,2263.14,2263.14,manders plumbing,0.6846279501914978,Manders Plumbing,98,98,"jun 28, 2018",2018-06-28 00:00:00
50955111,227.65,227.65,montgomery pacific corporation,0.9996278285980223,Montgomery Pacific Corporation,2018-2033,2018-2033,"august 3, 2018",2018-08-03 00:00:00
50990385,921.86,921.86,nancy hummel,0.6606360673904419,Stevens Business Service,84899,84899,8/2/2018,2018-08-02 00:00:00
51071004,200.0,200.0,pinnacle quality insight,0.979874551296234,Pinnacle Quality Insight,124168,124168,15/08/2018,2018-08-15 00:00:00
51569106,138.2,138.2,electric bubble,0.9844314455986024,Electric Bubble,1047,1047,2018-08-21,2018-08-21 00:00:00
52648691,115.5,115.5,digital boardwalk,0.9853482246398926,Digital Boardwalk,18301,18301,11/06/2018,2018-06-11 00:00:00
50739262,,50.0,uttl'tcnrsler,0.7864842414855957,Winchester Express,,,jul 2018,2018-07-01 00:00:00
51511027,900.0,900.0,punchstick,0.9840475916862488,Punch Stick,2691,2691,,2018-08-13 00:00:00
52884856,300.8,300.8,darvnn,0.6848915815353394,Darwi Fish Market,00075573,00075573,27 aug 2018,2018-08-27 00:00:00
50542756,773.82,773.82,amazon,0.9613766074180604,Amazon.com,,,06 august 2018,2018-08-06 00:00:00
52139047,3308.3,3308.3,canned heat enterprises,0.9521486759185792,Canned Heat Enterprises,11291,11291,2018-08-08,2018-08-08 00:00:00
52110949,249.0,249.0,sam pollari,0.7537679672241211,Sam Pollari,,,8/21/18,2018-08-21 00:00:00
50989971,,4467.23,mbmpcanada,0.8606315851211548,MBMP,12033,12033,08/20/2018,2018-08-20 00:00:00
51987116,1087.06,1087.06,eagle repair and maintenance,0.991259217262268,Eagle Repair and Maintenance LLC,2521,2521,,2018-08-20 00:00:00
51899978,,244.85,capitol hardware,0.8102136254310608,Capitol Hardware & Building Supply,,829522,,2018-07-19 00:00:00
52608209,1648.31,1648.31,wolseley canada,0.8219152092933655,Wolseley Canada,7084287,7084287,30 jul 2018,2018-07-30 00:00:00
52236194,15.52,15.52,amazon,0.9976413249969482,Amazon.ca,702-8831754-7788249,702-8831754-7788249,08/18/2018,2018-08-18 00:00:00
51081003,96.6,96.6,goodman distribution,0.7677221298217773,Goodman,232944,232944,07/13/2018,2018-07-13 00:00:00
52737229,3374.5,3374.5,m s international,0.9836814999580384,MSI,1106239740-IN,,"june 15 , 2017",2017-06-15 00:00:00
52163873,9.99,9.99,setapp,0.7666577696800232,Setapp Limited,SA319460X8,SA319460X8,"wed, aug 1, 2018",2018-08-01 00:00:00
50242288,393.24,393.24,nuimpact,0.9490270614624025,NUIMPACT,92814,92814,8/13/2018,2018-08-13 00:00:00
52607963,5424.0,5424.0,allgraphicsupplies,0.9554847478866576,All Graphic Supplies,FINV0216026,FINV0216026,03 august 2018,2018-08-03 00:00:00
51167170,445.96,445.96,adp,0.9992237091064452,Adp,518598396,518598396,05/14/14,2014-05-14 00:00:00
51990775,452.0,452.0,nfit for work,0.9246482253074646,Badger Services,16,16,07/23/2018,2018-07-23 00:00:00
51620340,56.54,56.54,hemisphere freight & brokerage,0.8796846866607666,Hemisphere,01-564045,01-564045,8/20/2018,2018-08-20 00:00:00
50198489,14.49,12.3,booker.co.uk,0.9672658443450928,Booker,3548938,3548938,02-aug-2018,2018-08-02 00:00:00
51678610,852.48,852.48,mrcooper,0.6203165054321289,Mr. Cooper,,,"03 august, 2018",2018-08-03 00:00:00
50404081,2445.51,2445.51,abc supply co,0.9870671033859252,Abc Supply Co,72569874,72569874,"june 4, 2018",2018-06-04 00:00:00
52071965,35.79,35.79,lowes,0.6463741660118103,Lowe's,,02569,jul-31-2018,2018-07-31 00:00:00
51104729,484.0,484.0,eliteequipt,0.7793504595756531,Elite Equipt,001667,001667,6/28/2018,2018-08-04 00:00:00
52114863,88.19,88.19,office depot,0.5941898226737976,Office Depot,,,17/08/2018,2018-08-17 00:00:00
51132332,798.59,798.59,united parcel service,0.7949333190917969,UPS,3066699,,2018-06-26,2018-06-26 00:00:00
52134305,906.06,906.06,e-plas,0.8662428855895996,E-Plas,R12990,R12990,"mar. 12, 2018",2018-03-12 00:00:00
52153007,154.77,154.77,b&d containers,0.9925302863121032,B&D CONTAINERS LTD.,4986,Aug16/18,10/08/2018,2018-08-10 00:00:00
50671177,83.71,83.71,orders.staples,0.987756609916687,Staples,5415859299,,"august, 2018",2018-08-06 00:00:00
52374706,250.0,250.0,thomas hogben,0.6742059588432312,Thomas Hogben,122,122,"january 4, 2018",2018-01-04 00:00:00
51809240,239.49,239.49,globegistics,0.9882165789604188,Globegistics,1823021,1823021,06/08/2018,2018-08-06 00:00:00
51829534,49.0,49.0,sameroom,0.9176042079925536,Sameroom,,,"sun, aug 12, 2018",2018-08-12 00:00:00
51268722,39327.6,39327.6,ameritex pipe & products,0.9872493743896484,Ameritex Pipe & Products,C0003073,C0003073,31-jul-2018,2018-07-31 00:00:00
53024573,7406.06,7406.06,chase,0.8420593142509459,Marriott Rewards,,,8/6/2018,2018-08-06 00:00:00
51555034,9737.95,9737.95,mckesson specialty care dist,0.9930465817451476,McKesson Specialty Care Dist.,315182970,315182970,7/31/2018,2018-07-31 00:00:00
53099687,446.25,446.25,intuit,0.9133076667785645,intuit quickbooks,230013678588,230013678588,07/26/18,2018-07-26 00:00:00
51312447,1386.0,1386.0,vega us,0.9796329736709596,VEGA US LLC,INV-SNU-00485468,INV-SNU-00485468,5/8/2018,2018-05-08 00:00:00
50618284,3300.0,3300.0,"roger mintz, cpa",0.854994535446167,"Roger Mintz, CPA LLC",265680,,06/26/2018,2018-06-26 00:00:00
50925950,2055.35,2055.35,sj display group,0.9645463228225708,SJ Display Group,,20856,07/30/2018,2018-07-30 00:00:00
51626051,71.0,71.0,queuesolutions,0.9997202754020692,Queue solutions,1807713,1807713,2018 07 31,2018-07-31 00:00:00
51028489,92.17,92.17,mendocino community network,0.92792809009552,Mendocino Community Network,1861622,,08/01/2018,2018-08-01 00:00:00
52996013,196.91,196.91,alloys,0.9970337748527528,Alloys,1714606,1714606,23aug18,2018-08-23 00:00:00
52031358,4.95,4.95,mm electrical merchandising,0.7938038110733032,MM Electrical Merchandising,428741-532,428741-532,17/08/2018,2018-08-17 00:00:00
52609669,181.44,181.44,apsley home hardware building centr,0.8582097887992859,Apsley Home Hardware Building Centr,220651,220651,"tue, jul 24, 2018",2018-07-24 00:00:00
51183996,199.06,199.06,mailchimp,0.9930186867713928,MailChimp,MC00875381,MC00875381,7/26/2018,2018-07-26 00:00:00
51347635,562.0,562.0,andrew,0.6648451089859009,Orange Vet Hospital,361860,,13/06/2018,2018-06-13 00:00:00
50998161,302.04,302.04,gm financial,0.7585083842277527,GM Financial,,,7/20/2018,2018-07-20 00:00:00
53036709,83.25,83.25,well being home,0.8262935876846313,Well Being Home Cleaning,000316,000316,05/23/18,2018-05-23 00:00:00
51397458,666.7,666.7,cameron compressor,0.9900868535041808,Cameron Compressor,0000186730,186730,01/08/2018,2018-08-01 00:00:00
50456046,,15.15,locke supply co,0.9821062088012696,Locke Supply Co,34965516-00,34965516-00,08/08/2018,2018-08-08 00:00:00
50606463,108.0,108.0,bankwest,0.6853290200233461,Able Sales,753657,753657,28/07/2018,2018-07-28 00:00:00
52812542,120.75,120.75,cre8iv design studio,0.9584106206893921,cre8iv Design Studio,4668,4668,6/29/2018,2018-07-01 00:00:00
50835795,63.92,63.92,nike australia,0.991759717464447,Nike Australia,9904558639,9904558639,"monday august 13, 2018",2018-08-13 00:00:00
51885810,73.45,73.45,unoimports,0.994176983833313,UNO IMPORTS,0000005409,0000005409,08-10-2018,2018-08-10 00:00:00
51936375,,27.17,gift card reconcile,0.9052528738975524,Gift Card Reconcile,,,07/30/18,2018-07-30 00:00:00
51267196,565.0,565.0,vivek wu,0.7876175045967102,vivek wu,,,8/08/18,2018-08-08 00:00:00
51841980,333.18,333.18,i-xl building products,0.9937164783477784,I-XL Building Products Ltd.,86538,86538,08/10/2018,2018-08-10 00:00:00
52707291,,50.0,chapters,0.9642854928970336,Chapters,,,2018 / 08 / 20,2018-08-20 00:00:00
50323555,170.0,170.0,professional painting services,0.969356119632721,Color Unlimited Painting,825,825,8/23/2018,2018-08-23 00:00:00
51371194,902.12,902.12,r.e. michel company,0.8988010287284851,R. E. Michel Company,25978000,25978000,31/07/18,2018-07-31 00:00:00
50251666,71.87,71.87,staples,0.9952194094657898,Staples,8050533392,8050533392,14 aug 2018,2018-08-14 00:00:00
52255631,74.6,174.6,nick's,0.7886179089546204,Nick's Fastaparcels,INV-6060,INV-6060,07/30/2018,2018-07-30 00:00:00
52411271,569.8,569.8,medsupply partners,0.9337804317474364,MedSupply Partners,181577,181577,2 aug 2018,2018-08-02 00:00:00
51600902,58.92,66.58,lowe's,0.9214391708374025,Lowe's,,02591,"august 14, 2018",2018-08-13 00:00:00
53011193,303.07,303.07,payzant building products,0.9664942026138306,Payzant Building,420381/1,Invoice# 420381/1,08/07/18,2018-08-07 00:00:00
51863091,1.48,1.48,staples,0.9123744368553162,Staples Canada,,,"july 5, 2018",2018-07-05 00:00:00
50784776,20.0,20.0,google asia pacific pte,0.7973047494888306,Google,3481934360,3481934360,"tue, jul 17, 2018",2018-07-17 00:00:00
50967643,193.6,193.6,hertz,0.8760814666748047,Hertz Equipment Rental,61140127-0002,61140127-0002,2018-07-25,2018-07-25 00:00:00
52507507,140.1,140.1,homewood suites,0.9396747350692748,Homewood Suites,,,"august 26, 2018",2018-08-26 00:00:00
51188970,730.36,480.36,american made apparel mfg,0.7793736457824707,W&W Associates,41156,41156,"friday, august 17, 2018",2018-08-18 00:00:00
51463714,5.68,5.68,paybyphone,0.9160286784172058,PayByPhone,383754458,3 August,08/24/2018,2018-08-24 00:00:00
53020060,191.4,191.4,sector nine distribution,0.9859371185302734,Sector Nine Distribution,3529,3529,05/31/16,2016-05-31 00:00:00
51146025,2772.0,2772.0,cloudsolve,0.5776097178459167,Cloudsolve,INV-1342,INV-1342,08/24/2018,2018-08-24 00:00:00
52974912,63.38,63.38,the home depot,0.9686030745506288,The Home Depot,,,july .2018,2018-07-01 00:00:00
51652583,1851.26,1851.26,coenergy propane,0.7313903570175171,coenergy-valley office,,,01/03/14,2014-01-03 00:00:00
52468514,218.89,103.67,eastlink,0.9752179384231568,Tolls,300330762536,300330762536,08/06/2018,2018-08-06 00:00:00
52376311,90.0,90.0,american chaircar services,0.981419026851654,American ChairCar Services,,,9/20/2018,2018-08-21 00:00:00
50593509,71.0,71.0,telstra,0.7498087286949158,Telstra App,4580119,4580119,01/09/18,2018-09-01 00:00:00
50257877,44.98,44.98,bk us,0.8333991765975952,Receipt Bank,65ADC4E-0015,65ADC4E-0015,29/07/2018,2018-07-29 00:00:00
51147605,435.53,435.53,century 21 national,0.763840913772583,Century 21 National Advertising Fund,39150718,39150718,august-14-18,2018-08-14 00:00:00
51478445,565.0,565.0,jade consulting,0.9977897405624392,Jade Consulting,1421,1421,20 august 2018,2018-08-20 00:00:00
51492897,25.0,81.13,harro foods,0.974825084209442,Harro Foods Ltd,,INV741157,feb 20 2016,2016-02-20 00:00:00
51375489,85.18,85.18,amazon,0.9988959431648254,Amazon,113-2500088-8698601,113-2500088-8698601,"august 3, 2018",2018-08-03 00:00:00
51013432,92.07,92.07,sprout social,0.8236748576164246,SproutSocial,1066776,1066776,"aug 10, 2018",2018-08-10 00:00:00
53017801,1572.57,1572.57,unico supply,0.961699903011322,Unico Supply,,,08/15/2018,2018-08-15 00:00:00
52753208,6.18,6.18,uber,0.9972261786460876,uber,,,08/27/2018,2018-08-27 00:00:00
51329662,2198.65,2198.65,bdc,0.8112061619758606,BDC,201815211832,201815211832,,2018-08-24 00:00:00
51394421,1018.86,1018.86,local montreal tours,0.8914221525192261,Local Montreal Tours,,,31/7/2018,2018-07-31 00:00:00
52432823,907.62,907.62,dallas flat glass distributors,0.983234703540802,Dallas Flat Glass Distributors,823115,823115,06 august 2018,2018-08-06 00:00:00
51280205,31.73,31.73,,,KEC Design,INV182107,INV182107,"aug 1, 2018",2018-08-01 00:00:00
50746262,1468.93,1468.93,srinivasan ganesan,0.8119667172431946,Srinivasan Ganesan,,May expenses,"thu, aug 9, 2018",2018-08-09 00:00:00
50699586,25.0,25.0,summit hosting,0.9976635575294496,Summit Hosting LLC,166136,166136,"july 27, 2018",2018-07-27 00:00:00
51111807,141.73,141.73,foodlink,0.9879300594329834,Foodlink,SI791319,SI791319,17 jul 2018,2018-07-17 00:00:00
51444401,17800.0,17800.0,antonio iron works,0.9590879082679749,Antonio Iron Works,,1126,16/8/2018,2018-08-16 00:00:00
52512055,265.84,265.84,etsy,0.814723789691925,Etsy,,,23 aug 2018,2018-08-23 00:00:00
51852909,937.5,937.5,david christensen consulting,0.7836020588874817,David Christensen Consulting,,6/08 - 10/08,"mon, aug 13, 2018",2018-07-26 00:00:00
51204970,288.65,288.65,bc hydro,0.971705436706543,BC Hydro,119009613418,119009613418,06/22/2018,2018-06-22 00:00:00
51810926,,111.56,stephensons,0.9588211178779602,Stephenson's Rental Services,1261041070-0001,1261041070-0001,10 august 2018,2018-08-10 00:00:00
51930365,59.0,59.0,realmac,0.9848538041114808,Realmac,4282159,4282159,"august 11, 2018",2018-08-11 00:00:00
53034566,399.58,54.4,empire supply co,0.970689296722412,Empire Supply Co Inc.,1808-129473,1808-129473,31/07/2018,2018-07-31 00:00:00
51777537,495.0,495.0,intersect bookkeeping services,0.9802916646003724,Intersect Bookkeeping Services,IBS-2132,IBS-2132,"fri, aug 17, 2018",2018-08-17 00:00:00
50766776,495.0,495.0,feedonomics,0.986500322818756,Feedonomics,1787-0397,Amex 1787-0397,30 jun. 2018,2018-06-30 00:00:00
52223455,5.25,5.25,parkx mobile pay,0.914699137210846,ParkX Mobile Pay,116033374,116033374,15/08/18,2018-08-15 00:00:00
50178142,18.33,18.33,city of charlotte,0.8690487742424011,City of Charlotte,,,08/08/2018,2018-08-08 00:00:00
51088138,2843.48,2843.48,meineke car care centre,0.8980924487113953,Meineke Car Care Centre - Cash Expense,2-323709,,,2018-08-06 00:00:00
50495643,16.13,16.13,express courier,0.7564996480941772,LSO Final Mile,162567,162567,09/08/2018,2018-08-09 00:00:00
50229651,7.4,7.4,paymentlogic,0.9902785420417786,Payment Logic,107489,107489,2018 / 08 / 11,2018-08-11 00:00:00
52652941,749.0,749.0,inc/colorado events,0.9321086406707764,Colorado Events LLC,11730,11730,07/24/2018,2018-07-24 00:00:00
50978875,397.47,397.47,upwork,0.9936044216156006,Upwork,T180664046,T180664046,"friday, august 24, 2018",2018-08-24 00:00:00
51952927,432.0,432.0,ithos global,0.8128462433815002,"Ithos Global, Inc.",012-0618-05,012-0618-05,,2018-06-30 00:00:00
52738371,-106.73,106.73,bpsp,0.5771964192390442,Medical Z,102476,102476,"august 11, 2018",2018-08-16 00:00:00
51397024,130.24,130.24,pedego,0.9888622164726256,Pedego Inc,IN4671,IN4671,"august 16, 2018",2018-08-16 00:00:00
50857706,990.0,990.0,foggedinbookkeeping,0.9416201710700988,Nantucket Data Platform,267,267,,2018-06-22 00:00:00
52989110,445.72,445.72,basf australia,0.9798465371131896,Basf Australia,6533535684,6533535684,21aug2018,2018-08-21 00:00:00
51990188,695.0,7599.46,atomas productions,0.8879423141479492,Atomas Productions,,,"july 18, 2018",2018-07-18 00:00:00
51199337,1520.39,1520.39,waxcenter,0.9142872095108032,European Wax Center,SIN284612,SIN284612,"aug 8, 2018",2018-07-31 00:00:00
50699213,20.36,20.36,bell media,0.9122453927993774,Bell Media,0685027600,0685027600,08/07/2018,2018-08-07 00:00:00
51438934,5431.61,5431.61,ace department of homeland security,0.784288227558136,Department of Homeland Security,,,14/08/2018,2018-08-14 00:00:00
51850836,116.23,116.23,microsoft,0.9931636452674866,Microsoft,E05006H37C,E05006H37C,"mon, aug 27, 2018",2018-08-27 00:00:00
50702876,102.25,102.25,google,0.9941225051879884,Google,3483894997,3483894997,08/06/2018,2018-08-06 00:00:00
51787913,35.88,35.88,emu australia,0.9030023217201232,EMU Australia,2016932,2016932,8/15/2018,2018-08-15 00:00:00
52646084,1034.25,1034.25,boost human external cargo systems,0.9268527030944824,Boost Human External Cargo Systems,183,183,07/25/2018,2018-07-25 00:00:00
50924961,1555.0,1555.0,sax international,0.9817339777946472,Sax International Pty Ltd,,,jul 05 2018,2018-07-05 00:00:00
50911070,162.5,162.5,the doney law firm,0.9925772547721864,the doney law firm,1252,1252,08/13/2018,2018-08-13 00:00:00
50439159,3600.0,3600.0,dattner consulting,0.9959181547164916,Dattner Consulting LLC,73118,73118,19 jul 2018,2018-07-19 00:00:00
52030711,14.97,14.97,the home depot,0.9686959385871888,The Home Depot,,20180815,08/08/2018,2018-08-08 00:00:00
50195829,,114.36,roberts,0.953750729560852,Roberts Limited,,,"aug 10, 2018",2018-07-31 00:00:00
52761218,14.99,14.99,apple,0.9902779459953308,Apple,118224046208,118224046208,07/27/2018,2018-07-27 00:00:00
52807546,98.34,98.34,webstaurantstore,0.9837836027145386,Webstaurantstore.com,34090587,34090587,"monday, august 6, 2018",2018-08-06 00:00:00
51877190,175.0,175.0,aaa electronic services,0.8944060206413269,AAA Electronic Services Inc,011667,W33586,10/08/2018,2018-08-10 00:00:00
52286387,5327.27,5327.27,581719,0.9671583771705629,581719,6751441179,6751441179,"friday, august 3, 2018",2018-08-03 00:00:00
52988440,3551.4,3551.4,h&r block,0.8528487682342529,H&R Block,,1-15,12.08.2018,2018-08-12 00:00:00
51126554,71.82,71.82,,,Tops Market,,,7/18/2018,2018-08-10 00:00:00
52192890,35.4,35.4,oxagon,0.9658770561218262,Oxagon,18/OX010068,18/OX010068,20/08/18,2018-08-20 00:00:00
52549657,3068.84,3068.84,cpawebengage,0.7524368166923523,CP Awebengage,5737,5737,"august 1, 2018",2018-08-01 00:00:00
51213145,,4436.1,"masterpurveyors,com",0.6801601648330688,"Master Purveyors, Inc.",,C43693,8/20/2018,2018-08-20 00:00:00
51717706,111.87,111.87,shout media,0.9816433191299438,Shout Media,0008849,0008849,13.07.2018,2018-07-13 00:00:00
52570375,10.49,10.49,delta,0.7950942516326904,Delta,,,31/07/2018,2018-07-31 00:00:00
50927120,30000.0,30000.0,rewardstyle,0.6603760719299316,Rewardstyle,C16368,C16368,13-08-2018,2018-08-13 00:00:00
51257331,317.11,317.11,mcmaster-carr,0.9913913011550904,McMaster-Carr,,,23-08-2018,2018-08-23 00:00:00
51327776,-12.15,12.15,beach &bush distributors,0.9806762337684632,Beach & Bush Distributors,401374,401374,08/06/2018,2018-08-06 00:00:00
50670694,,943.39,best buy,0.9678215980529784,Best Buy,BBY01-805553307224,,03-08-2018,2018-03-08 00:00:00
50866630,912.7,912.7,dominiontrading,0.9790289402008056,Dominiontrading.com,10189,10189 Copy,07/31/2018,2018-07-31 00:00:00
52118442,3782.56,3782.56,cibc,0.8521855473518372,Cibc,,,"august 21, 2018",2018-08-21 00:00:00
50871026,1940.0,2767.23,wilson sonsini goodrich & rosati,0.8590096235275269,Wilson Sonsini Goodrich & Rosati,1967563,1967563,"mon, jul 30, 2018",2018-07-30 00:00:00
51757051,399.99,399.99,noel leeming,0.9189842343330384,Noel Leeming,132139336,132139336,20/08/2018,2018-08-20 00:00:00
52164331,982.84,982.84,tle electrical,0.9549670219421388,TLE ELECTRICAL,247196-252,247196-252,2/2/2018,2018-02-02 00:00:00
52705644,221.89,221.89,keystone automotive industries,0.8856689929962158,Keystone Automotive Industries ON Inc.,TR361992,TR361992,17/07/2018,2018-07-17 00:00:00
52617437,640.17,640.17,andersonpumphouse,0.9708406925201416,Anderson Pump House Ltd.,IN420981,IN420981,"aug 2, 2018",2018-08-02 00:00:00
51282978,,9070.48,shield restraint systems,0.8268060684204102,Shield,,267318,07/18/2018,2018-07-18 00:00:00
53104679,6322.71,6322.71,the original cone co,0.9628955125808716,The Original Cone Co,INV-2280,,"jul 23, 2018",2018-07-23 00:00:00
51874840,463.34,463.34,united bank,0.9778184294700624,United Bank - Loans,VCR##0007141963202013081018,,jul14 2018,2018-07-10 00:00:00
51945991,103.47,103.47,oz north festival,0.9618149995803832,OZ North Festival food & liquor wholesalers,,975394,16 jun 2018,2018-06-16 00:00:00
51413344,112.61,112.61,westcoast strata management services,0.8268555998802185,Westcoast Strata Management Services Inc.,6689,6689 3 Morgan,6.22.18,2018-06-22 00:00:00
50834755,1046.51,1046.51,yarra valley water,0.991657018661499,Yarra Valley Water,,,"september 27, 2016",2016-09-27 00:00:00
50665810,1429.45,1429.45,ledgers,0.9869667291641236,Ledgers,1734,1734,7/5/2018,2018-07-05 00:00:00
52126262,6909.52,6909.52,qualitylifecares,0.9969417452812196,QualityLife,INV0261542,inv0261542,08/14/2018,2018-08-14 00:00:00
52675126,430.43,430.43,woodward meat purveyors,0.9910475611686708,Woodward Meat Purveyors,116551,116551,03 august 2018,2018-08-03 00:00:00
52052691,600.0,600.0,emily marucci,0.9969542622566224,EMILY MARUCCI,2,VAR-BND-2,"august 3, 2018",2018-08-03 00:00:00
50985437,358.2,358.2,innisfial,0.8567765951156616,The Town of Innisfail,1019981,1019981,,2018-07-31 00:00:00
50269797,141.33,141.33,sherwin-williams,0.9936110377311708,Sherwin-Williams Co.-Govt,,9025-2 072618,31/07/2018,2018-07-31 00:00:00
50467691,159.64,159.64,facebook ads,0.8664965033531189,Facebook,9A3WHGELU2,9A3WHGELU2,,2018-07-31 00:00:00
52488485,8.58,8.58,screwfix-ilford,0.7225656509399414,Screwfix,0905586042,0905586042,04/24/2018,2018-04-24 00:00:00
51301641,200.0,200.0,stamps,0.9849526286125184,Stamps,,,"july 18, 2018",2018-07-18 00:00:00
52239180,800.0,800.0,all trans,0.9529217481613159,All Trans,0070538-CM,0070538,8/27/2018,2018-08-27 00:00:00
50877681,10337.68,10337.68,the eight,0.9884160161018372,The Eight Limited Partnership,4961,4961,08/05/2018,2018-08-05 00:00:00
50259790,165.96,165.96,paypal,0.995487630367279,Paypal,,,"thursday, august 2, 2018",2018-08-02 00:00:00
52568062,911.9,911.9,videoconferencegear,0.8294383883476257,Video Conference Gear.com,9000,9000,,2018-07-15 00:00:00
52790221,6.99,6.99,amazon.co.uk,0.9929278492927552,Amazon.co.uk,203-4509314-7311537,203-4509314-7311537,08/01/2018,2018-08-01 00:00:00
50898408,126.71,126.71,ooma,0.9847606420516968,Ooma,BILL-255-CWXO5YN58TPLY3LZL,BILL-255-cwxo5yn58tply3lzl,,2018-07-04 00:00:00
53102937,8010.76,8010.76,wagepoint,0.8988325595855713,Wagepoint,,,08/23/2018,2018-08-23 00:00:00
52453587,373.0,373.0,telstra,0.9800926446914672,Telstra,149 852 591-9,P 149 852 591-9,7/25/18,2018-07-25 00:00:00
50318226,1660.5,1660.5,bradypeopleid,0.9984338283538818,Brady People  ID,9337737938,9337737938,08/8/2018,2018-08-08 00:00:00
51315061,1.06,1.06,debits,0.7294365167617798,Parking,,,08/09/2018,2018-08-09 00:00:00
52975514,4.66,4.66,amazon,0.9408731460571288,Amazon,AEU-INV-GB-2018-9809647,AEU-INV-GB-2018-9809647,13 aug 2018,2018-08-13 00:00:00
52402112,682.5,682.5,gurkha building services,0.9934895634651184,Gurkha Building Services Ltd,1254,1254,2018-08-08,2018-08-08 00:00:00
51269816,63.94,63.94,the home depot,0.934064507484436,The Home Depot,,,8/20/2018,2018-08-20 00:00:00
50828363,13110.27,13110.27,bradnams windows and door,0.9169005751609802,Bradnam's Windows & Doors,,,jul 16,2016-07-18 00:00:00
51904728,1149.21,1149.21,caffe vita,0.995276927947998,Caffe Vita,537886,537886,4/20/2018,2018-07-01 00:00:00
50157177,39.95,39.95,great excavations,0.5874652862548828,Great Excavations Inc,,,"thursday, august 2, 2018",2018-08-02 00:00:00
52099783,2041.91,2041.91,dufferin concrete,0.9928011298179626,Dufferin Concrete,706227230,706227230,july 02,2018-07-02 00:00:00
50836338,120.0,120.0,lions club of wyoming,0.7671513557434082,B&W,4850696,4850696,13 jul 2018,2018-07-13 00:00:00
51507030,4.99,4.99,email.apple,0.9707621335983276,Apple,148215859876,MMJSD59181,"aug 4, 2018",2018-08-04 00:00:00
53098340,34082.52,34082.52,rivapak,0.9857457876205444,Rivapak,,,"tue, aug 21, 2018",2018-08-21 00:00:00
50765436,262.5,262.5,priceisrightcomputers,0.9953173398971558,Priceisrightcomputers.com,36239,36239,17 august 2018,2018-08-17 00:00:00
51938974,246.8,246.8,electrical safety authority,0.9995102882385254,Electrical Safety Authority,97474099,97474099,"tue, aug 7, 2018",2018-08-07 00:00:00
53029900,30618.87,30618.87,rbcbank,0.568023145198822,Rbc Bank,,,08/03/2018,2018-08-03 00:00:00
51983286,17.84,17.84,1300ozetel,0.977664589881897,Ozetel Pty Ltd,1006328998,1006328998,31jul18,2018-07-31 00:00:00
51497399,329.03,329.03,nationwide,0.912100613117218,Nationwide Insurance,,,07/24/2018,2018-07-24 00:00:00
51845760,3500.0,3500.0,mario de jesus chi vela,0.8497429490089417,Mario De Jesus Chi Vela,,1,,2018-07-26 00:00:00
50606926,,409.07,,,Unique Health Products,,486112,"august 8, 2018",2018-08-08 00:00:00
52898456,7.0,7.0,adp,0.9998882412910458,"ADP, LLC",495497956,495497956,"aug 14, 2018",2018-08-14 00:00:00
52178815,781.0,781.0,dial a dump industries,0.9022492766380308,Dial A Dump Industries,IN00151662,IN00151662,"tue, jul 17, 2018",2018-07-17 00:00:00
51887928,2213.67,2213.67,knitca,0.8462615609169006,Knitca,7724,7724,,2018-08-06 00:00:00
50218022,835.54,835.54,fuji xerox,0.9593243598937988,FUJI XEROX,506959,506959,december 2018,2018-12-10 00:00:00
51260087,3327.31,3327.31,hilton chicago,0.7218772172927856,Hilton,,,12/06/2018,2018-06-12 00:00:00
51434793,108.2,108.2,amazon,0.9982655644416808,Amazon,112-7546632-7764200,112-7546632-7764200,25 jul 2018,2018-07-25 00:00:00
52414504,2509.6,2509.6,pro-line shipping,0.9574685096740724,Pro-line Shipping,PLS-AR013858,PLS-AR013858,08/06/2018,2018-08-06 00:00:00
51610071,147.7,147.7,dynamex,0.7489780783653259,Dynamex,2304640,2304640,28-jul-2018,2018-07-28 00:00:00
51621470,819.22,819.22,perkins,0.9935351610183716,Perkins Paper LLC - Centre,187845072,187845072,08/15/18,2018-08-15 00:00:00
51615899,783.0,783.0,"lbmc, pc",0.8347502946853638,"LBMC, PC",10497153,10497153,"thu, aug 2, 2018",2018-08-02 00:00:00
50223090,780.74,780.74,felice's place gourmet butchers,0.9147427082061768,Felice's Place Gourmet Butchers,3432522,3432522,08-02-2018,2018-08-02 00:00:00
53018727,44.56,44.56,berger hardware - hawthorne,0.9163283705711364,Berger Hardware Hawthorne,,,8/13/18,2018-08-06 00:00:00
52692445,,7625.65,einsure,0.6670800447463989,Hunter Premium,,,"fri, aug 3, 2018",2018-08-03 00:00:00
51887892,37.14,37.14,andrew sheret,0.9997711181640624,Andrew Sheret,22-092892,22-092892,17/08/2018,2018-08-17 00:00:00
50790773,6614.07,6614.07,2 guys with knives,0.7668542861938477,2 Guys With Knives,564,564,"aug 7, 2018",2018-08-07 00:00:00
51847038,99.0,99.0,hipaasecurenow,0.69130939245224,HIPPA Secure Now,20445241-20837851,20445241-20837851,,2018-07-11 00:00:00
52477243,2952.81,2952.81,beckman coulter,0.97818261384964,Beckman Coulter,107233452,107233452,08/15/2018,2018-08-15 00:00:00
51522271,34.94,34.94,windstream,0.9928407669067384,Windstream,,570-568-0041-08/18,,2018-04-13 00:00:00
51797434,,16018.57,business health trust commission,0.686024010181427,Business Health Trust,,,05/06/2018,2018-06-05 00:00:00
52437194,117.6,117.6,booktopia,0.93377947807312,Booktopia,7698806,Credit card,"wed, aug 8, 2018",2018-08-08 00:00:00
52461207,175.82,175.82,fastplast,0.9703179001808168,FastPlast Building Supplies,281045,281045,08/01/18,2018-08-01 00:00:00
52513584,19.85,19.85,connect logistics services,0.9933000206947328,Connect Logistics Services,,20180805,"july 23, 2018",2018-07-23 00:00:00
50228355,6490.0,6490.0,zrest furniture,0.993239164352417,ZRest Furniture,5340,5340,"august 9, 2018",2018-08-09 00:00:00
52636796,429.4,429.4,tpl installations,0.9872412681579592,Tpl Installations,TPL2017-109,TPL2017-109,19/07/18,2018-07-19 00:00:00
51517933,228.65,228.65,mountain rose herbs,0.987552523612976,Mountain Rose Herbs,R067693019,,31-07-2018,2018-07-31 00:00:00
51062170,25946.85,25946.85,ups,0.985588014125824,UPS,0000031,0000031f31527,"july 3, 2018",2018-07-03 00:00:00
52882287,99.9,99.9,image solutions,0.986345112323761,Image Solutions,3597457,3597457,14-aug-18,2018-08-14 00:00:00
51228882,1130.0,1130.0,big hit corporate,0.9295344948768616,Big Hit Corporate Inc.,1020,1020,31.08.18,2018-07-23 00:00:00
53043253,,8987.21,little rae's bakery,0.9768158793449402,Little Rae's Bakery,2224,2224,08/23/2018,2018-08-23 00:00:00
52716121,60.47,60.47,w.b.mason,0.9490889310836792,W.B. Mason,I57963434,I57963434,31 jul 2018,2018-07-31 00:00:00
51895027,642.97,642.97,,,Code Electrical Inc.,91613,91613,07/17/2017,2017-07-17 00:00:00
51887693,585.41,585.41,facebook,0.9426438808441162,Facebook Ads,UNL8LFE382,,08/01/2018,2018-08-01 00:00:00
51199247,980.0,980.0,designer express services,0.9924104809761048,Designer Express Services,15191,15191,"august 20, 2018",2018-08-20 00:00:00
51055640,,7806.03,soccer taco,0.6260894536972046,Soccer Taco,,,24 june 2018,2018-06-24 00:00:00
51477276,360.02,360.02,archangel academy,0.8591524362564087,Archangel Academy For Gifted,806700489,806700489,"tuesday, july 17, 2018",2018-07-20 00:00:00
51885586,-932.4,932.4,soskids,0.9558134078979492,Sos Safety Magazine,67901,67901,"aug 07, 2018",2018-08-07 00:00:00
51793882,2.98,2.98,surfers coffee bar,0.9875550866127014,Surfers Coffee Bar,,,08/10/2018,2018-08-10 00:00:00
52321403,11.88,11.88,p&r electrical wholesalers,0.9919344782829284,P&R Electrical Wholesalers,30551576,30551576,26/07/2018,2018-07-26 00:00:00
52609630,247.81,247.81,apsley home hardware building centr,0.8517457842826843,Apsley Home Hardware Building Centr,216685,216685,08/27/18,2018-08-27 00:00:00
52750833,25884.95,25884.95,pax,0.674763560295105,Pax,1200005670,1200005670,31jul18,2018-07-31 00:00:00
51416815,10.0,174.02,xcel source,0.9888095855712892,Xcel Source,1403047,1403047,07/31/2018,2018-07-31 00:00:00
53005962,97.3,97.3,amazon,0.8948923349380493,Amazon,,1RCY-69W7-JXGT,"sunday, april 15, 2018",2018-04-15 00:00:00
51760833,530.0,530.0,select hire,0.9828919768333436,Select Equipment,00021133,00021133,,2018-05-07 00:00:00
50370895,315.0,315.0,the electric blacksmith,0.99098801612854,The Electric Blacksmith Ltd.,TEB-160,TEB-160,"august 25, 2018",2018-08-25 00:00:00
50747769,443.63,443.63,the home depot,0.9211562871932985,The Home Depot,,,2018-07-30,2018-07-30 00:00:00
51799362,21.62,21.62,amazon,0.9979613423347472,Amazon,112-1941728-2981005,112-1941728-2981005,"fri, jun 22, 2018",2018-06-22 00:00:00
51251253,2518.1,2518.1,baileymade,0.8861549496650696,Bailey,00006253,00006253,8/1/2018,2018-08-01 00:00:00
50769203,310.75,310.75,bin there dump that,0.975416660308838,bin there dump that,285514,285514,26/07/2018,2018-07-26 00:00:00
52209890,9285.73,9285.73,ken's roofing supplies,0.9990932941436768,Ken's Roofing Supplies Ltd.,0000208924,0000208924,8/13/2018,2018-08-13 00:00:00
51591624,2.79,2.79,google,0.9804799556732178,"Google, LLC",SOP.3320-8578-3548-32772..16,,"aug 8, 2018",2018-08-08 00:00:00
51320322,1072.5,1072.5,blue chip bookkeeping services,0.984066128730774,Blue Chip Bookkeeping Services,11071,11071,"june 30, 2018",2018-06-30 00:00:00
51825465,44.36,44.36,amazon,0.9966632723808287,Amazon,112-6278277-1067445,112-6278277-1067445,08/06/2018,2018-08-06 00:00:00
52999161,47.31,47.31,superbiiz,0.6949036717414856,Elliot Hutchens,9DG72613Y4884414V,,,2012-12-06 00:00:00
51758397,126.57,126.57,bunnings,0.9860891103744508,Bunnings,6400/01768056,6400/01768056,8/8/2018,2018-08-08 00:00:00
50545774,90.55,90.55,the home depot,0.8965546488761902,Home Depot,,,08/13/18,2018-08-13 00:00:00
52631752,2.0,2.0,paybyphone,0.9119352102279664,Paybyphone,388478108,,07-aug-2018,2018-08-07 00:00:00
51943045,12.01,12.01,uber,0.9929295778274536,Uber,,,08/16/2018,2018-08-16 00:00:00
51527713,170.97,170.97,bad,0.6123425960540771,Bad Axe Throwing,,,23-aug-2018,2018-08-23 00:00:00
50706848,7.0,7.0,edm epark,0.8256612420082092,Edm Epark,179181,179181,"jul 30, 2018",2018-07-30 00:00:00
52042064,80.95,80.95,intuit's,0.614169716835022,Quickbooks,,,15 aug 2018,2018-08-15 00:00:00
51206065,173.0,173.0,ree,0.5321621298789978,Keating Dental Arts,,1013265,"fri, aug 3, 2018",2018-08-03 00:00:00
52631227,3000.0,3000.0,russ ruffino,0.6089947819709778,david fry,10357,,07/27/2018,2018-07-27 00:00:00
50722957,1061.67,1061.67,griff building supplies,0.9634513854980468,Griff Building Supplies,A332643,A332643,6/27/1,2018-06-27 00:00:00
53012291,483.75,483.75,charles faram brewing supplies,0.9815306067466736,Charles Farm Brewing Supplies Inc,CFBIN005399,CFBIN005399,"friday, august 3, 2018",2018-08-03 00:00:00
50302413,215.0,215.0,support.alldata,0.9905699491500854,ALLDATA,,,08/08/2018,2018-08-08 00:00:00
50782077,894.83,585.71,kindersley transport,0.9754740595817566,Kindersley Transport Ltd.,R1435550,116813715,07/31/2018,2018-07-31 00:00:00
50945829,66.0,66.0,essential safety solutions,0.9975086450576782,Essential Safety Solutions,INV-19692,INV-19692,07/10/2018,2018-07-10 00:00:00
51249651,10740.27,10740.27,campbell's carting,0.9915021061897278,Campbells Carting,INV-0093,INV-0093,aug 16 2018,2018-08-16 00:00:00
50834791,24.99,24.99,transaction pro,0.699783444404602,Transaction Pro,,PPH Tampa 080318,19 june 2018,2018-06-19 00:00:00
52570188,414.9,414.9,synergy,0.9984339475631714,Synergy,2224511657,2224511657,"fri, aug 24, 2018",2018-08-24 00:00:00
52218161,108.28,108.28,elliottelectric,0.978325605392456,Elliottelectric,66-56502-01,66-56502-01,17 february 2018,2018-02-17 00:00:00
52308284,12.5,12.5,bananatag systems,0.9852372407913208,Bananatag Systems,117505,117505,08/01/18,2018-08-01 00:00:00
51295746,110.34,110.34,at&t,0.8895710706710815,AT&T,,,"aug 05, 2018",2018-08-05 00:00:00
52505309,99.21,99.21,staples,0.9439825415611268,Staples Canada,5411718903,5411718903,"august 8, 2018",2018-08-10 00:00:00
52621253,650.0,650.0,all trans,0.9506517052650452,All Trans,0070654-CM,0070654,"thu, aug 23, 2018",2018-08-23 00:00:00
51836325,45.43,45.43,sysco,0.987278938293457,Sysco,7819996,7819996,07/10/2018,2018-07-10 00:00:00
52015077,12946.86,12946.86,u.s. bank,0.8842507600784302,US Bank,,,2018-08-17,2018-08-17 00:00:00
53020915,171.0,171.0,natp,0.7334190011024475,NATP,21529387,21529387,1/2/2017,2017-01-02 00:00:00
53060508,633.09,1266.18,american,0.6781816482543945,American Airlines,,ZOXQSL-1,08/16/2018,2018-08-16 00:00:00
51497064,58.0,58.0,berlin95,0.9905005693435668,Berlin95,,,5/29/2018,2018-05-29 00:00:00
51295533,-99.1,99.1,the rental,0.862446665763855,The Eagle Leasing Company,RI1071097,RI1071097,"may 23, 2018",2018-05-23 00:00:00
50815861,11.0,11.0,digitalocean,0.9744839668273926,DigitalOcean,,,2018/08/22,2018-08-22 00:00:00
50917160,82.31,82.31,home depot,0.6314576268196106,The Home Depot,29203,29203,19/08/2018,2018-08-19 00:00:00
51912613,69.04,69.04,eversource,0.9842432141304016,EVERSOURCE,,,08/02/2018,2018-08-02 00:00:00
50847652,220.94,220.94,sendgrid,0.9172979593276978,Sendgrid,P-03688630,P-03688630,"may 1, 2018",2018-05-01 00:00:00
51256526,870.0,870.0,oxygen sales & service,0.9943928122520448,Oxygen Sales & Service,31227,31227,31/07/2018,2018-07-31 00:00:00
52712335,6.25,6.25,vintage coffee roasters,0.9963645339012146,Vintage Coffee Roasters,00407G,,08/08/2018,2018-08-08 00:00:00
50702472,7.12,7.12,856494,0.9854456782341005,856494,6748498253,6748498253,"august 1, 2018",2018-08-01 00:00:00
51621447,256.25,256.25,benson,0.9338757395744324,Benson,85544093,85544093,13/08/2018,2018-08-13 00:00:00
51156023,66.0,66.0,sharesight,0.9953476190567015,Sharesight,311803,311803,"july 10, 2018",2018-07-10 00:00:00
52278848,10120.0,10120.0,n&b scaffold,0.9691739082336426,n&b scaffold,170245,170245,"august 1, 2018",2018-08-01 00:00:00
51403390,60.74,60.74,seller locker,0.8371791243553162,Seller Locker LLC,2933,2933,2/21/2012,2012-02-21 00:00:00
51211641,-17200.0,17200.0,,,Bank of Stockton,,,08/18/2018,2018-08-18 00:00:00
52594165,2037.46,1996.71,mckesson,0.9441115260124208,McKesson,7888067779,7888067779,2 august 2018,2018-08-02 00:00:00
52583904,12.95,12.95,canva,0.9810916781425476,Canva,02054-3353202,02054-3353202,"july 31, 2018",2018-07-31 00:00:00
50562910,66.41,66.41,arnoldsales,0.7732013463973999,Arnold sales,1250293-2,1250293-2,"august 15, 2018",2018-08-15 00:00:00
52331638,166.75,166.75,bidfood,0.967970848083496,Bidfood,46027676,46027676,07/27/2018,2018-07-27 00:00:00
51480738,228.5,228.5,mckinley plumbing services,0.982886016368866,McKinley Plumbing Services,16846,16846,"wed, aug 1, 2018",2018-08-01 00:00:00
53041073,804.44,804.44,expedia,0.9157852530479432,Expedia,,,8/17/2018,2018-08-17 00:00:00
52333569,,17.0,parrilla,0.6152248382568359,Drew Thompson,,30339,"friday, august 24, 2018",2018-08-24 00:00:00
51344263,40.86,40.86,chouchou foods,0.991277813911438,Chouchou foods,0449,0449,8/1/2018,2018-08-01 00:00:00
51771965,56.7,56.7,the home depot,0.9198060631752014,The Home Depot,,,07/27/2018,2018-08-03 00:00:00
51899906,5253.99,5253.99,liquor distribution branch,0.6560738682746887,BC Liquor Distribution Branch,,,8/09/18,2018-08-09 00:00:00
52438050,,3317.14,xero,0.9184747338294984,Xero,INV-6688854,6688854,20-08-2018,2018-08-20 00:00:00
52820584,24.04,24.04,lakesidefasteners,0.9974967837333679,Lakeside Fasteners Ltd.,289702,,2018/08/21,2018-08-21 00:00:00
52272391,394.2,394.2,qantas,0.7434272766113281,Qantas,59621386271,QACT9A3GR,7/31/18,2018-07-31 00:00:00
52024904,1445.98,1445.98,bair products,0.980816125869751,Bair Products,3029,3029,7/30/2018,2018-07-30 00:00:00
51048496,,90.59,camscanner,0.636422336101532,Lotua Indian Groceries,,04/08/18,"august 3 , 2018",2018-08-03 00:00:00
52598508,100.0,100.0,florida department of revenue,0.9604288339614868,Florida Department of Revenue,248319623418,248319623418,07/31/18,2018-07-31 00:00:00
52427916,103.72,25.93,city water international,0.954081118106842,City Water International Inc.,1471969,1471969,2/17/18,2018-02-17 00:00:00
51830929,157.5,157.5,,,EMCO Corporation,79441880-00,79441880-00,"tue, aug 21, 2018",2018-08-21 00:00:00
51880314,34.39,34.39,upwork,0.9937295913696288,Upwork,T192650142,T192650142,08/02/2018,2018-08-02 00:00:00
52727210,,331.8,,,Keystone,,,27/04/2018,2018-04-27 00:00:00
51963377,47.8,47.8,officeworks,0.9968750476837158,Officeworks,,,7/08/2018,2018-08-07 00:00:00
52439623,2150.4,2150.4,madegoods,0.6155778765678406,Made Goods,A103990-APP,A103990-APP,08/05/2018,2018-08-05 00:00:00
51020557,,1784.82,chase paymentech,0.8876206278800964,chase,,,31/07/2018,2018-07-31 00:00:00
52119970,3802.45,3802.45,ellenor developments,0.8966817855834961,Ellenor Developments,486960,486960,9/9/2016,2016-09-09 00:00:00
52005166,163.7,163.7,freshfarm markets,0.9957091212272644,FRESHFARM Markets Inc.,DP24N180805,DP24N180805,08/09/2018,2018-08-09 00:00:00
50854924,10740.0,10740.0,zhou,0.5447156429290771,Dongguan Compro Electronic Technology,,50% deposit,07/31/2018,2018-07-31 00:00:00
51048063,499.0,499.0,supporting strategies,0.9957711100578308,Supporting Strategies,1460,1460,08/22/18,2018-08-22 00:00:00
50252024,339.15,339.15,splashtop,0.8702110648155212,Splashtop,,,"friday, august 3, 2018",2018-08-03 00:00:00
52387443,-10.0,13.5,youcanbookme,0.9421663880348206,YouCanBookMe Ltd,KGRC3346,KGRC3346,14/08/18,2018-08-14 00:00:00
52805409,132.0,132.0,vacua-therm sales,0.945055902004242,Vacua-Therm Sales Ltd.,S13861,S13861,02 1,2018-08-02 00:00:00
52851624,1715.97,1715.97,action gypsum supply,0.969014048576355,Action Gypsum Supply,HOU00550171-001,HOU00550171-001,26 aug 2018,2018-08-26 00:00:00
50220034,442.09,442.09,mainfreight,0.8634464144706726,Mainfreight,02289652,02289652,"monday, august 13, 2018",2018-08-13 00:00:00
51381726,56207.5,56207.5,ropes & gray,0.9822402000427246,Ropes & Gray,1158561,1158561,"19 jul, 2018",2018-07-18 00:00:00
52239881,2833.58,2833.58,island paws veterinary hospital,0.9022830128669742,02-Daily Deposit Reports,,,30 april 2018,2018-04-30 00:00:00
50984059,117.0,117.0,city-wide fire protection,0.9980769157409668,City-Wide Fire Protection,59896,59896,04/20/2016,2016-04-20 00:00:00
51145006,15.97,15.97,maclean timber & hardware,0.9948665499687196,Maclean Timber & Hardware,0-1442512,0-1442512,01-08-18,2018-08-01 00:00:00
52676129,,74.37,swreg,0.7873562574386597,PDFXChange Editor,U7949007002,,31/07/2018,2018-07-31 00:00:00
50859994,181.49,181.49,uline,0.9988207817077636,Uline,4522381,4522381,08/03/18,2018-08-03 00:00:00
51967971,94.93,94.93,technolust,0.7532795667648315,Jerk Pay,,,08/01/2018,2018-08-01 00:00:00
52195325,2178.41,2178.41,kloeckner metals,0.9048770666122437,Kloeckner Metals,9131154,9131154,8/23/2018,2018-08-23 00:00:00
52711456,207.9,207.9,yoggu foods,0.9630300998687744,Yoggu,1065,1065,23/07/2018,2018-07-23 00:00:00
51605079,81.94,381.94,tilemastercanada,0.7196480631828308,tilemaster,820176,820176,08/23/2018,2018-08-23 00:00:00
52359450,1887.74,1887.74,sqm constructions,0.9653242826461792,SQM Constructions,159,159,08/14/2018,2018-08-14 00:00:00
52056424,2283.75,2283.75,alex nagel,0.9933412671089172,Nagel Design,0309,0309,,2018-07-01 00:00:00
51655603,26.52,26.52,facebook,0.920209527015686,Facebook Ads,K6HUZFALA2,K6HUZFALA2,june-14-18,2018-06-14 00:00:00
52365827,,32.28,uber,0.8757305145263672,Uber,,,23.08.2018,2018-08-23 00:00:00
51702745,135.73,135.73,apple,0.8810743093490601,Apple Glendale Galleria,,,7/31/18,2018-07-31 00:00:00
53081451,14.99,14.99,zoom video communications,0.7272930741310121,Zoom,,,08/23/2018,2018-08-23 00:00:00
52015009,218.04,218.04,orders.staples,0.9799118638038636,Staples,5415926666,5415926666,"august 25, 2018",2018-08-25 00:00:00
50950942,713.5,603.5,acis,0.8172403573989868,ACIS,526010,526010,"jul 23, 2018",2018-07-23 00:00:00
53112830,640.71,640.71,cyc design corporation,0.99642413854599,Cyc Design Corporation,SI-1015121,SI-1015121,13/08/2018,2018-08-13 00:00:00
53091338,402.6,402.6,boc,0.9785692095756532,BOC,,4020273773,,2016-02-09 00:00:00
50811049,40.15,40.15,j&r cooke trading,0.982860803604126,J&R Cooke Trading P\L,10716992,10716992,07/27/18,2018-07-27 00:00:00
52087873,159.9,159.9,hubspot,0.9798330664634703,HubSpot Billing,713155,713155,"july 18, 2018",2018-07-18 00:00:00
53049713,6.1,6.1,hydro one,0.959196388721466,Hydro One,,,11-aug-2018,2018-08-11 00:00:00
50350226,178.0,178.0,snappy internet and telecom,0.9884183406829834,Snappy Internet and Telecom,14522,14522,"jul 31, 2018",2018-07-31 00:00:00
50746462,565.0,565.0,atlantic presenters association,0.9920450448989868,Atlantic Presenters Association,8031,8031,,2018-08-09 00:00:00
51170574,121.05,121.05,the home depot,0.9445835947990416,The Home Depot,,,2017-10-01,2017-10-01 00:00:00
50432962,1569.0,1569.0,"robert ""s"" irrigation",0.9451493620872498,Robert S Irrigation,283,283,08-03-18,2018-08-03 00:00:00
51872435,33.6,45.31,royalty networks,0.9973993301391602,ROYALTY NETWORKS,RN-20180728-367,RN-20180728-367,"wed, aug 1, 2018",2018-08-01 00:00:00
50155248,1365.76,1365.76,us foods,0.9993047118186952,US Foods,4483036,4483036,7 aug 2018,2018-08-07 00:00:00
51002413,,566.32,sobeys,0.9542956948280334,Lumsden,33974148,33974148,08 august 2018,2018-08-08 00:00:00
51144413,68.4,68.4,van wegens continental bakery,0.9909992814064026,Van Wegen's Continental Bakery,INV-16983,INV-16983,08/17/18,2018-08-17 00:00:00
52084938,12232.0,12232.0,alan hajje,0.8615921139717102,Sydney Excavator,815,INV 815,"sunday, august 19, 2018",2018-08-19 00:00:00
51506153,500.0,500.0,rebecca and bryden,0.8396430611610413,Receipt,1229,1229,jul 27,2018-07-27 00:00:00
50199296,10.65,10.65,home depot,0.677562415599823,Home Depot,05312,,08/24/2018,2018-08-24 00:00:00
50255212,208.08,208.08,rodrigo rochin,0.9676539301872252,Upwork_STAT,T184513591,T184513591,"sun, aug 26, 2018",2018-08-26 00:00:00
50775781,180.0,180.0,vipcolor technologies usa,0.9349168539047241,Vipcolor Technologies Usa,S2018-00712,S2018-00712,,2018-07-28 00:00:00
52543888,7.74,7.74,zoom video communications,0.9000455737113953,Zoom Video Communications,INV03977209,INV03977209,7/25/2018,2018-07-25 00:00:00
51547844,272.25,272.25,premium linen services,0.9896782040596008,Premium Linen Services,INV-49910,INV-49910,2018/08/09,2018-08-09 00:00:00
51729908,4541.82,4541.82,facebook ads,0.8555957674980164,Facebook,,,18/06/2018,2018-07-01 00:00:00
50828693,1415.16,1415.16,bowens,0.9143808484077454,Bowens,14697028,14697028,08/23/18,2018-08-23 00:00:00
51847016,283.24,283.24,"kidkraft netherlands, bv",0.8095139861106873,KidKraft,0000524899,0000524899,20-08-18,2018-08-20 00:00:00
52449159,89.78,89.78,ideal electrical suppliers,0.8963794112205505,Ideal Electrical Suppliers,13318284,13318284,05/25/2018,2018-05-25 00:00:00
53073897,,1246.7,bravo group,0.7921798229217529,Bravo Group Real Estate,,2018-06,8/2/2018,2018-08-02 00:00:00
52370560,39.97,39.97,tm.vistaprint,0.9901345372200012,Vista Print,LRZZP-X4A60-9Q5,,"august 4, 2018",2018-08-04 00:00:00
51351233,6.5,6.5,institute of certified bookkeepers,0.7518389821052551,ICB Member Services,753821,753821,08/14/18,2018-08-15 00:00:00
51815029,25.0,25.0,github,0.9953237175941468,Github,MMJ43EPR,MMJ43EPR,"saturday, july 28, 2018",2018-07-28 00:00:00
51260199,108.55,108.55,,,Iggy's,2880510,2880510,26 april 2018,2018-04-26 00:00:00
50548354,300.0,300.0,max media of hampton roads,0.9741150140762328,Max Media Of Hampton Roads Llc,280781,280781,07/01/2018,2018-07-01 00:00:00
51547359,264.26,264.26,stramit corporation,0.7316093444824219,Stramit Corporation Pty Ltd,107052291,107052291,"thu, aug 16, 2018",2018-08-16 00:00:00
50754231,10.26,10.26,sargents sales & rental,0.9973170161247252,Sargents Sales & Rental,B38317,B38317,04/08/18,2018-08-04 00:00:00
52995388,508.5,508.5,2561396 ontario,0.8732261657714844,2561396 Ontario Inc,1083,1083,"wed, aug 1, 2018",2018-08-01 00:00:00
53008881,539.28,539.28,ultimate laser,0.9160433411598206,Ultimate Laser,244934,244934,28 june 2018,2018-08-22 00:00:00
51159746,2059.41,2059.41,lake cathie medical centre,0.9917758107185364,Lake Cathie Medical Centre,759,Inv 759,2/03/2018,2018-03-02 00:00:00
51201501,397.22,397.22,allen,0.5600930452346802,"Allen Tate at Phillips Place, LLC",080618.MONTE,080618.Monte,"july 18, 2018",2018-07-18 00:00:00
50680186,9.94,9.94,the,0.5925713181495667,The Home Depot,,,"february 28, 2018",2018-02-28 00:00:00
52300146,1638.23,1638.23,river source,0.9748206734657288,"River Source, LLC",M-12418B,M-12418B,07/31/18,2018-07-31 00:00:00
50169875,519.8,519.8,revel cider company,0.892647385597229,Revel Cider Co.,1737,1737,"aug 20, 2018",2018-08-20 00:00:00
51433840,13526.87,13526.87,everly howison,0.9961611032485962,Everly Howison,INV-1006,INV-1006,2/29/2016,2016-02-29 00:00:00
53058005,129.0,129.0,,,Anheuser Busch,563884,563884,08/09/18,2018-08-17 00:00:00
51593452,568.32,568.32,wells fargo,0.9138391613960266,Wells Fargo,,,08/17/2018,2018-08-17 00:00:00
52342021,108.11,108.11,amazon,0.9960806965827942,Amazon,114-1310598-7692246,,"wednesday, june 13, 2018",2018-06-13 00:00:00
52597403,226.17,226.17,google,0.7714395523071289,Google,,,27/08/2018,2018-08-27 00:00:00
52608800,134.02,134.02,echo rental & supply,0.9656699299812316,Echo Rental & Supply,227196,227196,8/13/18,2018-08-13 00:00:00
50219499,31.51,31.51,facebook,0.9659695625305176,Facebook,,,"fri, aug 24, 2018",2018-08-24 00:00:00
51349959,149.47,149.47,nte.works/notifications,0.8091158270835876,Nte,10152151,10152151,"august 3 , 2018",2018-08-03 00:00:00
50266421,33.23,33.23,mclendon hardware-puyallup,0.9341837167739868,McLendon Hardware-Puyallup,H09067,H09067,18/08/2018,2018-08-21 00:00:00
52245277,354.1,354.1,a professional image,0.9738311767578124,A Professional Image_STAT,141108012017,141108012017,31/07/2018,2018-07-31 00:00:00
51548793,888.2,888.2,progressive land management,0.9510526061058044,"Progressive Land Management, Inc",10381,10381,7/26/2018,2018-07-26 00:00:00
52606127,64.41,64.41,biochemicals,0.5386707782745361,Nucro Technics,SI-540879,SI-540879,04/30/18,2018-04-30 00:00:00
52933016,48.42,48.42,the home depot,0.9768620133399964,Home Depot,,,08/07/2018,2018-08-07 00:00:00
52301547,475.55,475.55,yuens,0.9752851724624634,Yuens,1038454,1038454,"august 4, 2018",2018-08-04 00:00:00
51375480,11.59,11.59,amazon,0.9984747767448424,Amazon,113-6405864-9836229,113-6405864-9836229,"august 02, 2018",2018-08-02 00:00:00
52477071,43.34,43.34,amazon,0.9969632625579834,Amazon,111-1297320-2589035,111-1297320-2589035,22 aug 2018,2018-08-22 00:00:00
52009681,,2467.5,,,mobank,,Aug int,"fri, aug 10, 2018",2018-08-10 00:00:00
53102800,360.0,360.0,thorne widgery,0.6845647096633911,Thorne Widgery,I000277,I000277,31-07-2018,2018-07-31 00:00:00
52255903,4.99,4.99,expensify,0.9914872646331788,Expensify,,,14-aug-2018,2018-08-14 00:00:00
52061246,22.0,22.0,5dpackages,0.9850529432296752,5dpackages,006930,,31 jul 2018,2018-07-31 00:00:00
51212935,8.0,8.0,uberx,0.9838429689407348,uber,,,"monday, august 20, 2018",2018-08-20 00:00:00
51612181,-35.75,35.75,union gas,0.9895752668380736,Union Gas,,,"august 2, 2018",2018-07-31 00:00:00
50489777,268.24,268.24,pacificplumbing,0.6503246426582336,Pacificplumbing,06261534,06261534,"fri, aug 10, 2018",2018-08-10 00:00:00
53025521,2217.2,2217.2,the cellular connection,0.9991750121116638,The Cellular Connection,279146-I,279146-I,7/31/2018,2018-07-31 00:00:00
52977753,10000.0,10000.0,facebook ads,0.8710433840751648,Facebook,,,08/24/2018,2018-08-24 00:00:00
52641956,153.6,153.6,,,Visiontron Corp.,653840,653840,6 aug 2018,2018-08-06 00:00:00
52844463,,500.0,statebank,0.5893023014068604,StateBank,,,"august 3, 2018",2018-08-03 00:00:00
50849757,152.06,149.02,mckesson,0.884943425655365,McKesson,7884673933,7884673933,"august 3, 2018",2018-08-17 00:00:00
50306432,376.2,376.2,american airlines,0.9407169222831726,American Airlines,,XAFRNZ,14/08/2018,2018-08-14 00:00:00
51062157,6305.0,6305.0,ups supply chain solutions,0.8395672440528871,UPS,3943111034,3943111034,07/31/2018,2018-07-31 00:00:00
50767894,1752.89,1752.89,dhl,0.9643969535827636,"DHL Express (Canada), Ltd.",YUL0001430333,YUL0001430333,30/07/2018,2018-07-30 00:00:00
52320770,444.41,444.41,p&r electrical wholesalers,0.9913913011550904,P&R Electrical Wholesalers,30535298,30535298,,2018-07-31 00:00:00
52564602,29.5,29.5,arlparra community store,0.8923208117485046,Arlparra Community Store,02492377,02492377,8/13/18,2018-08-13 00:00:00
52008591,293.97,293.97,fog river,0.9948110580444336,Fog River,1110234,1110234,jul-02-2018,2018-07-02 00:00:00
52064403,20.0,27.01,constant contact,0.9423834681510924,Constant Contact,,,8/24/18,2018-08-24 00:00:00
52700550,69.95,69.95,kents h hardware,0.6050482988357544,Kents H Hardware (Kents Building Supplies),HARDWARE_INVOICE_NO_72895,Hardware_Invoice_No_72895,8/16/18,2018-07-16 00:00:00
51890226,9.0,9.0,creative market,0.9801641702651978,Creative Market,80924999,,7/27/2018,2018-07-27 00:00:00
51390512,79.0,79.0,tiffedit,0.7729110121726991,Graphic Region,BI24525556,BI24525556,"thu, aug 23, 2018",2018-08-23 00:00:00
52988523,15180.0,15180.0,tonic the agency,0.8679627776145935,Tonic The Agency Pty Ltd,00004864,00004864 CoV,08/15/2018,2018-08-15 00:00:00
51005835,7.85,7.85,emcoltd,0.509992241859436,Emco Corporation,38171387-00,38171387-00,8/2/2018,2018-08-02 00:00:00
50492250,698.6,698.6,nobel biocare canada,0.6527277231216431,Nobel Biocare Canada Inc.,3511068894,3511068894,08/01/18,2018-08-01 00:00:00
52428352,62.05,62.05,amazon,0.5842409133911133,Amazon,,,"wed, mar 21, 2018",2018-03-21 00:00:00
52438701,10976.53,10976.53,2320472 ontario,0.7746244072914124,2320472 Ontario,2362,2362,,2018-07-27 00:00:00
52380102,53.91,131.88,secureship®,0.9984092712402344,Secureship.ca,10431820180820,10431820180820,31/07/2018,2018-07-31 00:00:00
52361490,50004.9,50004.9,mastercoat,0.9484978914260864,Mastercoat Powdercoating,00013422,00013422,"august 20, 2018",2018-08-20 00:00:00
51302652,69.09,69.09,ideal supply,0.9976066946983336,Ideal Supply Inc.,5105892,5105892,"wed, aug 1, 2018",2018-08-01 00:00:00
52766473,14628.86,14628.86,c.f.h. retail,0.9708648920059204,C.F.H. Retail,105-2018-09,105-2018-09,08/15/2018,2018-08-15 00:00:00
52584252,122.32,122.32,windsor powdercoating,0.9976686835289,Windsor Powdercoating,INV-22380,INV-22380,8/22/2018,2018-08-08 00:00:00
51258918,8347.34,8347.34,canadianlinen,0.9716659784317015,Canadian Linen & Uniform Service,,,08/17/2018,2018-08-17 00:00:00
50887291,62.19,62.19,george slomp,0.896833598613739,Central Builders Home Hardware Supply,313639,313639,8/3/2018,2018-08-03 00:00:00
52041634,11.69,11.69,amazon,0.9985300898551941,Amazon.com,113-7840350-3599466,113-7840350-3599466,1 jul 2018,2018-07-01 00:00:00
53005077,56.25,56.25,ventraip australia,0.8327115774154663,VentraIP Australia Pty Ltd,4553244,4553244,"august 10, 2018",2018-08-10 00:00:00
51147104,462.0,462.0,,,Perth Sign Installations,564,564,"july 6, 2018",2018-07-06 00:00:00
52107683,16.32,16.32,namecheap,0.9926493763923644,Namecheap,,,06/20/18,2018-06-20 00:00:00
51307970,752.28,752.28,booker,0.9869080185890198,Booker,3410151,,"july 27, 2018",2018-07-27 00:00:00
50269874,359.9,359.9,steam whistle brewing,0.9902348518371582,Steam Whistle Brewing,,,20 aug 2018,2018-08-20 00:00:00
52475324,33.09,66.18,lanternpay,0.7435766458511353,Lantern Pay,,TAC20180821FNBENEJ,8/5/2018,2018-08-05 00:00:00
52712698,583.08,583.08,kunkel bus lines,0.9927955865859984,Kunkel Bus LInes,47418,47418,"5march, 2018",2018-03-05 00:00:00
51589539,4271.63,4271.63,nedco-div.of,0.9900519251823424,Nedco,,,9 aug 2018,2018-08-09 00:00:00
51027341,,35466.46,0suntrust merchant,0.7905752658843994,Suntrust Merchant -6882,,,"wed, aug 1, 2018",2018-08-01 00:00:00
52507162,,409.69,power breaker,0.9720668792724608,Power Breaker LLC.,,88817,,2018-05-18 00:00:00
51190935,34.98,34.98,city clean,0.9865490198135376,City Clean,323846,323846,,2018-07-20 00:00:00
50630910,1050.0,1050.0,"holdings, mandy harding",0.6866394877433777,interac,,,21/08/2018,2018-08-21 00:00:00
50329437,479.92,479.92,inner city,0.6664695143699646,ICRS,13643,13643,08/14/18,2018-08-14 00:00:00
52390068,247.53,247.53,verizon,0.9928234815597534,Verizon,,,21-jun-18,2018-06-21 00:00:00
50781909,1875.0,1875.0,telpay,0.7703828811645508,Highland PCN,021,2018-08-01,08/10/18,2018-08-10 00:00:00
51293203,320.0,320.0,tiger mobile detailing,0.9396421909332277,Tiger Mobile Detailing,,,5/2/18,2018-05-02 00:00:00
51291241,1147.95,1147.95,paypal,0.975165605545044,PayPal,,,"august 6, 2018",2018-08-06 00:00:00
52175161,228.0,228.0,quicksilver connections,0.8159732818603516,Great Adventures,221332,221332,22-aug-2018,2018-08-27 00:00:00
52991262,38.6,38.6,astoria,0.7331230044364929,Astoria Paper Products Pty Ltd,IN526619,IN526619,16/08/2018,2018-08-16 00:00:00
52423828,339.0,339.0,plas-tech,0.9180392026901244,Plas-Tech,IN-123695,IN-123695,31/07/2018,2018-07-31 00:00:00
50838683,315.19,315.19,marketing group,0.9640613794326782,Marketing Group,162461,162461,jun 19 2018,2018-06-19 00:00:00
51826772,10.0,10.0,deer valley mail,0.9849920272827148,Deer Valley Mail,,,20 aug 2018,2018-08-20 00:00:00
51007381,7221.84,7221.84,dead sea warehouse,0.9768890738487244,Dead Sea Warehouse,70378,70378,31/07/2018,2018-07-31 00:00:00
50307918,131.6,131.6,fogged in bookkeeping,0.9957088232040404,"Fogged In Bookkeeping, Inc.",18744,18744,06/07/2018,2018-06-07 00:00:00
52567429,371.57,371.57,ecr4kids,0.9944440722465516,ECR4Kids,741110,741110,08/01/18,2018-08-01 00:00:00
50876611,19.8,19.8,google,0.9019683003425598,Google Ireland Limited,3482392155,3482392155,"thu, aug 2, 2018",2018-02-01 00:00:00
50769075,,41.9,easytrip,0.9881476163864136,Easy Trip,10571063,10571063,"fri, aug 10, 2018",2018-08-10 00:00:00
51444495,,110.0,golden state elevator,0.9920042157173156,"Golden State Elevator, Inc",00812118,00812118,"august 24, 2018",2018-08-24 00:00:00
50195969,25.34,25.34,wally's place,0.9878244400024414,Wally's Place,163032,,27/07/18,2018-07-27 00:00:00
51660989,75.53,75.53,gibbs parts,0.9687303900718688,Gibbs Parts,1241541,1241541,,2018-08-15 00:00:00
51212455,186.0,186.0,better-it,0.9593498706817628,Better-It,INV-11059,INV-11059,28/07/201,2018-07-28 00:00:00
52425682,945.78,945.78,broadway bank,0.95073801279068,Broadway Bank,,,07/30/2018,2018-07-30 00:00:00
51785726,39.99,39.99,amazon,0.9967390894889832,Amazon.ca,702-0721610-6080221,702-0721610-6080221,"tue, jul 31, 2018",2018-07-31 00:00:00
52253442,67.08,67.08,doordash,0.8866876363754272,Door Dash,,,,2018-08-13 00:00:00
51860714,2514.25,2514.25,bles biochemicals,0.6091310381889343,Nucro Technics,SI-540603,SI-540603,31/07/2018,2018-07-31 00:00:00
52435889,200.0,550.0,arrowhead dj,0.9940876960754396,Arrowhead DJ,,180904 J2 Sunderland/Castellano,07/01/2018,2018-07-01 00:00:00
52587582,1524.1,1524.1,synnex canada,0.9967171549797058,Synnex Canada,45547717,45547717,27 jul 2018,2018-07-27 00:00:00
52417487,33.35,29.99,lipman & wolf,0.8382334113121033,GSO - Golden State Overnight,3703438,3703438,"august 20, 2018",2018-08-20 00:00:00
50921763,,49759.8,toast,0.8633584976196289,Toast,,,"july 28, 2018",2018-07-28 00:00:00
50844720,127.97,127.97,paypal,0.9959254860877992,Paypal,,,"sat, aug 4, 2018",2018-08-04 00:00:00
52074747,1720.0,1720.0,ant enterprizes,0.6992720365524292,Ant Enterprises Australia Pty Ltd,R083532,R083532,1/31/2018,2018-01-31 00:00:00
51757130,989.0,989.0,the ascii group,0.9441359639167786,"The ASCII Group, Inc.",110695,110695,"august 7, 2018",2018-08-07 00:00:00
52037848,275.0,2248.0,invisalign,0.7670423984527588,Invisalign Store,,,"july 30, 2018",2018-07-30 00:00:00
50578083,150.09,150.19,,,CDCR Report,,,7/24/2018,2018-07-24 00:00:00
51418402,21383.7,21383.7,dr. aman bhopal,0.8501072525978088,Amandeep Bhopal Professional Corporation,,,04/21/2018,2018-04-21 00:00:00
52464407,9.0,9.0,rebecca sardoma,0.972575843334198,Upwork,T192911166,T192911166,aug 01 2018,2018-08-01 00:00:00
51823912,5315.26,5315.26,king taco restaurants,0.999714732170105,"King Taco Restaurants, Inc.",000361364,000361364,7/31/2018,2018-07-31 00:00:00
51070229,200.0,200.0,vinterchange,0.9536375403404236,"Vinterchange, Inc",,4286,11/08/2018,2018-08-11 00:00:00
50757478,86.44,86.44,general parts,0.6920605301856995,General Parts Group,5977517,5977517,"july 31, 2018",2018-07-31 00:00:00
52214050,19249.08,19249.08,performance controls,0.9955237507820128,Performance Controls,10133-SB,10133-SB,,2018-07-30 00:00:00
51847499,2281.17,2281.17,spruson & ferguson,0.9044177532196044,Spruson & Ferguson,1534818,1534818,25/06/2018,2018-06-01 00:00:00
52668510,4079.9,4079.9,am & tj bird otisa,0.8003884553909302,Forbes Livestock & Agency Co.,8381,,"apr. 14, 2018",2018-04-14 00:00:00
52438953,,1134.96,soho beach,0.5735988616943359,Soho Beach House,,,"aug 20, 2018",2018-08-20 00:00:00
51209374,450.0,450.0,olivo financial services,0.9180359840393066,Olivo Financial Services,1613,1613,"wed, aug 15, 2018",2018-08-15 00:00:00
53096361,21.32,21.32,google,0.9921011924743652,Google,2124018987084611-4,2124018987084611-4,08/02/2018,2018-08-02 00:00:00
51212952,331.0,331.0,manhattan fruit exchange,0.9935877919197084,Manhattan Fruit Exchange,1008566,1008566,,2013-12-11 00:00:00
52652489,17.25,17.25,virginia american water,0.980218231678009,Virginia American Water,,,28/08/2018,2018-08-28 00:00:00
52782953,39.6,39.6,petries mitre 10,0.9821122288703918,Petries Mitre 10,2-1543948,2-1543948,16 aug 2018,2018-08-16 00:00:00
52378411,42.23,42.23,pharmachoice canada,0.9883646965026855,PharmaChoice,204070,204070,01-05-2018,2018-05-01 00:00:00
52069227,3470.81,3470.81,precision business solutions,0.996120274066925,Precision Business Solutions,190207,190207,08/16/2018,2018-08-16 00:00:00
52086377,65.61,65.61,winsupply las vegas,0.941844642162323,WINSUPPLY OF LAS VEGAS,297762 00,297762 00,"monday, august 20, 2018",2018-08-20 00:00:00
52318788,419.79,419.79,workcover queensland,0.9075103998184204,WorkCover Queensland,,,"august 16, 2018",2018-08-16 00:00:00
52359078,126.5,126.5,deca australia,0.7305408120155334,Cjd Equipment Pty. Ltd.,009105444,9105444,2018/07/27,2018-07-27 00:00:00
51713081,,97.22,mail.etsy,0.9374072551727296,Etsy,1348016531,,10/04/2016,2016-10-04 00:00:00
50441569,11.96,11.96,johnson equipment company,0.9789138436317444,Bill Johnson Equipment company,144831,144831,01/24/2013,2013-01-24 00:00:00
53056911,,93363.49,,,KeyBank,,,8/15/2018,2018-08-15 00:00:00
52803276,154.79,154.79,amazon,0.9982314705848694,Amazon,112-4414498-4817816,112-4414498-4817816,2018-08-02,2018-08-02 00:00:00
51316166,79.1,79.1,ace sports,0.9938136339187622,Ace Sports Clinic,4167924223,15412,"august 5, 2018",2018-08-06 00:00:00
52507361,315.61,315.61,dimar,0.6390457153320312,Dimar Construction,339833,339833,07/26/2018,2018-07-26 00:00:00
51934215,3327.5,3327.5,lavin plumbing,0.8670894503593445,Lavin Plumbing Pty Ltd,50,50,31-jul-18,2018-08-01 00:00:00
52330062,136.11,120.0,linkt,0.6530868411064148,Linkt,4123538244,,,2018-08-15 00:00:00
52502916,15.0,15.0,the new york times co,0.8921507596969604,The New York Times Co.,,7544dca32a9a4507739bbe,15aug18,2018-08-15 00:00:00
51205525,52.0,52.0,big greta,0.9918229579925536,Big Greta,,,7/31/2018,2018-07-31 00:00:00
50232489,47.99,47.99,paypal,0.9963960647583008,Paypal,,,09-aug-18,2018-08-09 00:00:00
52610272,315.21,315.21,landscapelethbridge,0.960025191307068,Scenic Drive Landscape Centre,31047,31047,2018 / 08 / 24,2018-08-24 00:00:00
51294463,17.62,17.62,agropur cooperative natrel division,0.8305765390396118,Agropur Cooperative Natrel,128236,128236,07/29/18,2018-07-29 00:00:00
52211404,377.24,377.24,unishippers,0.9589772820472716,Unishippers,222799424,222799424,7/25/2018,2018-07-25 00:00:00
50280120,160.0,160.0,sylvia tobar,0.9888999462127686,Sylvia Tobar,220,220,"july 4, 2018",2018-07-04 00:00:00
51215478,1212.5,1212.5,singapore,0.6318274736404419,Faithfull The Brand,INV-8483,INV-8483,aug-17-2018,2018-08-17 00:00:00
51907056,15.0,15.0,st hubertus wild game,0.7546233534812927,St. Hubertus Wild,000044,000044,13 august 2018,2018-08-13 00:00:00
52758842,1479.0,1479.0,wsm international,0.9829154014587402,WSM Internation,50412,50412,08/17/18,2018-08-17 00:00:00
51727343,8981.77,8981.77,dell,0.8374314904212952,Dell,,,04.03.2018,2018-03-04 00:00:00
51921117,15.35,15.35,uberx,0.9908432960510254,Uber,,,14 aug 2018,2018-08-14 00:00:00
51238626,612023.94,603579.11,bell potter,0.7347210049629211,Bell Potter,,,6 aug 2018,2018-08-06 00:00:00
52080666,612.63,612.63,pfizer australia,0.98698890209198,Pfizer,6748883989PF,6748883989PF,8/16/2018,2018-08-16 00:00:00
51401587,47.75,47.75,tall tree lumber,0.9944416880607604,Tall Tree Lumber LTd.,1808-006389,1808-006389,"august 17, 2018",2018-08-17 00:00:00
50389906,105.0,105.0,benson seymour,0.9943331480026244,Benson Seymour,18839,18839,06/01/18,2018-06-01 00:00:00
52526503,325.0,325.0,atlassian,0.9984317421913148,Atlassian,AT-60549080,AT-60549080,08/28/2018,2018-08-28 00:00:00
52751098,30.45,30.45,shopify,0.976305902004242,Shopify,,,"january 12, 2018",2018-01-12 00:00:00
52765734,915.3,915.3,virtuous bookkeeping,0.9862357974052428,Virtuous Bookkeeping,3511,3511,"wed, aug 22, 2018",2018-08-22 00:00:00
51429799,5.0,5.0,woodstock natural health clinic,0.8685679435729979,Woodstock Natural Health Clinic,INV8181,INV8181,"tue, aug 21, 2018",2018-08-21 00:00:00
52808258,482.4,482.4,delta air lines,0.7403809428215027,Delta Air Lines,,,8/23/2018,2018-06-06 00:00:00
52771564,,93.85,eventbrite,0.8420568704605103,Eventbrite,,792419201,08/07/2018,2018-08-07 00:00:00
50726164,5999.52,5999.52,americanexpress,0.9786518216133118,American Express,,,31/07/2018,2018-07-31 00:00:00
50612875,10666.22,10666.22,kelmatt industries,0.8675575852394104,Kelmatt,,,07/30/18,2018-07-30 00:00:00
50566288,20.0,20.0,strathcon,0.710912823677063,Strathcon Industries,334438,334438,"wed, aug 8, 2018",2018-08-08 00:00:00
53091353,2425.5,2425.5,mary sarroff,0.9914171695709229,mary sarroff,331,331,02/08/2018,2018-08-02 00:00:00
51046724,1350.0,1350.0,themarketingindex,0.9593519568443298,The Marketing Index,11,11,08/03/2018,2018-08-03 00:00:00
50547530,12.6,12.6,uber,0.9920641183853148,UBER,,,08/20/2018,2018-08-20 00:00:00
51769065,6.37,6.37,pservicemobile,0.5360523462295532,pservicemobile,,,08/01/2018,2018-08-01 00:00:00
50263750,98.02,98.02,hallmark awards,0.8445910811424255,Caldwell Recognition,0000383772,0000383772,8/2/2018,2018-08-02 00:00:00
51811047,,2611.85,alphabroder canada,0.8758379220962524,AlphaBroder Canada,E27228020,E27228020,30 july 2018,2018-07-30 00:00:00
51896466,329.98,329.98,incremental media,0.9523306488990784,Incremental Media,10546,10546,31/07/18,2018-07-31 00:00:00
50808020,5866.06,5866.06,executive flight centre fuel services,0.9289767146110536,Executive Flight Centre Fuel Services Ltd,SI220201,SI220201,13 august 2018,2018-08-13 00:00:00
51066863,35.89,35.89,rasier operations b.v,0.9209277033805848,Uber,FNEFDYYE-03-2018-0000500,FNEFDYYE-03-2018-0000500,8/18/2018,2018-08-18 00:00:00
52907989,134.38,134.38,amazon,0.9989123344421388,amazon.ca,701-6931227-7550661,701-6931227-7550661,"august 10, 2018",2018-08-10 00:00:00
52702495,91.44,91.44,ringcentral,0.9854021072387696,Ring Central,1391515024,,28 aug 2018,2018-08-28 00:00:00
51363506,203.3,203.3,ingram,0.9034478664398192,Ingram Micro Global Services BV,2018SICA0012660,2018SICA0012660,18jul18,2018-07-18 00:00:00
50442397,118.82,118.82,taylor-davis,0.7463133335113525,Taylor Davis Ltd,1B185421RN9299821,,03/08/18,2018-08-03 00:00:00
51279177,1947.88,1947.88,shane lindsay,0.973378598690033,Shane Lindsay,42,42,,2018-07-10 00:00:00
51848596,525.8,525.8,wired automotive electrics,0.8238641619682312,Wired Automotive Electrics,INV-0089,INV-0089,30/07/2018,2018-07-30 00:00:00
50980563,1636.02,0.0,custom quality pools,0.998568058013916,"Custom Quality Pools, Inc.",,,16/07/2018,2018-07-16 00:00:00
51737822,520.0,21997.31,u.s. bank,0.944411277770996,US Bank,,,"23 march, 2018",2018-04-06 00:00:00
52435830,133.11,133.11,bon accord products,0.977684199810028,Bon Accord Products Ltd,759260,759260,08/01/2018,2018-08-01 00:00:00
52004894,6547.12,6547.12,gensco,0.997215449810028,"Gensco, Inc.",848298221,848298221,"jun 2, 2018",2018-06-02 00:00:00
52963021,,2.98,telus,0.9651037454605104,Telus,,,30/07/2018,2018-07-30 00:00:00
51305560,214.0,214.0,queuesolutions,0.9996355772018432,Queue solutions,1807540,1807540,8/5/2018,2018-08-05 00:00:00
51805630,4.19,4.19,itunes and app store,0.8675822019577026,Itunes and App Store,,,8/15/2018,2018-08-15 00:00:00
51285965,229.95,229.95,,,The Juice Truck,21473,21473,"wednesday, august 22, 2018",2018-08-22 00:00:00
52139354,245.25,245.25,407etr,0.978700578212738,407 ETR,,,"july 27, 2018",2018-07-27 00:00:00
52567103,90.0,90.0,sunshine coast 4wd wreckers,0.8913593292236328,Sunshine Coast,23345,23345,"august 1, 2018",2018-08-01 00:00:00
51073161,210.0,210.0,slickdata,0.9971989393234252,Slickdata LLC,11205,11205,"tuesday, july 31, 2018",2018-07-31 00:00:00
52709410,109.65,109.65,watt,0.9700698852539062,ATT_Caeveo,287284977146X08172018,287284977146X08172018,1 aug 2018,2018-08-01 00:00:00
52302253,6.0,6.0,paybyphone,0.965600311756134,PayByPhone,387455993,387455993,14 aug 18,2018-08-14 00:00:00
50315382,181.07,181.07,eecol electric,0.9931215643882751,Eecol Electric,VI 0406968,VI 0406968,"wed, aug 15, 2018",2018-08-15 00:00:00
50835390,346.5,346.5,aaa metal suppliers,0.8339680433273315,AAA Metal Suppliers,SI-00001845,SI-00001845,"friday, august 10, 2018",2018-08-09 00:00:00
51917469,99.9,12.0,intuit,0.9046288132667542,Quickbooks,210012876045,210012876045,19/06/18,2018-06-19 00:00:00
50190617,127.97,127.97,paypal,0.9962894320487976,Paypal,,,"mon, jul 30, 2018",2018-07-01 00:00:00
51458821,236.5,236.5,central telecoms,0.9979901313781738,Central Telecoms,63122,63122,7/13/18,2018-07-13 00:00:00
51718541,157.7,78.85,yarra valley milk,0.985576629638672,Yarra Valley Milk,2379662,2379662,"august 10, 2018",2018-08-10 00:00:00
52712996,4.57,4.57,rona,0.9957621097564696,RONA,514-17246191,514-17246191,07/31/2018,2018-07-31 00:00:00
52378877,266.5,266.5,keller supply company,0.9909366369247437,Keller Supply Company,S012199318.001,S012199318.001,8/9/2018,2018-08-09 00:00:00
52771013,136.08,136.08,coopervision,0.9802064299583436,Coopervision,62353165,111 62353165,08/19/2018,2018-08-19 00:00:00
51212594,194.08,194.08,csl business machines,0.5646747946739197,CSL group,1088663,1088663,"august 16, 2018",2018-08-16 00:00:00
52563799,122.38,122.38,dulux,0.991604208946228,DULUX,474311101,474311101,02/20/2018,2018-02-20 00:00:00
52661597,28000.0,28000.0,capitalone,0.9852024912834167,Capital  One,,,08/23/2018,2018-08-23 00:00:00
50920746,99.2,99.2,mb labs,0.5871884226799011,Sabinca Distributors,140779,,1/8/18,2018-08-01 00:00:00
50955104,244.16,244.16,montgomery pacific corporation,0.999605357646942,Montgomery Pacific Corporation,2018-2035,2018-2035,8/21/18,2018-08-21 00:00:00
51248216,231.09,231.09,kegstar,0.9971767067909241,Kegstar,INV-149836,INV-149836,"august 24, 2018",2018-08-24 00:00:00
50680579,54.52,54.52,when i work,0.997677206993103,When I Work,4295445,4295445,08/14/2018,2018-08-14 00:00:00
50316032,27.6,27.6,gilmours.co.nz,0.9944126605987548,Gilmours,4102076815,4102076815,"july 27, 2018",2018-07-27 00:00:00
51262425,31.98,31.98,amazon,0.9981270432472228,Shay Shnet,702-5505938-8545846,702-5505938-8545846,06/30/2018,2018-06-30 00:00:00
51374857,920.97,920.97,soper's supply,0.8127956390380859,Soper's Supply Ltd,,,7/30/2018,2018-07-30 00:00:00
53027697,178.53,178.53,homedepot,0.5699591040611267,Home Depot,,,05.08.2018,2018-08-05 00:00:00
51776687,1849.02,1849.02,one graphics,0.8410780429840088,SNZ Trading Inc,25241,25241,07/31/2018,2018-07-31 00:00:00
50757532,1457.12,1457.12,lincoln road chapel,0.9175048470497132,Lincoln Road Chapel,166,166,8/4/2018,2018-08-04 00:00:00
51326943,569.4,569.4,the original cone co,0.9839852452278136,The Original Cone Co,INV-2333,INV-2333,14.12.2017,2017-12-14 00:00:00
51400759,75.65,75.65,bell,0.9662121534347534,Bell,,,"august 21, 2018",2018-08-21 00:00:00
52190610,86.07,86.07,,,EMCO Corporation,82059490-00,82059490-00,7/30/2018,2018-07-30 00:00:00
52202108,3.25,3.25,mums the word,0.9586523771286012,Mums the word,,,"may 31, 2018",2018-05-31 00:00:00
52767882,30844.0,30844.0,a.j. grant building,0.9163101315498352,AJ Grant Building,,,"friday, august 3, 2018",2018-08-03 00:00:00
50915924,1000.0,1000.0,ann petrone,0.9135183095932008,Ann Petrone,AP2018-07,AP2018-07,07/26/18,2018-07-26 00:00:00
51222014,129.95,129.95,moneythumb,0.9605995416641236,Money Thumb,36437,,08/03/18,2018-08-03 00:00:00
52668853,-90.99,-90.99,tw&cm,0.7181739807128906,Terry White Management,SCN052761,SCN052761,17-08-18,2018-08-17 00:00:00
51975092,-20.0,-20.0,hubdoc,0.9981136322021484,Hubdoc,109192,109192,16 jul 2018,2018-07-16 00:00:00
51887305,139147.86,139147.86,american express,0.7777770161628723,American Express,,,"august 27, 2018",2018-08-27 00:00:00
51749008,2450.59,2450.59,commonwealth utilities corporation,0.9564646482467652,Commonwealth Utilities Corporation,,75108-July 2018,06/30/18,2018-08-14 00:00:00
50770579,9282.14,9282.14,residential insulation specialists,0.9862104058265686,Residential Insulation Specialists,15307,15307,"aug 19, 2018",2018-08-19 00:00:00
51301699,610.0,610.0,aviator,0.8666826486587524,Aviator Nation,N32999602,N32999602,08/01/2018,2018-08-01 00:00:00
51639137,1312.41,1312.41,wells fargo,0.9352053999900818,Wells Fargo,,,"jul 31, 2018",2018-07-31 00:00:00
51402480,863.25,863.25,greenco2systems,0.6519598364830017,Green Co2 Systems,145280,145280,,2018-07-28 00:00:00
50679583,592.4,592.4,td canada trust,0.7756063938140869,TD CANADA TRUST,CAUABR7V,CAuAbr7v,07/15/2018,2018-07-15 00:00:00
52728876,1100.0,1100.0,wsm-am,0.9521148800849916,wsm-am,2270-2,2270-2,"september 1, 2018",2018-09-01 00:00:00
52824094,55.99,55.99,discus,0.819574773311615,PHILIPS,338944,338944,29/06/2018,2018-07-01 00:00:00
52712366,67.24,67.24,tompkins canada,0.9920440316200256,Tompkins Canada,403970840,403970840,08/03/2018,2018-08-03 00:00:00
50574603,173.42,173.42,the bread & butter project,0.9944314360618592,The Bread & Butter Project,OMI57994,OMI57994,11-feb-2018,2018-03-12 00:00:00
52755253,316.39,316.39,vonage business,0.8305213451385498,Vonage85198_STAT,INV00925690,INV00925690,8/21/18,2018-08-21 00:00:00
52460345,7188.94,7188.94,flamestop,0.9803995490074158,FlameStop,0384070-D01,0384070-D01,23 aug 2018,2018-08-23 00:00:00
52649479,957.72,957.72,maltacourt,0.9236310720443726,Maltacourt Global Logistics - COD,00034475,00034475,8/19/2018,2018-08-19 00:00:00
53104127,25213.65,25213.65,homecorp constructions,0.9462085366249084,HOmecorp Constructions Pty Ltd,,,30/06/2017,2017-06-30 00:00:00
51504843,2553.8,2553.8,lrl associates,0.9792943596839904,Lrl Associates,180021.00,180021.00,"wed, aug 1, 2018",2018-08-01 00:00:00
52449114,109.0,109.0,boma technologies. boma technologies,0.9941220879554749,Boma Technologies,D8E1D5A-0009,D8E1D5A-0009,08/03/18,2018-08-03 00:00:00
52375033,5.4,5.4,amazon,0.8782719969749451,Amazon.com,,,7/18/2018,2018-07-18 00:00:00
50133036,928.0,928.0,vista outdoor sales,0.9984542727470398,Vista Outdoor Sales,950892516,950892516,2018/07/24,2018-07-24 00:00:00
50350519,,30.03,dhl,0.9395585060119628,DHL,GLAI024192,GLAI024192,07/25/18,2018-07-25 00:00:00
50582015,,1726.26,diamond fresh,0.7305001616477966,Commonwealth bank,12866370,,03/26/2018,2018-03-26 00:00:00
53034537,49.28,49.28,intuit,0.5520520210266113,Quickbooks,230013598006,230013598006,27-07-18,2018-07-27 00:00:00
52491155,19.95,26.7,simplecpr,0.5153290629386902,SimpleCPR,253439,253439,07/02/2018,2018-07-02 00:00:00
50593574,27.65,27.65,amazon,0.9980173707008362,Amazon.com,111-9017413-7087401,111-9017413-7087401,"august 7, 2018",2018-08-07 00:00:00
50832196,302.5,302.5,natura-pacific,0.8489575982093811,Natura Education,2807,2807,09 aug 2018,2018-08-09 00:00:00
50631852,3036.0,3036.0,mascot,0.91474050283432,Mascot Engineering Group,148368,148368,08/03/18,2018-08-03 00:00:00
50880760,4950.09,4113.8,managment,0.5939668416976929,Paycor,,PRJ 080118,25/07/2018,2018-07-25 00:00:00
50464417,2554.26,66.17,"thatcher farms butcher shop, bakery & farm",0.8412747979164124,Thatcher Farms Butcher Shop,,,"aug 06, 2018",2018-08-06 00:00:00
51378288,,164.25,,,Haylie Meyer Photography,456789,1003,"august 1, 2018",2018-08-01 00:00:00
51906719,39.71,39.71,aha! labs,0.9893452525138856,Aha labs,84606,84606,22/08/2018,2018-08-22 00:00:00
52409854,9.45,9.45,sysco,0.9962744712829592,Sysco,7305632,7305632,16/08/18,2018-08-16 00:00:00
52565358,11.3,11.3,cartika,0.9946441650390624,Cartika,119161,119161,07/31/18,2018-07-31 00:00:00
50265069,646.2,646.2,gskdirect,0.6206106543540955,GSK_statement,1246453,1246453,07/05/2018,2018-07-05 00:00:00
51601724,1699.12,1699.12,shane lindsay,0.9745886921882628,Shane Lindsay,52,52,"june 17, 2017",2017-06-17 00:00:00
51188065,472.81,472.81,sp provisions,0.9882062673568726,SP Provisions,704047,704047,7/16,2018-07-02 00:00:00
52568038,7053.75,7053.75,eco-white,0.9400076270103456,Eco-White Pty Ltd,INV-0360,INV-0360,18-aug-18,2018-08-18 00:00:00
50557023,361.6,361.6,snapd innisfil,0.721612811088562,snapd Nationals,V-088-010371,V-088-010371,"thu, aug 2, 2018",2018-08-02 00:00:00
52244900,4050.0,4050.0,hutchingame growth capital,0.9304738640785216,Hutchingame Growth Capital,,,"aug 1, 2018",2018-08-01 00:00:00
51986428,8375.0,8375.0,produits forestiers d&g,0.9094159603118896,Produits Forestiers D & G,7987,7987,05/08/18,2018-08-05 00:00:00
50959716,347.31,347.31,zendesk,0.9529463648796082,Zendesk,,,"august 26, 2018",2018-08-26 00:00:00
50831382,2775.33,2775.33,boral construction materials group,0.9517761468887328,Boral Construction Materials Group,VC13677775,VC13677775,8/1/18,2018-08-01 00:00:00
50191337,946.06,946.06,snowsport international,0.8940059542655945,Snowsport International,INVC7-15676,,"jul 31, 2018",2018-07-31 00:00:00
51458939,63.05,63.05,falcon fulfillment,0.9889846444129944,Falcon Fulfillment,25042,25042,08/16/18,2018-08-16 00:00:00
51444403,,157.0,appli.ance masters,0.7466863989830017,Appliance Masters,,,"august 12, 2018",2018-08-12 00:00:00
53024997,62.15,62.15,apple,0.8756235241889954,Apple,6752628004,6752628004,,2018-08-18 00:00:00
50296993,3999.21,3999.21,,,"Global Rental Co., Inc.",3266005,3266005,"jul 31, 2018",2018-07-31 00:00:00
51766740,54.0,54.0,richard smythe,0.8052586913108826,Richard Smythe Limit,119,119,jul-18,2018-08-09 00:00:00
50446821,200.0,200.0,trevor zaple,0.9949581623077391,Trevor Zaple,,,21/08/18,2018-08-21 00:00:00
50235720,7.98,7.98,amazon,0.9933369755744934,Amazon.ca,702-3796440-2129848,702-3796440-2129848,"august 31, 2018",2018-08-31 00:00:00
50574312,617.5,617.5,hart productions,0.9736433029174804,Hart Productions,1635,1635,"sunday, july 22, 2018",2018-07-22 00:00:00
52569152,49.5,49.5,flat earth organics,0.9658204913139344,Flat Earth Organics,INV-1166,INV-1166,"saturday, june 30, 2018",2018-06-30 00:00:00
52189307,26.51,26.51,cayan holdings,0.9944158792495728,Cayan,739491,739491,"august 1, 2018",2018-08-01 00:00:00
52231593,1151.19,1151.19,lifeboat distribution,0.9360412359237672,Lifeboat Distribution,A00653930101,A00653930101,13 aug 2018,2018-08-13 00:00:00
52526518,25.46,25.46,arizona nutritional supplements,0.9038010835647584,Arizona Nutritional Supplements,00426688,00426688,07/26/18,2018-07-26 00:00:00
52796585,40.03,40.03,tim card,0.6828398108482361,Tim Card,,,"july 31, 2018",2018-07-31 00:00:00
52507003,25.0,25.0,plaudit,0.7733707427978516,Plaudit Design,201808155,201808155,2015-02-16,2015-02-16 00:00:00
50228222,64.17,64.17,star food service,0.9589729309082032,Star Food Service Ltd,1115529,1115529,8/8/2018,2018-08-08 00:00:00
52126647,4607.5,4607.5,heckler design,0.997181236743927,Heckler Design,201417177,201417177,08/07/18,2018-08-07 00:00:00
51743443,460.0,460.0,kaslo hotel,0.928906798362732,Kaslo Hotel,18131404,18131404,"jun 04, 2018",2018-06-04 00:00:00
51784657,623.19,623.19,medline,0.941009521484375,"Medline Canada, Corporation",90570960,90570960,10-aug-2018,2018-08-10 00:00:00
52354412,1512.9,1512.9,americanexpress,0.8165199756622314,Am Exp RMC PA old -42003,,,2018-05-05,2018-05-05 00:00:00
50871196,267.84,267.84,supergoop,0.6732386350631714,Waste Connections,2401848059,BB 2401848059,8/21/2018,2018-08-21 00:00:00
50900976,15.98,15.98,montalbano lumber,0.9818311333656312,Montalbano Lumber,1808-719319,1808-719319,22-08-2018,2018-08-22 00:00:00
52295575,1560.77,1560.77,air canada,0.9951804280281068,Air Canada,RIND2A,RIND2A,"aug 17, 2018",2018-08-17 00:00:00
52170287,297.82,297.82,reinhart foodservice,0.9388825297355652,Reinhart Foodservice,328558,328558,"tuesday, august 14, 2018",2018-08-14 00:00:00
50274985,11.95,11.95,pennsylvania builders supply,0.9700859189033508,Pennsylvania Builders Supply,,,24. august 2018,2018-08-24 00:00:00
52779504,212.53,212.53,sanmar,0.9957839846611024,Sanmar,71919115,71919115,,2018-08-06 00:00:00
51130265,134.41,134.41,market.envato,0.8539659380912781,Envato,3W224728TJ449024G,3W224728TJ449024G,"thursday, august 2, 2018",2018-08-02 00:00:00
52593943,400.0,400.0,alistair mackenzie,0.8983876705169678,Fiat Lux Creative,201813,201813,"aug 6, 2018",2018-08-06 00:00:00
51213110,5.99,8.0,perfectlyposh,0.9913788437843324,Perfectlyposh,23590387,23590387,"may 10, 2018",2018-05-10 00:00:00
51739265,6.0,0.06,metcash food & grocery,0.9187288880348206,Metcash Food & Grocery,63209,63209,"august 25, 2018",2018-08-25 00:00:00
50848715,360.5,360.5,leeds,0.9731916189193726,Leed's,V7936952,V7936952,"january 22, 2018",2018-01-22 00:00:00
52825558,2797.64,2797.64,magtek,0.9803895354270936,MagTek,2000027347,2000027347,13 aug 2018,2018-08-13 00:00:00
51526794,5645.2,5645.2,moneycorp,0.866302490234375,Moneycorp,,,08/17/2018,2018-08-17 00:00:00
52604556,994.69,994.69,nassau candy midwest,0.9715970754623412,Nassau Candy Midwest,97290,97290,2018/08/07,2018-08-07 00:00:00
52770097,199.99,169.99,amazon,0.9625846743583679,Amazon,111-6611828-5411411,111-6611828-5411411,08/15/2018,2018-08-15 00:00:00
50314566,320.33,320.33,linkedin linkedin singapore,0.8104383945465088,Linkedin,3198595586,3198595586,"august 19, 2018",2018-08-19 00:00:00
51019192,15090.94,15090.94,td canada trust,0.8275887370109558,TD Canada Trust,8317-5219017,,,2018-08-14 00:00:00
52595843,65.48,65.48,"ricciardi brothers of paterson,inc",0.9148841500282288,"Ricciardi Brothers Of Paterson,inc",137985,137985,"mar 14, 2018",2018-03-14 00:00:00
53000502,505.76,505.76,obrientoyota,0.9233465194702148,O'Brien Motors Pty Ltd,,,august-12-2018,2018-08-12 00:00:00
50446533,73.43,73.43,you name it baby,0.9539568424224854,You name It Baby,,,10/08/18,2018-08-10 00:00:00
52188344,594.81,594.81,mouser electronics,0.9187762141227722,Mouser.com,14783194,14783194,15 aug 2018,2018-08-15 00:00:00
52472434,129.5,129.5,murray goulburn trading,0.9687145948410034,MG TRADING,6-259396,Inv 6-259396,17 aug 2018,2018-08-17 00:00:00
51853684,7392.0,7392.0,insideresponse,0.9967108964920044,insideresponse,2674,2674,2018,2018-08-03 00:00:00
50461143,231.18,231.18,a bigger bottom line,0.9967514872550964,A Bigger Bottom Line,1609,1609,08/18/2018,2018-08-18 00:00:00
52470080,454.6,454.6,jt's plumbing and gas,0.9943100810050964,JT's Plumbing and Gas,ITR-1477,ITR-1477,07/16/2018,2018-07-16 00:00:00
52054076,1805.76,1805.76,white cement co,0.9342135190963744,White Cement Co.,2811,2811,"jul. 9, 2018",2018-07-09 00:00:00
51912301,,0.0,capitalone,0.9807748794555664,capital one,,,,2018-03-31 00:00:00
51536192,,0.0,,,Symbion Non Stock,158453010,158453010,"mar 26, 2017",2017-03-26 00:00:00
52080081,172515.0,172515.0,majestic mobiles,0.8633136749267578,majestic mobiles,227320,227320,,2018-08-09 00:00:00
52053500,61.92,61.92,bradypeopleid,0.9992356896400452,Brady People  ID,9337856945,9337856945,31/07/2018,2018-07-31 00:00:00
50549394,9153.0,9153.0,growth counsel,0.9864343404769896,GrowthCounsel,20,20,8/6/2018,2018-08-06 00:00:00
50456602,63.0,63.0,agro merchants group,0.9835235476493835,"AGRO Merchants Oakland, LLC",49022,49022,"mon, aug 20, 2018",2018-08-20 00:00:00
51384593,29.95,29.95,rockbot,0.9730614423751832,Rockbot,A00012527,INV00030104,07/30/2018,2018-07-30 00:00:00
51720611,65.0,10.36,hoaoan thanh toan,0.7055551409721375,Gon,,1837013310,"wed, aug 8, 2018",2018-08-08 00:00:00
51684085,38510.36,18701.74,u.s. bank,0.8491491079330444,US Bank 7927,,,7-31-18,2018-07-31 00:00:00
50430094,99.99,99.99,digital river,0.9511914849281312,Digital River,6447063939,6447063939,07/31/18,2018-07-31 00:00:00
51375767,1027.95,1027.95,airefco,0.9909943342208862,"Airefco, Inc.",4032002,4032002,8/1/2018,2018-08-01 00:00:00
50334754,99.42,99.42,royal wolf trading,0.94994854927063,royal wolf,INV-00292835,INV-00292835,2018-08-04,2018-08-04 00:00:00
51240011,,8.91,tandemclinic,0.6036974787712097,SRFAX,1172243,1172243,07/31/2018,2018-07-31 00:00:00
51155754,1066.21,1066.21,toner on demand,0.9516305923461914,Toner on Demand,91322,91322,"august 13, 2018",2018-08-13 00:00:00
52722872,64.86,64.86,the home depot,0.9363310933113098,The Home Depot,,H0272-127310,23/08/2018,2018-08-23 00:00:00
50693808,14.0,14.0,cognito,0.8348604440689087,Cognito Forms,EED4A72-0003,EED4A72-0003,"august 20, 2018",2018-08-20 00:00:00
52380117,75.85,75.85,godaddy,0.9503545761108398,GoDaddy,1355422618,1355422618,21-sep-2017,2017-09-21 00:00:00
53065886,,31.56,tellanf,0.6672382950782776,Tellanf,,,07 aug 2018,2018-08-07 00:00:00
52069948,110.72,110.72,radglide,0.8319210410118103,Radglide,27621,27621,8/9/2018,2018-08-09 00:00:00
52151500,500.0,500.0,stamps,0.990496814250946,STAMPS.COM,,,18 jan 2018,2018-01-18 00:00:00
50498123,3935.44,3935.44,apple store,0.7697440981864929,Apple Inc.,1008008060,1008008060,,2016-11-01 00:00:00
53044441,3785.0,3785.0,mathews archery,0.9917337894439696,Mathews Archery Inc.,0001322037,1322037,8/10/2018,2018-08-10 00:00:00
51531832,82.08,82.08,kehe distributors,0.9871695041656494,Kehe Distributors,080821929,080821929,"july 6, 2018",2018-07-06 00:00:00
52988939,1747.42,1747.42,direct building trade centre,0.9777207970619202,Direct Building Trade Centre,INV20180020,INV20180020,07/26/2018,2018-07-26 00:00:00
50749726,361.11,361.11,the home depot,0.9766146540641784,The Home Depot,H2679-130893,H2679-130893,"august 18, 2018",2018-08-18 00:00:00
50954809,20187.13,20187.13,thomas foods international fresh produce,0.9928375482559204,Thomas Foods International Fresh Produce ,P02758,P02758 DKT 3389/3767 AARON BK 6 SOUTH,05/10/2018,2018-05-10 00:00:00
50298405,4271.4,4271.4,jj infiniti,0.9177064895629884,JJ Infiniti Inc,1023,1023,"august 20, 2018",2018-08-20 00:00:00
51668574,406.89,322.2,orbitz,0.9428877234458924,Orbitz,,,"june 21, 2018",2018-06-21 00:00:00
52967989,500.0,500.0,,,Turning Point Surveys Ltd.,,,,2018-08-23 00:00:00
51761252,75.82,75.82,bunnings,0.9941699504852296,Bunnings Trade,8471101481138,8471101481138,31/07/2018,2018-07-31 00:00:00
53075395,402.4,402.4,american express,0.5748029947280884,American Express,,,"july 29, 2018",2018-07-29 00:00:00
53000778,47.77,47.77,tim card,0.7310405969619751,Tim Card,,,"sun, aug 05, 2018",2018-08-05 00:00:00
51939916,1163.61,1163.61,truffles,0.7151164412498474,Truffles Inspired Catering,31708,31708,08/06/2018,2018-08-03 00:00:00
51674699,,770.44,aramark,0.9917618036270142,Aramark,000492669950,000492669950,9 aug 2018,2018-08-09 00:00:00
50835701,1194.0,1194.0,maclea maclean n tyre & mechanical,0.78207927942276,Maclean Tyre & Mechanical,154911,154911,29 july 2018,2018-07-29 00:00:00
50632099,5030.0,5030.0,catching clouds,0.9892803430557252,Catching Clouds,INV13-10394,INV13-10394,8/22/18,2018-08-22 00:00:00
51660853,5862.53,5862.53,uline,0.9985322952270508,Uline,100204787,100204787,2018-06-05,2018-06-05 00:00:00
52575047,52.14,52.14,apple,0.9278556108474731,Apple,,,08/16/18,2018-08-16 00:00:00
50279156,6443.4,6443.4,fullbright investments,0.9580660462379456,Dana Patty,118,118,01/08/2018,2018-01-08 00:00:00
53045432,300.0,700.0,arrowhead dj,0.9933512210845948,Arrowhead DJ,,180909 J2 Apacible/Tiempo,"tue, aug 14, 2018",2018-08-14 00:00:00
51832908,225.75,225.75,toshiba business solutions,0.8102777004241943,Toshiba Business Solutions,AR3491279,AR3491279,21/08/2018,2018-08-21 00:00:00
52364479,42.0,42.0,the bicycle baker,0.8712862730026245,The Bicycle Baker,INV-2657,INV-2657,6/26/2018,2018-06-26 00:00:00
50614409,211.43,211.43,huntheat,0.9038756489753724,Hunt Heating,409617,409617,"22 august, 2018",2018-08-22 00:00:00
51581711,25000.0,25000.0,servicestart.co.uk,0.87448650598526,Service Start,,,"feb 01, 2017",2017-02-01 00:00:00
52758497,112.35,112.35,mwi animal health,0.9770881533622742,MWI Animal Health,12379695,12379695,aug 15 2018,2018-08-15 00:00:00
51659218,1000.0,1000.0,healthleaders media,0.9900106191635132,HCpro,1000912,99905105,"thursday, august 23, 2018",2018-08-23 00:00:00
50679957,168.63,168.63,anderson pest solutions,0.9294437170028688,Anderson Pest Solutions,4850045,4850045,7/24/2018,2018-07-24 00:00:00
52093282,106.82,106.82,nd graphics,0.9954338669776917,ND Graphics,T426640/E,T426640/E,april-22-18,2018-04-22 00:00:00
51348545,,3623.63,,,Victory IV,11218,073118,19 july 2018,2018-07-19 00:00:00
53043170,595.98,595.98,easy source,0.9259056448936462,Easy Source Inc.,13611,,"sat, sep 16, 2017",2017-09-16 00:00:00
50238715,25.36,25.36,the home depot,0.9645937085151672,The Home Depot,,,"july 31, 2018",2018-07-31 00:00:00
52480128,138.37,138.37,univar,0.8050116896629333,Univar,BS864284,BS864284,"july 6, 2018",2018-07-06 00:00:00
52483254,279.67,279.67,awm electrical,0.9565401077270508,AWM Electrical,130166-370,130166-370,"thursday, july 5, 2018",2018-07-05 00:00:00
52533194,91.62,91.62,the home depot,0.977303683757782,The Home Depot,H2667-161221,H2667-161221,7/19/2018,2018-07-19 00:00:00
51838464,2500.0,2500.0,payments,0.6723496317863464,Bofa,,,7/30/2018,2018-07-30 00:00:00
52685707,2401.0,2401.0,fontaine industries,0.9750954508781432,Fontaine Industries,18-00007175,18-00007175,8-aug-2018,2018-08-08 00:00:00
52983472,294.0,294.0,buildxact,0.9636120200157166,Buildxact,21245,21245,30/05/2018,2018-05-30 00:00:00
50283222,,80.44,nationwide auto glass,0.8890088200569153,nationwide auto glass,,16502373,08/17/2018,2018-08-17 00:00:00
51611832,-588.5,-588.5,laser services,0.9733874201774596,Laser Services,183464,183464,aug 19 2018,2018-08-19 00:00:00
53024732,10825.31,10825.31,national energy equipment,0.9992201328277588,National Energy Equipment Inc,20093434-00,20093434-00,"july 31, 2018",2018-07-31 00:00:00
50463693,282.5,282.5,homestars,0.9986721873283386,HomeStars Inc,INV00134008,INV00134008,24 aug 2018,2018-08-24 00:00:00
50400425,575.0,575.0,mjw consultancy,0.8952346444129944,MJW Consultancy,002,002,30-july-2018,2018-07-30 00:00:00
52652537,499.0,499.0,more than just great dancing,0.925009310245514,More Than just Great Dancing,,,08/08/2018,2018-08-08 00:00:00
51898059,,200.0,,,Andrew,,,07/08/2018,2018-08-07 00:00:00
50288587,307.54,307.54,datto,0.9936450123786926,Datto Canada Enterprises Inc.,100869626,100869626,2018-08-09,2018-08-09 00:00:00
51265626,2677.5,2677.5,striking concrete,0.6612695455551147,Unicon Concrete Specialities,001421879,421879,05/31/2018,2018-05-31 00:00:00
51459986,592.9,592.9,acdtrade,0.9717963933944702,Acd Trade,222196/01,222196/01,31/10/2017,2017-10-31 00:00:00
51165380,187.85,187.85,southernhospitality.co.nz,0.9979670643806458,southern hospitality ltd,INV0622465,INV0622465,"august 8, 2018",2018-08-08 00:00:00
52098859,331.56,331.56,sanmar,0.998080551624298,Sanmar,84150679,84150679,2018-08-18,2018-08-18 00:00:00
50262381,12.95,12.95,hostgator,0.9973258972167968,HostGator_STAT,,HostGator-Invoice-63974674,14 august 2018,2018-08-14 00:00:00
51472139,41.04,41.04,parts town,0.9956836700439452,Parts Town,22045396,22045396,,2018-08-01 00:00:00
52081422,249.92,95.44,winenergy,0.9851187467575072,WinEnergy,68593-17888,68593-17888,"aug 6, 2018",2018-08-06 00:00:00
51128656,324.83,324.83,supportingstrategies,0.9936937093734741,supporting strategies,2291,2291,20.06.2018,2018-06-20 00:00:00
51904720,377.8,377.8,kelly paper,0.9998313784599304,Kelly Paper,9313027,9313027,31 jul 2018,2018-07-31 00:00:00
51644402,44.1,44.1,oncoreservices,0.98125022649765,Oncoreservices.ca,17352,17352,,2018-08-02 00:00:00
51429558,51.25,51.25,clearfuze,0.6780409216880798,ClearFuze,,1349325-001,24. august 2018,2018-08-24 00:00:00
52540599,315.3,315.3,mgxcopy,0.900771141052246,Mgx Copy,R769189808,,1. august 2018,2018-08-01 00:00:00
50234266,530.0,530.0,southern advertising,0.9992300271987916,Southern Advertising,I-52228,I-52228,8/10/2018,2018-08-10 00:00:00
53014347,74.8,74.8,myaccount.sensis,0.9432141184806824,Yellow Pages,INV10791801,INV10791801,2018-06-25,2018-06-25 00:00:00
50129949,17.3,17.3,central valley glass & screen,0.9993298053741456,"Central Valley Glass & Screen, Inc.",414398,414398,2018-15 aug 2018,2018-08-15 00:00:00
50968226,5416.82,5416.82,sysco,0.9725866317749025,Sysco,,,"august 16, 2018",2018-08-16 00:00:00
52419219,7237.24,7237.24,cayuga,0.7812767028808594,Cayuga Corporation,880,880,08/15/2018,2018-08-15 00:00:00
50786322,18.0,18.0,box,0.9905419945716858,Box,INV05572902,INV05572902,7/31/2018,2018-07-31 00:00:00
50466555,20.0,20.0,clear view,0.9878823161125184,"Clear View, Inc.",64783,64783,"tue, aug 7, 2018",2018-08-07 00:00:00
50407279,18.2,18.2,ingram,0.9490646719932556,Ingram Cloud,2018SIUS0088483,2018SIUS0088483,"thu, aug 16, 2018",2018-08-16 00:00:00
51210318,30.0,30.0,calendly,0.9959146976470948,Calendly LLC,AC194CD-0011,AC194CD-0011,aug 2018,2018-07-31 00:00:00
52932868,89.25,89.25,wimundo h.s.i.a. solutions,0.98179030418396,Wimundo H.s.i.a,2310,2310,08/03/2018,2018-08-03 00:00:00
51475894,59.73,59.73,universal distribution,0.9486564397811892,Universal DIstribution,SINV-031569,SINV-031569,2018-08-04,2018-07-29 00:00:00
51051208,,4885.01,independent grocers,0.9688499569892884,Independent Grocers,I757336 ALI,I757336 ALI,"june 30, 2018",2018-06-30 00:00:00
50572977,2127.61,2127.61,river source,0.969728410243988,"River Source, LLC",M-12322C,M-12322C,08/06/18,2018-08-06 00:00:00
52912856,1060.91,1060.91,mercury,0.9864777922630308,Mercury,3099924,3099924,08-aug-2018,2018-08-08 00:00:00
50990814,51.03,51.03,johnstone supply,0.9987292885780334,Johnstone Supply,329-S1764111.001,329-S1764111.001,27 april 2018,2018-04-27 00:00:00
51536969,-12.43,0.0,interstate battery,0.557442843914032,Interstate Batteries,,,08/06/18,2018-08-06 00:00:00
50230789,336.51,336.51,direct security services,0.9946481585502625,Direct Security Services,00021862,00021862,"apr 20, 2018",2018-04-20 00:00:00
51351404,555.0,555.0,the petal prop co,0.9725010991096495,The Petal Prop Co,180717,180717,jul 20/18,2018-07-20 00:00:00
52428924,102.75,102.75,the home depot,0.5653952956199646,Home Depot,,,"june 29, 2018",2018-06-29 00:00:00
51914823,565.0,565.0,aquisense technologies,0.9896059632301332,Auisense Technologies,18290,18290,8/15/2018,2018-08-15 00:00:00
50939230,1013.1,1013.1,north city,0.959553599357605,AHG Trade Parts Centre,301526,,2018-08-16,2018-08-16 00:00:00
52775251,-1129.83,-1129.83,corelogic,0.8937960863113403,CoreLogic,2265597,2265597,8/13/2018,2018-08-13 00:00:00
52381200,254.27,254.27,9209441 canada,0.9605273604393004,9209441 Canada Inc. - Natalia,385,385,1 may 2018,2018-05-01 00:00:00
50215408,33.25,33.25,melbourne it,0.9683733582496644,Melbourne IT,11825660,11825660,,2018-08-15 00:00:00
50482096,1500.0,1500.0,carrier maritime services,0.6397349238395691,Maritime Services Ltd.,06266,5513/ 046266,16/08/18,2018-08-16 00:00:00
50694723,71.29,71.29,the home depot,0.9621143341064452,The Home Depot,H6603-99035,H6603-99035,16 august 2018,2018-08-16 00:00:00
50398779,30000.0,130000.0,mobile lnvestmenl,0.5875593423843384,majestic mobiles,,6467,11-08-2018,2018-08-11 00:00:00
52683638,44.5,44.5,westco distributors,0.9220216870307922,Westco Distributors,1412225,1412225,31 mar 2018,2018-07-01 00:00:00
50350589,541.0,541.0,california department of tax and,0.7149187326431274,State of California,0-001-689-387,,"mon, aug 6, 2018",2018-08-06 00:00:00
52126769,38.31,38.31,pnm,0.9736970067024232,PNM,,,"october 25, 2017",2017-10-25 00:00:00
50911177,338.06,338.06,amunroe & company,0.5867553353309631,Munroe & Company,ER-00001,,9/08/2018,2018-08-09 00:00:00
50200033,639.0,639.0,,,Pacific Garage Door and Gates,10850,10850,08/13/2018,2018-08-13 00:00:00
52429622,3028.5,3028.5,austins,0.9729214906692504,Austins Inc,48177,48177,,2018-08-05 00:00:00
51835657,759.0,759.0,aspect one group,0.981211245059967,Aspect One Group Pty Ltd,INV-0094,INV-0094,08/11/17,2017-08-11 00:00:00
52497585,1973.14,1973.14,the home depot,0.9764332771301272,The Home Depot,,,08/16/2018,2018-08-16 00:00:00
50399775,,280.0,square,0.6139527559280396,Manning Acupuncture,,,8/24/2018,2018-08-24 00:00:00
51233112,63.0,63.0,synnex,0.9922240376472472,Synnex Corporation,702987,702987,08/24/18,2018-08-24 00:00:00
52105444,210.59,210.59,the home depot,0.9802244901657104,The Home Depot,,,19 january 2018,2018-01-19 00:00:00
50611820,2350.3,2600.0,springfield central,0.813113808631897,First National,,12,8-aug-2018,2018-08-08 00:00:00
51272757,28.19,258.19,paymybill.edrnet,0.5738368034362793,EDR,1NV0084L557,1NV0084L557,"july 30,2018",2018-07-30 00:00:00
52463018,128.93,128.93,michelle bonwick,0.7803174257278442,Michelle Bonwick,,,"wednesday, aug 8th, 2018",2018-08-08 00:00:00
51182147,3762.69,3762.69,nslc nova scotia liquor corporation,0.8374612331390381,Nova Scotia Liquor Corporation,,,06/24/2018,2018-06-24 00:00:00
51883062,15294.45,15294.45,toothville family dentistry,0.9475585222244264,Aug Deposit Slip,,,"aug 8, 2018",2018-08-08 00:00:00
51601275,5815.92,5815.92,spicers paper,0.9953516721725464,Spicers Paper,1965109,1965109,12/27/11,2011-12-27 00:00:00
51992386,2651.0,26.51,aramark-uniform,0.9878937602043152,Aramark,000051409364,000051409364,08/13/2018,2018-08-13 00:00:00
50873055,10.73,10.73,novex,0.8484365344047546,Novex,475969,475969,17/08/18,2018-08-17 00:00:00
52319405,10618.37,10618.37,capitalone,0.9813165664672852,Capitalone,,,07/24/18,2018-07-24 00:00:00
51076049,750.0,750.0,dean markus/overtime,0.8582921028137207,Dean Markus Overtime,,,01 aug 2018,2018-08-01 00:00:00
52112545,13.65,13.65,pingdi aolq bathroom supply,0.7130945920944214,Shenzhen Pingdi Aolq bathroom supply co ltd,AOLQ-20180816,AOLQ-20180816,"august 10, 2018",2018-08-10 00:00:00
50158806,151.83,82.92,rogers,0.9970083832740784,Rogers,1846072283,1846072283,18/08/2018,2018-08-18 00:00:00
51125122,60.87,60.87,bpme,0.725213885307312,BP Nth Ballina,,,21 august 2018,2018-08-21 00:00:00
51155434,450.35,450.35,ball & doggett,0.9551271200180054,Ball & Doggett,INV001543973,INV001543973,2018/08/25,2018-08-25 00:00:00
50771877,276.0,276.0,mlslistings,0.9910879731178284,"MLS Listings, Inc.",INV00323634,INV00323634,8/17/2018,2018-08-17 00:00:00
53025955,275.0,275.0,upwork,0.8806145191192627,Upwork,,,16/08/2018,2018-08-16 00:00:00
51461133,39.95,39.95,schedapple,0.977268397808075,Schedapple,,Aug 9th schedule,08/01/18,2018-08-01 00:00:00
52216080,12930.45,12930.45,murphy,0.8199107050895691,Phillips Edison And Company,,00016461,08/16/18,2018-08-16 00:00:00
53033179,1072.9,1072.9,suntrust,0.9640822410583496,9630 Stmt,1000055779630,,5/8/2018,2018-05-08 00:00:00
52748721,705.58,705.58,agropur cooperative natrel division,0.7598084211349487,"Agropur, Division",W4187467,W4187467,2018-04-01,2018-04-01 00:00:00
51583039,2286.0,2286.0,the cellular connection,0.9992448687553406,The Cellular Connection,277748-I,277748-I,15/01/2018,2018-01-15 00:00:00
50681287,92.52,92.52,beam insurance administrators,0.8585053086280823,Beam Insurance,AUGUST 2018,August 2018,aug 18,2018-08-08 00:00:00
50943093,,40791.55,springer foods,0.9694334268569946,Springer Foods,,,"august 11, 2018",2018-08-11 00:00:00
53015086,5.93,5.93,tollpass,0.5917989015579224,National,EHI74450705,,08/03/2018,2018-08-03 00:00:00
52753757,349.19,349.19,deposit,0.8171820640563965,Practice Payments,,,dec-14-2017,2017-12-14 00:00:00
51686341,4.95,4.95,traveling mailbox,0.9698781371116638,"Traveling Mailbox, LLC",1418-5256,1418-5256,3/08/2018,2018-08-03 00:00:00
51871741,14.1,14.1,greenco2systems,0.6513870358467102,Green CO2 Systems,145651,145651,08/17/18,2018-08-17 00:00:00
51786835,1538.64,1538.64,jessie cai,0.9548038244247437,Jessie Cai,4,4,,2018-08-15 00:00:00
51212569,251.25,251.25,santa monica,0.6586236357688904,THE RAW OFFICE,4139,4139,8/01/18,2018-08-01 00:00:00
52353085,110.0,110.0,virgin australia,0.9898319840431212,Virgin Australia,WCVAT,WCVATE,"june 25, 2018",2018-06-25 00:00:00
51126075,12.95,12.95,canva,0.9805747866630554,Canva,02042-0602281,02042-0602281,,2018-08-10 00:00:00
50416243,391.94,391.94,solarus technologies,0.9595643877983092,Solarus Technologies,,,"jul 29, 2018",2018-07-29 00:00:00
53097566,100.0,100.0,telstra,0.9813064336776732,Telstra,P 837 451 591-3,P837451591-3,jul-18,2018-07-18 00:00:00
52029773,49.68,49.68,pepco,0.9443594217300416,Pepco,,,07/31/2018,2018-07-31 00:00:00
50803810,30.87,30.87,amazon,0.995980978012085,Amazon,113-9489944-0074618,113-9489944-0074618,03/05/2018,2018-05-03 00:00:00
52802463,21.4,21.4,drake software,0.8301223516464233,Drake Tax Software,,,08/27/2018,2018-08-27 00:00:00
50864591,,55229.41,first republic bank,0.9638386964797974,First Republic Bank,,,08/14/2018,2018-08-14 00:00:00
53068461,215.0,215.0,pinpoint bookkeeping,0.9759796261787416,Pinpoint Bookkeeping,INV-2838,INV-2838,08/13/2018,2018-08-13 00:00:00
50848454,1929.2,1929.2,usa equipment solutions,0.9949727058410645,USA Equipment Solutions,218643,218643,17 aug 2018,2018-08-17 00:00:00
50801344,595.84,595.84,joval,0.9323954582214355,Joval Pty Ltd,INV-1762,INV-1762,08/09/18,2018-08-09 00:00:00
50716219,3500.0,3500.0,the port workspaces,0.985834538936615,The Port Workspaces,14793,14793,8/27/18,2018-08-27 00:00:00
51321437,856.82,856.82,scotiabank,0.5064138770103455,Scotia Bank,,,"aug. 08, 2018",2018-08-08 00:00:00
53044443,114.33,114.33,ferguson enterprises,0.9889587163925172,Ferguson Enterprises Inc.,6498526,6498526,31/07/2018,2018-07-31 00:00:00
51242487,494.12,494.12,gymsales software,0.8540109395980835,Gymsales Software,INV-9351,INV-9351,"wed, may 30, 2018",2018-05-30 00:00:00
51275340,268.75,268.75,levy,0.726383626461029,AMVIC,2018-24691,,"aug 1, 2018",2018-08-01 00:00:00
51194310,57521.54,57521.54,elec,0.5304298400878906,Watts Marketing Services,,20180729,27 august 2018,2018-08-27 00:00:00
51262351,1689.19,1689.19,americanxpress,0.9128227829933168,American Express,,,08/09/2018,2018-08-28 00:00:00
51955226,5970.43,970.43,thomas chin,0.951947808265686,Thomas Chin Pty Ltd.,,4076,18/08/2018,2018-08-18 00:00:00
52734870,625.6,625.6,cintas,0.9154687523841858,Cintas,55401-1252,4008218590,jun 29/18,2018-06-29 00:00:00
50776824,135.78,135.78,winters bros,0.9656343460083008,Winters Bros.,707355,707355,"friday, july 27, 2018",2018-07-23 00:00:00
51895499,28.15,28.15,encompass,0.894179105758667,Encompass,1-94634,1-792094-0818,,2018-07-30 00:00:00
52413128,2463.0,2463.0,lodged,0.572176456451416,Australian Government,38212842568,,"tue, aug 21, 2018",2018-08-21 00:00:00
51710208,41.0,41.0,prestozon,0.6756041049957275,Amazon,,,"sun, jul 22, 2018",2018-07-22 00:00:00
53049635,,238.97,manulife,0.907673716545105,Manulife,0062677,0062677,"jun 29, 2018",2018-06-29 00:00:00
50586108,267.17,267.17,southernhospitality.co.nz,0.9974071383476256,Southernhospitality.co.nz,INV0619363,INV0619363,"thursday, august 9, 2018",2018-08-09 00:00:00
51311084,3024.4,3004.4,amchar wholesale,0.9916498064994812,"AmChar Wholesale, Inc.",00886587,00886587,"july 28, 2018",2018-07-28 00:00:00
50195412,1725.0,1725.0,commerce park,0.6539150476455688,Commerce Park Investors Ii,1856,1856,,2018-08-08 00:00:00
52051192,587.94,587.94,leis pet distributing,0.988567352294922,Leis Pet Distributing,SO0312154,PS10363509,27-jul-18,2018-07-27 00:00:00
51392390,7150.0,7150.0,"busch, hutchison & associates",0.9516655206680298,"Busch, Hutchison & Associates, Inc",19033,19033,2016-12-01,2016-12-01 00:00:00
51195790,1095.0,1095.0,centerline communications,0.9777089953422546,Centerline,,,"august 10, 2018",2018-08-10 00:00:00
51779563,1.25,1.25,u.s. oil,0.9960806369781494,US Oil,201801286907,201801286907,21 jul 2018,2018-07-21 00:00:00
50829962,75.0,75.0,bdgwebdesign,0.9789682030677797,BDG Web Design,2859,2859,16th aug 2018,2018-08-16 00:00:00
51159147,2831.4,2831.4,arcadia cattle,0.886545717716217,Arcadia Cattle Co,02191001,02191001,15/08/18,2018-08-15 00:00:00
50250605,32.73,32.73,rubenstein supply company,0.9912314414978028,Rubenstein Supply Company,S1889918.001,S1889918-001,06-aug-18,2018-08-06 00:00:00
50238146,10.23,10.23,us foods,0.9979171752929688,Us Foods,1014220,1014220,18/06/2018,2018-06-18 00:00:00
52195516,226.32,226.32,kloeckner metals,0.9093689918518066,Kloeckner Metals,9125872,9125872,20.08.2018,2018-08-20 00:00:00
53020278,40.52,40.52,uber,0.9973448514938354,Uber,,,"july 30, 2018",2018-07-30 00:00:00
52930058,-40.0,-40.0,hubdoc,0.999683678150177,Hubdoc,112138,112138,08/14/2018,2018-08-14 00:00:00
50622736,553.93,553.93,scansource,0.9980167150497437,Scansource,5403888095,5403888095,3rd august 2018,2018-08-03 00:00:00
50966076,1125.66,1125.66,wella,0.9734889268875122,Wella (UK) Ltd,7578529001,7578529001,2016-07-27,2018-07-27 00:00:00
51614779,501.04,501.04,megan thompson league,0.9214940071105956,VISA Corp - Danielle 0491,136246,136246,"jul 31, 2018",2018-07-31 00:00:00
51806203,9739.37,9739.37,zionsbank,0.9691802263259888,Zions Bank,,,17/08/2018,2018-08-17 00:00:00
51780041,15.0,15.0,yesware,0.9901145100593568,yesware,INV00331766,INV00331766,,2018-08-14 00:00:00
51648885,2.79,2.79,google play,0.8252410292625427,Google Play,,,"fri, aug 10, 2018",2018-08-10 00:00:00
52711594,40.32,40.32,robertson electric wholesale 2008,0.9827768802642822,Robertson Electric Wholesale 2008 Ltd.,1605842,1605842,07/27/2018,2018-07-27 00:00:00
51767372,141.0,141.0,schuurman b.v,0.9104282855987548,schuurman bv,SO18-7568,SO18-7568,07/26/2018,2018-07-26 00:00:00
52556241,811.14,811.14,toner warehouse,0.9996541142463684,Toner Warehouse,IN2133456,IN2133456,"aug 20, 2018",2018-08-20 00:00:00
51481830,132.97,132.97,vistaprint,0.9913840293884276,Vistaprint,9324805388,9324805388,8/22/18,2018-08-22 00:00:00
52537951,94.5,94.5,big wave graphics,0.9449994564056396,Big Wave Graphics,813,813,"fri, aug 10, 2018",2018-08-10 00:00:00
50961289,1749.6,1749.6,bms insurance,0.8493494391441345,BMS Insurance,MHP18163163418P23,,20.08.2018,2018-08-20 00:00:00
51176717,35.92,35.92,hirsch pipe & supply co,0.9664211869239808,Hirsch Pipe & Supply Co,6054593,6054593,08/02/2018,2018-08-02 00:00:00
52461406,70583.81,400.0,wells fargo,0.8688898086547852,NapaRepairConst=+or-x1,,,"august 17, 2018",2018-08-17 00:00:00
50877839,1440.0,1440.0,benny bermudez,0.9909685850143432,Benny Bermudez,1287,1287,08/01/2018,2018-08-01 00:00:00
51780805,199.4,199.4,petersoncat,0.896297037601471,Peterson Cat,PC130272209,PC130272209,aug 22,2018-08-22 00:00:00
52462829,232.15,232.15,dulux,0.9921286702156068,Dulux,474339831,474339831,"august 23, 2018",2018-08-23 00:00:00
52803269,928.52,928.52,synnex corporation,0.9873754978179932,Synnex,96775832,96775832,6/6/18,2018-06-06 00:00:00
51734558,649.9,649.9,electric service electric,0.715088963508606,PETERSBURG BOROUGH,15392,15392,15/08/2018,2018-08-15 00:00:00
50951076,227.8,227.8,,,Rodney M Encinas,000006790566,,aug 04,2018-08-04 00:00:00
50856655,7.0,7.0,the royal produce company,0.9455587267875672,The Royal Produce Company,058826,058826,"thu, aug 23, 2018",2018-08-23 00:00:00
52737835,25.76,25.76,johnstone supply,0.9987192749977112,Johnstone Supply,329-S1771019.001,329-S1771019.001,"10 august, 2018",2018-08-10 00:00:00
51411072,227.45,392.06,,,Galleria Stone & Title,373074,373074,14 aug 2018,2018-08-14 00:00:00
50583508,114.45,89.25,telus,0.9564255475997924,Telus,,MAY18,,2018-06-19 00:00:00
51181131,372.62,372.62,,,Chownow,,,8/22/18,2018-08-22 00:00:00
53023862,3152.7,3152.7,cpaontario,0.7354276180267334,CPA Ontario,,,7/10/18,2018-08-04 00:00:00
51954489,26.09,26.09,jackie dasilva,0.9038497805595398,Jackie DaSilva,2XX64520DU397642E,,"august 12, 2016",2016-08-12 00:00:00
52190115,331.77,331.77,bidfood,0.9365118741989136,Bidfood,I43025841.CAI,I43025841.CAI,8/20/2018,2018-08-20 00:00:00
51969906,4987.95,4987.95,marsh advantage,0.6147763133049011,Marsh Advantage Insurance,,IT465246,2018-07-30,2018-07-30 00:00:00
51789589,2336.84,2336.84,aptus,0.9726543426513672,Aptus Court Reporting,1046152,1046152,2018-03-14,2018-03-14 00:00:00
50885001,81.59,81.59,first air,0.9062957763671876,First Air Head,67432,6743262572,4/08/2018,2018-08-04 00:00:00
50858730,25.0,25.0,rooforders,0.986136794090271,Rooforders.com,T020818132418,T020818132418,7/9/2018,2018-07-09 00:00:00
50564318,727.65,727.65,staples canada,0.9129272699356079,Staples,,,"august 3, 2018",2018-08-03 00:00:00
52294952,652.0,652.0,rgfn,0.6085895299911499,Lakelee Orchards,,96706,22 mar 2018,2018-03-22 00:00:00
52064504,29.7,29.7,empowerict,0.9833546876907348,Empowerict,CW-13147,CW-13147,09/08/2018,2018-08-09 00:00:00
51342912,250.24,250.24,farzad saberi,0.5727485418319702,Dr. Farzad Saberi,,,30-jul-2018,2018-07-30 00:00:00
51981574,14.41,14.41,facebook,0.9189648628234864,Facebook Ads,1757385607712015-3676931,,08.08.18,2018-08-08 00:00:00
52741487,57.96,57.96,shoes for crews,0.9728859663009644,Shoes For Crews,35046560,35046560,8/13/2018,2018-08-13 00:00:00
52692010,111.1,111.1,asics,0.9892861247062684,Asics,484019233,484019233,05/04/2018,2018-05-04 00:00:00
52207515,296.37,296.37,freightliner,0.9589948058128356,Freightliner of Arizona,XP001473580:01,XP001473580:01,,2018-08-10 00:00:00
52629187,325667.19,325667.19,old republic,0.6975140571594238,American Land Title Association,,,08/13/2018,2018-08-13 00:00:00
52533172,49.0,66.6,shutterstock,0.9894354939460754,Shutterstock,,,06 august 2018,2018-08-06 00:00:00
51312345,7569.3,7569.3,hawke's bay refrigeration,0.9670042395591736,Hawke's Bay Refrigeration,,,29.08.2018,2018-08-29 00:00:00
52200122,497.42,497.42,ringcentral,0.9656062722206116,RingCentral,,5167049008,10-08-18,2018-08-10 00:00:00
53067177,1364.2,1364.2,bix produce,0.9877857565879822,Bix Produce,,,"august 16, 2018",2018-08-16 00:00:00
50216565,4516.55,4516.55,spicers,0.9595780968666076,Spicers,95854363,95854363,"aug 21, 2018",2018-08-21 00:00:00
50742225,62533.39,62533.39,telpay,0.8385154604911804,TELPAY,,Session 39,"fri, aug 17, 2018",2018-07-03 00:00:00
52651873,234.0,234.0,fairfield inn,0.9199395775794984,Marriott,64464,64464,"tue, aug 21, 2018",2018-08-21 00:00:00
50978660,80.0,80.0,expensify,0.927637219429016,Expensify,,,08/20/2018,2018-08-20 00:00:00
51253908,9816.31,9816.31,s2 safety solutions,0.993384838104248,S2 Safety Solutions,999,999,15/08/2018,2018-08-15 00:00:00
52967719,1381.2,1381.2,bryan,0.6323690414428711,ShamansMarket,1071,1071,01/08/2018,2018-08-01 00:00:00
51430322,85.39,85.39,regus,0.992562472820282,Regus,1285-24552,1285-24552,"friday, august 24, 2018",2018-08-24 00:00:00
50445934,3455.48,3455.48,us-analytics solutions group,0.7565954923629761,US-Analytics,26148-2,26148-2,8/10/2018,2018-08-10 00:00:00
52205677,,88.33,ebay,0.9583326578140259,eBay,,,26/06/2018,2018-06-26 00:00:00
50170621,85.0,85.0,office furniture warehouse,0.9900919795036316,Office Furniture Warehouse,125134,125134,"tuesday, august 7, 2018",2018-08-10 00:00:00
50787462,2395.44,2395.44,pedego,0.9758453965187072,Pedego,SO9754,SO9754,7/30/2018,2018-07-30 00:00:00
52582515,49.26,49.26,sanmar,0.9982213973999025,Sanmar,84331965,84331965,07/27/2018,2018-07-27 00:00:00
52421897,150.0,150.0,la region,0.6695894002914429,Nu - La Region,INV-000175,INV-000175,"tue, aug 7, 2018",2018-08-07 00:00:00
52242498,29.0,29.64,partsource,0.9944030046463012,Part Source,385527,385527,8/13/2018,2018-08-13 00:00:00
50328859,800.25,800.25,huntheat,0.9184257984161376,Hunt Heating,409607,409607,25-jul-2018,2018-07-25 00:00:00
51160108,1760.0,1760.0,let's connect women,0.9916964173316956,Let's Connect Women,INV-1758,INV-1758,10-aug-2018,2018-08-10 00:00:00
50361623,199.0,199.0,blackbird media,0.9885095953941344,Blackbird Media,2188,2188,23 aug 2018,2018-08-23 00:00:00
50155341,4743.74,4743.74,top,0.6107380390167236,Quartz Co,15414,15414,15-aug-2018,2018-08-15 00:00:00
51609630,1104.57,1096.61,ken duval oil,0.9798728227615356,Ken Duval Oil,239225,239225,07-31-18,2018-07-31 00:00:00
50156530,570.64,570.64,american express,0.9057994484901428,AMEX 41000,,,"fri, aug 3, 2018",2018-08-03 00:00:00
50558614,200.0,200.0,receipt bank,0.8295164108276367,ReceiptBank,40949,,08/06/2018,2018-08-06 00:00:00
52404678,425.87,425.87,agropur cooperative natrel division,0.7651690840721129,Agropur Cooperative Natrel Division,W1519087,W1519087,8/1/2018,2018-08-01 00:00:00
51867219,-19.0,-19.0,aweber communications,0.9157819151878356,AWeber Communications,22022580,22022580,"august 21, 2018",2018-08-21 00:00:00
50972017,26.98,26.98,amazon,0.9990604519844056,Amazon.ca,701-3983685-4513003,701-3983685-4513003,2/16/2018,2018-02-16 00:00:00
52768323,,58068.59,,,Us bank,,,25-07-2018,2018-07-25 00:00:00
50942114,154.73,154.73,gourmeats.co.nz,0.9844018220901488,Gourmeats,20541,20541,"august 01, 2018",2018-08-01 00:00:00
51381174,5316.1,5316.1,donnelly ford lincoln,0.8564577698707581,Donnelly Ford Lincoln,,,aug 10 2018,2018-08-10 00:00:00
52656317,7144.19,7144.19,b&t steel,0.7730444669723511,Russel Metals,2017929,39310817,"tue, jul 31, 2018",2018-07-31 00:00:00
50142584,47.99,47.99,paypal,0.996415078639984,Paypal,,,19-08-2018,2018-08-19 00:00:00
52707092,307.39,307.39,american airlines,0.9703541994094848,American Airlines,,,"sun, aug 19, 2018",2018-08-19 00:00:00
51701653,89.05,89.05,amazon,0.9961584210395812,Amazon,113-0470716-1471436,113-0470716-1471436,"wed, aug 15, 2018",2018-08-15 00:00:00
51961031,256.47,256.47,followmont,0.920956552028656,Followmont Transport,2695620,2695620,07/25/18,2018-07-25 00:00:00
52549435,10.09,10.09,walmart,0.6119934916496277,Walmart,,,31-jul-18,2018-07-31 00:00:00
51981165,370.69,370.69,canyon pipe & supply,0.9994522929191588,Canyon Pipe & Supply Inc.,S4391328.001,S4391328.001,08/16/2018,2018-08-16 00:00:00
53018324,463.22,463.22,hertz,0.5706294178962708,Corwin Garber,,,8/10/2018,2018-08-10 00:00:00
52744510,109.22,109.22,kota graphics & design,0.9930744171142578,Kota Graphics,20638,20638,8/23/2018,2018-08-23 00:00:00
51634408,265.0,265.0,butter blossom bakery,0.8760378956794739,Butter Blossom Bakery,,180825 D2 Ballester/Baumgarten,"july 10, 2018",2018-07-10 00:00:00
52995980,1896.68,1896.68,breakout river,0.9980684518814088,Breakout River,00660013,00660013,06/11/2018,2018-06-11 00:00:00
50237172,-125.68,125.68,halton catholic district school board,0.9435710310935974,Halton Catholic,,1340-28105,18/08/18,2018-08-18 00:00:00
50794146,501.99,501.99,telstra,0.9829345941543579,Telstra,463 035,463 035 461-0,08/01/2018,2018-08-01 00:00:00
51349612,572.0,572.0,brett van,0.8219248056411743,Brett Van Gorp,INV0057,INV0057,,2018-08-20 00:00:00
51758562,698.98,698.98,j&r cooke trading,0.9661316871643066,J & R Cooke Trading Pty Ltd,,July 2018,8/22/2018,2018-08-22 00:00:00
51605108,345.57,345.57,the home depot,0.9592238068580629,The Home Depot,20657,,"saturday, july 28, 2018",2018-07-28 00:00:00
52368686,192.5,192.5,thomson reuters,0.8933939337730408,CLEARDOCS,1115977,1115977,2018-08-16,2018-08-16 00:00:00
50922719,55.65,55.65,bgs storage,0.8782581686973572,BGS Storage,645850482869474192452539,Aug 2/18,7/30/2018,2018-07-30 00:00:00
51837239,31.0,31.0,lohes.coh/pricehatch,0.5321191549301147,Lowe's,3961,,"tue, aug 28, 2018",2018-08-28 00:00:00
52715127,253.8,253.8,stickeryou,0.9489638209342957,StickerYou Inc.,06143484,06143484,"jul 26, 2018",2018-07-26 00:00:00
52970553,28.37,28.37,lyft,0.9572534561157228,Lyft,1172499509357828520,,12/08/2018,2018-08-12 00:00:00
50640741,327.6,327.6,tradebox,0.9757934808731079,Tradebox,,6918,8/8/2018,2018-08-08 00:00:00
51748708,1679.0,1679.0,one painting & decorating service,0.9043217301368712,One Painting & Decorating Service Pty Ltd,S1838,S1838,"tuesday, july 31, 2018",2018-07-31 00:00:00
52478867,3951.82,3951.82,sysco,0.9178220629692078,SYSCO,,,"august 23, 2018",2018-08-23 00:00:00
52975616,4.99,4.99,amazon.co.uk,0.994373857975006,Amazon,204-7171032-0413969,204-7171032-0413969,,2018-08-15 00:00:00
51828278,18.35,18.35,x.ai,0.9793503880500792,x.ai,4774021-0005,4774021-0005,04/09/2018,2018-04-09 00:00:00
51063161,5.0,5.0,leadnow,0.77706378698349,Leadnow,,,"sunday, july 29, 2018",2018-07-29 00:00:00
52704822,,212.96,cruzco,0.8653131127357483,Republic national distributing company llc,,3883450,7/31/2018,2018-07-31 00:00:00
50477019,190.12,190.12,wtc parts canada,0.9829866886138916,Wtc Parts Canada,508456680,508456680,31-07-18,2018-07-31 00:00:00
51803073,1344.18,1344.18,canadasyscoaccountcentre,0.9911720156669616,Sysco,6645838,6645838,20/8/2018,2018-08-20 00:00:00
52738820,567.0,567.0,bsgcraft,0.5912564992904663,BSGcraft,IS50000689142,IS50000689142,"sun, jul 22, 2018",2018-07-22 00:00:00
51460020,367.31,367.31,ball & doggett,0.951276957988739,Ball & Doggett,INV001497992,INV001497992,08/05/18,2018-08-05 00:00:00
51138328,60.0,64.65,backcountry,0.9735141396522522,Backcountry.com,B2767348103,b2767348103,"thu, jul 5, 2018",2018-07-05 00:00:00
50787699,21.6,21.6,total food equipment,0.9861491918563844,Total Food Equipment,389554,389554,"wednesday, july 11, 2018",2018-07-11 00:00:00
52991646,263.0,263.0,asic,0.7018489837646484,ASIC,,Arora & Zandi Pty Ltd,18 may 2018,2018-05-18 00:00:00
50826612,163.04,163.04,cozzini bros,0.9705629944801332,Cozzini Bros,,,07/27/2018,2018-07-27 00:00:00
52121422,64.0,64.0,the laundry room express,0.9670996665954592,The Laundry Room Express,,161909,21 jun 2018,2018-06-21 00:00:00
51258425,1.04,1.04,d. b. roberts company,0.9857099652290344,D. B. Roberts Company,CYTSJ2,CYTSJ2,07/18/2018,2018-07-18 00:00:00
51172865,769.63,769.63,hilton,0.8718941211700441,Hilton,,,02/07/2018,2018-07-02 00:00:00
50835194,370.0,370.0,speedy bins,0.9983170032501221,speedy bins,115563,115563,,2018-05-06 00:00:00
51161890,63.25,63.25,highland creative,0.9879963994026184,Highland Creative,INV-2272,INV-2272,"tuesday, august 21, 2018",2018-08-21 00:00:00
51589893,1800.0,1800.0,kallas honey farm,0.997264325618744,"Kallas Honey Farm, Inc",65293,65293,4/10/2018,2018-04-10 00:00:00
52881933,,12034.0,,,Mynhd,6058-115,,,2018-01-01 00:00:00
52033166,369.75,369.75,exhilarate bookkeeping,0.9623701572418212,Exhilarate Bookkeeping,INV-00830,INV-00830,15/08/2018,2018-08-15 00:00:00
52627250,168.0,168.0,magnetsigns northwest,0.8511515259742737,Magnetsigns Northwest,1296,1296,"tue, jul 31, 2018",2018-07-31 00:00:00
51006687,9189.1,9189.1,ferguson,0.6531513929367065,"Ferguson Enterprises, Inc.",1109327,,"july 18, 2016",2016-07-18 00:00:00
52414476,41.92,41.92,1password,0.9116041660308838,1Password,IN_1D1H3FHBAX7L5HDFU0LR0MFX,in_1D1H3FHBax7L5HDfU0lR0mfX,"december 30, 2017",2017-12-30 00:00:00
50603376,39904.23,39904.23,tri travel,0.6449444890022278,WU Business Solutions,AFS3035398_001,,"thursday, august 2, 2018",2018-08-02 00:00:00
52152583,79.94,79.94,paychex,0.9871856570243835,Paychex,2018080801,2018080801,14-04-2018,2018-04-14 00:00:00
50314014,100.6,100.6,coastalsunbelt,0.9062823057174684,Coastalsunbelt.,1778978,1778978,04/12/2017,2017-12-04 00:00:00
51440217,61.0,61.0,myob australia,0.7142917513847351,Myob,1-60233928666,1-60233928666,"jul 31, 2018",2018-07-31 00:00:00
50311488,829.02,829.02,ba consulting,0.9953568577766418,BA Consulting Inc,1886,1886,03/08/2018,2018-03-08 00:00:00
52497900,147.96,147.96,aank,0.6595386266708374,US Bank,362980872,362980872,8/16/2018,2018-08-16 00:00:00
50917553,178.25,178.25,cave industries,0.9415027499198914,ecomist,INV-26511,,8/15/2018,2018-08-15 00:00:00
51240473,-49000.0,49000.0,ebanking.bankofmaldives,0.8184319138526917,Majestic Company,,6535,07/18/18,2018-07-18 00:00:00
51905903,79.0,79.0,jetbuilt,0.89656662940979,Corry McGibbon,,,"tue, aug 7, 2018",2018-08-07 00:00:00
50643771,2000.0,2000.0,sanctuary marketing group,0.9862629175186156,Sanctuary Marketing Group,9129,9129,"apr 30, 2018",2018-04-30 00:00:00
51656684,350.0,350.0,dellfinancialservices.ebillservice,0.9295846223831176,Dell Financial Services,,,"fri, aug 17, 2018",2018-08-17 00:00:00
51751471,563.78,780.55,toll ipec,0.9922598600387572,Toll Ipec,,100818-0029 - ,08/08/2018,2018-08-08 00:00:00
52001202,,377.24,unishippers,0.9908530712127686,Unishippers,1014896943,1014896943,"august 24, 2018",2018-08-24 00:00:00
52950566,36.26,36.26,sherwin williams,0.9972035884857178,Sherwin-Williams,4665-5,4665-5,07/26/2018,2018-07-26 00:00:00
51981334,500.0,500.0,paper tube & core,0.913339138031006,Paper tube & Core,10032,10032,,2018-01-01 00:00:00
50746044,1104.57,1634.57,gross sales net commission,0.6777949929237366,Jason Parnell,,3011,27/07/18,2018-07-27 00:00:00
52530259,871.52,871.52,,,Birnn,100738,100738,"august 17, 2018",2018-08-17 00:00:00
52434310,15.0,15.0,prochurch,0.9866253733634948,"ProChurch, Inc",000000262-4,000000262-4,"monday, july 30, 2018",2018-08-01 00:00:00
51441516,1116.5,1116.5,sector nine distribution,0.9670607447624208,Sector Nine Distribution,1011,,27/07/2018,2018-07-27 00:00:00
51909351,,1267.81,the home depot,0.8856028318405151,The Home Depot,,,"jul 31, 2018",2018-07-31 00:00:00
52486234,432.62,432.62,apc mississauga,0.9352243542671204,Apc Mississauga,0114635/26753,0114635,31/07/18,2018-07-31 00:00:00
51841673,343.7,343.7,the landscaping yard & hardware,0.999465823173523,The Landscaping Yard & Hardware,451054,451054,08/08/18,2018-08-08 00:00:00
52820472,800.0,800.0,micro quality labs,0.994933009147644,Micro Quality Labs,296019,296019,"jul 31, 2018",2018-07-31 00:00:00
50312364,2694.0,2694.0,pedego,0.9739543795585632,Pedego,SO9608,SO9608,8/20/2018,2018-08-20 00:00:00
52995778,1131.56,1131.56,ewen lewis photography,0.9903873205184937,Ewen Lewis Photography,1026,1026,2/08/2018,2018-08-02 00:00:00
50149947,266.47,266.47,momentum energy,0.9627621173858644,Momentum Energy,6728732,6728732,14/08/2018,2018-08-14 00:00:00
52662933,1554.33,1535.1,canyonstatecu.org,0.5813363194465637,Canyon State,,,7/25/2018,2018-07-25 00:00:00
52764682,30.54,30.54,trimar promotional,0.6388413310050964,Trimar Promotional Products,20181715,20181715,06/30/2018,2018-06-30 00:00:00
52206295,7145.25,7145.25,the cellular connection,0.9991406798362732,The Cellular Connection,278350-I,278350-I,1 jul 2018,2018-07-02 00:00:00
52414828,4408.47,4408.47,sbop retail property,0.8429223895072937,SBOP Retail Property,,,21 apr 2018,2018-04-21 00:00:00
52028229,175.0,175.0,robco residential,0.957727551460266,"Robco Residential, Inc.",61447,61447,"jul 28, 2018",2018-07-28 00:00:00
53037055,231.53,231.53,gordon food service,0.9897261261940002,Gordon Food Service,790277701,790277701,,2018-08-09 00:00:00
52187577,112.5,112.5,trustee for i & i services,0.8284302949905396,i&i Services,INV-00005639,INV-00005639,"tuesday, august 7, 2018",2018-08-03 00:00:00
50793352,2401.04,2401.04,great lakes orthodontic products,0.8175137639045715,Great Lakes Products-Salinas,727089,727089,17/07/18,2018-07-17 00:00:00
52033523,331.51,331.51,paint spot mornington,0.8557456731796265,Paint Spot Mornington,1501012471,1501012471,13 january 2018,2018-01-13 00:00:00
52162818,5806.0,5806.0,us.hsbc,0.8985856771469116,HSBC,,,"sunday, august 5, 2018",2018-08-05 00:00:00
51606648,25.0,25.0,codecov,0.9864832162857056,Codecov,40C0AF2-0006,40C0AF2-0006,08/04/2018,2018-08-04 00:00:00
52010495,57.75,57.75,planet telecom,0.9848103523254396,Planet Telecom,166778,166778,20.07.2018,2018-07-20 00:00:00
51161163,99.0,99.0,silvereye street,0.736929714679718,Sunny Coast Property Maintenance,INV-0901,901,"tue, aug 21, 2018",2018-08-21 00:00:00
51120192,129.0,129.0,johnny,0.6356119513511658,Gps.com.au,,J18137346-1,"wednesday, august 8, 2018",2018-08-08 00:00:00
52567898,481.48,481.48,the landscaping yard & hardware,0.9993356466293336,The Landscaping Yard & Hardware,451676,451676,01.08.2018,2018-01-08 00:00:00
50223832,2337.0,2337.0,murray computers murray computers,0.9404603838920592,Murray Computers,311116,311116,"sat, aug 18, 2018",2018-08-18 00:00:00
51505164,1820.5,1820.5,gkb services,0.7296001315116882,Gkb Services,,,08/01/18,2018-08-01 00:00:00
52265227,11997.0,11997.0,dandy plumbing & drainage,0.8200737237930298,Dandy Plumbing & Drainage Pty Ltd.,00001774,00001774,,2018-07-05 00:00:00
52682411,2496.17,2496.17,,,McLaren Press Graphics,91166,91166,aug 18,2018-08-13 00:00:00
50889552,5661.14,5661.14,tim hortons,0.9287102222442628,Ad Fund 7450,7250071607,7250071607,,2018-05-15 00:00:00
52654109,111.68,111.68,sale - approved,0.9573506116867064,Sale - Approved,2133709,2133709,"july 27, 2018",2018-07-27 00:00:00
51987587,270.0,270.0,collaboration,0.94464111328125,"Bennett International Group, LLC",INV-0783,INV-0783,"july 27, 2018",2018-07-27 00:00:00
51929896,,70180.44,kids in the house,0.9748208522796632,Kids In The House LLC,,6922,jul-08-18,2018-07-08 00:00:00
52351042,299.25,299.25,touchbistro,0.9347120523452759,Touch Bistro,,,,2018-07-17 00:00:00
52721842,588.17,588.17,rodda paint company,0.94659161567688,rodda paint,75047192,75047192 Stoer Rives,"mon, aug 13, 2018",2018-08-13 00:00:00
52901389,22.6,22.6,intuit,0.9012889862060548,Intuit,230013641873,230013641873,08/15/2018,2018-08-15 00:00:00
51129929,225.64,225.64,bear's custom painting,0.8818460702896118,Bear's Custom Painting,2129,2129,"friday, july 27, 2018",2018-07-27 00:00:00
50756022,422.62,422.62,weldtech training,0.9443836212158204,Weld Tech,,,07/27/2018,2018-07-27 00:00:00
53057425,7.12,7.12,856494,0.9872503876686096,856494,6752933181,6752933181,31-07-18,2018-07-31 00:00:00
52195102,50.01,50.01,nick and moe's citgo,0.8531798124313354,Gas Receipts,,072737,13/08/2018,2018-08-13 00:00:00
53033768,620.0,620.0,wework,0.9718294143676758,WeWork,3881276518,3881276518,"august 24, 2018",2018-08-24 00:00:00
51186343,1400.0,1400.0,gomez painting & drywall,0.9727008938789368,Flores Kitchen 2018,80694,80694,6 aug 2018,2018-07-31 00:00:00
50780325,,390.0,hinshaw & culbertson,0.7161688208580017,Hinshaw & Culbertson LLP,11785876,11785876,17/08/2018,2018-08-17 00:00:00
51944307,,100.0,,,Greenies Real Food,,49,aug-08-2018,2018-08-08 00:00:00
50849961,1156.06,1156.06,southern hospitality australia,0.9145530462265016,Southern Hospitality,Q91423,Q91423,8/16/2018,2018-08-16 00:00:00
52364557,140.0,140.0,commander,0.9898960590362548,Commander,17863774,17863774,8/24/2018,2018-08-24 00:00:00
52696960,14.95,14.95,amazon.co.uk,0.988323450088501,Amazon,202-4501736-2874769,202-4501736-2874769,25 oct 2017,2017-10-25 00:00:00
51413917,,622.16,svision travel,0.9667933583259584,Vision Travel,1120501,1120501,"saturday, august 11, 2018",2018-08-11 00:00:00
51910344,607.52,607.52,abs automation,0.991981029510498,ABS Automation,23006,23006,06/08/2018,2018-08-06 00:00:00
50266613,293.4,293.4,a group,0.6578254699707031,IronMongery Direct,4332960,4332960,"friday, august 24, 2018",2018-08-24 00:00:00
51470488,769.2,769.2,genewiz,0.9969385862350464,Genewiz,US71005002222,US71005002222,"jun 04, 2018",2018-06-04 00:00:00
52295912,3628.08,3628.08,guest supply canada,0.936132550239563,Guest Supply Canada,9595839,9595839,aug 12 2018,2018-08-12 00:00:00
51730127,4999.99,4999.99,facebook ads,0.8591881394386292,Facebook,,,08/13/2018,2018-08-13 00:00:00
52085125,38.74,38.74,practice ignition,0.9968856573104858,Practice Ignition,39365,39365,"aug 4, 2018",2018-08-04 00:00:00
51549392,4.49,4.49,itunes and app store,0.8275511860847473,iTunes and app store,,MMNFLVY8SQa0,07/31/2018,2018-07-31 00:00:00
51155416,,29.25,norman firehouse art center,0.7587692737579346,Nona Vance,989003,,"tuesday, july 31, 2018",2018-07-31 00:00:00
51698721,80.0,80.0,earth flower earth flower,0.9905660152435304,Earth Flower,INV-0636,0636,august 07,2018-08-08 00:00:00
51244631,23.23,23.23,c e n t r a l c a l i f o r n i a i m p l e m e n t c o m pa n y,0.8258383274078369,Central California Implement Company,76842A,76842A,8/27/2018,2018-08-27 00:00:00
51919436,1669.28,1669.28,,,By Design Embroidery,20182372,20182372,17,2018-08-17 00:00:00
50649741,999.0,999.0,shopgate,0.9749666452407836,Shopgate,2218001610,2218001610,25 jul 2018,2018-07-25 00:00:00
51853529,415.01,415.01,tierone,0.693524956703186,Fiona Buttler,537478,,08/03/18,2018-08-03 00:00:00
50758059,1580.01,1580.01,taylormade golf,0.8347584009170532,TaylorMade,100052088,100052088,6/29/2018,2018-06-29 00:00:00
51370429,106.0,12281.17,,,Hilton Memphis,,45672,6 august 2018,2018-08-06 00:00:00
52833951,230.0,230.0,plimpton & hills,0.9830790162086488,Plimpton & Hills,1552568-1,1552568-1,"august 8, 2018",2018-08-08 00:00:00
52682918,885.54,885.54,lionco,0.8525063991546631,Lion LD & D Australia Pty LTd,557210565,557210565,08/21/2018,2018-08-21 00:00:00
52631863,100.0,100.0,canadian vaping association,0.9603717923164368,Canadian Vaping Association,16359,16359,08/21/18,2018-08-21 00:00:00
51729014,291.47,291.47,canadapost,0.9926223754882812,Canada Post,9660728464,9660728464,08/09/18,2018-08-08 00:00:00
50695496,638.22,638.22,miller paint,0.9983648657798768,Miller Paint,INVOICES/30949675.PDF,30949675,2 jun 2018,2018-06-02 00:00:00
50245598,496.08,496.08,t.m.c,0.5323662161827087,Stitch One,29341,29341,"may 19, 2018",2018-05-19 00:00:00
52705301,,22.33,camscanner,0.636422336101532,Petro Canada,,,07/08/18,2018-08-07 00:00:00
51602943,-50.0,50.0,apex clearing corporation,0.8894044756889343,Stockpile,,,"thu aug 2, 2018",2018-08-02 00:00:00
51271431,12.99,12.99,adobe creative cloud,0.9305738210678101,Adobe Creative Cloud,ADD018124606,ADD018124606,7/7/2018,2018-07-07 00:00:00
50403577,,229172.0,ooredoo,0.7533555626869202,Ooredoo Maldives,,SH07/60138,"december 29, 2017",2017-12-29 00:00:00
52202099,441.73,441.73,wexinc,0.6618645191192627,Quiktrip,,,03/29/2018,2018-03-29 00:00:00
52029870,1244.55,1244.55,sunshine hardware,0.7478216886520386,Sunshine Hardware,50863377,50863377,17.08.2018,2018-08-17 00:00:00
50712521,55.5,55.5,spi health and safety,0.9319084882736206,SPI Health And Safety Inc.,,,7/25/18,2018-07-25 00:00:00
52461189,90.25,90.25,blue card services,0.8590388894081116,Blue Card Services,,85298871559,,2018-07-24 00:00:00
50459488,1578.02,1578.02,los angeles collective,0.9265604615211488,Los Angeles Collective,0034807,0034807,"aug 27, 2017",2017-08-27 00:00:00
51223969,550.0,550.0,clinic to cloud,0.99461567401886,Clinic to Cloud,INV-014916,INV-014916,8/20/2018,2018-07-11 00:00:00
51445115,296.21,296.21,cydcor,0.971599280834198,Cydcor,REIM00599,REIM00599,7/20/18,2018-07-20 00:00:00
51316846,1466.85,1466.85,savcom,0.7368208765983582,Ipswich City Mechanical,171790,171790,31 july 2018,2018-07-31 00:00:00
50646819,137.7,137.7,expensify,0.9921103715896606,Expensify,,,1/08/2018,2018-08-01 00:00:00
51036285,,12487.42,parkland refining,0.993390679359436,Parkland Refining,,,31/07/2018,2018-07-31 00:00:00
51848293,12723.13,12723.13,telstra,0.9845762848854064,Telstra Corporation Limited,885859091,P8858590918,8/16/2018,2018-08-16 00:00:00
51851983,476.45,476.45,boogie,0.5454977154731749,Gravedancer,,,08/13/2018,2018-08-13 00:00:00
50312365,605.0,605.0,coastal survey solutions,0.98432594537735,Coastal Survey Solutions,0941,0941,7.27.18,2018-07-27 00:00:00
52482986,5830.8,5830.8,siderman,0.9977081418037416,Siderman inc.,791,791,08/10/18,2018-08-10 00:00:00
52988654,13.75,13.75,deane apparel,0.9272664189338684,Deane Apparel,543901,543901,,2018-07-17 00:00:00
51166063,99.0,99.0,perry s. marshall,0.7058952450752258,Perry Marshall,430918,430918,"august 24, 2018",2018-08-24 00:00:00
51499315,4586.01,4586.01,bmo,0.6767467260360718,BMO Mastercard Manual,,,01/10/2016,2016-10-01 00:00:00
51031680,15.0,15.0,anna osherov,0.8972745537757874,Anna Osherov,2U026702X0782082V,,,2018-08-15 00:00:00
51233010,236.5,236.5,apf cold storage & logistics,0.9102022051811218,APF,INV-1651,INV-1651,08/02/2018,2018-08-02 00:00:00
50632837,4120.0,4120.0,basis 365 accounting,0.9282801747322084,Basis 365 Accounting,INV-2074,INV-2074,07/09/2018,2018-07-09 00:00:00
51975160,2780.69,2780.69,wells fargo,0.6581121683120728,Walker Property Rental,,,07/28/2018,2018-07-28 00:00:00
50489267,672.35,672.35,hanson crossborder tax,0.6830533742904663,Oakville Chamber of Commerce,,,"july 31, 2017",2017-07-31 00:00:00
52601710,47.96,47.96,windstream,0.9925649762153624,Windstream,,606-674-2513-08/18,2018 08 23,2018-08-23 00:00:00
51495085,584.26,584.26,,,Southern Glazier's of AZ,,1596704,07/31/2018,2018-07-31 00:00:00
51069162,6606.13,6606.13,webster bank,0.7802312970161438,Webster Bank,,,3 august 2018,2018-08-03 00:00:00
50217775,1101.95,1101.95,top shelf closets & glass,0.9799828529357908,Top Shelf Closets & Glass,30048,,25/07/18,2018-07-25 00:00:00
50575910,1066.76,1066.76,franz family bakeries,0.9926298260688782,Franz Family Bakeries,,,8/10/2018,2018-08-10 00:00:00
50667607,163.84,135.0,rogers,0.9055683612823486,Crystal Patry,1903219404,Cell Jul/18 CP,,2018-07-23 00:00:00
52729984,2.0,2.35,m.paybyphone,0.845234215259552,Paybyphone,,,"friday, august 24, 2018",2018-08-24 00:00:00
52237110,-27.12,27.12,wpcloud,0.8820519447326659,WPCloud.ca,12713,12713,08/01/18,2018-08-01 00:00:00
52478381,2.99,2.99,google payment,0.7598907351493835,Google,,AU00MBDSNI,8/27/2018,2018-08-27 00:00:00
52242337,574.9,574.9,ken's roofing supplies,0.9985833764076232,Ken's Roofing Supplies Ltd.,0000209871,0000209871,07/08/2018,2018-08-07 00:00:00
50977843,75.98,75.98,wb mason company,0.7901139259338379,WB Mason Company,S081091801,S081091801,"wed, aug 15, 2018",2018-08-15 00:00:00
52745700,65.0,87.01,reliable permit solutions,0.7491446733474731,Reliable Permit Solutions,237363,237363,31 july 2018,2018-07-31 00:00:00
51625128,26.68,26.68,dhl,0.8884015679359436,DHL,2647796,,27.07.2018,2018-07-27 00:00:00
53048788,700.0,700.0,discount bartending,0.9943222999572754,Discount Bartending,,180909 F2 Apacible/Tiempo,08/27/18,2018-08-27 00:00:00
51869042,10.0,10.0,dfi,0.6505939960479736,Wisconsin Dept. of Financial Institutions,,,"august 11, 2018",2018-08-11 00:00:00
50290410,12.5,12.5,short stop distribution,0.9928385019302368,Short Stop Distribution,1123558,1123558,7/27/2018,2018-07-27 00:00:00
52534771,249.97,249.97,kelowna house of floors,0.9452195167541504,House of Floors,HF0324,HF0324,8/27/2018,2018-08-27 00:00:00
52471133,327.8,327.8,metfold industries,0.8448017835617065,Larnec Doors & Systems,075535,000000000075922,07/29/2018,2018-07-29 00:00:00
50892634,5104.0,5104.0,klass electronics,0.9254781603813172,Petty Cash,76,76,08 jul 2018,2018-07-08 00:00:00
51184413,22.5,22.5,zoho,0.9937413334846495,Zoho,63990704,63990704,08/24/2018,2018-08-24 00:00:00
51794331,63.0,63.0,realstudio®,0.9803595542907716,Real Studio,INV-000160,INV-000160,"wednesday, august 15, 2018",2018-08-15 00:00:00
51117217,8.16,2.84,campaign monitor,0.9535428881645204,Campaign Monitor,1XG91008SW513270S,,aug 15 2018,2018-08-15 00:00:00
51125596,1076.91,1076.91,agropur cooperative natrel division,0.763657808303833,Agropur 1898,W4703221,W4703221,06/01/2018,2018-06-01 00:00:00
51480918,1996.71,1996.71,snapd,0.9698110818862916,snapd Nationals,V-001-014206,V-001-014206,12-jul-2018,2018-08-16 00:00:00
52444651,43.16,43.16,upwork,0.9079411625862122,Upwork Inc.,195187390,,08/14/2018,2018-08-14 00:00:00
50269790,16.98,16.98,sherwin-williams,0.9951536655426024,Sherwin-Williams Co.-Govt,,4217-8 072818,"july 21 , 2018",2018-07-21 00:00:00
52237176,312.24,312.24,thomson reuters,0.757903516292572,Thomson Reuters,8708117,8708117,"august 1, 2018",2018-08-01 00:00:00
52151490,402.9,402.9,farmers insurance,0.8855995535850525,Farmers Insurance,,,03/16/17,2017-03-16 00:00:00
51141837,395.81,395.81,bell,0.9611205458641052,bell,,,1 may 2018,2018-05-01 00:00:00
52127107,,64.22,cinitas,0.5820928812026978,Cintas Canada Limited,,839602071,31.5,2018-08-18 00:00:00
52779597,2250.0,2250.0,tvpx aircraft,0.7734730243682861,TVPX,21357-5,21357-5,08/01/2018,2018-08-01 00:00:00
51330958,106.21,106.21,malden car service,0.9893593192100524,Malden Car Service Inc,27817,,7/5/2018,2018-07-05 00:00:00
52842274,130.0,130.0,pedego,0.986750602722168,Pedego,IN5324,IN5324,"august 15, 2018",2018-08-15 00:00:00
51159018,200.0,200.0,noranda service centre,0.9700936675071716,Noranda Service Centre,,"18,907","thu, jan 4, 2018",2018-01-04 00:00:00
52726877,,270.07,,,BERTRAND,,,"aug 19, 2018",2018-08-19 00:00:00
51164630,500.0,500.0,kramerica business solutions,0.9749099612236024,KRAMERICA BUSINESS SOLUTIONS LLC,2066,2066,"thu, aug 16, 2018",2018-08-16 00:00:00
52020570,212.5,212.5,one 8 solutions,0.9955587983131408,"One 8 Solutions, LLC",,,2018-08-23,2018-08-23 00:00:00
50936764,250.0,250.0,joe manley,0.995181679725647,Joe Manley,JULY2019B,july2019b,"thursday, july 26, 2018",2018-07-26 00:00:00
50646272,995.46,995.46,marchand quentin,0.961381733417511,Marchand Quentin,ENFR180801,ENFR180801,"august 07, 2018",2018-08-07 00:00:00
50213610,2306.25,2306.25,bauen group,0.7239182591438293,Bauen Group,BG1078,BG1078,06-17-18,2018-06-17 00:00:00
52419255,211.75,211.75,jon's electric,0.9962809681892396,Jon's Electric,1555,1555,2018-08-07,2018-08-07 00:00:00
51142365,1.5,1.5,paybyphone,0.9805077314376832,PayByPhone,384298007,,"jun 30, 2018",2018-06-30 00:00:00
52125470,190.0,190.0,rbc,0.6007076501846313,EFT Email Interac,,13B,08/21/2018,2018-08-21 00:00:00
52455368,330.0,330.0,sciberras stockfeeds,0.8879734873771667,Sciberras Produce & Stock Feeds,00003334,,"monday, july 30, 2018",2018-05-01 00:00:00
51753819,3315.64,10133.08,first republic bank,0.9445295929908752,First Republic Bank,,,01/16/2018,2018-01-16 00:00:00
50190050,119.76,149.76,telstra,0.9900921583175659,Telstra,179 480 291-6,,"august 23, 2018",2018-08-23 00:00:00
53111182,13.12,13.12,cityelectricsupply,0.7009868025779724,C.E.S. (Moore),MRE/019349,,"july 31, 2018",2018-07-31 00:00:00
50982944,204.2,204.2,garbage co,0.9847445487976074,Garbage Co.,2016-11,2016-11,8/24/2018,2018-08-24 00:00:00
50828961,148.0,148.0,the cellular connection,0.9996880888938904,The Cellular Connection,IN000000000458936,IN000000000458936,,2018-05-31 00:00:00
53072281,466.05,466.05,dhl,0.9721922874450684,Dhl Express,YVRI000812094,YVRI000812094,"july 6, 2018",2018-07-06 00:00:00
52359074,2575.85,2575.85,decaaus,0.6936946511268616,Cjd Equipment Pty. Ltd.,006213171,006213171,31-07-2018,2018-07-31 00:00:00
50840513,43.29,43.29,synnex,0.9796373844146729,Synnex Canada,92435,92435,"july 17, 2018",2018-07-17 00:00:00
51788379,2184.0,2184.0,ey law,0.9891314506530762,Ey Law LLP,CA05C400031571,CA05C400031571,"monday, august 6, 2018",2018-08-06 00:00:00
51859864,1508.79,1508.79,wizmo solutions,0.9886974096298218,Wizmo Solutions Inc.,INV-1276,INV-1276,07/06/2018,2018-07-06 00:00:00
50208863,1543.41,1543.41,air canada,0.9936564564704896,Air Canada,LD2V2R,,"july 30, 2018",2018-07-30 00:00:00
50239827,996.56,996.56,quickbooks,0.6082783341407776,KS DOL,,,"aug 1, 2018",2018-08-01 00:00:00
52016565,28.76,28.76,fedex,0.9980311393737792,Fedex,A2-349-22197,A2-349-22197,07/31/2018,2018-07-31 00:00:00
51892288,13750.0,13750.0,the boda group,0.9970789551734924,The Boda Group,3607,3607,07/31/2018,2018-07-31 00:00:00
50983717,1595.0,605.0,dennis p. block & associates,0.9739938378334044,Dennis P. Block & Associates,138164,138164,01 august 2018,2018-08-01 00:00:00
52871578,754.68,754.68,monoprice,0.998850405216217,"Monoprice, Inc",17945561,17945561,22 aug 2018,2018-08-22 00:00:00
52723915,485.88,485.88,thegreenmethod,0.9194735288619996,The Green Method,2308,2308,8/1/2018,2018-08-01 00:00:00
51231615,16.99,16.99,amazon,0.9873169064521792,Amazon,D01-4674801-3692254,D01-4674801-3692254,26.08.2018,2018-08-26 00:00:00
51436439,103.0,103.0,telstra,0.9798296689987184,Telstra,1361719263,1361719263,"august 9, 2018",2018-08-09 00:00:00
52066759,2137.0,1022.0,farmers,0.6151109337806702,Farm Bureau Insurance,,,"fri, aug 24, 2018",2018-08-24 00:00:00
50724853,1890.62,1890.62,gensco,0.9975969195365906,"Gensco, Inc.",848249934,848249934,"friday, july 20, 2018",2018-07-20 00:00:00
52481814,19225.0,31968.75,burt,0.5807268023490906,Burt & Associates,,,7/31/2018,2018-07-31 00:00:00
52271961,8393.12,8393.12,bp australia,0.9378741383552552,Bp Australia Pty Ltd,10302089,10302089,"july 31, 2018",2018-07-31 00:00:00
51286651,370.0,370.0,bootstrap coffee roasters,0.9953672885894777,Bootstrap Coffee Roasters,R4928,R4928,"aug 19, 2018",2018-07-20 00:00:00
50481645,52.94,52.94,boxed,0.9867145419120787,Boxed,RECEIPT#188346597,,14/08/18,2018-08-14 00:00:00
51165393,360.15,360.15,freshfrontier,0.937442660331726,Fresh Frontier,1116096,1116096,21/08/2018,2018-08-21 00:00:00
52034477,1442.63,1442.63,expedia,0.8885927796363831,Expedia.ca,7370085751991,,07/31/2018,2018-07-31 00:00:00
52128829,7.03,7.03,zoho corporation,0.7431697845458984,Zoho Corporation,,,09/08/2018,2018-08-09 00:00:00
50525219,11.98,11.98,new seasons market,0.8155420422554016,NEW SEASONS MARKET,,,8/2/2018,2018-08-02 00:00:00
51315249,384.0,384.0,tava organics,0.950639307498932,TAVA ORGANICS,10727,10727,,2018-07-27 00:00:00
51150791,34.32,34.32,allied lumberland,0.9974797368049622,Allied Lumberland Ltd.,361164,361164,"august 20, 2018",2018-08-20 00:00:00
51935934,28.75,28.75,city bakery of arizona,0.9307697415351868,City Bakery of Arizona,2979,2979,1/08/2018,2018-08-01 00:00:00
52895182,58.76,58.76,qualityprint,0.9884145855903624,Quality Print,81337,81337,,2018-07-23 00:00:00
51580930,66.9,66.9,regal decorating & paint regal decorating & paint,0.9960228800773621,Regal Decorating & Paint-Jupiter,A19610/8,A19610/8,08/24/2018,2018-08-24 00:00:00
52539489,,24.74,,,Office Depot,,181097052001,03/08/2018,2018-08-03 00:00:00
51978883,36.67,36.67,hardware & general supplies,0.9748154282569884,Hardware & General,39436861,39436861,07-15-18,2018-07-15 00:00:00
50983671,125.0,125.0,dennis p. block & associates,0.961964190006256,Dennis P. Block & Associates,,,,2018-07-06 00:00:00
50903520,2268.86,2268.86,floor gallery,0.962476134300232,Floor Gallery,21755,,31 jul 2018,2018-07-31 00:00:00
52580771,39.94,39.94,electrical,0.5865083336830139,Godfreys Freight,2024209,2024209,06/29/2018,2018-06-29 00:00:00
51401351,455.94,455.94,google ads,0.8423475623130798,Google,,,05/10/2017,2017-05-10 00:00:00
53091476,15400.0,15400.0,morgans,0.6975840926170349,Morgans,33/001340,33/001340,07/19/18,2018-07-19 00:00:00
51244465,408.0,408.0,speedy couriers,0.818862795829773,Speedy Same Day Deliveries,6705,6705,8/7/2018,2018-08-07 00:00:00
51259744,199.54,199.54,peapod,0.945895493030548,Peapod,D122904204,d122904204,"august 06, 2018",2018-08-06 00:00:00
52771848,10.45,10.45,usps,0.6865593194961548,USPS,441946876,,6 aug 2018,2018-08-06 00:00:00
52139051,866.45,866.45,essential,0.6512439250946045,Stripe,,,8/23/2018,2018-08-23 00:00:00
52104112,37.39,37.39,superior threads,0.9872239828109741,Superior Threads,648365,8-16-18,8/21/2018,2018-08-21 00:00:00
51280741,47.5,47.5,roland wawrzyniak,0.9585909843444824,"Roland Wawrzynak, Inc.",195,195,"december 31, 2017",2017-12-31 00:00:00
51396174,125.17,125.17,johnny on the spot,0.9943177700042723,Johnny On The Spot,0000485366,0000485366,25/07/2018,2018-07-25 00:00:00
50762094,979.03,979.03,pure juice bar,0.662225067615509,Raw Elements,263033,263033,08/17/18,2018-08-17 00:00:00
51789887,6039.89,6039.89,rona,0.9956889152526855,Rona,6183010598121,61830-10598121,"thu, jul 12, 2018",2018-07-12 00:00:00
52202109,35.12,35.12,american airlines,0.9707556366920472,American Airlines,,,"aug 18, 2018",2018-08-18 00:00:00
52555480,60.0,60.0,hermann troeger,0.9053608179092408,Vancouver Animation School,0029,0029,7/27/2018,2018-07-27 00:00:00
53109598,86.12,86.12,homedepot,0.6823060512542725,Homedepot.ca,60408,,01 aug 18,2018-08-01 00:00:00
51336310,486.25,486.25,pinnacle flowers,0.9805731773376464,Pinnacle Flowers,PF-02252,PF02252,27/07/2018,2018-07-27 00:00:00
52712398,472.8,472.8,,,Visiontron Corp.,653880,653880,29 june 2018,2018-06-29 00:00:00
51886770,16.28,16.28,apple,0.9860232472419742,Apple,213221335932,,"thursday, august 9, 2018",2018-08-09 00:00:00
52114773,55.69,55.69,louestt463,0.7480747699737549,Loves,,,,2018-07-08 00:00:00
52641926,1370.48,1370.48,trouw nutrition,0.8334363102912903,TROUW NUTRITION,41E018012924,41E018012924,5/21/2018,2018-05-21 00:00:00
51730078,5000.0,5000.0,facebook ads,0.8614144921302795,Facebook,,,"sun, aug 5, 2018",2018-08-05 00:00:00
51800608,38.22,38.22,amazon.co.uk/contact-us,0.7343656420707703,Amazon Retail,INV-GB-137208351-2018-2754,inv-gb-137208351-2018-2754,,2018-05-01 00:00:00
51318405,10.0,10.0,e.gogoair,0.9300444722175598,Gogo,315962554TPAA,315962554TPAA,"sat, jul 28, 2018",2018-07-28 00:00:00
51379556,2664.07,2664.07,highland packers,0.9745136499404908,Highland Packers Ltd.,231509,231509,8/16/18,2018-08-16 00:00:00
51314800,517.68,517.68,waypay,0.7561469078063965,Waypay,ORDER#1018640,,04/19/2012,2012-04-12 00:00:00
52864647,110.53,110.53,eversource,0.9896338582038879,Eversource,,(ck269) 180823,8/27/18,2018-08-27 00:00:00
51125307,23500.0,1000.0,knox used cars,0.6026288270950317,Knox Used Cars & Commercials,,2248,20 aug 18,2018-08-20 00:00:00
52282789,1159.87,1159.87,sysco,0.9981693029403688,Sysco,252174879,252174879,2018-08-01,2018-08-01 00:00:00
51917226,300.57,300.57,the home depot,0.941404402256012,The Home Depot,,H0272-131513,8/1/18,2018-08-01 00:00:00
52125495,251.2,251.2,highlander,0.6625562906265259,The Highlander,21434,21434,7/31/2018,2018-07-31 00:00:00
51565804,200.0,200.0,jessica rodrigues de sousa,0.8483234643936157,Jessica De Sousa,,,"august 13, 2018",2018-08-13 00:00:00
52597952,210.17,210.17,the home depot,0.9746136665344238,The Home Depot,H4110-66826,H4110-66826,11 aug 18,2018-08-11 00:00:00
51477756,25.0,25.0,starbucks coffee company,0.7419155240058899,Starbucks Coffee Company,V40DC07J93235W8G77HC1R14L7,,8/5/2018,2018-08-05 00:00:00
50216888,122.5,122.5,the picture,0.8284231424331665,Alexander Rusovan,INV-4697,INV-4697,nov 29 17,2017-11-29 00:00:00
50668310,632.52,632.52,avenue tools,0.957386553287506,avenue tools,51011,51011,3 august 2018,2018-08-03 00:00:00
52829345,-2.35,-2.35,flying apron bakery,0.8912269473075867,Flying Apron Bakery,79531,79531,dec-12-2017,2017-12-12 00:00:00
50885108,2830.31,2830.31,lone tree cellars,0.9916477203369141,Lone tree cellars,JUNE 2018,,08/23/2018,2018-08-23 00:00:00
50835341,3602.8,3602.8,south coast brick & roofing,0.9902187585830688,DBC,4773,4773,28-07-2018,2018-07-28 00:00:00
51460011,179.19,179.19,ball & doggett,0.9606712460517884,Ball & Doggett,INV001501845,INV001501845,08/07/2018,2018-08-07 00:00:00
52140266,12.9,12.9,aspen mills bread co,0.96316260099411,Aspen Mills,,,11 aug 2018,2018-08-14 00:00:00
52335072,240.0,240.0,bluegate enterprises,0.8816666603088379,Bluegate Enterprises LLC,1170,1170,17 august 2018,2018-08-17 00:00:00
50245487,,950.0,,,US -Analytics Solutions Group LLC,,,07/12/2018,2018-07-12 00:00:00
52391185,-60.0,-60.0,hubdoc,0.9997534155845642,Hubdoc,110335,110335,8/13/2018,2018-08-13 00:00:00
52229348,22845.0,22845.0,chargebacks911,0.9106901288032532,Chargebacks911,118730,118730,08/14/2018,2018-08-14 00:00:00
52408012,712.32,712.32,aquiform distributors,0.9319915771484376,aquiform distributors,611887,611887,8/10/2018,2018-08-10 00:00:00
50214117,2656.39,2656.39,nelson wine,0.7877531051635742,Nelson Wine Co,1512559,,,2018-07-29 00:00:00
52688186,1309.0,1309.0,a-force transport,0.9875503778457642,A-Force Transport,,,08/14/2018,2018-08-14 00:00:00
52206307,36.75,36.75,zoho,0.9854326248168944,Zoho,64021121,64021121,10 jul 2018,2018-07-10 00:00:00
53038652,67.18,67.18,the home depot,0.976874053478241,The Home Depot,,,08/16/2018,2018-08-16 00:00:00
51578163,122.53,122.53,taylor automotive williams,0.9548428058624268,Taylor,,,"august 9, 2018",2018-08-09 00:00:00
50714124,50.0,50.0,the bottom line,0.9653643369674684,The Bottom Line,10367,10367,07/30/18,2018-07-30 00:00:00
50630436,151.92,589.17,wolseley canada,0.8619946837425232,Wolseley Canada Inc,7010246,"7010246, 7040247","october 23, 2017",2017-10-23 00:00:00
53034590,16.97,16.97,wolseley canada,0.8269250988960266,Wolseley,7078995,7078995,"jul 31, 2018",2018-07-31 00:00:00
52838738,51.85,51.85,tyler distribution centers,0.9753490686416626,Tyler Distribution Centers Inc.,00072139,00072139,2018-08-01 2018-08-08,2018-08-02 00:00:00
51395725,5.99,5.99,hotspot,0.6298332214355469,Htsp.ca,,,20/08/2018,2018-08-20 00:00:00
52037169,74.84,74.84,quench usa,0.84808349609375,Quench USA Inc,INV01341149,INV01341149,"monday, august 13, 2018",2018-08-13 00:00:00
51510669,,107.78,at&t,0.9445461630821228,AT&T,,,30 april 2018,2018-04-30 00:00:00
50747653,21104.13,21104.13,mckesson canada,0.9153035283088684,Mckesson Canada Corporation,1400137058,,01/03/2018,2018-01-03 00:00:00
50229260,51321.5,1321.5,thomas chin,0.8163289427757263,Thomas Chin Pty Ltd.,3942,3942,"aug 17, 18",2018-08-17 00:00:00
52574435,285.0,285.0,daniel hunt,0.9918005466461182,Daniel Hunt,INV-1652,INV-1652,"august 10, 2018",2018-08-10 00:00:00
50634211,1321.13,1321.13,stoland,0.7247081398963928,Kent's Hardware,20005850,20005850,2018-08-02,2018-08-02 00:00:00
52756819,299.0,299.0,demandforce,0.9959238171577454,Demandforce,INV04335540,INV04335540,30/07/2018,2018-07-30 00:00:00
52373271,1344.0,1344.0,aggregate industries,0.7427632808685303,Aggregate Industries,27022378,27022378,"04 august, 2018",2018-08-04 00:00:00
50297854,228.0,228.0,freshworks,0.9600895643234252,Freshworks,FD574657,FD574657,"august 1, 2018",2018-08-01 00:00:00
52196472,22799.59,22799.59,dhl,0.9082271456718444,DHL,,,7/19/2018,2018-07-19 00:00:00
52484873,325.0,325.0,august - andrew jones,0.7876836061477661,Andrew Jones,,082018,08/16/18,2018-08-16 00:00:00
53112151,47.15,35.0,blockchain data,0.840825617313385,Blockchain data LTD,,,"aug 8, 2018",2018-08-08 00:00:00
52007431,10000.0,10000.0,facebook ads,0.8713612556457521,Facebook,,,8/20/2018,2018-08-20 00:00:00
52640308,,92.22,uniform express,0.9963198304176332,Uniform Express,348366,348366,,2018-07-06 00:00:00
51271447,40.86,40.86,,,GSU,,,,2018-07-18 00:00:00
51187661,4.49,4.49,email.apple,0.9734387397766112,Apple,,iCloud Storage,08/01/2018,2018-08-01 00:00:00
50313343,615.3,615.3,hilti,0.8408601880073547,Hilti,1685430336,1685430336,08/14/2018,2018-08-14 00:00:00
51634794,208.31,208.31,florida power and light,0.8155261874198914,Florida Power and Light,,,"thursday, august 2, 2018",2018-08-02 00:00:00
50306784,310.05,310.05,verizon,0.8988944888114929,Verizon,,,,2018-04-15 00:00:00
51013592,171.6,171.6,xero,0.9979206323623656,Xero Inc.,INV-1554707,INV-1554707,"july 31, 2018",2018-07-31 00:00:00
52458936,1027.0,1027.0,rmb enterprises,0.9486451745033264,RMB Enterprises,18-08348,18-08348,"mon, aug 20, 2018",2018-08-20 00:00:00
51601373,3.0,3.0,rev,0.9590012431144714,"Rev.com, Inc.",3LU01856K6412201R,,30-11-2017,2018-08-24 00:00:00
51825143,54.08,3.94,alpine interior,0.8229584693908691,Alpine,2204492,2204492,"wed, aug 8, 2018",2018-08-08 00:00:00
50446739,3633.71,3633.71,grimco,0.8882580399513245,Grimco,4236126-00,4236126-00,08/23/18,2018-08-23 00:00:00
51252638,299.99,299.99,dative,0.8429706692695618,Dative,,,22-aug-2018,2018-08-22 00:00:00
52973482,9.99,9.99,google play,0.9176896810531616,Google Play,GPM.1216-4672-2333-55776..34,,03/02/2018,2018-03-01 00:00:00
52773664,,433.0,first data,0.5913991332054138,First Data,B01219817,B01219817,"july 31, 2018",2018-07-31 00:00:00
51572346,23.5,23.5,john,0.5567639470100403,JOHN CROOKS HARDWARE,,1145657,"aug 17, 2018",2018-08-17 00:00:00
52073613,214.8,214.8,mlba consulting,0.985634744167328,HCM Cigar Beads,8727-65383,8727-65383,16 aug 2018,2018-08-16 00:00:00
50571165,3347.52,3347.52,metcash food & grocery,0.9346551299095154,Metcash Food & Grocery,,G0824471,"aug 14, 2018",2018-08-14 00:00:00
51426410,2664.35,2664.35,janmohamed jaffer professional corporation,0.9869162440299988,Janmohamed Jaffer Professional Corporation,,,7/30/2018,2018-07-30 00:00:00
51812797,19.42,19.42,amazon web services,0.7028037309646606,amazon web services,145056289,145056289,27/07/2018,2018-07-27 00:00:00
53025480,1296.84,1296.84,vantyghem diamonds,0.9811553955078124,Vantyghem Diamonds,,042358,08/06/2018,2018-08-06 00:00:00
51199381,236.04,236.04,johnstone supply,0.9988478422164916,Johnstone Supply,329-S1764700.001,329-S1764700.001,"sat, aug 4, 2018",2018-08-04 00:00:00
50558713,761.9,982.57,discmania,0.7073643803596497,Discmania dealer store,2247,20187.04.17,07/31/2018,2018-07-30 00:00:00
50586610,673.32,673.32,t & f all states,0.9741767048835754,T & F All States,,,08/01/2018,2018-08-01 00:00:00
51812365,,95.45,alliston home hardware building centre,0.7181568145751953,Home Hardware,,403870,"july 31, 2018",2018-07-31 00:00:00
52610508,1050.0,1050.0,metrics chartered professional,0.7545349001884459,Metrics Chartered,INV-2400,INV-2400,3 aug 2018,2018-08-03 00:00:00
51167810,480.0,480.0,supporting strategies partners,0.9676180481910706,Supporting Strategies Partners,8365,8365,16 august 18,2018-08-16 00:00:00
50609329,720.07,720.07,waxcenter,0.908453106880188,Waxcenter.com,SIN284358,SIN284358,09/08/2018,2018-08-09 00:00:00
50734378,32.77,32.77,intuit,0.914760172367096,Intuit Quickbooks,230012713635,230012713635,"august 2, 2018",2018-08-02 00:00:00
51315914,46.75,46.75,peak bookkeeping,0.988290309906006,Peak Bookkeeping,INV-2566,2566,2018-07-31,2018-07-31 00:00:00
51289920,329.0,329.0,support.checkpoint.thomsonreuters,0.6460420489311218,Thomson reuters,16505382,,8/6/2018,2018-08-06 00:00:00
50683459,516.0,10328.97,rave restaurant group,0.9920749664306641,Rave Restaurant Group,INV0008470,INV0008470,30 jun 2018,2018-06-30 00:00:00
50237556,994.06,994.06,genieall,0.9466227293014526,GenieAll,1798,1798,26/07/2018,2018-07-26 00:00:00
50228141,654.5,654.5,scott winder,0.6763458847999573,Winder Design,00674,00674,28-08-18,2018-08-28 00:00:00
51557976,520.0,520.0,washington multi-family housing assoc,0.9580475091934204,Washington Multi-Family Housing Association,39047,39047,"tue, aug 7, 2018",2018-08-01 00:00:00
51479603,2275.0,4450.0,kravet,0.9280555248260498,Kravet,,PO10443,7/31/2018,2018-07-31 00:00:00
52412355,1093.2,1093.2,single origin coffee,0.9673115611076356,Single Origin Coffee,3512,3512,aug 15,2018-08-15 00:00:00
52333756,4583.7,4583.7,wah trust,0.9020647406578064,WAH Trust,INV-0016,INV-0016,"august 9, 2018",2018-08-09 00:00:00
52200351,8161.07,8161.07,envirolite,0.9983686208724976,Envirolite LLC,28018,28018,4-august 17,2018-08-17 00:00:00
52656193,,479.16,,,Young's Market Company,,1640543,27 jul 2018,2018-07-27 00:00:00
51483637,45.2,45.2,orkin canada,0.9156108498573304,Orkin Canada Corporation,IN-8698276,IN-8698276,7/31/2018,2018-07-31 00:00:00
51715739,105.0,105.0,mailchimp,0.982711136341095,MailChimp,MC06741969,MC06741969,08/13/2018,2018-08-13 00:00:00
50732535,1909.44,1909.44,bj's,0.7150076031684875,BJ's Wholesale Club,,,31/07/2018,2018-07-31 00:00:00
52888610,36.95,36.95,amazon.co.uk,0.9916453957557678,Amazon.co.uk,203-6367633-8327568,203-6367633-8327568,7/23/2018,2018-07-23 00:00:00
50467288,122.85,122.85,securtek,0.9595450162887572,SecurTek,R0007460048,R0007460048,"1 sep 1, 2018",2018-08-01 00:00:00
51546797,17.49,17.49,microsoft,0.9783048629760742,Microsoft,E02006B9A5,E02006B9A5,13/08/18,2018-08-13 00:00:00
50962356,20851.19,20851.19,,,Peloton Media,17000513,17000513,"wed, aug 22, 2018",2018-08-22 00:00:00
51215976,,711.1,cc,0.5565699338912964,Costco Business Center,,276739045,30/05/2018,2018-05-30 00:00:00
52087362,432.0,432.0,vivian rose alim,0.8482839465141296,Vivian Rose Alim,,08152018,08/02/18,2018-08-02 00:00:00
52658669,746.19,746.19,locust lumber company,0.7980517148971558,Locust Lumber,1808-170743,1808-170743,09-aug-2018,2018-08-09 00:00:00
52910313,56.0,56.0,barrie sports medicine,0.980607271194458,Barrie Sports Medicine,99634,99634,"august 25, 2018",2018-08-25 00:00:00
50736036,309.75,309.75,statemint bc,0.9014856219291688,Statemint,1012,1012,08/08/18,2018-08-08 00:00:00
51467271,632.0,632.0,location medical services,0.9753862023353576,Location Medical Services,43952,43952,08/05/2018,2018-08-05 00:00:00
52039778,62.09,62.09,pan pacific pet,0.9989637732505798,Pan Pacific Pet,IN9443694,IN9443694,,2018-08-06 00:00:00
52974531,5.0,5.0,craigslist,0.9154031872749328,Craigslist,6681461006,,"thu, aug 23, 2018",2018-08-23 00:00:00
50208601,4.02,4.02,hunnybee,0.9923280477523804,Hunnybee,,,7/28/18,2018-07-28 00:00:00
51178156,393.98,393.98,southwest airlines,0.950240433216095,Southwest Airlines,,,6/15/2018,2018-06-15 00:00:00
52369511,209.0,209.0,designline,0.6083851456642151,Designline Graphics,INV-194860,,,2018-07-31 00:00:00
50802826,43.5,43.5,pressed earth juices,0.733801007270813,Pressed Earth Juices,INV-9904,INV-9904,"august 8, 2018",2018-07-31 00:00:00
51615806,34.0,34.0,amazon web services,0.8969216346740723,Amazon Web Services,108169079,108169079,15-aug-2018,2018-08-15 00:00:00
51393504,582.42,582.42,cave spring cellars,0.7682690024375916,Cave Spring Niagara Peninsula,IN0000000394085,IN0000000394085,2018 07 30,2018-07-30 00:00:00
52643701,1407.0,1407.0,quality-construction,0.9161162376403807,Quality Construction,INVOICE#130356,Invoice#130356,07/28/2018,2018-07-28 00:00:00
50956604,20.0,20.0,myob australia,0.7117193937301636,MYOB Australia Pty Ltd,1-57839508977,1-57839508977,jul 31 2018,2018-07-31 00:00:00
51281011,466.67,466.67,trucolors contracting,0.8827908635139465,Trucolors Contracting,9011,9011,"aug 16, 2018",2018-08-16 00:00:00
51916870,225.0,225.0,linkedin,0.9820972084999084,LinkedIn,78110301730,78110301730,"tue, aug 21, 2018",2018-08-21 00:00:00
51295440,457.53,457.53,socalgas,0.9804948568344116,SoCalGas,,,"september 30, 2017",2017-09-30 00:00:00
51249595,10949.4,10949.4,kurlben,0.8238607048988342,Kurlben Darwin,001291B,001291B,"thu, dec 14, 2017",2017-12-20 00:00:00
52038865,97.84,97.84,platt,0.9983787536621094,Platt.com,T085555,,07/31/2018,2018-07-31 00:00:00
52608632,23.1,23.1,drew's catering & events,0.7159134745597839,Drew's Cartering & Events,E12806,E12806,"wed, aug 01, 2018",2018-08-01 00:00:00
50753789,27.13,27.13,apple,0.9509197473526,Apple,,,8/14/2018,2018-08-14 00:00:00
51012406,430.01,430.01,commander,0.990001380443573,Commander,17834988,17834988,,2018-08-23 00:00:00
51027363,,57613.63,businesstrack,0.5924301147460938,Suntrust Merchant -6882,,,19/03/2018,2018-03-19 00:00:00
51003916,6698.78,6698.78,dsv air & sea,0.8197596073150635,DSV,US03870131,US03870131,13. august 2018,2018-08-01 00:00:00
51249381,6638.26,6638.26,capitalone,0.9922325015068054,Capital One,,,"monday, august 6, 2018",2018-08-06 00:00:00
52440156,231.44,231.44,callaway golf canadas,0.9790806770324708,Callaway,9460671528,9460671528,08/20/2018,2018-08-20 00:00:00
50254754,40.23,40.23,amazon,0.9914960265159608,Amazon,70132156282023416,,3 aug 2018,2018-08-03 00:00:00
52709326,13.56,13.56,enviroshred record management,0.9040374159812928,Enviroshred Record Management,422,422,8/3/2018,2018-08-03 00:00:00
52994218,99.0,99.0,triple j t transport,0.9838813543319702,Triple J T Transport,00007611,00007611,05-01-2015,2015-05-01 00:00:00
50946368,845.13,845.13,wells fargo,0.9219690561294556,Wells Fargo,,,6/21/18,2018-06-21 00:00:00
50749365,80.0,30782.87,chocolates,0.6328940391540527,stubbe chocolates ltd.,,,07/31/2018,2018-07-31 00:00:00
52415414,202.13,202.13,handicare canada,0.8593207597732544,Handicare Canada Ltd,C-100165,C-100165,02 aug 2018,2018-08-02 00:00:00
51325199,500.0,500.0,yahoo gemini,0.7533290982246399,Yahoo Online Services,,,"august 02, 2018",2018-08-02 00:00:00
52655217,42.21,42.21,amazon,0.998304545879364,Amazon,701-8181615-1610638,701-8181615-1610638,8/6/2018,2018-08-06 00:00:00
51586414,6.0,6.0,ppplaci,0.6523367762565613,PC Place,1345B,,"april 01, 2018",2018-04-01 00:00:00
52371031,122.32,122.32,rhino rack australia,0.9334657788276672,Rhino Rack Australia,915842,915842,8/8/2018,2018-08-08 00:00:00
52390175,593.34,593.34,ningbo mh canada,0.8040162920951843,HSBC,5961457,5961457,8 august 2018,2018-08-08 00:00:00
51225068,172.11,172.11,amazon,0.9960322976112366,amazon,111-9585847-6413065,,,2013-05-24 00:00:00
52760817,84.73,84.73,goodman,0.8597766757011414,Goodman,182490,R016960,,2018-08-15 00:00:00
51937080,1000.0,1000.0,gouter,0.9520354866981506,Gouter,1317,1317,13.08.2018,2018-08-13 00:00:00
52999881,82.45,82.45,oneworldcourier,0.7966764569282532,One World Courier,1001,1001,08/14/2018,2018-08-14 00:00:00
51221192,21.05,21.05,bowral co-operative,0.8892027139663696,Bowral Co-op,655671,655671,07/31/18,2018-07-31 00:00:00
52689393,,4.0,,,Hokka Hokka,,,22 aug 2018,2018-08-22 00:00:00
50430180,206.91,206.91,azuga,0.9069473147392272,Azuga,A00006587,,6/28/2018,2018-06-28 00:00:00
50884262,395.71,395.71,agropur,0.9966614842414856,Agropur - Pay 4606,17963,,17aug2018,2018-08-21 00:00:00
51757061,21.99,21.99,jeays hardware,0.9985502362251282,Jeays Hardware,110530079,110530079,08/20/18,2018-08-20 00:00:00
52107345,154.03,154.03,henry schein,0.9632750749588012,Henry Schein Animal Health,NF49282,NF49282,7/18/2018,2018-07-18 00:00:00
50885354,900.0,900.0,shepherd solutions,0.9988510608673096,Shepherd Solutions,131,131,07/20/2015,2015-07-20 00:00:00
53021082,10.0,10.0,jerem-ross-7e3k.squarespace,0.9890986084938048,Squarespace,,,31/07/18,2018-07-31 00:00:00
50894750,24900.0,24900.0,crucible metals solutions,0.8817869424819946,"Waupaca Foundry, Inc",2000585365,,24/07/2018,2018-07-31 00:00:00
51898090,14.4,14.4,bleu handcrafted foods,0.9837507009506226,Bleu Handcrafted Foods,,,31/07/18,2018-07-31 00:00:00
52773525,62.5,62.5,c&c cleaning,0.9686686396598816,C&C Cleaning,39,1,"aug 3, 2018",2018-08-02 00:00:00
52148643,252.0,252.0,maple grove finishing,0.9271479845046996,Maple Grove Finishing,101702,101702,2018 / 07 / 24,2018-07-24 00:00:00
52020598,933.1,933.1,staples,0.9638257622718812,STAPLES,9404825322,9404825322,30/07/2018,2018-07-30 00:00:00
52237108,1213.38,1222.2,kaknes landscape supply,0.9941060543060304,Kaknes Landscape Supply,35847,35847,26/08/2018,2018-08-26 00:00:00
52802708,29.31,29.31,royal canin,0.9626805186271667,Royal Canin,SC-0618086,SC-0618086,10 august 2018,2018-08-10 00:00:00
51636338,3604.03,3604.03,td,0.8532617092132568,TD Canada Trust,,,27/07/2018,2018-07-27 00:00:00
52737006,208.61,208.61,conscious water,0.9544254541397096,Conscious Water,18955,18955,8/7/2018,2018-08-07 00:00:00
51097045,35.0,35.0,renaissance chicken,0.9914486408233644,Renaissance Chicken,2857,2857,8/15/2018,2018-08-15 00:00:00
51596143,77.13,77.13,loblaws,0.6301471590995789,Instacart,,,"thursday, august 9, 2018",2018-08-09 00:00:00
50416502,222.83,222.84,leeds,0.9612965583801272,Leed's,V7930989,V7930989,08/21/2018,2018-08-21 00:00:00
50242906,25.0,25.0,starbucks,0.7529786229133606,Starbucks,,,08/01/2018,2018-08-01 00:00:00
52379784,1189.83,1189.83,adobe creative cloud,0.8552418947219849,Adobe Creative Cloud,AD015372758,AD015372758,aug-02-2018,2018-08-02 00:00:00
51985173,73.14,73.14,garden st. portables,0.9921881556510924,Garden St Portables,A-44320,A-44320,may-24-2018,2018-05-24 00:00:00
52565996,46.0,46.0,lescodistributing,0.9046226739883424,Lesco Distributing,OC291239,OC291239,08/15/18,2018-08-15 00:00:00
52914761,1352.6,1352.6,d e p o s i t s l i p,0.9580330848693848,Deposit Slip,,,"fri, aug 17, 2018",2018-08-17 00:00:00
51258506,315.0,315.0,plantbase food and products,0.85831218957901,PlantBase Food and Products,1443,1443,04-30-17,2017-04-30 00:00:00
52384548,1919.09,1919.09,county line,0.9940681457519532,County Line,,,aug 27 2018,2018-08-27 00:00:00
52097176,,9.96,credit one bank,0.8648906946182251,Credit One,,,20/07/2018,2018-07-20 00:00:00
51742475,165.0,165.0,fig flowers,0.9876938462257384,Fig Flowers,INV-0803,INV-0803,"july 27, 2018",2018-07-27 00:00:00
50243514,73.44,73.44,ehrlich,0.789659321308136,Ehrlich,7987928,7987928,"jul 9, 2018",2018-07-09 00:00:00
52735420,1526.4,1526.4,purefoodessentials,0.7395265102386475,Pure Food Essentials,N132,N132,"aug 19, 2018",2018-08-19 00:00:00
52235028,7.99,7.99,montalbano lumber,0.9820059537887572,Montalbano Lumber,1808-730586,1808-730586,"july 30, 2018",2018-07-30 00:00:00
50900869,14464.0,14464.0,teamlogic it northeast ma,0.9595560431480408,TeamLogic IT Northeast MA,,STATEMENT 08/02/18,15.08.18,2018-08-15 00:00:00
52581974,61.0,61.0,the brothers cup,0.9718304276466372,The Brothers Cup,,1388,6/19/2018,2018-06-19 00:00:00
50736229,,761.96,opportunite import,0.7370550632476807,Opportunites Import,,984t,23 aug 2018,2018-08-23 00:00:00
52026082,2.18,2.18,facebook,0.8408185243606567,Paypal,,,"23 aug, 2018",2018-08-23 00:00:00
50688164,1000.0,1000.0,erin byrne,0.9814934730529784,Erin McCartin,18,18,08/06/2018,2018-08-20 00:00:00
52480089,662.58,649.33,mckesson,0.9321843981742859,McKesson,7887857853,7887857853,"jun 30, 2018",2018-06-30 00:00:00
51758482,127.66,0.0,eveve,0.6449292898178101,Restaurant Hub,30430313,30430313,"jul 13, 2018",2018-07-13 00:00:00
51361935,880.27,880.27,freedom,0.9967209100723268,Freedom,193749,193749,aug-01-2018,2017-10-28 00:00:00
52779757,877.57,877.57,interfulfillment,0.9985957741737366,Inter Fulfillment Inc.,419291,419291,05 oct 2017,2017-10-05 00:00:00
52064519,193.93,193.93,wardpackaging,0.9527537822723388,Ward Packaging,IN0470775,IN0470775,"aug 1, 2018",2018-08-01 00:00:00
51214828,7.72,7.72,o c h i,0.6319254636764526,Chick Fil A,,,"february 6, 2017",2017-02-06 00:00:00
50769610,50.0,50.0,vstock transfer,0.9860314726829528,"Vstock Transfer, LLC",V1503718,V1503718,"february 05, 2018",2018-02-05 00:00:00
52881865,44.0,44.0,castroville community services district,0.9785858392715454,Castroville Community Services District,6023,6023,31/07/2018,2018-07-31 00:00:00
50907795,289.26,289.26,manpower,0.9811856150627136,Manpower,33010919,33010919,08/14/2018,2018-08-14 00:00:00
51663071,5.36,5.36,we energies,0.6621994376182556,WE Energy,,,12/8/15,2015-12-08 00:00:00
50971907,2000.0,2000.0,lampix,0.919898509979248,Leen Al-Bassam,,21,"friday, september 22, 2017",2018-09-09 00:00:00
52719818,41.99,41.99,princessauto,0.9951205253601074,Princess Auto,1193842,1193842,08/04/2018,2018-08-04 00:00:00
51264435,155.0,155.0,sfax,0.6817315816879272,Sfax,7635,7635,08/21/2018,2018-08-21 00:00:00
52706460,90.0,90.0,intuit's,0.5708381533622742,Intuit,,,"february 21, 2018",2018-02-21 00:00:00
52584839,,18.04,by camscanner,0.7356483936309814,SSP America,,,,2018-06-27 00:00:00
52375544,286.0,286.0,ball & doggett,0.9621508717536926,Ball & Doggett,INV001558058,INV001558058,"sat, aug 25, 2018",2018-08-21 00:00:00
51332826,285.0,285.0,morgan robinson,0.9837048649787904,Morgan Robinson,0000002,0000002,10 august 2018,2018-08-10 00:00:00
51610486,59.83,59.83,teksavvy solutions,0.7568942308425903,TekSavvy Solutions Inc,IN020538091,IN020538091,10-31-2017,2017-10-31 00:00:00
51219788,68.25,68.25,premier post installations,0.9719638824462892,Premier Post Installations,1816,1816,08/01/2018,2018-08-01 00:00:00
51023696,1638.01,1638.01,impex gls,0.9788608551025392,Impex Gls,IML27180,IML27180,"aug 27, 2018",2018-08-27 00:00:00
50964200,149.58,149.58,modernworks,0.9956696033477784,ModernWorks,16381,16381,19 july 2018,2018-07-19 00:00:00
52072053,41.28,41.28,amazon,0.9974945187568665,Amazon,113-0031301-7181005,113-0031301-7181005,"august 11, 2018",2018-08-11 00:00:00
50981282,202.0,202.0,bsk associates,0.999868869781494,BSK Associates,A822149,A822149,08/01/2018,2018-08-01 00:00:00
51694186,27.72,27.72,uber,0.9397339224815368,uber Eats Marketplace,,,"saturday, august 11, 2018",2018-08-11 00:00:00
50700951,5.3,5.3,google,0.9922752976417542,Google,3484934262,3484934262,"july 29, 2018",2018-07-29 00:00:00
50502067,2843.8,2843.8,agropur,0.9768094420433044,AgroPur - pay,,,30/04/2018,2018-04-30 00:00:00
52213169,136.84,136.84,hotels,0.9688382744789124,Hotels,151103364835,151103364835,8/21/2018,2018-08-21 00:00:00
52017389,5880.0,5880.0,sort-tek,0.5193407535552979,Kamax L.P.,02648,02648,07/06/2018,2018-07-06 00:00:00
52594886,286215.0,286215.0,"rbc phillips, hager & north",0.9949302673339844,"RBC Phillips, Hager & North",,,2/02/13,2013-02-02 00:00:00
50973517,26.72,26.72,quartzy,0.9982498288154602,Quartzy,141446,141446,6 august 2018,2018-08-06 00:00:00
51125873,12266.0,12266.0,backerkit,0.7718098163604736,BackerKit,,,16 jul 18,2018-07-16 00:00:00
50268800,7.23,7.23,drive thru technology,0.9890122413635254,"Drive Thru Technology, Inc.",2059424,2059424,"august 18, 2018",2018-08-18 00:00:00
50283705,18.97,18.97,rona,0.9951450824737548,RONA,514-17206941,514-17206941,8/08/18,2018-08-08 00:00:00
51973210,80.27,80.27,sherwin williams,0.9974911212921144,Sherwin Williams,0879-7,0879-7,"july 04, 2018",2018-07-04 00:00:00
51550234,10.26,10.26,lucid software,0.9966655373573304,Lucid Software Inc,2546165,2546165,"aug 01, 2018",2018-08-01 00:00:00
50488941,20.0,20.0,"searle, susan",0.991641879081726,"Searle, Susan",,20180731 SS,14.08.2018,2018-08-14 00:00:00
51139030,,600.8,,,Gary M Mattes,,,"tue, aug 14, 2018",2018-08-14 00:00:00
51350961,153.0,153.0,pfd food services,0.9628817439079284,Pfd Food Services,KL308938,KL308938,08/14/18,2018-08-14 00:00:00
50690650,295.0,295.0,donuts,0.9831824898719788,Donuts,9958,9958,"monday, august 13, 2018",2018-08-13 00:00:00
52434519,64.7,64.7,the wierchant tap house,0.8964589238166809,The merchant Tap HOuse,,,08/24/2018,2018-08-24 00:00:00
50229174,4.0,4.0,astoria,0.8278197050094604,Astoria Paper Products Pty Ltd,IN524138,IN524138,7/30/2018,2018-07-30 00:00:00
52766951,4.36,4.36,ebay,0.9685518741607666,eBay,,,"tue, aug 21, 2018",2018-08-21 00:00:00
51261674,57.5,57.5,3d property management,0.9944800734519958,3D Property Management,12199364,12199364,6/08/2018,2018-08-06 00:00:00
50807806,1000.0,1000.0,itplanb,0.9933881759643556,ItplanB Llc,1001,1001,9 august 2018,2018-08-09 00:00:00
52488082,54.99,54.99,screwfix-norwich-bowthorpe,0.9568870067596436,Screwfix,0904496341,0904496341,30/03/2018,2018-03-30 00:00:00
52116723,,37599.83,bmo,0.6353951096534729,BMO Bank of Montreal,,,8/5/2018,2018-08-05 00:00:00
51574523,152.44,152.44,atlassian,0.5717030167579651,Atlassian,,,2018-05-14,2018-05-14 00:00:00
52513964,5988.0,5988.0,yotpo,0.7793641686439514,YOTPO,,2018 ,12/11/2013,2013-12-11 00:00:00
51271687,90.36,90.36,bmtlinen,0.8882663249969482,BMT,51002172,S1002172,02/07/18,2018-02-07 00:00:00
51195852,50.0,50.0,team in training,0.6281430125236511,Team in training,,,11 jun 2018,2018-06-11 00:00:00
51594377,978.06,978.06,logos 1001,0.819047212600708,LOGOS,4096,4096,08/25/18,2018-08-25 00:00:00
51913091,3450.95,5.0,ascendfcu.org,0.5594362020492554,Ascend Federal Credit Union,,,20/06/2018,2018-06-20 00:00:00
52178083,240.47,240.47,optimum,0.5511792302131653,Robayne,IV219558,IV219558,7/30/2018,2018-07-30 00:00:00
51163987,15790.03,15790.03,acn,0.7154906988143921,TheraponPty Ltd,293027,,08/14/2018,2018-08-14 00:00:00
51436794,-75.0,75.0,wholesale appliance supplies,0.9957613945007324,WHOLESALE APPLIANCE SUPPLIES,CS821872,CS821872,08/17/2018,2018-08-17 00:00:00
50219245,795.08,795.08,katherine laundry,0.9974947571754456,Katherine Laundry,4355,4355,30/07/2018,2018-07-30 00:00:00
51668386,187.13,187.13,856494,0.9809191226959229,856494,6900344259,6900344259,"monday, august 27, 2018",2018-08-27 00:00:00
51246548,95.0,95.0,intellicasting,0.93350487947464,Intellicasting,40859784973,40859784973,,2018-07-31 00:00:00
52182672,23.47,23.47,vistaprint,0.99105566740036,Vistaprint,9325651877,9325651877,"10 aug, 2018",2018-08-10 00:00:00
51648527,,0.0,,,Group-A Engineering,0442865-CM,0442865-CM,"june 12, 2018",2018-06-12 00:00:00
51704398,235.0,235.0,maven drive,0.9188783764839172,Maven,GIG-3285-180118,GIG-3285-180118,14-aug-2018,2018-08-14 00:00:00
51221978,2699.95,2699.95,mercedes-benz,0.9038644433021544,Mercedez Benz,,,14 may 2018,2018-05-14 00:00:00
50854745,333.88,333.88,kravetcanada,0.9892876744270324,Kravet Canada,1427226,1427226,"july 31, 2018",2018-07-01 00:00:00
50848734,8.0,8.0,patreon,0.962487518787384,Patreon,,,july 28th 2018,2018-07-28 00:00:00
51253301,48.26,48.26,a & b courier,0.9949750304222108,A&B Courier,718730,718730,31/07/2018,2018-07-31 00:00:00
53051242,678.99,678.99,videoconferencegear,0.7985114455223083,VideoConferenceGear,9034,9034,7/31/2018,2018-07-31 00:00:00
50507416,14.24,14.24,microsoft,0.9981827139854432,Microsoft,E010069LXY,E010069LXY,8/13/2018,2018-08-13 00:00:00
51371567,116.0,116.0,heroku,0.9688664078712464,Heroku,19626806,19626806,07/20/2018,2018-07-20 00:00:00
50934088,6017.25,6017.25,capitalone,0.9590898752212524,Capital One,,,"tue, aug 14, 2018",2018-08-14 00:00:00
50748783,1459.2,1459.2,equal exchange,0.8563337326049805,Equal Exchange Centre,PSI219759,PSI219759,22-aug-2018,2018-08-22 00:00:00
51306305,,1418.29,j. kings food service,0.7296139597892761,J. Kings,5316410,5316410,19.06.2018,2018-06-19 00:00:00
51019021,,58.48,rover grub & pub,0.9282366037368774,The Grover Pub,,,1 aug 2018,2018-08-01 00:00:00
52174933,185.7,185.7,pfd food services,0.9877644777297974,PFD Food Service Pty Ltd,KL666779,KL666779,5/1/2018,2018-05-01 00:00:00
51624497,1101.41,1101.41,sunbelt rentals,0.9563681483268738,Sunbelt Rentals,51373,80061779-0001,08/27/2018,2018-08-27 00:00:00
52975649,44.12,44.12,amazon,0.9493100643157959,Amazon,AEU-INV-GB-2018-73149889,AEU-INV-GB-2018-73149889,"tue, jun 19, 2018",2018-06-19 00:00:00
51759112,81.45,81.45,barker boy fresh,0.934054970741272,Barker Boy Fresh,185722,185722,24/08/18,2018-08-24 00:00:00
51593967,382.2,382.2,shimmer & shine cleaning services,0.7893715500831604,Shimmer & Shine,142,142,08/16/2018,2018-08-16 00:00:00
51221016,316.0,316.0,bsk associates,0.9998704791069032,BSK Associates,A822570,A822570,22-aug-2018,2018-08-22 00:00:00
50992716,69.0,69.0,sharktech,0.9943384528160096,Sharktech,693116,693116,"jul 31, 2018",2018-07-31 00:00:00
51859332,10.5,10.5,craftmade,0.9403848648071288,Craftmade,90606000-00,90606000-00,15/06/2018,2018-08-06 00:00:00
51812651,3643.09,3643.09,american express,0.856231153011322,American Express,,,2 august 2018,2018-08-02 00:00:00
51182518,189.0,189.0,propertyware,0.9735326170921326,Propertyware,02272012,02272012,"nov 17, 2015",2015-11-17 00:00:00
52574806,6010.55,6010.55,australian plastic profiles,0.9870137572288512,Australian Plastic Profiles,743584,743584,23 august 2018,2018-08-23 00:00:00
52728193,130.5,130.5,email.sunlife,0.7525594234466553,Sun Life Financial,,,09/07/2018,2018-07-09 00:00:00
51479239,631.31,631.31,abetteranswer,0.9288483262062072,A Better Answer Call Centers (ABA),148507,148507,"aug 14, 2018",2018-08-14 00:00:00
52442036,700.0,700.0,daniel dadoun,0.9799599051475524,Daniel Dadoun,1191,1191,08/07/2018,2018-08-07 00:00:00
52731730,,3739.2,manulife,0.8318047523498535,Manulife,E-000646,,2015-01-01,2015-01-01 00:00:00
50307594,2058.0,2058.0,cwi 2 op,0.8059908151626587,CWI OP LP,26135-2,26135-2,"thu, aug 9, 2018",2018-08-09 00:00:00
51211481,497.56,497.56,kabs4kidz,0.9919467568397522,Kabs4Kidz,INV-1604,INV-1604,may 31 2018,2018-05-31 00:00:00
51907755,132.6,132.6,rexel,0.9534309506416321,Rexel,436410619,436410619,12-06-2018,2018-06-12 00:00:00
52491479,2108.17,2108.17,michael farace,0.9825109839439392,Michael Farace,1027,1027,08/02/18,2018-08-02 00:00:00
53041893,83.38,83.38,canada bread company,0.8910665512084961,Canada Bread Company Limited,119105701905,119105701905,18/07/2018,2018-07-19 00:00:00
50766204,63.17,63.17,the home depot,0.9678657650947572,The Home Depot,,,04/22/2018,2018-08-06 00:00:00
50957282,126.42,126.42,intuit,0.8200011849403381,Quickbooks,225011409942,225011409942,14 aug 2018,2018-08-14 00:00:00
51590138,22200.68,22200.68,americanexpress,0.9843601584434508,American Express,,,"mon, jul 16, 2018",2018-07-16 00:00:00
51374849,470.84,470.84,gs1 canada,0.9545921087265016,GS1  Canada,FR-005051,FR-005051,2018-08-27,2018-08-27 00:00:00
50570348,1933.8,1933.8,all trans,0.9525164365768432,All Trans,0069991-IN,0069991,,2018-07-24 00:00:00
50872703,95.0,95.0,etsy,0.8612653613090515,Etsy,,,9 aug 2018,2018-08-09 00:00:00
50993151,341.88,341.88,amkad,0.7877357602119446,Taylor Fluid Systems,00329339,00329339,"august 14, 2018",2018-08-14 00:00:00
51173857,507.37,507.37,berkshore,0.9894902110099792,Berkshore LLC,2794,2794,08/10/2018,2018-08-10 00:00:00
52736783,4.27,4.27,the home depot,0.9790934920310974,The Home Depot,86545,,07/30/2018,2018-07-30 00:00:00
50849836,528.0,528.0,deputy,0.9361701607704164,Deputy,INV00297151,INV00297151,"sun, jul 9, 2017",2017-07-10 00:00:00
52842363,132.35,132.35,prairie dog,0.8439480662345886,Alberta Gaming & Liquor Commission,E-1019,Prairie Dog E-1019,5/25/18,2018-05-25 00:00:00
50820003,1100.0,1100.0,rhys tremble,0.9149681925773621,Rhys Tremble Concreting,IV00000000194,IV00000000194,"july 25, 2018",2018-08-15 00:00:00
52657813,207.13,55.13,jetstar airways,0.8292885422706604,Jetstar,WCWJ5V,WCWJ5V,07/30/2018,2018-07-30 00:00:00
51178520,220.0,220.0,andrei radu,0.897688090801239,Andrei Radu,6NN168904T479090X,,"sun, aug 26, 2018",2018-08-26 00:00:00
52856134,155.96,155.96,phoenix 3 marketing,0.9822118878364564,Phoenix 3 Marketing LLC,63563,63563,10/08/2018,2018-08-10 00:00:00
51781036,8350.96,8350.96,aviva,0.628337562084198,1065945 Ontario,,,8/14/2018,2018-08-14 00:00:00
52195236,348.8,348.8,greenmountainpower,0.9815082550048828,Green Mountain Power,,20180816,"mon, jul 30, 2018",2018-07-30 00:00:00
50918606,468.6,468.6,norwood industries,0.7809830307960509,Norwood,,Statement,29 may 2018,2018-08-01 00:00:00
50611876,38725.66,38725.66,tribal planet,0.7009375691413879,Group Avantica Inc,11606,11606,"august 3, 2018",2018-08-03 00:00:00
52473924,400.0,400.0,nalla,0.6449874043464661,Nalla Constructions,304,304,"sun, aug 5, 2018",2018-08-05 00:00:00
53081396,1380.0,1380.0,barrington,0.716266930103302,AHN,Q-00227523,,"fri, jul 27, 2018",2018-07-27 00:00:00
52384766,30.0,30.0,department of revenue,0.8456224799156189,South Carolina Department of Revenue,0-008-118-152,0-008-118-152,"tue, aug 21, 2018",2018-08-21 00:00:00
52287448,96.99,96.99,hinckleysprings,0.8931926488876343,Hinckley Springs,2684628 081718,2684628 081718,08 august 2018,2018-08-08 00:00:00
51465507,12347.44,12347.44,solarus technologies,0.9703764915466307,Integra Pay,,,"aug 17, 2018",2018-08-17 00:00:00
51434036,4756.5,4756.5,tandem accounting group,0.9834011197090148,Tandem Accounting Group,3074,3074,06.08.2018,2018-08-06 00:00:00
53025281,9.14,9.14,uberx,0.9962152242660522,Uberx,,,07/19/2018,2018-07-19 00:00:00
52268703,145.32,145.32,vistaprint netherlands b.v,0.7186458110809326,Vistaprint,W7JKN-X4A34-8O1,W7JKN-X4A34-8O1,,2018-08-02 00:00:00
52193292,215.97,215.97,fedex,0.9884629249572754,FedEx,95499260,4617684492,"august 12, 2018",2018-08-12 00:00:00
51669950,642.18,728.09,parts europe,0.9998616576194764,Parts Europe,01329403,01329403,26/06/2018,2018-07-26 00:00:00
50242723,1476.0,1476.0,the affiliati network,0.9970666766166688,The Affiliati Network,INV-17457,INV-17457,"december 18, 2017",2017-12-18 00:00:00
52263387,2485.27,2485.27,u.s. bank,0.927056610584259,US Bank,,,28 jul 2018,2018-07-28 00:00:00
50927288,80.0,80.0,easter,0.5262500047683716,Easter Seals,,,28.01.2018,2018-01-28 00:00:00
51226806,587.99,587.99,khronowerx industries,0.9844197630882264,Khronowerx Industries,B7EB0A0-0040,B7EB0A0-0040,"sep 25, 2017",2017-09-25 00:00:00
51878287,8.32,8.32,adobe systems software,0.7481435537338257,Adobe Systems Software,IEE2018003658847,IEE2018003658847,2018-07-23,2018-07-23 00:00:00
51837745,320.76,320.76,biopak,0.979112148284912,BioPak Pty Ltd.,CAS-A-29871,CAS-A-29871,06/09/2018,2018-06-09 00:00:00
52418918,-224.0,224.0,homedepot,0.9567753672599792,THe home Depot,,,1/06/18,2018-06-01 00:00:00
50958018,8.4,8.4,euro systems,0.9662173390388488,Euro Systems Statement,,,8/6/2018,2018-08-06 00:00:00
51384414,342.44,342.44,doubletree,0.886016845703125,double tree,,,"tuesday, july 31, 2018",2018-07-31 00:00:00
51138097,35.26,35.26,the home depot,0.9680777788162231,The Home Depot,,656G,08/13/2018,2018-08-13 00:00:00
52569301,691.26,691.26,aw holdings,0.9865631461143494,Aw Holdings Corp.,,BJ126,"fri, aug 3, 2018",2018-08-03 00:00:00
51796521,32.28,32.28,ew,0.7477989196777344,Electrical Wholesalers Inc.,S111156441.001,S111156441.001,"august 6, 2018",2018-08-06 00:00:00
52337244,957.81,957.81,metcash food & grocery,0.9395681023597716,Metcash Food & Grocery,25620,25620,"jul 31, 2018",2018-07-31 00:00:00
51612195,,513.0,paper tube & core,0.8720782399177551,Paper tube & Core,10031,10031,7/10/2018,2018-07-10 00:00:00
51506638,65.0,65.0,kc,0.5786578059196472,Bill's Plumbing Service LLC,9101-CC-BF,9101-CC-BF,8/1/2018,2018-08-01 00:00:00
53067509,530.5,530.5,hennyandcoco,0.6719315052032471,Henny and Coco,SO0088,SO0088,"wednesday, august 01, 2018",2018-08-01 00:00:00
52089608,15.89,15.89,shamrock foods company,0.9686271548271179,Shamrock Foods Company,2157116,2157116,2018.7.31,2018-07-31 00:00:00
50598631,6167.09,6167.09,d e p o s i t s l i p,0.945229470729828,Deposit Slip,,,"wed, aug 15, 2018",2018-08-15 00:00:00
50618560,479.64,479.64,toner warehouse,0.9995728135108948,Toner Warehouse,IN2128960,IN2128960,7/27/2018,2018-07-27 00:00:00
52884383,34.55,34.55,asian - united,0.7239364981651306,Asian - United Food Service,122137,122137,"tue, aug 14, 2018",2018-08-14 00:00:00
51901230,283.57,283.57,canada post,0.8667165637016296,Canada Post,92525082,,08/17/2018,2018-08-20 00:00:00
50897825,192.77,192.77,steadfast networks,0.9226507544517516,Steadfast Networks,INV-3156-818577,INV-3156-818577,,2018-08-11 00:00:00
51778853,,594.98,,,Amazon,,702-8097339-8429815,08/06/18,2018-08-06 00:00:00
52350950,770.0,770.0,one stop bookkeeping,0.9981355667114258,One Stop Bookkeeping,INV-0512,INV-0512,08/03/2018,2018-08-03 00:00:00
51725780,95.97,95.97,miller waste systems,0.7804977297782898,Miller Waste Systems Inc,0000722439,0000722439,31-jul-18,2018-07-31 00:00:00
52206209,2060.0,2060.0,pepper2qjne -university,0.7087188363075256,Pepperdine University,12189,12189,,2018-08-03 00:00:00
51427393,115.1,115.1,vancity endur apparel,0.6549382209777832,Endur Apparel Ltd,,,,2018-08-09 00:00:00
52241494,999.99,999.99,c.e.s,0.8262757062911987,C.E.S,PHN/060128,PHN/060128,"march 01, 2018",2018-03-01 00:00:00
52363076,160.62,160.62,jensens market supplies,0.9769123792648317,Jensens Market Supplies,,0208233-D01,4 aug 2018,2018-08-04 00:00:00
52815829,39.92,39.92,amazon,0.9973141551017758,amazon.com,701-2828877-3147421,701-2828877-3147421,07/29/2018,2018-07-29 00:00:00
52466242,125.0,125.0,network of community activities,0.8584378957748413,Network Of Community Activities,INVNET02019,INVNET02019,6/29/2018,2018-06-29 00:00:00
51335080,1000.0,1000.0,revolver advertising,0.9051764607429504,Revolver Advertising,,523,"jul 20, 2018",2018-07-20 00:00:00
52809249,165.0,165.0,rebecca gerretsen,0.9529367089271544,Rebecca,63,63,04/30/17,2017-04-30 00:00:00
50757855,8.7,8.7,google,0.9919187426567078,Google,3487405931,3487405931,"august 22, 2018",2018-08-22 00:00:00
53079187,82.04,82.04,quickbooks,0.6961821913719177,QuickBooks,69534970,69534970,august 2018,2018-08-21 00:00:00
52229284,20.0,20.0,uberconference,0.9672122597694396,Uber,,,"tue, jul 31, 2018",2018-07-31 00:00:00
51566135,625.0,625.0,elysha coleman-winiata,0.8910877704620361,elysha coleman-winiata,INV14,INV14,"wed, aug 1, 2018",2018-08-01 00:00:00
50750655,26.25,26.25,ministry of citizens' services crown publications,0.7016445994377136,British Columbia,33417497,33417497,31/07/2018,2018-07-31 00:00:00
50579776,21.64,21.64,cushman & wakefield,0.9261926412582396,Cushman & Wakefield,,,20/08/2018,2018-08-20 00:00:00
51956182,,825.0,,,Neils Landscaping,2581I05,258405,03/19/2018,2018-03-19 00:00:00
50298323,5781.91,5781.91,"delton construction, gp",0.9910763502120972,"Delton Construction, Gp",202218,202218,07/31/18,2018-07-31 00:00:00
51441365,550.81,550.81,sysco,0.989933967590332,Sysco Victoria,,,21. august 2018,2018-08-21 00:00:00
50835465,29.73,29.73,cozzini bros,0.991234302520752,Cozzini Bros,C5309832,C5309832,3 aug 2018,2018-08-03 00:00:00
50629468,952.0,952.0,beyond books qld,0.9553608894348145,Beyond Books,INV-0345,INV-0345,"fri, jul 20, 2018",2018-07-20 00:00:00
51457656,299.0,299.0,applied education,0.9757127165794371,Applied Education,INV-2888,INV-2888,"july 31, 2018",2018-08-07 00:00:00
53022116,58.74,58.74,dulux paints,0.8467414379119873,Dulux Paints,863902086331,863902086331,05-07-2018,2018-05-07 00:00:00
52604630,17424.0,17424.0,marketo,0.9915529489517212,Marketo Inc.,USINV-079772,USINV-079772,06/20/2018,2018-06-20 00:00:00
50292320,85.05,85.05,over ez lifestyles,0.9778780341148376,OVER EZ Lifestyles Inc.,200827,200827,03-aug-2018,2018-08-23 00:00:00
50985434,991.14,991.14,carpet,0.6267170310020447,Pacific Coast Floors,,,"may 09, 2017",2017-05-09 00:00:00
50736994,15.0,15.0,google,0.9927041530609132,Google,3484497565,3484497565,08/27/2018,2018-08-27 00:00:00
52624996,41.4,41.4,the raw office,0.8816846013069153,The Raw Office,,,08/23/18,2018-08-23 00:00:00
50734811,32.77,32.77,intuit,0.8858285546302795,Intuit Quickbooks,23001862147,23001862147,08/23/2018,2018-08-23 00:00:00
50634139,695.31,695.31,mountmedia,0.9560546875,Mount Media,INV-00070308,INV-00070308,"april 30, 2016",2016-04-30 00:00:00
50473000,227.0,227.0,myworks,0.8180494904518127,My Works Software,12187,12187,"mar 8, 2018",2018-03-08 00:00:00
51720023,2118.88,2118.88,bliss accounts,0.9669823646545408,Bliss Accounts,INV-1084,INV-1084,7/31/2018,2018-07-31 00:00:00
51377173,153.13,153.13,ysl consulting,0.9935728907585144,Ysl Consulting,2018-741,2018-741,"july 25, 2018",2018-07-25 00:00:00
52703954,231.0,231.0,communications consulting,0.9992255568504332,Communications Consulting,4135,,08/22/2018,2018-08-22 00:00:00
51604824,12126.76,12126.76,chemistry creative,0.998248815536499,Chemistry Creative,07262018,07262018,07/06/2018,2018-07-06 00:00:00
51865819,2000.0,2000.0,kennedydp,0.9960973262786864,Kennedydp,1045,1045,27jul18,2018-07-27 00:00:00
51530983,100.0,100.0,clubcorp,0.7663956880569458,Club Corp,CCUPAY000152687,,19 jul 2018,2018-07-19 00:00:00
51267041,24.46,24.46,dhl,0.968398094177246,DHL,YHMI000801320,YHMI000801320,08/10/2018,2018-08-10 00:00:00
51417012,755.47,755.47,fersten worldwide,0.8739782571792603,Fersten Worldwide,824257,824257,"saturday, august 11, 2018",2018-08-11 00:00:00
50168027,-102.85,102.85,homedepot,0.9681965708732604,The Home Depot,,REFUND,6-aug-18,2018-08-06 00:00:00
52255639,,58.34,,,Capricorn Society,,90324823,"mon, aug 6, 2018",2018-08-06 00:00:00
50251173,600.0,600.0,phillips aquatic,0.6230498552322388,Phillips Area Aquatic Foundation,,,8/6/2018,2018-08-06 00:00:00
51063113,2848.0,3190.0,ups supply chain solutions,0.8007797598838806,UPS,4021113203,4021113203,,2018-08-09 00:00:00
52099144,40.15,40.15,skipthedishes,0.5364407300949097,Osaka Sushi - Skip the Dishes,52869887,,"thu, aug 2, 2018",2018-08-02 00:00:00
53029834,42.91,42.91,uber,0.9852996468544006,Uber,,,8/02/2018,2018-02-02 00:00:00
50996004,845.0,845.0,roto rooter,0.9732879400253296,Roto-Rooter,285814,285814,22/11/2016,2016-11-22 00:00:00
52280029,8238.68,8238.68,absolute pressure cleaning,0.9954608678817748,Absolute Pressure Cleaning,,,,2018-06-22 00:00:00
52490194,2409.0,2409.0,catherine  hnatov,0.9828754663467408,Catherine Hnatov,082018,082018,"july 31, 2018",2018-07-31 00:00:00
50986214,1660.13,1660.13,dentsply,0.709222674369812,Densply Tulsa Dental,57804154,57804154,7/27 / 18,2018-07-27 00:00:00
52640741,,50.0,thebiggreenk,0.8640141487121582,Killingsworth,,,"august 16, 2018",2018-08-16 00:00:00
50433466,15.0,15.0,nimble,0.9493635296821594,Nimble,A2QV3WR8, a2qv3wr8,04/23/2018,2018-04-23 00:00:00
50432393,-73.44,-73.44,xplornet,0.9898058176040648,Xplornet,INV22959829,INV22959829,15-aug-2018,2018-08-15 00:00:00
50834368,12.95,12.95,canva,0.9843462705612184,Canva,02039-1329722,02039-1329722,,2018-08-01 00:00:00
50875976,149.39,149.39,the home depot,0.973249077796936,THE HOME DEPOT,,H0477-291717,jun 29 2018,2018-06-29 00:00:00
51210987,290.0,290.0,westerville chamber of commerce,0.9109162092208862,Westerville Chamber of Commerce,3695959,3695959,"fri, aug 17, 2018",2018-08-17 00:00:00
50853770,35.35,35.35,docherty,0.6984457969665527,Docherty,548610,548610,30/07/2018,2018-07-30 00:00:00
51369270,9270.36,9270.36,valur talon holdings,0.971068263053894,Valur Talon Holdings,1013,1013,21-aug-2018,2018-08-21 00:00:00
51703790,75.8,75.8,gordon food service,0.9734349250793456,Gordon Food Service,533355,533355,11 august 2018,2018-08-11 00:00:00
51233116,25.0,26.25,wilson/stacie nyqyto,0.6886019110679626,Westjet,,,"jul 19, 2018",2018-07-19 00:00:00
51261432,653.04,653.04,fuseco,0.8823652267456055,Fuseco,S101361800.001,S101361800.001,1. august 2018,2018-08-01 00:00:00
53059631,147.84,147.84,rdk marketing solutions,0.7839487195014954,RDK Marketing Solutions Ltd,3313,3313,03/11/2015,2015-03-11 00:00:00
50997243,79.0,79.0,harvest,0.9949509501457214,Harvest,H-44A1AF50D0,H-44A1AF50D0,10 jul 2018,2018-07-10 00:00:00
50610032,233.79,233.79,barrel maker printing,0.8387452363967896,Barrel Maker Printing,37055,37055,"august 25, 2018",2018-08-25 00:00:00
53027989,31.71,31.71,amazon,0.998126983642578,AMAZON,113-4502833-6957057,113-4502833-6957057,8/9/2018,2018-08-09 00:00:00
50594123,293.6,293.6,bench mark bookkeeping,0.9883744716644288,Bench Mark Bookkeeping,INV-0054,INV-0054,05/31/2018,2018-07-01 00:00:00
52387206,267.32,267.32,schreiberg,0.5392602682113647,Stephanie Meitzler,177052,,07/08/2018,2018-07-08 00:00:00
51986369,3998.7,3998.7,rbc,0.5940051674842834,RBC,,,7/08/2018,2018-08-07 00:00:00
51014814,,111.26,ca@c,0.5749058723449707,Wix.com,6789,,08/01/2018,2018-08-01 00:00:00
51891091,131.0,131.0,3drpd,0.5767509341239929,3DRPD Inc.,PK180723-08,in0000013096,17 august 2018,2018-08-17 00:00:00
51630408,195.01,195.01,originenergy,0.9978558421134948,Origin,161000447313,161000447313,7/30/18,2018-07-30 00:00:00
52674389,132.0,132.0,cmr bookkeeping services,0.9525185227394104,CMR Bookkeeping Services,2152,2152,18 jun 2018,2018-08-15 00:00:00
50445171,87.81,87.81,stericycle,0.980497658252716,Stericycle,10000357047,10000357047,07/24/18,2018-07-24 00:00:00
51862254,90.07,90.07,pioneer energy,0.984587550163269,Pioneer Energy,,,20 aug 2018,2018-01-01 00:00:00
53052185,127.79,127.79,juice roll upz,0.7792778015136719,Ediexpressinc.com,493142019,493142019,09/09/17,2017-09-09 00:00:00
52989788,603.19,603.19,the home depot,0.9702433943748474,The Home Depot,,,8/13/2018,2018-08-13 00:00:00
52374125,126.5,126.5,well connected,0.5445513129234314,Jodie Land,,,"july 9, 2018",2018-07-09 00:00:00
50798754,7.62,7.62,amazon,0.9991121292114258,Amazon,702-5587496-4609847,702-5587496-4609847,14 aug 2018,2018-08-14 00:00:00
50725140,123.0,123.0,yeleo apparel company,0.9877812266349792,Yeleo Apparel Company,280907,280907,9/19/2018,2018-08-20 00:00:00
51811957,17.06,17.06,dallas flat glass distributors,0.984508454799652,Dallas Flat Glass Distributors,819406,819406,"august 03, 2018",2018-08-03 00:00:00
52769779,154.09,154.09,engin,0.992686927318573,engin pty ltd,45854348,45854348,30-07-2018,2018-07-30 00:00:00
51568974,773.0,773.0,the cellular connection,0.9996705055236816,The Cellular Connection,IN000000000459548,IN000000000459548,26/08/2018,2018-08-26 00:00:00
51186745,78.0,78.0,larry schwartz,0.7950440645217896,Larry Schwartz PC,FIANZA 2017-5,Fianza 2017-5,2 apr 2018,2018-04-02 00:00:00
52126655,8.62,8.62,mcmaster-carr,0.9916924238204956,McMaster-Carr,7829556,,"august 6, 2018",2018-08-06 00:00:00
51172805,97.24,97.24,vendorcentral.amazon,0.9109700322151184,amazon,6406-190165465,6406-190165465,"august 23, 2018",2018-08-23 00:00:00
51547397,78.36,78.36,the home depot,0.9214425683021544,The Home Depot,009875/7025276,7025276,12/08/2018,2018-08-12 00:00:00
53065869,14.8,14.8,chick-fil-a,0.9768587350845336,Chick-fil-A,,,"fri, aug 17, 2018",2018-08-17 00:00:00
51444620,195.39,195.39,affordable contractors resources,0.9485591650009156,Affordable Contractors Resources,,INVOICE#sycamore,"aug 8, 2018",2018-08-08 00:00:00
53062922,100.0,100.0,trimet,0.6840237975120544,TriMet,8301824,8301824,08/23/2018,2018-08-23 00:00:00
51144172,218.43,218.43,homedepot,0.5709104537963867,The Home Depot,,W612826094,"sun, mar 25, 2018",2018-03-25 00:00:00
50763130,35.9,35.9,sherwin williams,0.9983876943588256,Sherwin Williams,0569-1,0569-1,01/31/16,2016-01-31 00:00:00
51911291,20.0,20.0,tsheets,0.9860032200813292,TSheets,941567,941567,31 july 2018,2018-07-31 00:00:00
52186007,546.8,546.8,springer foods,0.9822980761528016,Springer Foods,00624229,00624229,08 aug 2018,2018-08-08 00:00:00
52071594,,15.0,felicia fresh,0.7922420501708984,Felicia Fresh LLC,59,59,14-aug-18,2018-08-14 00:00:00
52742104,16.79,16.79,adobe creative cloud,0.9321079254150392,Adobe Creative Cloud,ADB012775231,,"august 9, 2018",2018-08-09 00:00:00
50950836,1320.0,1320.0,people + culture strategies,0.928485631942749,People+Culture Strategies,BI5010765,BI5010765,25-jul-18,2018-07-25 00:00:00
51768597,24.0,24.0,silver,0.6473432779312134,Silver financial Management Ltd,2102,2102,08/15/18,2018-08-15 00:00:00
51817613,25.0,25.0,github,0.9809846282005308,GitHub,,JK525TR,"wednesday, august 15, 2018",2018-01-01 00:00:00
52687838,1930.0,1930.0,h squared racing,0.9878808856010436,H Squared Racing,405,405,aug 18,2018-08-10 00:00:00
50574460,88.81,88.81,canada post,0.991413116455078,Canada Post,,,"thursday, july 26, 2018",2018-07-30 00:00:00
51249599,1069.32,1069.32,dulux,0.9435523748397828,Dulux,0474114984,0474114984,08/09/2018,2018-08-09 00:00:00
52042468,25.0,25.0,preferred meats,0.9979934692382812,"Preferred Meats, Inc.",187262,187262,"july 24, 2018",2018-07-24 00:00:00
52286067,91.02,91.02,ferguson enterprises,0.9996706247329712,Ferguson Enterprises Inc,6727132,6727132,,2018-08-08 00:00:00
51623300,5629.8,5629.8,lowest direct,0.996381402015686,Lowest Direct,18051,18051,8/9/18,2018-08-09 00:00:00
52016224,91.49,91.49,slegg building materials,0.8960322737693787,Slegg Building Materials,IN1848636,IN1848636,09/30/12,2012-09-30 00:00:00
50788418,2.65,2.65,parkboston,0.9116801023483276,Go Passport,113455807,113455807,"fri, aug 3, 2018",2018-08-03 00:00:00
50840596,23.94,23.94,worldpay,0.8715435862541199,World Pay,WM10429298,WM10429298,07/20/2018,2018-07-20 00:00:00
51323704,5.0,5.0,ultimate parking management,0.9750386476516724,Ultimate Parking Management LLC,,,2018-08-10,2018-08-10 00:00:00
52939203,75.0,75.0,jack.org,0.8895909786224365,Jack.org,TJP-39192,TJP-39192,01-08-2018,2018-08-01 00:00:00
51153578,344.0,344.0,the landscaping yard & hardware,0.9993942379951476,The Landscaping Yard & Hardware,450657,450657,01/08/2018,2018-01-08 00:00:00
50577353,27.02,27.02,home depot,0.6730536222457886,The Home Depot,,,08/01/2018,2018-08-01 00:00:00
51876176,87.05,87.05,mophie,0.7832855582237244,Mophie,MI31554467,M131554467,"mon, aug 20, 2018",2018-08-20 00:00:00
50924298,870.1,870.1,wilkins it solutions,0.9844881296157836,Wilkins It Solutions,20500,20500,,2018-07-30 00:00:00
52129198,,1276.4,,,G. JOHN,,G. JOHN 2017OCT,"thu, jul 19, 2018",2018-07-19 00:00:00
50914621,22186.02,22186.02,deposit,0.8264841437339783,The Toronto Dominion Bank,,,"thursday, august 9, 2018",2018-08-09 00:00:00
50820519,200.0,200.0,hector garcia cpa,0.7642457485198975,Hector Garcia CPA,16323746,,8/12/2018,2018-08-12 00:00:00
51140447,2524.04,2524.04,mew construction,0.8775362372398376,Mew Construction,002,002,,2018-08-15 00:00:00
52221301,10.0,10.0,stamps,0.99280047416687,Stamps.com,,,13.08.2018,2018-08-13 00:00:00
51169378,258.28,258.28,the home depot,0.9128822684288024,The Home Depot,,,7/30/2018,2018-07-30 00:00:00
53100818,153.66,153.66,reece australia,0.8627672791481018,Reece Australia,262086946,262086946,"wed, aug 15, 2018",2018-08-15 00:00:00
51267348,87.47,87.47,platt,0.9886792898178101,Platt.com,T027370,,27 aug 18,2018-08-27 00:00:00
51317523,495.02,495.02,jacent strategic merchandising,0.9996439814567566,Jacent Strategic Merchandising,4680107,4680107,08/06/18,2018-08-03 00:00:00
51158357,62977.01,62977.01,landmark,0.9705705642700196,LANDMARK,2004492183,,28-jul-2018,2018-07-28 00:00:00
51986450,74.23,100.26,payoneer,0.8766460418701172,Ola Solonenko,,,7/30/2018,2018-07-30 00:00:00
52777296,265.86,265.86,faggs mitre 10,0.9847126007080078,Fagg's Mitre 10,224352052,224352052,,2018-08-04 00:00:00
50918830,4067.53,4067.53,dv01,0.8642408847808838,DV01,4676201806,4676201806,28/08/18,2018-08-28 00:00:00
52367373,140.0,140.0,hamish macritchie,0.5781091451644897,Hamish MacRitchie,NO.38,38,,2018-08-01 00:00:00
52177512,161.99,161.99,jims group,0.9630416631698608,Jims Group,284341,284341,"saturday, july 28, 2018",2018-07-28 00:00:00
51706422,-42.36,42.36,amazon,0.9790961742401124,Amazon,113-5219738-8378652,113-5219738-8378652,2018-07-12,2018-07-12 00:00:00
52043254,998.91,998.91,bingo waste services,0.9569241404533386,Bingo Waste Services Pty Ltd,BR906556,BR906556,08/27/2018,2018-08-27 00:00:00
52442397,3547.6,3547.6,millers turf,0.9776827692985536,Millers Turf,,,14/07/2018,2018-07-20 00:00:00
52596646,12.99,12.99,dropbox,0.9897796511650084,Dropbox,FC66C91H9WKD,,23 august 2018,2018-08-23 00:00:00
52726513,-31.64,-31.64,small business bookkeeping,0.9915218353271484,Small Business Bookkeeping,1046,1046,17-aug-2018,2018-08-17 00:00:00
51207729,750.0,750.0,"jl verar cpa, pllc",0.9261605739593506,JL Verar CPA,1089,1089,8/01/2018,2018-08-01 00:00:00
52156780,80.0,80.0,you like it salon,0.7789088487625122,AYLI DAILY SALES,,,14-jun-18,2018-07-31 00:00:00
50211528,60.05,60.05,emcoltd,0.5642747282981873,Emcoltd,79440663-00,79440663-00,09/08/2018,2018-08-09 00:00:00
52878245,26.01,26.01,minuteman press,0.8805341720581055,minuteman press,83432,83432,"aug 18, 2018",2018-08-18 00:00:00
51182485,1254.87,1254.87,the home depot,0.913305938243866,The Home Depot,,,8/27/2018,2018-08-27 00:00:00
51678585,70.53,70.53,the home depot,0.9672731161117554,The Home Depot,,,08-25-18,2018-08-25 00:00:00
51205602,133.17,133.17,supporting strategies,0.9911276698112488,Supporting Strategies,2524,2524,08/09/2018,2018-08-09 00:00:00
52208490,2717.65,2717.65,flexserv,0.962887167930603,Flexserv,3250,3250,03.08.2018,2018-07-26 00:00:00
50357911,204.75,204.75,steady mobility,0.9969337582588196,Steady Mobility,1678,1678,"friday, august 10, 2018",2018-08-10 00:00:00
51270218,3004.09,3004.09,lloydminster & district co-op,0.9860469698905944,Lloydminster & District Co-op Ltd.,525627,525627,8/3/2018,2018-08-03 00:00:00
52750073,142.59,239.18,day & ross,0.9899188280105592,Day & Ross,WSK3199586,,07/17/2018,2018-07-17 00:00:00
52815511,415.89,415.89,at cost fulfillment canada ulc,0.9796935319900512,At Cost Fulfillment Canada ULC,4220,4220,"saturday, july 28, 2018",2018-07-28 00:00:00
51989221,720.0,720.0,atomas,0.6898975968360901,Annie-Claude St-Pierre,AC18ATM-006,AC18-ATM-006,09-aug-2018,2018-08-09 00:00:00
52884485,6.97,6.97,exclaimer,0.9955291748046876,Exclaimer,288235,288235,august  18,2018-08-18 00:00:00
51332838,426.58,420.17,intuit,0.9160950779914856,Intuit Quickbooks,100001698140241,100001698140241,"jul 30, 2018",2018-07-30 00:00:00
51555961,29.9,29.9,amaysim,0.922837257385254,amaysim,38411036,,20-aug-2018,2018-08-20 00:00:00
52745762,223.52,298.98,reliable permit solutions,0.6581297516822815,Reliable Permit Solutions,237457,237457,"mon, jul 30, 2018",2018-07-30 00:00:00
52432634,114.1,114.1,amazon,0.9388609528541564,Amazon,111-9922272-4404268,111-9922272-4404268,08/06/18,2018-08-06 00:00:00
50317603,2286.2,2286.2,alphabroder,0.6617485284805298,Pop Culture Brew co,1232,1232,"wednesday, august 15, 2018",2018-08-15 00:00:00
52164802,135.0,135.0,bethel trails farm,0.9170334935188292,Bethel Trails Farm,,,08/01/2018,2018-08-01 00:00:00
50232840,1056.0,1056.0,custom concrete pumps,0.9928798675537108,Custom Concrete Pumps,00008119,00008119,"august 9, 2018",2018-08-09 00:00:00
52122267,100.0,100.0,liz rodriguez,0.9469003677368164,Liz Rodriguez,374,373,july 31 2018,2018-07-31 00:00:00
52190902,44.0,44.0,burson automotive,0.7764480710029602,BURSON Auto Parts,90575835,90575835,06/05/2018,2018-06-05 00:00:00
51004937,15.0,15.0,zoho,0.8877432346343994,Zoho,RPS105758000039862767,,08/22/2018,2018-08-22 00:00:00
50283522,89.59,89.59,mrchain,0.9975694417953492,Mr.Chain,0155357-IN,0155357-IN,07/23/2018,2018-07-23 00:00:00
53048009,38.24,38.24,,,Dollarama,,,31-jul-18,2018-07-31 00:00:00
50461562,169.25,169.25,lake court medical supplies,0.9401015043258668,Lake Court Medical Supplies,0894401-IN,0894401-IN,"august 19, 2018",2018-08-19 00:00:00
51224138,21.99,21.99,amazon,0.9022811055183412,Amazon,114-4319117-6279402,114-4319117-6279402,2/02/2018,2018-02-02 00:00:00
50821131,533.61,533.61,german butchery,0.9543473720550536,German Butchery,S32698,S32698,15/08/18,2018-08-15 00:00:00
51586695,20.99,20.99,united,0.7011927366256714,United,01629211915553,01629211915553,"july 25, 2018",2018-07-25 00:00:00
51598141,,66.0,camscanner,0.6278602480888367,Staples,,,"august 22, 2018",2018-08-22 00:00:00
50789024,282.39,282.39,six cent press,0.8677636384963989,Six Cent Press,32707,Buttons,08/24/2018,2018-08-24 00:00:00
51768911,720.0,79720.0,hallmark,0.6812975406646729,Hallmark House,,,05/12/2017,2017-05-12 00:00:00
50699870,28.82,28.82,rent check credit bureau,0.6916384696960449,Rent Check Credit Bureau,,,08/23/2018,2018-08-23 00:00:00
51350636,9632.26,484.67,9bluepay,0.9336417317390442,BluePay,,,"august 01, 2018",2018-08-01 00:00:00
50416767,627.0,627.0,peter john nichols,0.9719545841217041,Peter John Nichols,1084,1084,"august 7, 2018",2018-08-07 00:00:00
53016197,120.49,120.49,tri state knife grinding,0.9504329562187196,Tri State Knife ace Grinding,15466,15466,"wed, aug 15, 2018",2018-08-15 00:00:00
52084321,8.77,8.77,uber,0.9976155757904052,Uber,,,2018-08-01,2018-08-01 00:00:00
51375719,450.0,450.0,ferguson,0.6113185286521912,Ferguson Hvac,2562195,2562195,20-aug-2018,2018-08-20 00:00:00
51516691,113.0,113.0,baeumler,0.8766967058181763,Baeumler Approved,3846,3846,8/21/2018,2018-08-21 00:00:00
51721702,2221.38,7269.29,clifford hallam healthcare,0.9841902852058412,Clifford Hallam Healthcare,,,"august 1, 2018",2018-08-01 00:00:00
52788139,58.49,58.49,eecol electric,0.9968870878219604,EECOL ELECTRIC,CO 0290109,CO 0290109,27-jul-18,2018-07-27 00:00:00
52992937,,100.0,medicine hat spca,0.8618274331092834,Paypal,,,07/30/18,2018-07-30 00:00:00
52183891,500.0,500.0,brina carey,0.9910915493965148,Brina Carey,560,560,"mon, aug 13, 2018",2018-08-13 00:00:00
53057265,557.09,557.09,cristina,0.7659766674041748,Nobel Biocare,3511072931,3511072931,18-jan-2017,2017-01-18 00:00:00
52025040,3904.68,3904.68,viadirect marketing,0.9844073057174684,ViaDirect marketing,060618-2,060618-2,07/14/18,2018-07-14 00:00:00
50837535,645.75,645.75,peak to peak bookkeeping,0.991855800151825,Peak to Peak Bookkeeping Ltd,1718371,1718371,30 jul 2018,2018-07-30 00:00:00
51475938,1750.0,1750.0,colorific paint,0.9986943006515504,Colorific Paint,985,985,"may 28, 2018",2018-05-28 00:00:00
52196569,50.0,50.0,google,0.8834838271141052,Google Pay,,,"fri, aug 24, 2018",2018-08-24 00:00:00
52390995,10.41,10.41,lyft ride,0.817042350769043,Lyft Ride,,,01/09/2018,2018-01-09 00:00:00
51177673,2713.2,2713.2,cg roxane,0.8751086592674255,CG roxane llc,45/2463,,"sunday, aug 05, 2018",2018-08-05 00:00:00
52642699,21.0,21.0,amazon web services,0.8132826089859009,Amazon Web Services,146428770,146428770,"jul 25, 2018",2018-07-25 00:00:00
51207565,392.41,392.41,steriquip,0.991821825504303,Steriquip,AM0605181,AM0605181,07 aug 2018,2018-08-07 00:00:00
52421411,392.91,392.91,red arrow brewing,0.7554783821105957,Red Arrow Brewing Company,52998,52998,,2018-08-02 00:00:00
52578664,308.75,308.75,star food service,0.9729915857315063,Star Fish Supply Ltd,1120549,1120549,28/08/2018,2018-08-14 00:00:00
51834456,11.42,11.42,amazon,0.9987108111381532,Amazon,702-4355686-8812224,702-4355686-8812224,2016-02-01,2016-02-01 00:00:00
52259483,,198.5,department,0.5209144353866577,Jema,,38237,03/27/2018,2018-03-27 00:00:00
52782082,156.0,156.0,compusult,0.9811566472053528,Compusult,00033955,00033955,"sat, aug 11, 2018",2018-08-11 00:00:00
52966264,32.59,32.59,mailchimp,0.9819743037223816,Mailchimp,MC06484945,MC06484945,25/07/2018,2018-07-25 00:00:00
50160316,,265.85,,,American Watertek,42898,42898,26-jul-18,2018-07-26 00:00:00
50702029,4068.0,4068.0,5d media & design,0.9654563665390016,5d media & design,1823,1823,2018 06 12,2018-06-12 00:00:00
51196865,10.0,10.0,login.skype,0.9798938632011414,Skype,8097000005758271571,,01-jul-18,2018-06-27 00:00:00
51176240,,564.68,,,Fisher Zucker,,72973,08/17/18,2018-08-17 00:00:00
50218332,480.25,480.25,alternativebeauty,0.9258984327316284,Alternativebeauty,0000041998,0000041998,"may 10, 2018",2018-05-10 00:00:00
51624150,9314.5,9314.5,diamond concentrates,0.9895450472831726,Diamond Concentrates,1096,1096,"july 23, 2018",2018-07-23 00:00:00
51263157,142.39,142.39,cal-steam,0.9993876218795776,Calsteam,3287088,3287088,10/07/2018,2018-07-10 00:00:00
52726920,,652.74,,,Bertland Supplies,,437970,"july 04, 2018",2018-07-04 00:00:00
52438913,56.41,56.41,uber,0.9899498820304872,Uber,,,08/27/2018,2018-08-27 00:00:00
52435282,101.99,101.99,godaddy,0.9985451698303224,GoDaddy,1354034660,1354034660,18/07/2018,2018-07-18 00:00:00
52283247,,113.37,,,Bunnings Warehouse,,,08 august 2018,2018-08-01 00:00:00
50532727,,200.84,inabuggy,0.9696128368377686,Inabuggy,51845,,,2018-06-22 00:00:00
51572856,553.56,553.56,merrill,0.6300187706947327,Katherine G Gragan,238257560,,07/28/2018,2018-07-28 00:00:00
52334709,6.35,6.35,fiction donuts,0.9968107342720032,Fiction Donuts,,,"wed, aug 15, 2018",2018-08-15 00:00:00
50558753,50.0,50.0,website tailor,0.6933625340461731,Website Tailor,853,853,2018-08-03,2018-08-03 00:00:00
52672999,,44.66,burp eat,0.7735646963119507,Burp Eat Drink,6663,33268,"jul 23, 2018",2018-07-23 00:00:00
51264430,227.2,227.2,"choi, pyoung & sang",0.6537674069404602,City of Minneapolis,,,"august 20, 2018",2018-08-20 00:00:00
52734428,29.73,29.73,hesselbein tire co,0.9923210144042968,Hesselbein TIre CO,93862,93862,,2018-07-31 00:00:00
51992425,,1500.0,franchise tax,0.6387792229652405,New Jersey,0132,,08/14/2018,2018-08-14 00:00:00
51351267,951.0,951.0,andy gump,0.8720071911811829,Bulli Corp,0002,0002,"july 31, 2018",2018-07-31 00:00:00
52702295,180.8,180.8,wolseley canada,0.8336290121078491,wolseley,7034703,7034703,,2018-07-28 00:00:00
51732945,627.2,627.2,reliable septic services,0.995713233947754,Reliable Septic Services,2018-668,2018-668,"august 14, 2018",2018-08-14 00:00:00
52087868,-24.99,-24.99,amazon,0.9955819249153136,Amazon,111-9087402-2337852,111-9087402-2337852,2018-06-30,2018-06-30 00:00:00
51603091,-35.58,-35.58,gensco,0.9978070855140686,"Gensco, Inc.",848279588,848279588,08/28/2018,2018-08-28 00:00:00
53007199,,2460.0,hanson construction materials,0.9742421507835388,Hanson Construction Materials,0071464939|C,71464939,may 25. 2018,2018-05-25 00:00:00
52312608,89.35,89.35,,,Worldwide Specialty Foods Ltd.,,1367736,"august 24, 2018",2018-08-24 00:00:00
51147658,49.0,49.0,accolution.teamwork,0.971390962600708,Teamwork,TWPM20181142885,TWPM20181142885,25/07/2018,2018-07-25 00:00:00
51451957,14.09,14.09,uber,0.9922593832015992,Uber,,,8/18/18,2018-08-18 00:00:00
52208240,501.37,501.37,indeed,0.8967585563659668,Indeed,16671016,16671016,,2018-08-21 00:00:00
52195959,214.73,214.73,sundal international,0.9948290586471558,Sundal International Ltd.,2102,2102,03/12/2018,2018-03-12 00:00:00
51723585,16.6,16.6,agropur cooperative natrel division,0.7545439004898071,Agropur Cooperative Natrel Division,W1503731,W1503731,"august 15, 2018",2018-08-15 00:00:00
51631974,109.0,109.0,current electric & lighting,0.7628120183944702,Bora Bora Residential and Commercial,12180,12180,07/31/18,2018-07-31 00:00:00
51128626,39.0,55.5,nmi,0.6804017424583435,Payscape,,,"august 1, 2018",2018-08-01 00:00:00
52226669,1604.02,1604.02,mach,0.9180506467819214,"Mach 1 Global Services, Inc.",S01232811,S01232811,06/08/18,2018-08-06 00:00:00
51548807,1826.03,1826.03,endota product company,0.9949647784233092,Endota Product Company,82535,82535,08/16/2018,2018-08-16 00:00:00
50796833,211.15,211.15,medtrainer,0.9950044751167296,MedTrainer,23432,23432,8/9/2018,2018-08-09 00:00:00
52252564,39.06,39.07,andrew sheret,0.9998139142990112,Andrew Sheret Limited,20-056123,20-056123,"october 18, 2015",2015-10-18 00:00:00
51382406,,187064.8,the trade desk,0.9907343983650208,The Trade Desk,INV-0096820,INV-0096820,25 jul 2018,2018-07-25 00:00:00
50955584,2429.52,0.0,lennox industries,0.8481416106224059,Lennox Industries Inc,0554949803,multiple 8.2.18,08/03/2018,2018-08-03 00:00:00
52415516,682.7,682.7,americanexpress,0.9712353348731996,American Express,,,"thursday, august 16, 2018",2018-08-16 00:00:00
52705354,169.51,169.51,allied electronics,0.7777683138847351,Allied Electronics,,9009848550,"august 5, 2018",2018-08-05 00:00:00
50773683,109.27,109.27,office plus of nevada,0.7645241022109985,Office Plus,,,10/08/2018,2018-08-10 00:00:00
52742484,67.03,67.03,henryschein,0.9878197312355042,Henry Schein,,11588259,19 july 2018,2018-07-19 00:00:00
52215179,375.8,375.8,technologies,0.5840312242507935,Visiontron Corp.,653674,653674,"august 14, 2018",2018-08-14 00:00:00
52495505,32.77,32.77,shopify,0.8702095150947571,Shopify,,,07/20/2018,2018-07-20 00:00:00
51242234,150.0,150.0,muzz buzz it,0.9596112370491028,MuzzBuzz IT,INV-0349,INV-0349,31/07/2018,2018-07-31 00:00:00
53110826,580.0,580.0,r.lago,0.9145486950874328,R Lago Corp,"318,,,3114",318 311437 st SW,29/jul/18,2018-08-01 00:00:00
50803649,65.0,65.0,karbon,0.9870229363441468,Karbon,INV00007550,INV00007550,,2018-09-01 00:00:00
52242616,30.57,30.57,partsource,0.9907048940658568,Part Source,1551544,386009,7/27/2018,2018-07-27 00:00:00
52237787,371.25,371.25,train,0.6083226799964905,PB Accountants,INV-0451,INV-0451,8/13/2018,2018-08-13 00:00:00
50812517,1534.09,1534.09,arb corporation,0.9996857047080994,ARB Corporation,8817807,8817807,07/13/18,2018-07-13 00:00:00
50615555,2084.61,2084.61,adept printing,0.9486191868782043,Adept,,,"july 28, 2018",2018-07-28 00:00:00
53031576,454.95,454.95,meridiancu,0.5616610050201416,Meridian,,,"thu, aug 2, 2018",2018-08-02 00:00:00
52780998,43.12,43.12,golden eagle,0.6664406657218933,Golden Eagle Deve,1-7087,,09/08/2018,2018-08-09 00:00:00
52556983,3343.91,3343.91,metcash food & grocery,0.9339334964752196,Metcash Food & Grocery,,,2018-08-01,2018-08-01 00:00:00
50588690,116.9,116.9,shopify,0.967112123966217,Shopify,14421295160,,07/30/2018,2018-07-30 00:00:00
52813296,93.15,93.15,signrequest,0.9408082962036132,SignRequest,SR-2018082413,SR-2018082413,08/22/18,2018-08-22 00:00:00
50781437,2080.3,430.0,stirlingfildes,0.6362000703811646,stirling Fildes,,June18,08/08/2018,2018-08-08 00:00:00
52760447,750.0,750.0,google,0.993052899837494,Google,,,2018/07/24,2018-07-24 00:00:00
53065462,381.47,381.47,the home depot,0.972621500492096,The Home Depot,,,26 jul 2018,2018-07-26 00:00:00
52494838,65.71,65.71,canadianlinen,0.9928584098815918,Canadian Linen & Uniform Service,5002946450,5002946450,08/10/2018,2018-08-10 00:00:00
52478296,25.0,25.0,notifications.skype,0.9795945882797241,Skype,8040000001384172039,8040000001384172039,08/22/18,2018-08-22 00:00:00
50239208,,1257.48,,,VincesMarket,2626,,10-08-18,2018-08-10 00:00:00
50848705,148.78,148.78,coolparts,0.9943214058876038,Cool Parts,00163750,00163750,"jul 31, 2018",2018-07-31 00:00:00
50789155,,137.4,ferguson waterworks,0.908963680267334,Ferguson Waterworks,0974535,0974535,"tuesday, august 21, 2018",2018-08-21 00:00:00
53083973,710.0,710.0,chartered accountants australia and,0.8378316760063171,Chartered Accountants,PMTAU536361,INVAU61418868,"jul 31, 2018",2018-07-31 00:00:00
52037936,23.38,23.38,boating in,0.6478395462036133,Boating In Boston,602633,602633,31/07/2018,2018-07-31 00:00:00
50751232,321.44,321.44,revel systems,0.8753674626350403,"Revel Systems Canada, ULC",580861,580861,27/07/2018,2018-07-27 00:00:00
50605018,260.05,260.05,eastside bearing & brake supplies,0.9537346363067628,Eastside Bearing & Brake Supplies,,,11/08/2018,2018-08-15 00:00:00
51509047,25.0,25.0,github,0.9944812655448914,github.com,,R5JECGDQ,20.12.2017,2017-12-20 00:00:00
52878655,99.75,99.75,xero australia,0.6871009469032288,Xero Australia Pty ltd,INV-6653566,6653566,july 9. 2018,2018-07-09 00:00:00
52101634,3146.4,3146.4,jfrey eyewear,0.8605660200119019,JFREY Eyewear Design,,10176,8/8/2018,2018-06-19 00:00:00
50530775,83.32,83.32,amazon,0.9945478439331056,Amazon,114-7756928-0817815,Conditioner,7/10/2018,2018-07-10 00:00:00
52881727,1500.0,1500.0,mh engineering co,0.8193319439888,MH Engineering Co,,,13/08/18,2018-08-13 00:00:00
51254679,45.06,45.06,namecheap,0.9961277842521667,Namecheap,36791768,36791768,22/08/2018,2018-08-22 00:00:00
52805215,15999.42,15999.42,rbc,0.7251605987548828,Royal Bank Of canada,,,"mon, aug 27, 2018",2018-08-27 00:00:00
50649869,3240.0,3240.0,gareth hill,0.9396774172782898,Gareth Hill,00003985,00003985,16 aug 2018,2018-08-16 00:00:00
52440550,15.1,15.1,uber,0.989937663078308,Uber,,,8/16/2018,2018-08-16 00:00:00
50782351,107.6,107.6,myob australia,0.841011643409729,Myob,1-60034864202,1-60034864202,07.31.2018,2018-07-31 00:00:00
52203357,141.69,141.69,hotwire,0.916620135307312,Hotwire,5666914285,,06aug18,2018-08-06 00:00:00
52859452,31.95,130.61,haymans electrical,0.818541407585144,MM Electrical,277682-241,277682-241,08 aug 2018,2018-08-08 00:00:00
52913008,12.5,12.5,short stop distribution,0.9961806535720824,Short Stop Distribution,1126254,1126254,"jul 31, 2018",2018-07-31 00:00:00
51757016,28000.0,28000.0,roshen constructions,0.926411509513855,Roshen Constructions,280,280,"friday, august 17, 2018",2018-08-09 00:00:00
51790411,119.84,119.84,fishwindowcleaning,0.9875872135162354,Fish Window Cleaning,3115762719,8-13-18,08-20-2018,2018-08-20 00:00:00
52457306,,236.79,,,City of Medicine Hat,,,1 august 2018,2018-08-01 00:00:00
51265235,663.0,663.0,dei rossi marketing,0.7887221574783325,Dei Rossi,41372-1,41372-1,17/08/2018,2018-08-17 00:00:00
50852198,18500.04,462.84,sobeys,0.9670408368110656,Lumsden,33967775,33967775,2018/08/01,2018-08-01 00:00:00
52229222,46.85,46.85,mcmaster-carr,0.9982908964157104,McMaster Carr,,,7/31/2018,2018-07-31 00:00:00
52118057,78.88,78.88,saskatoon,0.8192408680915833,Consolidated Gypsum Roofing Supply,422812,422812,8/ 7/2018,2018-08-07 00:00:00
52051193,2444.19,2444.19,alarmnorth security,0.992722988128662,AlarmNorth Security,55,5550,"july 31, 2018",2018-07-31 00:00:00
51904715,922.5,922.5,caffe vita,0.9957722425460817,Caffe Vita,537898,537898,"august 18th, 2018",2018-08-18 00:00:00
51214396,1015.0,1015.0,quickerbookkeepers usa,0.8065516948699951,QuickerBookkeepers USA,29371,29371,30 sep 2017,2017-08-20 00:00:00
52403794,13.56,13.56,joeyco,0.916961669921875,JoeyCo,ST-33747,ST-33747,"may 06, 2018",2018-05-06 00:00:00
51381854,106.05,106.05,airgas national,0.7754440307617188,Airgas,34908721,34908721,27/07/2018,2018-07-27 00:00:00
50312570,393.69,393.69,national,0.9263372421264648,Israel Sublett,50033389341,50033389341,"july 31, 2018",2018-07-31 00:00:00
51050537,65.4,65.4,nextiva,0.7745909094810486,Nextiva,16047848401,16047848401,09 jul 2018,2018-07-09 00:00:00
51754864,1296.0,2625.0,nalini,0.5927171111106873,Moa,,Fattura 10994,"mon, aug 20, 2018",2018-08-20 00:00:00
51588854,726085.0,726085.0,four squares tools co,0.9882065653800964,Four Squares Tools Co Ltd,B1872601,B1872601,08/27/2018,2018-08-27 00:00:00
52995623,1237.5,1237.5,hippo media,0.9738792181015016,Hippo media,1022,1022,"fri, aug 24, 2018",2018-08-24 00:00:00
52828129,159.19,159.19,essex,0.7595924735069275,Essex Powerlines,00242384-12,00242384-12,"monday, august 27, 2018",2018-08-27 00:00:00
51881634,1779.75,4667.75,estate connection,0.6028978228569031,Deposits,,,,2018-07-31 00:00:00
51459778,59.95,59.95,ra-wifi,0.7429484724998474,Nuskope Internet,443489,443489,19/07/2018,2018-07-19 00:00:00
51079916,18.73,18.73,amazon,0.9986101984977722,Amazon,114-3217546-2857013,114-3217546-2857013,17 aug 2018,2018-08-17 00:00:00
51842670,86.79,86.79,the educational experience,0.8677144050598145,Educational Experience,1371817,1371817,aug 18,2018-08-02 00:00:00
52101743,417.2,417.2,chrome hearts,0.9322201013565063,Chrome Hearts Eyewear LLC,INV-234177,INV-234177,"aug 06, 2018",2018-08-06 00:00:00
52560506,48.0,48.0,water world pure drinking water,0.985279381275177,Water World Pure Drinking Water,694471,694471,,2018-07-31 00:00:00
50984965,548.54,548.54,jayalakshmi ramanna,0.7234435677528381,Willowbrae Academy,,,"thu, aug 23, 2018",2018-08-23 00:00:00
52673879,742.5,742.5,promotek,0.6923804879188538,United Fuel,40574,40574,"july 28, 2018",2018-07-28 00:00:00
50665286,891.37,873.54,mckesson,0.8908959627151489,McKesson - 897847 RX,7884427222,7884427222,"april 09, 2017",2017-04-09 00:00:00
50880708,4500.0,4500.0,us technical services,0.9634276032447816,US Technical Services,BA044,BA044,"mon aug 13, 2018",2018-08-13 00:00:00
50933265,,6848.67,mega parts,0.962586522102356,Statement Mega Parts,,,8/1/2018,2018-08-01 00:00:00
50838125,67.99,67.99,paypal,0.9958045482635498,Paypal,,,,2016-12-10 00:00:00
50271684,1470.0,1470.0,rwm enterprise,0.946669101715088,RWM Enterprise,43-P040,43-P040,17 july 2018,2018-07-17 00:00:00
50840623,130.66,130.66,menulog,0.8489325642585754,Menulog,,1406850,07/31/2018,2018-07-31 00:00:00
51862354,35.61,34.9,mckesson corporation,0.8571422696113586,McKesson,7886641839,7886641839,08/08/2018,2018-08-08 00:00:00
51317941,460.0,460.0,bowens,0.9354447722434998,Bowens,14697066,14697066,"aug 01, 2018",2018-08-01 00:00:00
51609610,797.75,797.75,mike brennler,0.7653008103370667,Brennier Investigative Services,2074-043,2074-043,24/07/2018,2018-07-24 00:00:00
52938724,674.09,674.09,van isle water services,0.967939019203186,Van Isle Water Services,CM1300,CM1300,9 august 2018,2018-08-09 00:00:00
50399196,3652.0,3652.0,ralsad,0.8999763131141663,QUEENSLAND STAIRS,14898,14898,"august 10, 2018",2018-08-10 00:00:00
50210131,882.09,882.09,premium landscaping services,0.9799098968505859,Premium Landscaping Services,2313,2313,8/6/2018,2018-08-06 00:00:00
52125737,77.83,77.83,amazon,0.9976593852043152,Amazon,111-2916369-1047438,111-2916369-1047438,"mon, aug 27, 2018",2018-08-27 00:00:00
52884784,180.58,180.58,darwrn fish,0.6855437159538269,Darwin Fish Market,00078533,00075535,08/14/2018,2018-08-14 00:00:00
52531894,68.74,68.74,the home depot,0.9021511673927308,The Home Depot,,,5/24/2018,2018-05-24 00:00:00
52286565,13614.4,13614.4,elements air systems,0.8386605381965637,Elements Air Systems,,,09 aug 2018,2018-08-09 00:00:00
51729195,682.43,682.43,ford,0.7442948818206787,Ford,,,24-07-2018,2018-07-24 00:00:00
51900824,2983.65,2983.65,cdw,0.8410030007362366,CDW,1BVC9GN,,"july 16, 2017",2017-07-16 00:00:00
52525858,387.2,518.0,avis,0.9150222539901732,AVIS,297754251,,07/01/2018,2018-07-01 00:00:00
50854388,930.0,930.0,canadian transit company,0.9633763432502748,Canadian transit Company,181061647,181061647,"aug 18, 2018",2018-08-18 00:00:00
51211556,204.12,204.12,echevron business card,0.8547747731208801,Chevron Business Card,53926801,53926801,07/31/2018,2018-07-31 00:00:00
51293216,483.04,483.04,gensler,0.8955544233322144,Gensler,746553,746553,"august 22, 2018",2018-08-22 00:00:00
50741071,299.0,299.0,demandforce,0.9953655004501344,"Demandforce, Inc.",INV04303130,INV04303130,"june 07, 2018",2018-06-07 00:00:00
51974853,286.0,286.0,technology marketing toolkit,0.9762629270553588,Technology Marketing Toolkit,87128,87128,,2018-07-31 00:00:00
52320865,2000.0,2000.0,facebook,0.8820037245750427,Facebook Ads,LC9WPGWMY2,LC9WPGWMY2,02/09/18,2018-02-09 00:00:00
53009556,203.25,203.25,erynn adle,0.6393894553184509,Erynn Adle,,,7/29/2018,2018-07-29 00:00:00
52984670,159.08,159.08,nunawading toyota,0.9682673215866088,Nunawading Toyota,291689H,291689H,05/20/2018,2018-05-20 00:00:00
51766831,7458.0,7458.0,karratha cabinets,0.9789614081382751,Karratha Cabinets,00002810,00002810 - PO049,12/30/2016,2016-12-30 00:00:00
51881568,,28.12,purolator,0.9955978393554688,Purolator,438808176,438808176,,2018-08-02 00:00:00
51130975,7.88,7.88,diamond vogel paint center,0.8353637456893921,Diamond Vogel Paint Center,283065460,283065460,,2018-05-06 00:00:00
51133412,17.56,17.56,the home depot,0.9606127142906188,Home Depot,,,15/08/2018,2018-08-15 00:00:00
52860393,2.27,2.27,russell hendrix,0.862186074256897,Russell Hendrix Foodservice Equipment,1349984,1349984,"jul 20th, 2018",2018-07-20 00:00:00
50986982,149.0,149.0,big green cleaning company,0.9336734414100648,BigGreen,518165,518165,"jun 22, 2018",2018-06-22 00:00:00
51407227,20.0,199.0,officesxm,0.9121469855308532,Office World,1077881,1077881,19jul2017,2017-07-19 00:00:00
51746466,224.43,224.43,usg boral,0.9383050203323364,USG Boral,49689406,49689406,"aug 13, 2018",2018-08-13 00:00:00
52596781,133.65,133.65,nedco-div.of,0.9933249354362488,Nedco,5897052,5897052,"aug 1, 2018",2018-08-01 00:00:00
51595132,19.0,19.0,amazon web services,0.833473801612854,Amazon Web Services,146228828,146228828,7/15/18,2018-07-15 00:00:00
51468345,1004.3,1004.3,additional business concepts,0.9535880088806152,Additional Business Concepts,786,786,,2018-08-08 00:00:00
53090542,635.33,35.0,umpqua bank,0.8364385366439819,Umpqua Bank,,,2018/08/13,2018-08-13 00:00:00
52079394,400.0,400.0,roslyn hall interior design,0.9840720295906068,Roslyn Hall,046456,046456,"august 19, 2018",2018-08-19 00:00:00
51680732,504.09,504.09,vibrant,0.9218004941940308,Vibrant,,,28/05/2018,2018-06-17 00:00:00
